uuid,title,description,keywords,snippet,url,image_url,language,published_at,source,relevance_score,type,industry,match_score,sentiment_score
e8bd2d31-dd32-4125-94a7-df93bd38d510,Bitcoin Setup – BTC/USD Wrestles With Resistance After Optimistic NFP,"Bitcoin (BTC) prices have regained confidence after temporarily falling below $38,000. Positive NFP report raises the probability of an aggressive Fed.",,"Bitcoin, USD Talking Points

Bitcoin prices shows initial sensitivity to positive NFP report

BTC/ USD continues to challenge $38,000

USD strength remains a ke...",https://www.dailyfx.com/forex/market_alert/2022/02/04/Bitcoin-Setup-BTCUSD-Wrestles-With-Resistance-After-Optimistic-NFP.html,https://a.c-dn.net/b/3RSTOJ/headline_BITCOIN_STACK.jpg,en,2022-02-04T15:02:00.000000Z,dailyfx.com,,cryptocurrency,N/A,190.42502,0.220267
4bf1f370-ce93-4e9c-850d-48796d9f41cd,"Bitcoin forms a base as Amazon, Snap stocks surge on Q4 results (Cryptocurrency:BTC-USD)",Bitcoin (BTC-USD) jumps to $39.6K per token as tech giants Snap (SNAP) and Amazon (AMZN) shares skyrocket following blowout Q4 results after Thursday's close. This...,,Bitcoin (BTC-USD) jumps to $39.6K per token as tech giants Snap (NYSE:SNAP) and Amazon (NASDAQ:AMZN) shares skyrocket following blowout Q4 results after Thursda...,https://seekingalpha.com/news/3796086-bitcoin-jumps-to-sub-40k-as-amazon-snap-stocks-surge-on-q4-results,https://static.seekingalpha.com/cdn/s3/uploads/getty_images/1255216496/image_1255216496.jpg?io=getty-c-w750,en,2022-02-04T15:24:41.000000Z,seekingalpha.com,,cryptocurrency,N/A,85.48946,0.400325
7f9caafc-7bb7-4496-9bb4-7e109735aec8,Bitcoin Strategy ETFs surge as Bitcoin tops $40K,Bitcoin Strategy ETFs lead all exchange traded funds on Friday afternoon as Bitcoin (BTC-USD) retakes the $40K price marker. Learn more information.,,"Bitcoin Strategy ETFs lead all exchange traded funds Friday afternoon as Bitcoin (BTC-USD) retakes the $40K price marker, up 11.6% on the session.

Catching a b...",https://seekingalpha.com/news/3796214-bitcoin-strategy-etfs-surge-as-bitcoin-tops-40k,https://static.seekingalpha.com/cdn/s3/uploads/getty_images/1322810064/image_1322810064.jpg?io=getty-c-w750,en,2022-02-04T20:26:39.000000Z,seekingalpha.com,,cryptocurrency,N/A,58.5074,0.0
4160a552-9b24-4c2b-8cfd-2fe467ea7d10,"Hot Stocks: SNAP jumps nearly 60%; Bitcoin stocks rally; XOM, COP set highs; CLX drops",Bitcoin stocks rose. SNAP jumped nearly 60% on earnings. CLX plunged on weak results. XOM and COP extended their highs. SKYW set a fresh low.,,"Strong earnings from big names like Amazon helped lift the Nasdaq and S&P 500 on Friday. While the Dow finished near the flat line, investors showed renewed opt...",https://seekingalpha.com/news/3796283-hot-stocks-snap-jumps-nearly-60-bitcoin-stocks-rally-xom-cop-set-highs-clx-drops-skyw-hits-low,https://static.seekingalpha.com/cdn/s3/uploads/getty_images/1289819603/image_1289819603.jpg?io=getty-c-w750,en,2022-02-04T23:08:50.000000Z,seekingalpha.com,,cryptocurrency,N/A,51.15167,0.215467
154ced9b-f58e-49b2-a140-59c2668f7de3,Dogecoin Is Here To Stay (DOGE-USD),"Cryptocurrencies have given up, or are trending towards giving up, almost all of 2021's gains. Learn why Dogecoin isn't going away..",,"Alexander Buerkle/iStock via Getty Images

Let's face the facts - the past few months have seen Dogecoin's (DOGE-USD) price trend continually downward ever sinc...",https://seekingalpha.com/article/4484192-dogecoin-here-to-stay,https://static.seekingalpha.com/cdn/s3/uploads/getty_images/1327952149/image_1327952149.jpg?io=getty-c-w750,en,2022-02-04T00:28:12.000000Z,seekingalpha.com,,cryptocurrency,N/A,38.1732,0.5434
862fe0f3-6df2-4b76-b839-ba3a194d5d5e,"How Bitcoin Is Valued, Similarities To Gold And Fed Policy Implications",Bitcoin's valuation is mainly a function of the real yield and a derivative of expected inflation. Fed assets inversely drive the real yield.,,"hamzaturkkol/iStock via Getty Images

Bitcoin (BTC-USD) is heavily influenced by a combined inflation derivative I call the “Required Yield” or ""RY"" (explai...",https://seekingalpha.com/article/4484187-how-bitcoin-valued,https://static.seekingalpha.com/cdn/s3/uploads/getty_images/1310459406/image_1310459406.jpg?io=getty-c-w750,en,2022-02-04T00:07:56.000000Z,seekingalpha.com,,cryptocurrency,N/A,27.979723,0.0
