uuid,title,description,keywords,snippet,url,image_url,language,published_at,source,relevance_score,type,industry,match_score,sentiment_score
40af620c-0644-4069-a899-b0d5330eea76,Bitcoin (BTC/USD) Price Latest: Struggling to Reclaim Recent Highs Despite Debt Talk Optimism,"US debt ceiling talks yesterday between President Biden and House Speaker McCarthy may have paved the way for an agreement to be reached, giving risk markets, including the cryptocurrency space, a boost.",,"Bitcoin (BTC) Prices, Charts, and Analysis:

Bitcoin edges higher but price action lacks conviction.

US debt ceiling talks may provide the next driver.

Recomm...",https://www.dailyfx.com/news/bitcoin-btc-usd-price-latest-struggling-to-reclaim-recent-highs-despite-debt-talk-optimism-20230518.html,https://a.c-dn.net/b/28i6oB/Bitcoin_1.jpg,en,2023-05-18T12:30:03.000000Z,dailyfx.com,,cryptocurrency,N/A,150.71782,0.208233
79e885d6-c681-4b59-8254-2bd00ff59d96,Bitcoin Tops This Key Level Following Economic Data; Render Token Emerges As Top Gainer,"Bitcoin (CRYPTO: BTC) moved higher, with the cryptocurrency prices trading above the key $27,000 level on Thursday. Ethereum (CRYPTO: ETH) also traded higher, topping the key $1,800 mark this morning.",,"Bitcoin BTC/USD moved higher, with the cryptocurrency prices trading above the key $27,000 level on Thursday.

Ethereum ETH/USD also traded higher, topping the ...",https://www.benzinga.com/markets/cryptocurrency/23/05/32466666/bitcoin-tops-this-key-level-following-economic-data-render-token-emerges-as-top-gainer,https://cdn.benzinga.com/files/images/story/2023/05/18/bitcoin-_logo_2.jpg?width=1200&height=800&fit=crop,en,2023-05-18T13:42:33.000000Z,benzinga.com,,cryptocurrency,N/A,54.08735,0.0
9a349985-d25e-427c-afbd-26bc97ac33f9,"SEC Ramps Up Regulatory Action, Rules Filecoin A Security",The Securities and Exchange Commission (SEC) announced on Wednesday that it considers Filecoin’s token (CRYPTO: FIL) a security.,,"The Securities and Exchange Commission (SEC) announced on Wednesday that it considers Filecoin’s token FIL/USD a security.

What Happened: This decision comes...",https://www.benzinga.com/markets/cryptocurrency/23/05/32459065/sec-ramps-up-regulatory-action-rules-filecoins-token-a-security,https://cdn.benzinga.com/files/images/story/2023/filecoin.jpeg?width=1200&height=800&fit=crop,en,2023-05-18T05:00:12.000000Z,benzinga.com,,cryptocurrency,N/A,54.077538,0.4902
e58780c8-970c-400d-9fe4-390d6ac79a04,"Florida’s Ron DeSantis Led In Banning CBDC, Who's Next?",Florida Governor Ron DeSantis recently signed a bill that outlawed the use of central bank digital currencies (CBDCs) in Florida.,,"Florida Governor Ron DeSantis recently signed a bill that outlawed the use of central bank digital currencies (CBDCs) in Florida.

What Happened: It seems that ...",https://www.benzinga.com/markets/cryptocurrency/23/05/32458848/ron-desantis-florida-not-the-only-one-here-are-other-us-states-gearing-up-against-cbdcs,https://cdn.benzinga.com/files/images/story/2023/Money.jpeg?width=1200&height=800&fit=crop,en,2023-05-18T03:55:33.000000Z,benzinga.com,,cryptocurrency,N/A,47.508278,0.6369
879a8d6a-6200-4caf-8fdd-630bbd1bb9f1,BITQ: A Bullish Pattern In A Very Volatile ETF,The Bitwise Crypto Industry Innovators ETF is inexpensive and offers leveraged exposure to cryptocurrencies. Click here to find out why I rate BITQ ETF a buy.,,"spawns

After reaching a low in November 2022, Bitcoin (BTC-USD) recovered, reaching its latest high at just below the $31,000 per token level on April 14.

Sin...",https://seekingalpha.com/article/4605820-bitq-bullish-pattern-very-volatile-etf,https://static.seekingalpha.com/cdn/s3/uploads/getty_images/1436167319/image_1436167319.jpg?io=getty-c-w1536,en,2023-05-18T18:15:35.000000Z,seekingalpha.com,,cryptocurrency,N/A,30.133064,-0.1531
b245fd47-d552-45f9-88a9-99e168e48bf9,Bitfarms (BITF): Strategic Genius Preparing For The Halving,Bitfarms reduced debt and costs significantly and ordered new low-energy miners to make most of its low-cost electricity supply. Read why BITF stock is a buy.,,"Dilok Klaisataporn

The Q1 2023 earnings call gave much information about the progress Bitfarms Ltd. (NASDAQ:BITF) has made and was an opportunity for managemen...",https://seekingalpha.com/article/4605760-bitfarms-strategic-genius-preparing-for-the-halving,https://static.seekingalpha.com/cdn/s3/uploads/getty_images/1344939844/image_1344939844.jpg?io=getty-c-w1536,en,2023-05-18T15:38:37.000000Z,seekingalpha.com,,cryptocurrency,N/A,18.588625,0.2023
