uuid,title,description,keywords,snippet,url,image_url,language,published_at,source,relevance_score,type,industry,match_score,sentiment_score
100d3a63-d0e7-42b5-8cad-20d65c5afe37,Cathie Wood's Ark Sees Ethereum Rising Above A Whopping $20T Market Cap In Next 10 Years,Cathie Wood-led Ark Investment Management says that the market capitalization of Ethereum (CRYPTO: ETH) could exceed $20 trillion in the next ten years.,,"TODAY ONLY! For only $7, you can get 2 winning options trade alerts every month! Click Here to See Trade Ideas! (Risk-free with a 14 day refund guarantee)

Cath...",https://www.benzinga.com/analyst-ratings/analyst-color/22/01/25227496/cathie-woods-ark-sees-ethereum-rising-above-a-whopping-20t-market-cap-in-next-10-ye,https://www.benzinga.com/images/schema-image-default.png,en,2022-01-26T10:44:32.000000Z,benzinga.com,,cryptocurrency,N/A,46.895554,0.0
0df881c9-3644-41d5-8ddd-699ba1512b1f,Experts Talk: Is Bitcoin Safe Now Or A Slip Back To $33K Is In The Cards? Ethereum Above $3K Again Soon?,"As Bitcoin (CRYPTO: BTC), Ethereum (CRYPTO: ETH) and other major cryptocurrencies traded in the green as of Tuesday evening, four analy",,"TODAY ONLY! For only $7, you can get 2 winning options trade alerts every month! Click Here to See Trade Ideas! (Risk-free with a 14 day refund guarantee)

As B...",https://www.benzinga.com/analyst-ratings/analyst-color/22/01/25227050/experts-talk-is-bitcoin-safe-now-or-a-slip-back-to-33k-is-in-the-cards-ethereum-abo,https://www.benzinga.com/images/schema-image-default.png,en,2022-01-26T10:14:18.000000Z,benzinga.com,,cryptocurrency,N/A,40.32758,0.34
f2d164ab-34d9-4d53-9241-6653e6b3a2b6,"Crypto Regulation: Bitcoin, Ripple, & Squandered Opportunities",The regulatory stance on crypto is unclear at best and chaotic at worst. See why I believe the U.S. will create a regulatory framework that supports blockchain.,,"DNY59/iStock via Getty Images

In 2013, the U.S. Treasury defined Bitcoin (BTC-USD) as both a virtual currency and a payment system. In December 2014, the Commo...",https://seekingalpha.com/article/4481838-crypto-regulation-bitcoin-ripple-squandered-opportunities,https://static.seekingalpha.com/cdn/s3/uploads/getty_images/1312130929/image_1312130929.jpg?io=getty-c-w750,en,2022-01-26T20:08:30.000000Z,seekingalpha.com,,cryptocurrency,N/A,31.586666,0.2023
83438181-c412-440c-be1c-de804e2334fc,Crocs: An UGGs 2.0 (NASDAQ:CROX),Crocs are much more than a seasonal fad. It has exceptional revenue & operating income growth. Here's why I think CROX has the potential to be a great investment.,,"undefined undefined/iStock via Getty Images

Intro & Thesis

When I first laid my eyes on a pair of Crocs (CROX), I thought what most people think: Well, that?...",https://seekingalpha.com/article/4481647-crocs-uggs-2-0,https://static.seekingalpha.com/cdn/s3/uploads/getty_images/944274962/image_944274962.jpg?io=getty-c-w750,en,2022-01-26T06:29:11.000000Z,seekingalpha.com,,cryptocurrency,N/A,20.41117,0.0
23cd40b4-998d-40f7-8ff5-f0a7e5ab1000,Bitcoin Setup – BTC/USD Crawls Along Support After Hawkish Fed,"Bitcoin (BTC) prices have recovered slightly after failing to breach $32,000. With the Fed rate decision on the horizon, key technical levels remain intact.",,"We use a range of cookies to give you the best possible browsing experience. By continuing to use this website, you agree to our use of cookies.

You can learn ...",https://www.dailyfx.com/forex/market_alert/2022/01/27/Bitcoin-Setup-BTCUSD-Crawls-Along-Support-After-Hawkish-Fed.html,https://a.c-dn.net/b/2oVo47/headline_shutterstock_365875643.jpg,en,2022-01-27T18:30:00.000000Z,dailyfx.com,,cryptocurrency,N/A,178.09323,0.4019
ef068a87-1c9a-4e3e-b3ad-65fb746463fc,SEC rejects Fidelity’s Spot Bitcoin ETF proposal,"Today, the U.S. Securities and Exchange Commission has rejected Fidelity Investment’s application for a spot Bitcoin (BTC-USD) exchange traded fund.",,The U.S. Securities and Exchange Commission has rejected Fidelity Investment’s application for a spot Bitcoin (BTC-USD) exchange traded fund today as they con...,https://seekingalpha.com/news/3792579-sec-rejects-fidelitys-spot-bitcoin-etf-proposal,https://static.seekingalpha.com/cdn/s3/uploads/getty_images/1304532030/image_1304532030.jpg?io=getty-c-w750,en,2022-01-27T16:25:38.000000Z,seekingalpha.com,,cryptocurrency,N/A,69.51142,-0.40195
517df964-6701-4118-8a71-63f76d987f78,"Inflation - what have we learned from earnings so far, and who could benefit","Investors don't need to see the Federal Reserve's CPI report to know that inflation has arrived, the evidence is all around. The cause of the price inflation is a source of much debate",,"Investors don't need to see the Federal Reserve's CPI report to know that inflation has arrived, the evidence is all around. The cause of the price inflation is...",https://seekingalpha.com/news/3792652-inflation-what-have-we-learned-from-earnings-so-far-and-who-could-benefit,https://static.seekingalpha.com/cdn/s3/uploads/getty_images/1317087986/image_1317087986.jpg?io=getty-c-w750,en,2022-01-27T19:04:30.000000Z,seekingalpha.com,,cryptocurrency,N/A,46.892593,0.7506
74258cca-8142-4451-aba5-0bf8a18da95d,Will Bitcoin See A Short-Term Bounce And Ethereum Trade Range-Bound? Here's What The Experts Are Saying,"As Bitcoin (CRYPTO: BTC), Ethereum (CRYPTO: ETH) and other major cryptocurrencies traded lower on Wednesday evening after the U.S.",,"TODAY ONLY! For only $7, you can get 2 winning options trade alerts every month! Click Here to See Trade Ideas! (Risk-free with a 14 day refund guarantee)

As B...",https://www.benzinga.com/analyst-ratings/analyst-color/22/01/25252342/will-bitcoin-see-a-short-term-bounce-and-ethereum-trade-range-bound-heres-what-the-,https://www.benzinga.com/images/schema-image-default.png,en,2022-01-27T13:25:24.000000Z,benzinga.com,,cryptocurrency,N/A,44.01975,-0.296
f21d4911-5eec-41ae-ad5a-fe8ee179725a,Fighting Inflation: Five Things To Buy Now Before Prices Go Up.,A list of tried-and-true inflationary protective assets. Gold and silver as alternative investments.,,"TonyBaggett/iStock via Getty Images

During times of high inflation, consumer goods, investments, real estate, and fuel prices can increase significantly. The i...",https://seekingalpha.com/article/4481965-fighting-inflation-5-things-to-buy-now-before-prices-go-up,https://static.seekingalpha.com/cdn/s3/uploads/getty_images/1283011874/image_1283011874.jpg?io=getty-c-w750,en,2022-01-27T08:22:53.000000Z,seekingalpha.com,,cryptocurrency,N/A,34.568634,0.2574
08c7d35c-a5d5-45df-8b70-a34471753c48,Market Rebound: 5 Stocks To Buy At The Dip,The current market correction opens a buying opportunity for trends we might have missed. Read more about the list of these trends and find out my top picks.,,"naphtalina/iStock via Getty Images

Investment Thesis

For many retail traders who entered the market following social distancing rules in 2020, many of which a...",https://seekingalpha.com/article/4482017-market-rebound-5-stocks-buy-dip,https://static.seekingalpha.com/cdn/s3/uploads/getty_images/1257405518/image_1257405518.jpg?io=getty-c-w750,en,2022-01-27T14:01:28.000000Z,seekingalpha.com,,cryptocurrency,N/A,29.095465,0.6705
c4cc1e6c-d72b-4392-8efc-996937c41c73,"Block Stock: Market Has Lost Its Mind, It's Time To Buy (NYSE:SQ)","Block has compelling growth story as it embraces crypto and DeFi, valuation is more attractive than ever. See why I'm buying SQ stock and holding for a while.",,"Diamond Dogs/iStock via Getty Images

Thesis Summary

Block, Inc. (SQ) has a compelling business proposition, and with the recent cut in valuation, it is also a...",https://seekingalpha.com/article/4482062-block-market-lost-mind-time-to-buy,https://static.seekingalpha.com/cdn/s3/uploads/getty_images/1268654991/image_1268654991.jpg?io=getty-c-w750,en,2022-01-27T16:07:43.000000Z,seekingalpha.com,,cryptocurrency,N/A,27.992104,0.0
d87907dc-02ec-424a-a5db-a6529b65a06f,BTCS: Best Crypto Stock For Dividend Growth Investors (NASDAQ:BTCS),"BTCS is one of my favorite cheap crypto stocks that made headlines becoming the first ever company to pay a ""bividend"". Read more about BTCS stock here.",,"ersinkisacik/iStock via Getty Images

BTCS (NASDAQ:BTCS) is a micro-cap crypto blockchain stock that I recently added to my portfolio in 2022 as a wonderful pla...",https://seekingalpha.com/article/4482115-btcs-best-crypto-stock-for-dividend-growth-investors,https://static.seekingalpha.com/cdn/s3/uploads/getty_images/1303397527/image_1303397527.jpg?io=getty-c-w750,en,2022-01-27T18:15:54.000000Z,seekingalpha.com,,cryptocurrency,N/A,26.033876,0.8555
65095215-e138-48ca-8244-5c8429f4a10b,Sizing Up 17 Bitcoin Miners For 2022,Bitcoin mining stocks have been caught up in the extreme market volatility and pressured by the crypto selloff. Find out which miners are the best investments.,,"artiemedvedev/iStock via Getty Images

It's been a wild ride for Bitcoin (BTC-USD) and the entire crypto sector facing extreme volatility to start the year. BTC...",https://seekingalpha.com/article/4482079-sizing-up-17-bitcoin-miners-2022,https://static.seekingalpha.com/cdn/s3/uploads/getty_images/1332576796/image_1332576796.jpg?io=getty-c-w750,en,2022-01-27T17:02:44.000000Z,seekingalpha.com,,cryptocurrency,N/A,14.931887,-0.296
87ca82b4-1b44-42bb-89c0-481a191cc05b,"Bitcoin Selloff Eases Amid Broader Weakness, but Bear Flag Forms Casting Doubt on Recovery","Bitcoin is struggling to gain ground after Wall Street surrendered early gains, which pushed haven flows into the US Dollar. The APAC session may see another risk-off move to end the week.",,"Bitcoin, BTC/USD, Market Sentiment, APAC, NZD/USD, Covid - Talking Points

Bitcoin struggling to gain ground against the safe-haven charged US Dollar

Risk-off ...",https://www.dailyfx.com/forex/fundamental/daily_briefing/daily_pieces/asia_am_briefing/2022/01/28/Bitcoin-Selloff-Eases-Amid-Broader-Weakness-but-Bear-Flag-Forms-Casting-Doubt-on-Recovery.html,https://a.c-dn.net/b/0JYk86/headline_BITCOIN.jpg,en,2022-01-28T00:00:00.000000Z,dailyfx.com,,cryptocurrency,N/A,66.13262,0.191833
f4dedc25-eaf8-4292-8e1b-f0f86933568f,Riot Blockchain: Not Best In Class (RIOT),This is not the start of a crypto winter. RIOT is overvalued relative to the competition. Find out why I rate the Bitcoin miner a Hold.,,"happyphoton/iStock via Getty Images

The cryptocurrency market has been distressed hitting a local bottom of ~33K so far. Due to the operational structure, Riot...",https://seekingalpha.com/article/4482307-riot-blockchain-not-best-in-class,https://static.seekingalpha.com/cdn/s3/uploads/getty_images/1277317471/image_1277317471.jpg?io=getty-c-w750,en,2022-01-28T02:06:23.000000Z,seekingalpha.com,,cryptocurrency,N/A,27.991835,0.6912
81f33ec9-c3b6-47e6-955b-459d9e799473,Why Global Payments Is The FinTech Stock Worth Salvaging Over PayPal And Square (NYSE:GPN),Global Payment's renewed focus on core business has helped drive growth. More attractive business dynamics for the short and long-term. Favorable balance sheet in rate-hike environment.,,"Tippapatt/iStock via Getty Images

Following a disappointing end to 2021 for FinTech stocks, investors have sifted through the wreckage and picked their winners...",https://seekingalpha.com/article/4482336-global-payments-fintech-stock-valuation-bullish-buy,https://static.seekingalpha.com/cdn/s3/uploads/getty_images/1313070537/image_1313070537.jpg?io=getty-c-w750,en,2022-01-28T04:39:37.000000Z,seekingalpha.com,,cryptocurrency,N/A,17.612514,0.8442
cb006146-6d46-4270-8d4a-74983322d0a6,Successfully Trading HIVE Blockchain And Other Bitcoin Proxy Stocks,There is only thing investors need to watch to make decisions on taking a position in HIVE and other crypto mining stocks. Click to find out what it is.,,"Just_Super/E+ via Getty Images

HIVE Blockchain Technologies Ltd. (HIVE) is a profitable company to trade when investors understand the simple elements associat...",https://seekingalpha.com/article/4482667-successfully-trading-hive-bitcoin-proxy-stocks,https://static.seekingalpha.com/cdn/s3/uploads/getty_images/1089565874/image_1089565874.jpg?io=getty-c-w750,en,2022-01-28T23:28:23.000000Z,seekingalpha.com,,cryptocurrency,N/A,17.601732,0.0
fdfe4e2e-b3d2-4a87-bd41-86f325fbaa8e,Crypto lender Genesis' lending desk gets hit (Cryptocurrency:BTC-USD),Cryptocurrency lender Genesis; lending desk experienced a,,"Cryptocurrency brokerage Genesis' lending desk experienced a ""wave of year-end deleveraging"" as digital asset prices continue to fall in a nearly three-month cy...",https://seekingalpha.com/news/3792633-crypto-lender-genesis-lending-desk-gets-hit-with-a-wave-of-deleveraging-as-crypto-prices-fall,https://static.seekingalpha.com/cdn/s3/uploads/getty_images/1226798658/image_1226798658.jpg?io=getty-c-w750,en,2022-01-29T16:56:00.000000Z,seekingalpha.com,,cryptocurrency,N/A,67.49115,0.2976
a0b89e32-a65d-4aa3-9242-f8bd7b28e5b4,A Shift In Cryptocurrencies,"Bitcoin has fallen almost 50% from its peak, and the future seems far less certain than it did a year ago. Read more.",,"da-kuk/iStock via Getty Images

Cryptocurrencies are in focus recently. Bitcoin (BTC-USD) has fallen almost 50% from its peak, and the future seems far less cer...",https://seekingalpha.com/article/4482747-shift-in-cryptocurrencies,https://static.seekingalpha.com/cdn/s3/uploads/getty_images/1295857409/image_1295857409.jpg?io=getty-c-w750,en,2022-01-29T17:27:00.000000Z,seekingalpha.com,,cryptocurrency,N/A,32.999634,0.1868
f375f6f1-8486-40f5-b4c2-1a20c35ab464,"Stocks To Watch: Alphabet, Meta Platforms, Amazon And Starbucks Headline Big Earnings Week","Get ahead of the market by subscribing to Seeking Alpha's Stocks to Watch, a preview of key events scheduled for the coming week",,"Get ahead of the market by subscribing to Seeking Alpha's Stocks to Watch, a preview of key events scheduled for the coming week. The newsletter keeps you infor...",https://seekingalpha.com/article/4482740-stocks-to-watch-alphabet-meta-platforms-amazon-and-starbucks-headline-big-earnings-week,https://static.seekingalpha.com/assets/og_image_1200-29b2bfe1a595477db6826bd2126c63ac2091efb7ec76347a8e7f81ba17e3de6c.png,en,2022-01-29T14:53:48.000000Z,seekingalpha.com,,cryptocurrency,N/A,22.862623,-0.5719
