uuid,title,description,keywords,snippet,url,image_url,language,published_at,source,relevance_score,type,industry,match_score,sentiment_score
fab2a3b2-8f7a-4fc5-a957-fc1b65b6e992,Crypto giant Binance resumes bitcoin outflows after second halt (Cryptocurrency:BTC-USD),"Binance, the largest cryptocurrency exchange by trading volume, twice briefly paused bitcoin (BTC-USD) withdrawals from its platform in less than 24 hours, as the token's...",,"Binance, the largest cryptocurrency exchange by trading volume, twice briefly paused bitcoin (BTC-USD) withdrawals from its platform in less than 24 hours, as t...",https://seekingalpha.com/news/3967004-crypto-giant-binance-resumes-bitcoin-outflows-after-second-halt,https://static.seekingalpha.com/cdn/s3/uploads/getty_images/1409529116/image_1409529116.jpg?io=getty-c-w750,en,2023-05-08T12:40:34.000000Z,seekingalpha.com,,cryptocurrency,N/A,73.73427,-0.156033
b6d2df62-77bb-4439-81cf-e6ceb3b4238c,Bitcoin & Ethereum Price Action: Is the Rally Over?,"Bitcoin and Ethereum’s rise may have stalled recently, but the uptrend is far from over. How much more downside in cryptocurrencies?",,"Bitcoin, BTC/USD, Ethereum, ETH/USD - Technical Outlook:

Bitcoin and Ethereum have essentially been sideways recently.

The sideway price action appears to be ...",https://www.dailyfx.com/analysis/bitcoin-ethereum-price-action-is-the-rally-over-20230508.html,https://a.c-dn.net/b/1fux68/iStock-817313424.jpg,en,2023-05-08T06:30:00.000000Z,dailyfx.com,,cryptocurrency,N/A,66.46643,-0.0526
92c7c7f5-5235-4aba-84a1-b45928bf7aac,Binance Draws FTX Comparisons After Pausing Bitcoin Withdrawals By DailyCoin,Binance Draws FTX Comparisons After Pausing Bitcoin Withdrawals,,"Published May 08, 2023 10:50AM ET Updated May 08, 2023 11:00AM ET

© Reuters. Binance Draws FTX Comparisons After Pausing Bitcoin Withdrawals

BTC/USD -3.66% A...",https://www.investing.com/news/cryptocurrency-news/binance-draws-ftx-comparisons-after-pausing-bitcoin-withdrawals-3076006,https://i-invdn-com.investing.com/news/LYNXMPED510BO_L.jpg,en,2023-05-08T15:00:26.000000Z,investing.com,,cryptocurrency,N/A,55.302677,-0.4767
39e240d4-253c-4d15-90cb-1f1c9833dbfe,"Binance Did Not See 190K Bitcoin Outflows, Says Crypto Analyst",Bitcoin (CRYPTO: BTC) withdrawals from leading cryptocurrency exchange Binance are experiencing difficulties amid severe networ,,"Bitcoin BTC/USD withdrawals from leading cryptocurrency exchange Binance are experiencing difficulties amid severe network congestion.

What Happened: The issue...",https://www.benzinga.com/markets/cryptocurrency/23/05/32260039/no-binance-did-not-see-190-000-bitcoin-outflows-crypto-analyst-debunks-fud,https://cdn.benzinga.com/files/images/story/2023/Binance_and_Bitcoin_Photo_by_Primakov_on_Shutterstock.jpeg?width=1200&height=800&fit=crop,en,2023-05-08T10:40:15.000000Z,benzinga.com,,cryptocurrency,N/A,54.08825,-0.4019
c5a1d82b-2a67-46b5-a331-c8881fd6ef35,Bitcoin Layer-2 Token Rises 5% Amid Binance BTC Withdrawal Halt - Seagate Tech Hldgs (NASDAQ:STX),"Stacks (CRYPTO: STX) a Bitcoin (CRYPTO: BTC) layer-2 token, has seen a 5% rise in the past 24 hours and is currently the top-performing asset among the top 100 cryptocurrencies, according to CoinMarketCap data.",,"Stacks STX/USD a Bitcoin BTC/USD layer-2 token, has seen a 5% rise in the past 24 hours and is currently the top-performing asset among the top 100 cryptocurren...",https://www.benzinga.com/markets/cryptocurrency/23/05/32258678/this-bitcoin-layer-2-token-rises-5-amid-binances-pause-on-btc-withdrawals,https://cdn.benzinga.com/files/images/story/2023/Stacks_cryptocurrency_Photo_by_FellowNeko_on_Shutterstock.jpeg?width=1200&height=800&fit=crop,en,2023-05-08T08:25:42.000000Z,benzinga.com,,cryptocurrency,N/A,53.034607,0.5106
2449f676-263f-4c5f-9a18-bc69880cd696,"Bitcoin Dips Below $28,000; Pepe, Render Token Among Top Losers","Bitcoin (CRYPTO: BTC) moved lower, with the cryptocurrency prices falling below the key $28,000 level on Monday. Ethereum (CRYPTO: ETH) also traded lower, dropping below the key $1,900 mark this morning.",,"Bitcoin BTC/USD moved lower, with the cryptocurrency prices falling below the key $28,000 level on Monday.

Ethereum ETH/USD also traded lower, dropping below t...",https://www.benzinga.com/markets/cryptocurrency/23/05/32264905/bitcoin-dips-below-28-000-pepe-render-token-among-top-losers,https://cdn.benzinga.com/files/images/story/2023/05/08/bitcoin_-_logo.jpg?width=1200&height=800&fit=crop,en,2023-05-08T13:37:23.000000Z,benzinga.com,,cryptocurrency,N/A,53.034607,-0.765
6f331bc3-e022-4cd1-8d2c-7867c4cb0892,"Why Bitcoin-Related Stocks Coinbase, Marathon Digital And Riot Platforms Are Falling - Coinbase Glb (NASDAQ:COIN)","Shares of several crypto-related stocks including Coinbase Global Inc (NASDAQ: COIN), Marathon Digital Holdings Inc (NASDAQ: MARA) and Riot Platforms Inc (NASDAQ:",,"Shares of several crypto-related stocks including Coinbase Global Inc COIN, Marathon Digital Holdings Inc MARA and Riot Platforms Inc RIOT are trading lower Mon...",https://www.benzinga.com/markets/cryptocurrency/23/05/32266044/why-bitcoin-related-stocks-coinbase-marathon-digital-and-riot-platforms-are-falling,https://cdn.benzinga.com/files/images/story/2023/05/08/btc-gc3593504f_1920.jpg?width=1200&height=800&fit=crop,en,2023-05-08T14:37:33.000000Z,benzinga.com,,cryptocurrency,N/A,51.05206,-0.8374
c6bb63fc-8726-409d-acb1-e1f7122939bc,"Is Banking System ‘Collapsing,’ Asks Robert Kiyosaki As T-Bill Yield Soars - iShares Gold Trust Shares of the iShares Gold Trust (ARCA:IAU), SPDR Gold Trust (ARCA:GLD)","‘Rich Dad, Poor Dad' author Robert Kiyosaki has cautioned about the significant rise in the yield on one-month treasury bill asking his Twitter followers to stick with gold, silver and Bitcoin (C",,"‘Rich Dad, Poor Dad' author Robert Kiyosaki has cautioned about the significant rise in the yield on one-month treasury bill asking his Twitter followers to s...",https://www.benzinga.com/markets/cryptocurrency/23/05/32257779/rich-dad-poor-dad-author-highlights-record-yield-on-1-month-t-bill-omg-stick-with-gold-sil,https://cdn.benzinga.com/files/images/story/2023/Robert_Kiyosaki_Wikimedia_Commons_3.jpeg?width=1200&height=800&fit=crop,en,2023-05-08T04:01:06.000000Z,benzinga.com,,cryptocurrency,N/A,47.521282,0.5719
68d416de-1d60-4d91-8516-2890b64d1411,Markets Finish Flat Ahead of Key Inflation Data,"U.S. equities indexes were little changed on Monday, May 8, 2023, with crucial reports on inflation expected later in the week.",,"Key Takeaways Major U.S. equities were mostly flat to begin the trading week on May 8, 2023, ahead of upcoming reports on retail and wholesale inflation.

The D...",https://www.investopedia.com/markets-finish-flat-ahead-of-key-inflation-data-7495461,https://www.investopedia.com/thmb/BXMV_CFEFqMJR2xLT8Os4-ZYw2U=/1500x0/filters:no_upscale():max_bytes(150000):strip_icc()/indexesmay8-14d73ab6fad14b3ab6782e69ce9da6f8.png,en,2023-05-08T22:08:02.000000Z,investopedia.com,,cryptocurrency,N/A,45.93039,-0.5719
377ed2bd-1a08-44bf-aef5-5c0d20171478,Ethereum Edges Lower; Bitcoin SV Emerges As Top Gainer,"Bitcoin (CRYPTO: BTC) moved slightly lower, with the cryptocurrency prices trading below the key $28,000 level on Tuesday. Ethereum (CRYPTO: ETH) also edged lower, trading below the key $1,900 mark this morning.",,"Bitcoin BTC/USD moved slightly lower, with the cryptocurrency prices trading below the key $28,000 level on Tuesday.

Ethereum ETH/USD also edged lower, trading...",https://www.benzinga.com/markets/cryptocurrency/23/05/32290595/ethereum-edges-lower-bitcoin-sv-emerges-as-top-gainer,https://cdn.benzinga.com/files/images/story/2023/05/09/bitcoin-_logo_2.jpg?width=1200&height=800&fit=crop,en,2023-05-09T13:46:50.000000Z,benzinga.com,,cryptocurrency,N/A,59.110268,0.355
19e4d76c-8cae-40ef-bc77-3b0909f398bd,Bittrex Files For Bankruptcy After SEC Charges,"Bittrex, a popular cryptocurrency trading platform, has filed for Chapter 11 bankruptcy protection in the District of Delaware, according to court filings made on May 8.  What Happened: The company estimated that it has more than 100,000 creditors, with assets between $500 million and $1 billion and liabilities in the same range.",,"Bittrex, a popular cryptocurrency trading platform, has filed for Chapter 11 bankruptcy protection in the District of Delaware, according to court filings made ...",https://www.benzinga.com/markets/cryptocurrency/23/05/32279806/bittrex-files-for-bankruptcy-after-sec-charges-this-us-authority-tops-creditor-list-with-2,https://cdn.benzinga.com/files/images/story/2023/Bittrex_Photo_by_Grey82_on_Shutterstock.jpeg?width=1200&height=800&fit=crop,en,2023-05-09T05:47:21.000000Z,benzinga.com,,cryptocurrency,N/A,49.218235,0.3612
08f0d736-0cf1-441f-94f5-37b4a6a025c3,"Bitcoin, Ethereum, Dogecoin Drop Amid Binance Congestion Chaos","Major coins tumbled on Monday as investors grappled with the surge in demand for Pepe Coin (CRYPTO: PEPE) and congestion issues on Binance. Over the weekend, Binance was forced to temporarily suspend Bitcoin withdrawals, resulting in concerns among investors.",,"Major coins tumbled on Monday as investors grappled with the surge in demand for Pepe Coin PEPE/USD and congestion issues on Binance. Over the weekend, Binance ...",https://www.benzinga.com/markets/cryptocurrency/23/05/32279324/bitcoin-ethereum-dogecoin-tumble-amid-binance-congestion-chaos-analyst-bearish-on-eth-pred,https://cdn.benzinga.com/files/images/story/2023/Cryptocurrency_Photo_by_SvetlanaParnikova_on_Shutterstock.jpeg?width=1200&height=800&fit=crop,en,2023-05-09T03:17:21.000000Z,benzinga.com,,cryptocurrency,N/A,44.45333,0.34
1499c569-9b7a-465a-85c8-80611488269e,Okex: Exploring An Exchange Utility Token (OKB-USD),"Okex is the utility token of the popular crypto exchange and derivatives platform OKX. Read my in-depth analysis here and find out if OKB is a buy, sell, or hold.",,"Irina Fedorova/iStock Editorial via Getty Images

Since the collapses of companies like Celsius (CEL-USD), BlockFi, and FTX (FTT-USD) last year, there has been ...",https://seekingalpha.com/article/4601997-okex-exploring-exchange-utility-token,https://static.seekingalpha.com/cdn/s3/uploads/getty_images/1138605426/image_1138605426.jpg?io=getty-c-w1536,en,2023-05-09T17:28:44.000000Z,seekingalpha.com,,cryptocurrency,N/A,26.750586,0.0
c260abba-89db-42b6-8d67-06463a2431f8,CleanSpark posts Q2 earnings beat as bitcoin rebound boosts gross profit margins,CleanSpark (CLSK) on Wednesday reported better-than-expected Q2 earnings as a rebound in bitcoin (BTC-USD) prices boosted gross profit margins.Q2 EPS from continuing operations was...,,"CleanSpark (NASDAQ:CLSK) on Wednesday reported better-than-expected Q2 earnings as a rebound in bitcoin (BTC-USD) prices boosted gross profit margins.

Q2 EPS f...",https://seekingalpha.com/news/3969726-cleanspark-posts-q2-earnings-beat-as-bitcoin-rebound-boosts-gross-profit-margins,https://static.seekingalpha.com/cdn/s3/uploads/getty_images/1322810064/image_1322810064.jpg?io=getty-c-w750,en,2023-05-10T21:56:44.000000Z,seekingalpha.com,,cryptocurrency,N/A,75.89861,0.492533
e708ca2b-2879-44fd-9a10-a28e324f5d41,"Bitcoin Surpasses $28,000 Following Inflation Data; Kava, Terra Classic Among Top Gainers","Bitcoin (CRYPTO: BTC) moved higher, with the cryptocurrency prices trading above the key $28,000 level on Wednesday. Ethereum (CRYPTO: ETH) also traded lower, but remained below the key $1,900 mark this morning.",,"Bitcoin BTC/USD moved higher, with the cryptocurrency prices trading above the key $28,000 level on Wednesday.

Ethereum ETH/USD also traded lower, but remained...",https://www.benzinga.com/markets/cryptocurrency/23/05/32317419/bitcoin-surpasses-28-000-following-inflation-data-kava-terra-classic-among-top-gainers,https://cdn.benzinga.com/files/images/story/2023/05/10/bitcoin_-_logo.jpg?width=1200&height=800&fit=crop,en,2023-05-10T14:07:39.000000Z,benzinga.com,,cryptocurrency,N/A,56.789757,-0.151
0cd11d47-9575-4f98-a5a8-efce0cbf307c,"PayPal Reveals $1B Crypto Assets, Draws Binance CEO's Criticism - PayPal Holdings (NASDAQ:PYPL), Banco De Chile (NYSE:BCH)","PayPal Holdings Inc (NASDAQ:PYPL) on Tuesday disclosed in a 10-Q filing with the Securities and Exchange Commission, or SEC, that it holds nearly $1 billion worth of customer assets in Bitcoin (CRYPTO: BTC)",,"PayPal Holdings Inc PYPL on Tuesday disclosed in a 10-Q filing with the Securities and Exchange Commission, or SEC, that it holds nearly $1 billion worth of cus...",https://www.benzinga.com/markets/cryptocurrency/23/05/32308136/paypal-discloses-1b-in-crypto-assets-draws-criticism-from-binance-ceo-4,https://cdn.benzinga.com/files/images/story/2023/Paypal_Photo_by_Primakov_on_Shutterstock.jpeg?width=1200&height=800&fit=crop,en,2023-05-10T05:43:01.000000Z,benzinga.com,,cryptocurrency,N/A,54.8829,0.5859
f9da40e2-f85d-435c-bd98-b7859253d3ac,"Crypto Trader Predicts Floki To Double By June, Labels Meme Coin A 'Rocket Ship'","A pseudonymous crypto trader on Tuesday said that Floki (CRYPTO: FLOKI) could experience a bullish momentum in the coming months. What Happened: Crypto Tony told his 295,000 followers on Twitter that he is looking for the next FLOKI pump.",,"A pseudonymous crypto trader on Tuesday said that Floki FLOKI/USD could experience a bullish momentum in the coming months.

What Happened: Crypto Tony told his...",https://www.benzinga.com/markets/cryptocurrency/23/05/32314042/crypto-trader-predicts-floki-to-double-by-june-labels-meme-coin-a-rocket-ship,https://cdn.benzinga.com/files/images/story/2023/Floki_Photo_by_Maurice_NORBERT_on_Shutterstock_1.jpeg?width=1200&height=800&fit=crop,en,2023-05-10T12:24:33.000000Z,benzinga.com,,cryptocurrency,N/A,54.086735,0.0
77ee88e4-91f2-4e6b-a900-8fc6b4482451,Iconic Pepe Meme Creator Says He's A 'Dogecoin Maxi',"Artist Matt Furie, creator of the viral Pepe meme, said that he has no knowledge of Pepe Coin (CRYPTO: PEPE), despite its recent surge in",,"Artist Matt Furie, creator of the viral Pepe meme, said that he has no knowledge of Pepe Coin PEPE/USD, despite its recent surge in popularity.

What Happened: ...",https://www.benzinga.com/markets/cryptocurrency/23/05/32310551/iconic-pepe-meme-creator-hasnt-heard-of-pepe-coin-says-he-is-a-dogecoin-maxi,https://cdn.benzinga.com/files/images/story/2023/Pepe_Meme_Tokens.jpeg?width=1200&height=800&fit=crop,en,2023-05-10T10:33:26.000000Z,benzinga.com,,cryptocurrency,N/A,54.086735,0.0258
700081f1-af05-4043-b283-e1a7038e7604,Biden Urges Congress To End Crypto ‘Tax Loopholes’,U.S. President Joe Biden on Tuesday called on Congress to slash tax loopholes for wealthy cryptocurrency investors. What Happened: The message was accompanied by an infographic that claimed such a move would save a significant $18 billion.,,"U.S. President Joe Biden on Tuesday called on Congress to slash tax loopholes for wealthy cryptocurrency investors.

What Happened: The message was accompanied ...",https://www.benzinga.com/markets/cryptocurrency/23/05/32307904/joe-biden-calls-for-congress-to-end-tax-loopholes-for-wealthy-crypto-investors-points-to-p,https://cdn.benzinga.com/files/images/story/2023/JOE_BIDEN_Photo_by_lev_radin_on_Shutterstock_6.jpeg?width=1200&height=800&fit=crop,en,2023-05-10T04:45:52.000000Z,benzinga.com,,cryptocurrency,N/A,52.029854,0.7269
6e9d00ce-d0c5-439b-8a06-8d95d25750bd,Fake Kim Jong-Un Account Gets KYC-Approved On Popular Crypto Exchange,"Crypto on-chain analyst ZachXBT tested the credibility of a crypto exchange's Know-Your-Customer process by creating a fake account under the name of North Korea’s leader, Kim Jong-Un. What Happened: ZachXBT on Tuesday said he applied for a Gate.io account using a fake name and email address.",,Crypto on-chain analyst ZachXBT tested the credibility of a crypto exchange's Know-Your-Customer process by creating a fake account under the name of North Kore...,https://www.benzinga.com/markets/cryptocurrency/23/05/32311402/fake-kim-jong-un-account-gets-kyc-approved-on-popular-crypto-exchange,https://cdn.benzinga.com/files/images/story/2023/Kim_Jong_Un.jpeg?width=1200&height=800&fit=crop,en,2023-05-10T11:05:45.000000Z,benzinga.com,,cryptocurrency,N/A,49.217686,0.4215
f7ecf46c-a5e4-4652-9abf-957b78ee1e24,Cryptocurrency's Inflation Protection Hype Put To The Test: History Found Lacking,Rating agency S&P Global on Tuesday acknowledged the potential of cryptocurrencies as assets that can protect investors from inflation.,,"Rating agency S&P Global on Tuesday acknowledged the potential of cryptocurrencies as assets that can protect investors from inflation.

However, the rating age...",https://www.benzinga.com/markets/cryptocurrency/23/05/32322642/cryptocurrencys-inflation-protection-hype-put-to-the-test-history-found-lacking,https://cdn.benzinga.com/files/images/story/2023/05/10/crypto_chart_shutter.jpg?width=1200&height=800&fit=crop,en,2023-05-10T19:50:26.000000Z,benzinga.com,,cryptocurrency,N/A,47.51979,0.1779
e2440d1d-defa-40b9-98d6-119b20911700,"BTC, ETH, DOGE Trade Mixed: Buffett's Sell-Off ‘Bad Signal,' Says Analyst",Major coins traded mixed on Tuesday evening as investors await Wednesday’s latest U.S. inflation report.,,"Major coins traded mixed on Tuesday evening as investors await Wednesday’s latest U.S. inflation report.

Cryptocurrency Gains +/- Price (Recorded 9:30 p.m. E...",https://www.benzinga.com/markets/cryptocurrency/23/05/32307571/bitcoin-ethereum-dogecoin-trade-mixed-ahead-of-cpi-data-warren-buffetts-big-stock-dump-bad,https://cdn.benzinga.com/files/images/story/2023/Bitcoin_Photo_by_kitti_Suwanekkasit_on_Shutterstock_3.jpeg?width=1200&height=800&fit=crop,en,2023-05-10T03:03:43.000000Z,benzinga.com,,cryptocurrency,N/A,38.326878,0.34
1c7a6089-e7bb-4cd8-96c8-fbaf833e5f55,"Bitcoin, Ethereum Record Losses Following PPI Data; Pepe Becomes Top Loser","Bitcoin (CRYPTO: BTC) moved lower, with the cryptocurrency prices trading below the key $28,000 level on Thursday. Ethereum (CRYPTO: ETH) also traded lower, but remained above the key $1,800 mark this morning.",,"Bitcoin BTC/USD moved lower, with the cryptocurrency prices trading below the key $28,000 level on Thursday.

Ethereum ETH/USD also traded lower, but remained a...",https://www.benzinga.com/markets/cryptocurrency/23/05/32342114/bitcoin-ethereum-record-losses-following-ppi-data-pepe-becomes-top-loser,https://cdn.benzinga.com/files/images/story/2023/05/11/bitcoin-_logo_2.jpg?width=1200&height=800&fit=crop,en,2023-05-11T13:56:34.000000Z,benzinga.com,,cryptocurrency,N/A,59.93649,-0.05485
ed768c03-aac5-4299-972b-0f3b90a53698,Dogecoin Is Falling Thursday: So What's Up?,Dogecoin (CRYPTO: DOGE) is trading lower by 4.16% to $0.0694 Thursday afternoon.,,Dogecoin DOGE/USD is trading lower by 4.16% to $0.0694 Thursday afternoon. The altcoin is trading lower in sympathy with the broader crypto market amid a fall i...,https://www.benzinga.com/markets/cryptocurrency/23/05/32350224/dogecoin-is-falling-thursday-so-whats-up,https://cdn.benzinga.com/files/images/story/2023/05/11/analysis-4937349_1.jpg?width=1200&height=800&fit=crop,en,2023-05-11T19:30:58.000000Z,benzinga.com,,cryptocurrency,N/A,56.33445,0.5719
53139be9-33f7-4ea1-82a3-13494ea21ab7,Crypto Analyst Identifies 'Strong Demand Area' For Pepe Coin: Key Levels To Watch Out For,A pseudonymous analyst said that the current price level for Pepe Coin (CRYPTO: PEPE) is a “strong demand area.,,"A pseudonymous analyst said that the current price level for Pepe Coin PEPE/USD is a “strong demand area.""

What Happened: Rekt Capital in a YouTube video tol...",https://www.benzinga.com/markets/cryptocurrency/23/05/32337002/crypto-analyst-identifies-strong-demand-area-for-pepe-coin-key-levels-to-watch-out-for,https://cdn.benzinga.com/files/images/story/2023/Pepe_Meme_Tokens_1.jpeg?width=1200&height=800&fit=crop,en,2023-05-11T11:19:06.000000Z,benzinga.com,,cryptocurrency,N/A,53.040817,0.0516
9b0dae72-5059-470b-8dcc-c96511576c5b,"US Rep Brad Sherman Takes Shot At Crypto Bros, Argues Government Can Make 'Money Out Of Thin Air'","U.S. Congressman Brad Sherman, who is a California Democrat and a vocal critic of cryptocurrencies, has expressed doubts over the future of digital assets in the United States.",,"U.S. Congressman Brad Sherman, who is a California Democrat and a vocal critic of cryptocurrencies, has expressed doubts over the future of digital assets in th...",https://www.benzinga.com/markets/cryptocurrency/23/05/32332700/us-rep-brad-sherman-takes-shot-at-crypto-bros-argues-government-can-make-money-out-of-thin,https://cdn.benzinga.com/files/images/story/2023/Cryptocurrency_Photo_by_Fernando_Cortes_on_Shutterstock_0.jpeg?width=1200&height=800&fit=crop,en,2023-05-11T05:09:56.000000Z,benzinga.com,,cryptocurrency,N/A,49.22629,0.2263
d3bee89b-6133-42b9-9897-3da9600d7212,Binance Retains Market Supremacy Despite Nearly 50% Dip In April Trading Volume - Coinbase Glb (NASDAQ:COIN),"Binance, the world’s largest cryptocurrency exchange, has reported a 48% decrease in spot trading volume for the second month in a row, according to CCData research firm. What Happened: The report revealed that Binance’s trading volume fell to $287 billion in April, the second-lowest this year.",,"Binance, the world’s largest cryptocurrency exchange, has reported a 48% decrease in spot trading volume for the second month in a row, according to CCData re...",https://www.benzinga.com/markets/cryptocurrency/23/05/32334991/binance-retains-market-supremacy-despite-nearly-50-dip-in-april-trading-volume,https://cdn.benzinga.com/files/images/story/2023/Binance._Illustration_by_increation87_on_Shutterstock_0.jpeg?width=1200&height=800&fit=crop,en,2023-05-11T10:10:59.000000Z,benzinga.com,,cryptocurrency,N/A,49.224247,-0.1027
7a8f42c3-51aa-4c1c-9a43-3904f4c787d4,"BTC, ETH, DOGE Tumble Despite Benign CPI Report",Major coins tumbled on Wednesday evening despite a promising Consumer Price Index (CPI).,,"Major coins tumbled on Wednesday evening despite a promising Consumer Price Index (CPI).

Cryptocurrency Gains +/- Price (Recorded 9:30 p.m. EST) Bitcoin BTC/US...",https://www.benzinga.com/markets/cryptocurrency/23/05/32332344/bitcoin-ethereum-dogecoin-tumble-despite-inflation-news-analyst-sees-altcoins-bleeding-aga,"https://cdn.benzinga.com/files/images/story/2023/Bitcoin,And,Cryptocurrency,Investing,Concept.,Bitcoin,Cryptocurrency,Gold,Coin.,Trading_0.jpeg?width=1200&height=800&fit=crop",en,2023-05-11T03:09:21.000000Z,benzinga.com,,cryptocurrency,N/A,39.41168,0.0
6ed52a32-198d-4531-9503-e5b6e2dd7681,"If You Invested $1,000 In Bitcoin When Donald Trump Appeared On CNN In 2016, Here's How Much You'd Have Now","One of the most talked about television interviews happened Wednesday night, with former President Donald Trump taking part in a town hall on CNN.",,"One of the most talked about television interviews happened Wednesday night, with former President Donald Trump taking part in a town hall on CNN.

The event wa...",https://www.benzinga.com/markets/cryptocurrency/23/05/32346902/if-you-invested-1-000-in-bitcoin-when-donald-trump-appeared-on-cnn-in-2016-heres-how-much-,https://cdn.benzinga.com/files/images/story/2023/05/11/trump_bitcoin_shutter.jpg?width=1200&height=800&fit=crop,en,2023-05-11T17:43:52.000000Z,benzinga.com,,cryptocurrency,N/A,36.338413,0.0
fe87272a-f62a-4a85-98e5-8a171515a909,Ethereum: The Frog Meme Moment (ETH-USD),The PEPE memecoin launched on Ethereum in mid-April and has already sucked in over 100k unique wallet addresses. Find out what this means for ETH-USD investors.,,"Anthony Kwan/Getty Images News

There is a new coin on the Ethereum (ETH-USD) network that is causing quite a bit of chaos within crypto. PEPE (PEPE-USD) is the...",https://seekingalpha.com/article/4602798-ethereum-the-frog-meme-moment,https://static.seekingalpha.com/cdn/s3/uploads/getty_images/1170676049/image_1170676049.jpg?io=getty-c-w1536,en,2023-05-11T01:04:15.000000Z,seekingalpha.com,,cryptocurrency,N/A,26.755308,0.2263
5f4edff7-6613-4fa0-8613-d64b81fe03b3,Cipher: Don't Look Up (NASDAQ:CIFR),"Cipher has a fast-growing, low-cost Bitcoin mining operation that they believe is the best-in-class. Find out why I rate CIFR stock a hold.",,"Charday Penn/E+ via Getty Images

Cipher Mining Inc. (NASDAQ:CIFR) is building mining capacity at an impressive rate; it has signed an outstanding Power Purchas...",https://seekingalpha.com/article/4603203-cipher-dont-look-up,https://static.seekingalpha.com/cdn/s3/uploads/getty_images/1132766128/image_1132766128.jpg?io=getty-c-w1536,en,2023-05-11T18:58:54.000000Z,seekingalpha.com,,cryptocurrency,N/A,17.71168,0.91
62786af5-4260-4d18-9943-2da946bbbedb,Bitcoin: Sell The Market (Technical Analysis) (BTC-USD),"Bitcoin's rebound to $28,000 has been met with resistance, signaling a potential further decline. Find out what TA indicates is next for BTC-USD.",,"KanawatTH

Bitcoin (BTC-USD) is currently undergoing a period of turbulence and uncertainty, characterized by a downward trend. This can be largely attributed t...",https://seekingalpha.com/article/4603786-bitcoin-sell-the-market-technical-analysis,https://static.seekingalpha.com/cdn/s3/uploads/getty_images/1403389740/image_1403389740.jpg?io=getty-c-w1536,en,2023-05-12T19:47:35.000000Z,seekingalpha.com,,cryptocurrency,N/A,158.90854,-0.4201
