uuid,title,description,keywords,snippet,url,image_url,language,published_at,source,relevance_score,type,industry,match_score,sentiment_score
c8b9f350-c275-43d0-bd6c-7a0198f5444d,"Bitcoin (BTC/USD) Price Forecast: Boom or Bust for Bitcoin Bulls Above $52,000?","Bitcoin prices struggle to surpass $52,000 after breaking through prior resistance of $50,000.",,"Bitcoin (BTC/USD) Price Update:

The analysis contained in article relies on price action and chart formations. To learn more about price action or chart patter...",https://www.dailyfx.com/forex/market_alert/2021/09/06/Bitcoin-BTCUSD-Price-Forecast-Boom-or-Bust-for-Bitcoin-Bulls-Above-52000-LiveEdu-TDC.html,https://a.c-dn.net/b/2VEZHf/headline_iStock-696301332.jpg,en,2021-09-06T17:54:00.000000Z,dailyfx.com,,cryptocurrency,N/A,86.62875,-0.093367
2e89df13-fbbd-4b0c-ac3b-cf096e6fcd00,"Bitcoin (BTC) Becomes Legal Tender in El Salvador, Solana (SOL) Continues to Surge Higher",Bitcoin is now legal tender in El Salvador and the country now holds 400 BTC and is looking to buy more.,,"Bitcoin (BTC/USD), Solana (SOL/USD) Prices, Charts, and Analysis

Bitcoin breaks above resistance and eyes further gains.

Solana hits yet another all-time high...",https://www.dailyfx.com/forex/market_alert/2021/09/07/Bitcoin-BTC-Becomes-Legal-Tender-in-El-Salvador-Solana-SOL-Continues-to-Surge-Higher-.html,https://a.c-dn.net/b/2jPuVf/headline_shutterstock_365875643.jpg,en,2021-09-07T08:34:00.000000Z,dailyfx.com,,cryptocurrency,N/A,64.348625,0.353933
c79fde79-6a2e-4a74-adda-e9050351953c,"Bitcoin (BTC/USD) Finds Support above $45,000 after Steep Decline","Bitcoin (BTC/USD) falls back to $46,000 after a strong rally. Which way will crypto go?",,"Bitcoin (BTC/USD) Outlook:

Bitcoin (BTC/USD) finding resistance below $48,000 El Salvador accepts Bitcoin as a legal tender, BTC/ USD bulls back off US Dollar ...",https://www.dailyfx.com/forex/market_alert/2021/09/08/Bitcoin-BTCUSD-Finds-Support-above-45000-after-steep-decline-LiveEdu-TDC.html,https://a.c-dn.net/b/3nePLO/headline_BITCOIN_STACK.jpg,en,2021-09-08T19:07:00.000000Z,dailyfx.com,,cryptocurrency,N/A,92.61352,0.242
4e4b7088-7ba9-41a6-b165-900b4ded57ea,BTC ‘Crash’ and Other False Narratives,In today’s Money Morning after another big crypto pump. the FUD was inevitable why did BTC crash today? Depends on who you listen to don’t buy the FUD hype and more,,In today’s Money Morning…after another big crypto pump…the FUD was inevitable…why did BTC crash today? Depends on who you listen to…don’t buy the FU...,https://www.moneymorning.com.au/20210908/btc-crash-and-other-false-narratives.html,https://www.moneymorning.com.au/wp-content/uploads/2021/09/BTC-‘Crash-and-Other-False-Narratives1.jpg,en,2021-09-08T03:03:01.000000Z,moneymorning.com.au,,cryptocurrency,N/A,30.931234,-0.4278
7a5a1fce-a6a6-406c-8068-e5a79af052b2,Wednesday Morning Reads,Wednesday Morning Reads,,"Wednesday Morning Reads

Reads:

Futures:

premium:

SeekingAlpha

Crypto crumble

Cryptocurrencies and related stocks are facing less volatility this morning f...",https://www.optionmillionaires.com/wednesday-morning-reads-215/,https://www.optionmillionaires.com/wp-content/uploads/2016/06/The-OM-Bunch.png,en,2021-09-08T12:12:51.000000Z,optionmillionaires.com,,cryptocurrency,N/A,23.407217,-0.2263
