uuid,title,description,keywords,snippet,url,image_url,language,published_at,source,relevance_score,type,industry,match_score,sentiment_score
ed101cc8-71b1-4d01-9369-2efc6edc6823,Syrah Resources : December Quarterly Activities and Cashflow Report,"Mozambique
        
        
          Syrah Resources Limited   recorded a TRIFR of 0.5 at quarter end for Balama.
        
        
          
            
              
            
            
 ... | January 30,  2022","SYRAH RESOURCES LIMITED stock exchange, news, information, press release, syrah, resources, limited, recorded, trifr, of, at, quarter, end, for | SYR | AU000000SYR9","Syrah Resources : December Quarterly Activities and Cashflow Report 01/30/2022 | 05:11pm EST Send by mail :

Name : First name : From * : To * : (You can enter ...",https://www.marketscreener.com/quote/stock/SYRAH-RESOURCES-LIMITED-10355302/news/Syrah-Resources-December-Quarterly-Activities-and-Cashflow-Report-37691664/,https://www.marketscreener.com/images/twitter_MS_fdgris.png,en,2022-01-30T22:11:06.000000Z,marketscreener.com,,equity,Consumer Cyclical,11.6654495,0.487767
3dbb77da-c4f6-4343-a7e6-3ce32c802142,"For chip industry, global supply crunch pushes next target to $1 trillion","After posting record sales in 2021, semiconductor makers prepare for historic expansion to boost capacity","Chip companies, semiconductor, TSMC, GlobalFoundries, Samsung, Tesla",Chip companies just had their best sales year ever—charged by a global semiconductor shortage and growing demand—and industry executives expect that total t...,https://www.livemint.com/industry/manufacturing/for-chip-industry-global-supply-crunch-pushes-next-target-to-1-trillion-11643546008826.html,https://images.livemint.com/img/2022/01/30/600x338/AFP_8ZR4WX_1617337750674_1643546485120.jpg,en,2022-01-30T12:41:46.000000Z,livemint.com,,equity,Consumer Cyclical,10.447843666666666,-0.4019
75882e3e-a222-4f05-a57b-e60d90dd821a,Tesla (NASDAQ:TSLA) PT Raised to $910.00,"Tesla (NASDAQ:TSLA) had its price objective boosted by Wells Fargo & Company from $860.00 to $910.00 in a report published on Thursday morning, Analyst Price Targets reports. The firm currently has an equal weight rating on the electric vehicle producer’s stock. A number of other research analysts have also recently commented on the company. upped […]",,"Tesla (NASDAQ:TSLA) had its price objective boosted by Wells Fargo & Company from $860.00 to $910.00 in a report published on Thursday morning, Analyst Price Ta...",https://etfdailynews.com/news/tesla-nasdaqtsla-pt-raised-to-910-00/,https://www.marketbeat.com/logos/tesla-motors-inc-logo.jpg,en,2022-01-31T07:28:44.000000Z,etfdailynews.com,,equity,Consumer Cyclical,40.93029683333334,0.26018199999999997
e70fb6c9-0411-4414-be57-4ec72fae9403,Tesla Stock: Nothing New To See Here (NASDAQ:TSLA),Tesla’s 4Q21 earnings report only underscores our thesis that the stock is wildly overvalued and will fall as low $136/share.,,"jetcityimage/iStock Editorial via Getty Images

Tesla’s (NASDAQ:TSLA) 4Q21 earnings report only underscores our thesis that the stock is wildly overvalued and...",https://seekingalpha.com/article/4482592-tesla-nothing-new-to-see-here,https://static.seekingalpha.com/cdn/s3/uploads/getty_images/1140204814/image_1140204814.jpg?io=getty-c-w750,en,2022-01-31T15:20:00.000000Z,seekingalpha.com,,equity,Consumer Cyclical,66.767426,0.162473
4c5f07b0-ded5-484b-a9b4-0d9e77db64f2,Tesla The Train Conductor? How The Company Is Providing Transportation For German Employees,One way to help hire thousands of employees and keep production going at a factory is providing reliable transportation to them. Here’s how Tesla Inc ...,,One way to help hire thousands of employees and keep production going at a factory is providing reliable transportation to them. Here’s how Tesla Inc (NASDAQ:...,https://www.benzinga.com/news/22/01/25314144/tesla-the-train-conductor-how-the-company-is-providing-transportation-for-german-employees,https://cdn.benzinga.com/files/imagecache/og_image_social_share_1200x630/images/story/2012/0x0-model3_19_2.jpg,en,2022-01-31T20:33:50.000000Z,benzinga.com,,equity,Consumer Cyclical,34.80309966666667,0.15106700000000003
42f7213d-6f84-4c1b-b8cd-6096a3b009da,Monday Morning’s 5 Tech Stock Movers Include Netflix and Tesla – 24,Two tech stocks that have taken some lumps in recent days received a boost Monday from analyst upgrades.,,"Monday Morning's 5 Tech Stock Movers Include Netflix and Tesla

Tech stocks got off to a mixed start Monday morning. The Nasdaq was up more than 1%, while the D...",https://247wallst.com/technology-3/2022/01/31/monday-mornings-5-tech-stock-movers-include-netflix-and-tesla/,https://247wallst.com/wp-content/uploads/2021/12/imageForEntry19-58i.jpg,en,2022-01-31T15:36:27.000000Z,247wallst.com,,equity,Consumer Cyclical,34.332448666666664,0.243625
caa4a2ef-83e8-48bf-b4f0-fee8de79f147,"Tesla's Ace In The Hole: 60,000 FSD Beta Testers (NASDAQ:TSLA)","Tesla announced in its quarterly earnings letter that 60,000 people are testing its Full Self-Driving beta software. This could be its ace in the hole, read this article to learn more.",,"Spencer Platt/Getty Images News

Resolving all doubt that its data collection efforts are at a quality on par with competitors like Waymo (GOOG, GOOGL) and Crui...",https://seekingalpha.com/article/4482970-teslas-ace-in-the-hole-60000-fsd-beta-testers,https://static.seekingalpha.com/cdn/s3/uploads/getty_images/968584528/image_968584528.jpg?io=getty-c-w750,en,2022-01-31T17:39:26.000000Z,seekingalpha.com,,equity,Consumer Cyclical,49.87961,0.18255
444366aa-a66a-412e-b8f9-7905a451e92a,"NJ State Employees Deferred Compensation Plan Buys Tesla Inc, Glacier Bancorp Inc, Regal Rexnord Corp, Sells , Cloudera Inc,",GuruFocus Article or News written by insider and the topic is about:,"GuruFocus, Article, News, insider, GBCI, TSLA, RRX, ZWS, CP, CADE, CADE, XLRN, CLDR, KSU, STMP, CADE, MDP, ","New Purchases: TSLA, RRX, ZWS, CP, CADE, CADE, LAND, ARW, FORM, KBH, UNH, VRTX, REXR,

TSLA, RRX, ZWS, CP, CADE, CADE, LAND, ARW, FORM, KBH, UNH, VRTX, REXR, Ad...",https://www.gurufocus.com/news/1629447/nj-state-employees-deferred-compensation-plan-buys-tesla-inc-glacier-bancorp-inc-regal-rexnord-corp-sells--cloudera-inc-,https://www.gurufocus.com/favicon.ico,en,2022-01-31T18:38:10.000000Z,gurufocus.com,,equity,Consumer Cyclical,49.568913,0.118475
07be2737-9ff3-428e-8e4e-63e8c35d461f,5 Stocks That Beat the Quarterly Expectations,"In this article, we discuss the 5 stocks that beat the quarterly expectations.",,"In this article, we discuss the 5 stocks that beat the quarterly expectations. If you want to read our detailed analysis of these companies, go directly to the ...",https://www.insidermonkey.com/blog/5-stocks-that-beat-the-quarterly-expectations-1022598/,https://d2gr5kl7dt2z3t.cloudfront.net/blog/wp-content/uploads/2021/05/06234200/joseph-frank-XGC_1eH_ZGI-unsplash.jpg,en,2022-01-31T21:48:09.000000Z,insidermonkey.com,,equity,Consumer Cyclical,33.39289516666667,0.22936416666666667
f350cad2-3333-4046-8de4-1a10539dea82,"Canal Insurance CO Buys Weibo Corp, Pfizer Inc, Northrop Grumman Corp, Sells APA Corp, Tesla Inc, MP Materials Corp",GuruFocus Article or News written by insider and the topic is about:,"GuruFocus, Article, News, insider, PFE, NOC, BMY, VZ, CRNC, NIO, WB, INTC, SBRA, FLNC, ARKK, ARKX, APA, TSLA, MP, ","New Purchases: WB, INTC, SBRA, FLNC, ARKK, ARKX, K, KGC, ETHE, KD, BE,

WB, INTC, SBRA, FLNC, ARKK, ARKX, K, KGC, ETHE, KD, BE, Added Positions: PFE, NOC, BMY, ...",https://www.gurufocus.com/news/1630630/read,https://www.gurufocus.com/favicon.ico,en,2022-01-31T23:38:03.000000Z,gurufocus.com,,equity,Consumer Cyclical,48.223365666666666,0.0
6fd187d0-be27-41ea-9f49-7cae7127525d,"Monday Afternoon’s Top Analyst Upgrades and Downgrades: Chevron, Netflix, Robinhood, Tesla and More – 24","Monday afternoon's top analyst upgrades and downgrades included Beyond Meat, Chevron, Deutsche Bank, EOG Resources, Kellogg, Microchip Technology, Netflix, Robinhood Markets, Spotify Technology, StoneCo and Tesla.",,"Monday Afternoon's Top Analyst Upgrades and Downgrades: Chevron, Netflix, Robinhood, Tesla and More

Markets started the week somewhat mixed, as investors are l...",https://247wallst.com/investing/2022/01/31/monday-afternoons-top-analyst-upgrades-and-downgrades-beyond-meat-chevron-deutsche-bank-eog-resources-kellogg-microchip-technology-netflix-robinhood-markets-spotify-technology-stoneco-tes/,https://247wallst.com/wp-content/uploads/2018/03/finance-background.jpg,en,2022-01-31T16:50:25.000000Z,247wallst.com,,equity,Consumer Cyclical,30.68057516666666,0.33016699999999993
4e7cbc47-44c2-474e-9b2d-e354635f477d,"The Zacks Analyst Blog Highlights: Apple Inc., Tesla, Inc., and Johnson & Johnson","Apple Inc., Tesla, Inc., and Johnson & Johnson are highlighted in this Analyst Blog article.","stock, stocks, investment, investment advice, investing, online trading, online investment, online stock trading, stock market, financial, financial planning, quote, quotes, stock quotes","This page has not been authorized, sponsored, or otherwise approved or endorsed by the companies represented herein. Each of the company logos represented herei...",https://www.zacks.com/stock/news/1860313/the-zacks-analyst-blog-highlights-apple-inc-tesla-inc-and-johnson-johnson?cid=CS-ZC-FT-press_releases-1860313,https://staticx-tuner.zacks.com/images/articles/main/94/53.jpg,en,2022-02-01T10:00:00.000000Z,zacks.com,,equity,Consumer Cyclical,60.76832666666667,0.0
0c88cb36-fbb4-41d2-83b1-e5d95c92098d,"The Zacks Analyst Blog Highlights: General Motors Co., Tesla Inc., Marvell Technology Inc., FedEx Corp. and Zoetis Inc","General Motors Co., Tesla Inc., Marvell Technology Inc., FedEx Corp. and Zoetis Inc are highlighted in this Analyst Blog article.","stock, stocks, investment, investment advice, investing, online trading, online investment, online stock trading, stock market, financial, financial planning, quote, quotes, stock quotes","This page has not been authorized, sponsored, or otherwise approved or endorsed by the companies represented herein. Each of the company logos represented herei...",https://www.zacks.com/stock/news/1860307/the-zacks-analyst-blog-highlights-general-motors-co-tesla-inc-marvell-technology-inc-fedex-corp-and-zoetis-inc?cid=CS-ZC-FT-press_releases-1860307,https://staticx-tuner.zacks.com/images/articles/main/3e/106.jpg,en,2022-02-01T09:43:00.000000Z,zacks.com,,equity,Consumer Cyclical,50.778639,0.0
f37812f7-00df-4c14-8283-05f84a33424a,Tesla's Slow Product Release Strategy Explained (NASDAQ:TSLA),"Tesla is operating under significant supply, manufacturing and logistical constraints. Their delays in product launches make sense. Read more...",,"jetcityimage/iStock Editorial via Getty Images

Global light vehicle sales peaked in 2018 at 94 million vehicles, and have since dropped to 81 million in 2021, ...",https://seekingalpha.com/article/4483107-teslas-tsla-stock-slow-product-release-strategy-explained,https://static.seekingalpha.com/cdn/s3/uploads/getty_images/1227575736/image_1227575736.jpg?io=getty-c-w750,en,2022-02-01T13:00:00.000000Z,seekingalpha.com,,equity,Consumer Cyclical,55.683495,0.388709
8802f030-981d-47ef-8db9-ba00ea3ed823,"The Zacks Analyst Blog Highlights: General Motors Co., Tesla Inc., Marvell Technology Inc., FedEx Corp. and Zoetis Inc","General Motors Co., Tesla Inc., Marvell Technology Inc., FedEx Corp. and Zoetis Inc are highlighted in this Analyst Blog article.","Stocks, Finance","For Immediate Release

Chicago, IL – February 1, 2022 – Zacks.com announces the list of stocks featured in the Analyst Blog. Every day the Zacks Equity Rese...",https://www.entrepreneur.com/article/416188,https://assets.entrepreneur.com/providers/zacks/hero-image-zacks-416188.jpeg,en,2022-02-01T09:43:00.000000Z,entrepreneur.com,,equity,Consumer Cyclical,50.19024833333334,0.3071
8724ed9c-45d7-49f6-be2d-4985d19219ac,"Assenagon Asset Management S.A. Buys Apple Inc, Microsoft Corp, Tesla Inc, Sells Amazon.com Inc, Adobe Inc, Uber Technologies Inc",GuruFocus Article or News written by insider and the topic is about:,"GuruFocus, Article, News, insider, MSFT, AAPL, TSLA, GOOGL, QCOM, ABT, VALE, HDB, DOCN, VST, AAP, OVV, XLRN, TER, POST, CFX, CCJ, WEN, ","Investment company Current Portfolio ) buys Apple Inc, Microsoft Corp, Tesla Inc, Alphabet Inc, Qualcomm Inc, sells Amazon.com Inc, Adobe Inc, Uber Technologies...",https://www.gurufocus.com/news/1631488/assenagon-asset-management-sa-buys-apple-inc-microsoft-corp-tesla-inc-sells-amazoncom-inc-adobe-inc-uber-technologies-inc,https://www.gurufocus.com/favicon.ico,en,2022-02-01T18:38:20.000000Z,gurufocus.com,,equity,Consumer Cyclical,48.20639366666668,0.31103300000000006
c0c8bb1d-c47a-48e8-83f8-0a4dd5f9f766,"Oak Ridge Investments Llc Buys Tesla Inc, R1 RCM Inc, TechTarget Inc, Sells LHC Group Inc, Salesforce.com Inc, Everbridge Inc",GuruFocus Article or News written by insider and the topic is about:,"GuruFocus, Article, News, insider, AZEK, ORLY, STE, IWO, EXPE, IUSG, TSLA, RCM, TTGT, LNTH, AMD, NKE, LHCG, EVBG, INOV, NEO, XLRN, BMY, ","New Purchases: TSLA, RCM, TTGT, LNTH, AMD, NKE, AUPH, LULU, SPT, SNPS, TYL, RPD, MSCI, GNRC, MDLZ,

TSLA, RCM, TTGT, LNTH, AMD, NKE, AUPH, LULU, SPT, SNPS, TYL,...",https://www.gurufocus.com/news/1631485/oak-ridge-investments-llc-buys-tesla-inc-r1-rcm-inc-techtarget-inc-sells-lhc-group-inc-salesforcecom-inc-everbridge-inc,https://www.gurufocus.com/favicon.ico,en,2022-02-01T18:38:13.000000Z,gurufocus.com,,equity,Consumer Cyclical,46.936225166666674,0.131675
5ebabd21-72df-4843-aca6-fce5b98c0659,Tesla Stock Looks Poised To Rise After Recent Sell Off,"Tesla stock has declined by almost 21% over the last month (about 21 trading days) considerably underperforming the S&P 500, which remains down by about 7% over the same period. The decline is primarily driven by the broader sell-off in high-growth, high-multiple stocks, as investors brace for...","tsla stock, tsla revenues, covid-19, coronavirus","GOTHENBURG, SWEDEN - 2019/09/14: An American automotive and energy company that specialises in ... [+] electric car manufacturing Tesla logo seen in Gothenburg....",https://www.forbes.com/sites/greatspeculations/2022/02/01/tesla-stock-looks-poised-to-rise-after-recent-sell-off/,https://imageio.forbes.com/specials-images/imageserve/1170611911/0x0.jpg?format=jpg&width=1200&fit=bounds,en,2022-02-01T14:30:16.000000Z,forbes.com,,equity,Consumer Cyclical,41.242813,0.3449
5a29f2b5-6166-4738-a619-30a85d81ebf9,Nasdaq narrowly misses worst January ever as Wall Street gains,"Valuations of growth and technology stocks have come under increasing scrutiny, as investors fretted about companies trading at lofty valuations at a time when the U.S. Federal Reserve is set to begin raising interest rates to combat inflation and withdraw its pandemic stimulus measures.",,"Representative image

U.S. stocks closed higher on Monday, at the end of a volatile month for Wall Street where the tech-heavy Nasdaq narrowly avoided its worst...",https://www.moneycontrol.com/news/business/markets/nasdaq-narrowly-misses-worst-january-ever-as-wall-street-gains-8012371.html,https://images.moneycontrol.com/static-mcnews/2020/09/wall-street-770x433.jpg,en,2022-02-01T00:43:01.000000Z,moneycontrol.com,,equity,Consumer Cyclical,18.972602499999997,0.22629999999999997
bbc54688-a345-484e-a0e5-de9962abe301,"Wall St eases after two-day surge as Tesla, Microsoft slip","Electric-car maker Tesla Inc fell 0.9% after recalling nearly 54,000 vehicles, while Microsoft Corp declined 1.3% after a media report that the U.S. Federal Trade Commission will be reviewing its $68.7 billion deal for Activision Blizzard Inc.",,"U.S. stocks fell in a volatile session on Tuesday, with Microsoft and Tesla weighing the most as high-valued technology and growth stocks gave back some gains f...",https://www.businesstoday.in/latest/world/story/wall-st-eases-after-two-day-surge-as-tesla-microsoft-slip-321182-2022-02-01,https://akm-img-a-in.tosshub.com/businesstoday/images/story/202202/stocks-sixteen_nine.jpg,en,2022-02-01T21:55:12.000000Z,businesstoday.in,,equity,Consumer Cyclical,31.86387883333333,0.3102
1807784a-ee93-49ef-acac-9a4812aa4fe7,"Insider Selling: Tesla, Inc. (NASDAQ:TSLA) SVP Sells 3,500 Shares of Stock","Tesla, Inc. (NASDAQ:TSLA) SVP Andrew D. Baglino sold 3,500 shares of the stock in a transaction that occurred on Thursday, January 27th. The stock was sold at an average price of $933.56, for a total value of $3,267,460.00. The transaction was disclosed in a filing with the SEC, which is available through the SEC website. […]",,"Tesla, Inc. (NASDAQ:TSLA) SVP Andrew D. Baglino sold 3,500 shares of the stock in a transaction that occurred on Thursday, January 27th. The stock was sold at a...",https://etfdailynews.com/news/insider-selling-tesla-inc-nasdaqtsla-svp-sells-3500-shares-of-stock/,https://www.marketbeat.com/logos/tesla-motors-inc-logo.jpg,en,2022-02-02T09:42:42.000000Z,etfdailynews.com,,equity,Consumer Cyclical,67.97809066666667,0.35823999999999995
e7b49be9-7bef-4c9a-9813-b066a83fdb40,Were Hedge Funds Illusioned With Tesla Inc. (TSLA)?,How do you pick the next stock to invest in? One way would be to spend days of research browsing through thousands of publicly traded companies.,,"How do you pick the next stock to invest in? One way would be to spend days of research browsing through thousands of publicly traded companies. However, an eas...",https://www.insidermonkey.com/blog/were-hedge-funds-illusioned-with-tesla-inc-tsla-1023524/,https://d2gr5kl7dt2z3t.cloudfront.net/blog/wp-content/uploads/2019/04/04120141/Matthew-Hulsizer-PEAK6-Capital.jpg,en,2022-02-02T15:30:09.000000Z,insidermonkey.com,,equity,Consumer Cyclical,71.64177066666667,0.37100249999999996
a2a4c600-0159-4a38-893f-eb18fe69dca9,Tesla Stock: Profit To Soar As Production Passed Breakeven Scale (NASDAQ:TSLA),"After 2021, there should no longer be any doubt about the profitability of Tesla. Read more to learn why TSLA's profit is poised to soar.",,"Justin Sullivan/Getty Images News

Thesis and Background

After 2021, there should no longer be any doubt about the profitability of Tesla (TSLA). As announced ...",https://seekingalpha.com/article/4483552-tesla-stock-profit-soar-production-passed-breakeven-scale,https://static.seekingalpha.com/cdn/s3/uploads/getty_images/490597708/image_490597708.jpg?io=getty-c-w750,en,2022-02-02T16:37:03.000000Z,seekingalpha.com,,equity,Consumer Cyclical,62.28132,0.188438
ba08a7ed-a8cc-464e-8c00-23fa4e422535,"DekaBank Deutsche Girozentrale Buys Mastercard Inc, Tesla Inc, NVIDIA Corp, Sells Visa Inc, Northrop Grumman Corp, Honeywell International Inc",GuruFocus Article or News written by insider and the topic is about:,"GuruFocus, Article, News, insider, MA, TSLA, NVDA, NTR, MRVL, TSM, MED, CHGG, RBLX, BE, CRNC, OLED, KSU, CHPT, STEM, CHPT, VER, NATI, ","Frankfurt, 2M, based Investment company Current Portfolio ) buys Mastercard Inc, Tesla Inc, NVIDIA Corp, Marvell Technology Inc, Nutrien, sells Visa Inc, Northr...",https://www.gurufocus.com/news/1632696/dekabank-deutsche-girozentrale-buys-mastercard-inc-tesla-inc-nvidia-corp-sells-visa-inc-northrop-grumman-corp-honeywell-international-inc,https://www.gurufocus.com/favicon.ico,en,2022-02-02T18:38:16.000000Z,gurufocus.com,,equity,Consumer Cyclical,48.196827500000005,0.098667
5a4cae15-e70d-4f41-8d0a-53b41f8ce38f,Ron Baron Comments on Tesla,GuruFocus Article or News written by Sydnee Gatewood and the topic is about: Guru stock highlight,"GuruFocus, Article, News, Sydnee Gatewood, Ron Baron, TSLA","Tesla, Inc. ( TSLA, Financial) designs, manufactures, and sells fully electric vehicles, solarproducts, energy storage solutions, and battery cells. The stock r...",https://www.gurufocus.com/news/1632796/read,https://www.gurufocus.com/favicon.ico,en,2022-02-02T21:29:29.000000Z,gurufocus.com,,equity,Consumer Cyclical,41.2684715,0.46685
6082ffad-f655-4bc0-92bc-99b0116d76a1,Ron Baron Comments on Tesla,GuruFocus Article or News written by Sydnee Gatewood and the topic is about: Guru stock highlight,"GuruFocus, Article, News, Sydnee Gatewood, Ron Baron, TSLA","Tesla, Inc. ( TSLA , Financial ) designs, manufactures, and sells fully electric vehicles, solarproducts, energy storage solutions, and battery cells. The stock...",https://www.gurufocus.com/news/1632796/ron-baron-comments-on-tesla,https://www.gurufocus.com/favicon.ico,en,2022-02-02T21:29:29.000000Z,gurufocus.com,,equity,Consumer Cyclical,40.667187333333324,0.46685
9aa524b3-a5e2-4cb2-bf09-75333351a6e7,"Grace Capital Buys Vanguard Consumer Discretionary ETF, Tesla Inc, Jasper Therapeutics Inc, Sells Vanguard Real Estate Index Fund ETF, Vanguard Health Care ETF, SPDR Bloomberg High Yield Bond ETF",GuruFocus Article or News written by insider and the topic is about:,"GuruFocus, Article, News, insider, VCR, GOOGL, NEO, XLE, UNP, NVDA, TSLA, JSPR, BKEPP.PFD, NSC, MMP, HSY, VNQ, VHT, SRLN, JNK, TIP, VGT, ","New Purchases: TSLA, JSPR, BKEPP.PFD, NSC, MMP, HSY,

TSLA, JSPR, BKEPP.PFD, NSC, MMP, HSY, Added Positions: VCR, GOOGL, NEO, XLE, SPY, UNP, NVDA, PSX, PFE, AAP...",https://www.gurufocus.com/news/1632683/grace-capital-buys-vanguard-consumer-discretionary-etf-tesla-inc-jasper-therapeutics-inc-sells-vanguard-real-estate-index-fund-etf-vanguard-health-care-etf-spdr-bloomberg-high-yield-bond-etf,https://www.gurufocus.com/favicon.ico,en,2022-02-02T18:38:04.000000Z,gurufocus.com,,equity,Consumer Cyclical,37.97334,0.455525
de4f7830-3345-440e-adad-dc9582fc2244,Elon Musk says his tweet about taking Tesla private was ‘entirely truthful’,Saudi Arabia’s sovereign wealth fund had agreed to support his attempt to take the company private.,"Elon Musk, Tesla, Tesla EVs, Elon Musk billionaire","Elon Musk says his 2018 tweet about plans to take Tesla Inc. private was “entirely truthful"" and that investors who claim the missive was a fraud are wrong.

...",https://www.livemint.com/companies/people/elon-musk-says-his-tweet-about-taking-tesla-private-was-entirely-truthful-11643782620487.html,https://images.livemint.com/img/2022/02/02/600x338/8e334d08-409c-11ec-91d6-37695f3e70ee_1639114386615_1643782696149.jpg,en,2022-02-02T06:23:37.000000Z,livemint.com,,equity,Consumer Cyclical,34.76671416666667,0.04614000000000001
7e53d874-8652-4006-be04-a883d1eb4b94,Elon Musk And Dogecoin Earn Litecoin Creator's Praise - Dogecoin - United States Dollar ($DOGE),Litecoin (CRYPTO: LTC) creator Charlie Lee,,Litecoin (CRYPTO: LTC) creator Charlie Lee praised Elon Musk and the world's first memecoin Dogecoin (CRYPTO: DOGE) for their contributions to the cryptocurrenc...,https://www.benzinga.com/markets/cryptocurrency/22/02/25376557/elon-musk-and-dogecoin-earn-litecoin-creators-praise,https://cdn2.benzinga.com/files/imagecache/og_image_social_share_1200x630/images/story/2012/dogecoin-gc60e17d19_1920_0.png?width=720,en,2022-02-02T20:10:00.000000Z,news.google.com,,equity,Consumer Cyclical,24.105692833333332,0.25126699999999996
bf46a834-7774-47d0-b606-2a0649f2e30a,Tesla (NASDAQ:TSLA) Stock Rating Upgraded by Credit Suisse Group,"Credit Suisse Group upgraded shares of Tesla (NASDAQ:TSLA) from a neutral rating to an outperform rating in a report published on Monday, Analyst Price Targets reports. The firm currently has $1,025.00 price target on the electric vehicle producer’s stock. Several other brokerages also recently commented on TSLA. Wedbush increased their target price on Tesla from […]",,"Credit Suisse Group upgraded shares of Tesla (NASDAQ:TSLA) from a neutral rating to an outperform rating in a report published on Monday, Analyst Price Targets ...",https://etfdailynews.com/news/tesla-nasdaqtsla-stock-rating-upgraded-by-credit-suisse-group/,https://www.marketbeat.com/logos/tesla-motors-inc-logo.jpg,en,2022-02-03T07:34:42.000000Z,etfdailynews.com,,equity,Consumer Cyclical,37.13463716666667,0.458291
0c996e4a-0153-4a44-bded-9d91be8dc08c,"Palisades Hudson Asset Management, L.P. Buys Vanguard ESG U.S. Stock ETF, Tesla Inc, Nuveen ESG Small-Cap ETF, Sells Globant SA",GuruFocus Article or News written by insider and the topic is about:,"GuruFocus, Article, News, insider, ESGV, TSLA, NUSC, BRK.B, AZO, ","New Purchases: TSLA, NUSC, AZO, BRK.B,

TSLA, NUSC, AZO, BRK.B, Added Positions: ESGV, EWA, IWM, EWJ, VGK, SMOG, ICLN, IAU, AAXJ, VSS, EWC, EPP, HD, GOOGL, COST...",https://www.gurufocus.com/news/1634081/palisades-hudson-asset-management-lp-buys-vanguard-esg-us-stock-etf-tesla-inc-nuveen-esg-smallcap-etf-sells-globant-sa,https://www.gurufocus.com/favicon.ico,en,2022-02-03T22:38:03.000000Z,gurufocus.com,,equity,Consumer Cyclical,45.696699,0.486733
3d78181a-3261-4757-bd42-49fc00bbe619,"Longitude (Cayman) Ltd. Buys Tesla Inc, Meta Platforms Inc, PayPal Holdings Inc, Sells Invitae Corp, The Walt Disney Co, Berkshire Hathaway Inc",GuruFocus Article or News written by insider and the topic is about:,"GuruFocus, Article, News, insider, PYPL, LILM, QS, AEO, CURI, CURI, TSLA, FB, UPST, NNOX, FSLY, RIG, NVTA, DIS, MRNA, BNTX, ","New Purchases: TSLA, FB, UPST, NNOX, FSLY, RIG,

TSLA, FB, UPST, NNOX, FSLY, RIG, Added Positions: PYPL, SOFI, SOFI, LILM, QS, AEO, CURI, CURI, AMZN, NVDA, JBLU...",https://www.gurufocus.com/news/1633830/longitude-cayman-ltd-buys-tesla-inc-meta-platforms-inc-paypal-holdings-inc-sells-invitae-corp-the-walt-disney-co-berkshire-hathaway-inc,https://www.gurufocus.com/favicon.ico,en,2022-02-03T18:38:35.000000Z,gurufocus.com,,equity,Consumer Cyclical,44.548812,0.13650000000000004
