uuid,title,description,keywords,snippet,url,image_url,language,published_at,source,relevance_score,type,industry,match_score,sentiment_score
4fbaafb0-3cae-4ca1-bde1-f729891c010e,AI buzz pushes tech stocks higher – but here’s why the ripple effect in stocks may still be ‘narrow’,"The buzz around artificial intelligence may resonate across industries, as investors attempt to identify the stock-market winners as generative AI takes off.","article_normal, ai, tech, stocks, etf, Chemicals, Fertilizers, Computers/Consumer Electronics, Artificial Intelligence Technologies, Semiconductors, Agrochemicals, Basic Materials/Resources, Computing, Computer Hardware, Financial Services, Industrial Electronics, Industrial Goods, Integrated Circuits, Investing/Securities, Technology, Graphics Processing Units, Corporate/Industrial News, Artificial Intelligence/Machine Learning, Political/General News, Computer Science, Sciences/Humanities, Equity Markets, Commodity/Financial Market News, Content Types, Factiva Filters, C&E Exclusion Filter, IWE Filter, Routine Market/Financial News, AI, corporate, industrial news, artificial intelligence, machine learning, political, general news, computer science, sciences, humanities, equity markets, commodity, financial market news, content types, factiva filters, c&e exclusion filter, iwe filter, routine market, financial news, chemicals, fertilizers, computers, consumer electronics, artificial intelligence technologies, semiconductors, agrochemicals, basic materials, resources, computing, computer hardware, financial services, industrial electronics, industrial goods, integrated circuits, investing, securities, technology, graphics processing units","The buzz around artificial intelligence may resonate across industries, as investors attempt to identify the stock-market winners as generative AI takes off.

?...",https://www.marketwatch.com/story/ai-buzz-pushes-tech-stocks-higher-but-heres-why-the-ripple-effect-in-stocks-may-still-be-narrow-fe906482,https://images.mktw.net/im-785098/social,en,2023-05-27T17:39:00.000000Z,marketwatch.com,,equity,Consumer Cyclical,12.2193885,0.0
8b2b1baf-c8b1-4c1c-b352-8b1b86d88b06,"Hyundai, LG partner to build $4.3 billion electric vehicle battery plant in Georgia",Hyundai Motor Group and LG Energy Solution announced that they will build a $4.3 billion electric battery plant as part of Hyundai's new electric vehicle assembly plant in Georgia.,,South Korea’s Hyundai Motor Group and LG Energy Solution Ltd (LGES) announced Thursday that they will build a $4.3 billion electric battery plant in Georgia a...,https://finance.yahoo.com/news/hyundai-lg-partner-build-4-085042483.html,https://s.yimg.com/ny/api/res/1.2/.LHwCLfOznafBXMt81XvvQ--/YXBwaWQ9aGlnaGxhbmRlcjt3PTEyMDA7aD02NzU-/https://media.zenfs.com/en/fox_business_text_367/2e3f52f9ae99883d59e5f901b298fa80,en,2023-05-27T08:50:42.000000Z,finance.yahoo.com,,equity,Consumer Cyclical,13.285828333333333,0.34
6a1472e4-b922-4cad-b4ed-82c29fa7be84,Week On Wall Street - A Market In Limbo (NYSEARCA:SPY),Bulls and Bears continue their trench warfare. This might be the same movie we saw in 2022 but with different players. Read more here.,,"shapecharge/E+ via Getty Images

Earnings season is over, and barring a major inflation shock, the consensus says the Fed has probably increased interest rates ...",https://seekingalpha.com/article/4607783-week-on-wall-street-market-in-limbo,https://static.seekingalpha.com/cdn/s3/uploads/getty_images/1434074172/image_1434074172.jpg?io=getty-c-w1536,en,2023-05-27T06:26:20.000000Z,seekingalpha.com,,equity,Consumer Cyclical,4.884142,-0.5267
0bceb69d-ee46-4059-8d11-110d8365a522,Lithium Junior Miners News For The Month Of May 2023,Lithium chemical spot prices surged higher and spodumene spot prices were flat the past month. Click here for the May 2023 update on lithium junior miners.,,"Just_Super

Welcome to the May 2023 edition of the 'junior' lithium miner news. We have categorized those lithium miners that won't likely be in production befo...",https://seekingalpha.com/article/4607817-lithium-junior-miners-news-for-the-month-of-may-2023,https://static.seekingalpha.com/cdn/s3/uploads/getty_images/1393018046/image_1393018046.jpg?io=getty-c-w1536,en,2023-05-27T11:17:13.000000Z,seekingalpha.com,,equity,Consumer Cyclical,4.712086,0.65365
9a609a3e-1920-4796-850c-459464a53b60,2 Top Growth Stocks to Buy Right Now and Hold for the Long-Term,"For investors trying to determine what stocks could put up market-beating returns in the coming years, Tesla (NASDAQ: TSLA) and Nvidia (NASDAQ: NVDA) should be on your list.  While I won't get points for originality for putting Tesla on this list, there are some very good reasons for investors to consider buying Tesla right now.  First, Tesla's early moves into the EV market are paying off.",,"For investors trying to determine what stocks could put up market-beating returns in the coming years, Tesla (NASDAQ: TSLA) and Nvidia (NASDAQ: NVDA) should be ...",https://finance.yahoo.com/m/1a2b6aea-935c-3b00-94d1-4310710463e2/2-top-growth-stocks-to-buy.html?.tsrc=rss,https://s.yimg.com/ny/api/res/1.2/wJTT1R9UznI8DQYcGuJZmQ--/YXBwaWQ9aGlnaGxhbmRlcjt3PTEyMDA7aD03NTg-/https://media.zenfs.com/en/motleyfool.com/efad62dfe991f3e16d9f890c6f1ea504,en,2023-05-28T09:35:00.000000Z,finance.yahoo.com,,equity,Consumer Cyclical,37.232277,0.4877
9ee89538-3a92-4b09-a213-3056ff82a4d4,Ford's huge deal with Tesla: EV hits this week,By Michael Elkins,,"By Michael Elkins

Investing.com -- Here is your weekly Pro Recap of the past week's biggest headlines in the electric vehicle space: a buzzy Ford-Tesla pact; p...",https://finance.yahoo.com/news/fords-huge-deal-tesla-ev-074105990.html?.tsrc=rss,https://s.yimg.com/cv/apiv2/social/images/yahoo_default_logo-1200x1200.png,en,2023-05-28T07:41:05.000000Z,finance.yahoo.com,,equity,Consumer Cyclical,32.4753,0.030271
9b62882b-65c5-4a8c-8bdc-ce7c6a26d9e1,Ford's huge deal with Tesla: EV hits this week By Investing.com,Ford's huge deal with Tesla: EV hits this week,,"Published May 28, 2023 07:41AM ET

© Reuters.

F +6.24% Add to/Remove from Watchlist TSLA +4.72% Add to/Remove from Watchlist STLA +1.60% Add to/Remove from Wa...",https://www.investing.com/news/stock-market-news/fords-huge-deal-with-tesla-this-week-in-evs-3092574,https://i-invdn-com.investing.com/news/LYNXNPEE8G0G4_L.jpg,en,2023-05-28T11:41:05.000000Z,investing.com,,equity,Consumer Cyclical,27.818192,0.211717
d51b9fdd-3f97-464f-812a-748fb4986c01,Tesla Model Y Passes Toyota Corolla To Become Best Selling Car In The World In 2023,"ZeroHedge - On a long enough timeline, the survival rate for everyone drops to zero",,"While Elon Musk continues to be a lightning rod for political controversy and discussion, Tesla is (at least for the time being) still executing in the backgrou...",https://www.zerohedge.com/markets/tesla-model-y-passes-toyota-corolla-become-best-selling-car-world-2023,https://assets.zerohedge.com/s3fs-public/styles/16_9_max_700/public/2023-05/FxALaO0WICcqJtH.jpg?itok=Os0ui_tf,en,2023-05-28T13:55:00.000000Z,zerohedge.com,,equity,Consumer Cyclical,27.398968666666672,0.49122000000000005
c354e0d3-6618-43e4-9b7e-1e18ef262e56,Ford EVs will have Tesla DNA and Waymo's robotaxis are coming to Uber,"Musk’s latest push toward turning Twitter into an actual town square.  In the future, Ford’s next generation of EVs will be equipped with Tesla’s charge port, called the North American Charging Standard, starting in 2025.  This will give them access to 12,000 Tesla Superchargers in the U.S. and Canada, which is double the number Ford customers currently have access to.",,"Welcome back to The Station, your central hub for all past, present and future means of moving people and packages from Point A to Point B.

I'm turning the whe...",https://finance.yahoo.com/news/ford-evs-tesla-dna-waymos-191545078.html,https://s.yimg.com/ny/api/res/1.2/A_8RFkgivwTESlMO6YMTEQ--/YXBwaWQ9aGlnaGxhbmRlcjt3PTEyMDA7aD04MDA-/https://media.zenfs.com/en/techcrunch_350/61a657ab0db84d27566555fe5f818995,en,2023-05-28T19:15:45.000000Z,finance.yahoo.com,,equity,Consumer Cyclical,21.915657,0.184673
c0072f30-72f0-46b1-a093-30fc53f66bbd,The Dirty Secret Behind The Clean-Car Revolution (And A “New” Way To Profit),Here’s the dirty little secret behind the clean-car revolution. Folks cruising around in EVs think they’re saving our kids from asthma-filled lungs.,,"“They’re ticking time bombs waiting to explode.”

I recently ran into a guy I hadn’t seen in 20 years.

He’s a car salesman. I asked his opinion on el...",https://www.valuewalk.com/the-dirty-secret-behind-the-clean-car-revolution-and-a-new-way-to-profit/,https://www.valuewalk.com/wp-content/uploads/2023/03/electric-vehicles.jpeg,en,2023-05-28T19:02:03.000000Z,valuewalk.com,,equity,Consumer Cyclical,14.199955,0.0279
ce578359-7e93-4560-9cc1-4a6b125205ca,Bitcoin Ranks High as a Safe-Haven Asset as Household Debt Climbs to $17 Trillion,"Once a year, Miami becomes a global Mecca for Bitcoin enthusiasts and advocates when the city hosts the titular conference celebrating the largest digital asset by market value.",,"Once a year, Miami becomes a global Mecca for Bitcoin enthusiasts and advocates when the city hosts the titular conference celebrating the largest digital asset...",https://www.etftrends.com/bitcoin-ranks-high-as-a-safe-haven-asset-as-household-debt-climbs-to-17-trillion/,https://www.etftrends.com/wp-content/uploads/2023/05/Bitcoin-Ranks-High-As-A-Safe-Haven-Asset-As-Household-Debt-Climbs-To-17-Trillion.jpg,en,2023-05-28T14:00:07.000000Z,etftrends.com,,equity,Consumer Cyclical,13.091545166666668,0.064
156a163f-3a46-4acb-8964-e51738e6d063,"NVIDIA Hits All Time High: Alphabet, Amazon And Meta Don’t Get There",NVIDIA is trading at a price-earnings ratio of 202 and at 43 times its book value. The price to sales ratio is 36 and price to free cash flow sits at 212.,"Nividia, Nvidia, NVDIA, NVIDIA, AI, artificial intelligence, NASDAQ, technology, Amazon, Alphabet","AI, NVIDIA, technology getty

The soaring price action in NVIDIA DIA last week, based a good earnings report and on projections for the impact of artificial int...",https://www.forbes.com/sites/johnnavin/2023/05/28/nvidia-hits-all-time-high-alphabet-amazon-and-meta-dont-get-there/,https://imageio.forbes.com/specials-images/imageserve/6473e2fd4da74ffc917fb050/0x0.jpg?format=jpg&width=1200,en,2023-05-28T23:34:25.000000Z,forbes.com,,equity,Consumer Cyclical,9.979355,0.7096
fe89872a-2118-43bd-89fa-b44774065e0e,"Pay Attention to Silicon Carbide Chips, Says Hedge Fund Manager","The production of lithium is scaling up rapidly, alongside the establishment of lithium refineries like the one built by Tesla (TSLA), which CEO Elon Musk has referred to as a “license to print money.” These refineries offer the opportunity to process lower-grade lithium, which is more abundant, into batteries suitable for EVs. At the same time, hedge fund managers and analysts see promise in another aspect of powering EVs – silicon carbide chips. The electric vehicle (EV) revolution is gaining",,"The production of lithium is scaling up rapidly, alongside the establishment of lithium refineries like the one built by Tesla (TSLA), which CEO Elon Musk has r...",https://finance.yahoo.com/news/pay-attention-silicon-carbide-chips-084131976.html?.tsrc=rss,https://media.zenfs.com/en/tipranks_452/c0b13afff180c521cffd8fdb22af0ad1,en,2023-05-28T08:41:31.000000Z,finance.yahoo.com,,equity,Consumer Cyclical,9.121688,0.6486
ba363d76-7d4d-4ddd-9bbc-772c4f791751,"Tesla, Amazon, Meta: Options Market Offers Clues On Crucial Trading Levels For The Week - Meta Platforms (NASDAQ:META), Tesla (NASDAQ:TSLA), Amazon.com (NASDAQ:AMZN)",,,"Major Wall Street indices closed at least 1% higher on Friday in anticipation of lawmakers reaching a consensus on the debt ceiling crisis over the weekend.

As...",https://www.benzinga.com/news/23/05/32613374/tesla-amazon-meta-options-market-offers-clues-on-crucial-trading-levels-for-the-week,https://cdn.benzinga.com/files/images/story/2023/Futures_&_options_traders_suffer_heavy_losses_in_India._11.jpeg?width=1200&height=800&fit=crop,en,2023-05-29T11:28:22.000000Z,benzinga.com,,equity,Consumer Cyclical,37.390037166666666,0.42419999999999997
51aa4750-4b14-48c8-bd0f-00e2ebd9d802,14 Best Self-Driving Car Stocks To Invest In,"In this article, we will take a look at the 14 best self-driving car stocks to invest in. For more stocks, head on over to 5 Best Self-Driving Car Stocks To Invest In. According to Fortune Business Insights, the autonomous cars market size is expected to increase from $1.63 billion in 2022 to $19.96 billion […]",,"In this article, we will take a look at the 14 best self-driving car stocks to invest in. For more stocks, head on over to 5 Best Self-Driving Car Stocks To Inv...",https://finance.yahoo.com/news/14-best-self-driving-car-141134948.html?.tsrc=rss,https://media.zenfs.com/en/insidermonkey.com/7b312b97564a33ffe3ac7e6fc700f9da,en,2023-05-29T14:11:34.000000Z,finance.yahoo.com,,equity,Consumer Cyclical,20.256224333333336,0.37184416666666675
8c11a887-17d0-4324-9f94-493df5463fbe,GM vs. TSLA: Which Stock Is the Better Value Option?,GM vs. TSLA: Which Stock Is the Better Value Option?,,Investors interested in stocks from the Automotive - Domestic sector have probably already heard of General Motors Company (GM) and Tesla (TSLA). But which of t...,https://finance.yahoo.com/news/gm-vs-tsla-stock-better-154011445.html?.tsrc=rss,https://media.zenfs.com/en/zacks.com/5ecaf2a9bf082a5f3a554e6526b34be0,en,2023-05-29T15:40:11.000000Z,finance.yahoo.com,,equity,Consumer Cyclical,18.42331733333333,0.821033
66c43a9d-13d7-4d3b-a127-c3c40e08b478,"AI means everyone can now be a programmer, Nvidia chief says","Artificial intelligence means everyone can now be a computer programmer as all they need to do is speak to the computer, Nvidia Corp CEO Jensen Huang said on Monday, hailing the end of the digital... | May 29,  2023","NVIDIA CORPORATION stock exchange, news, information, press release, artificial, intelligence, means, everyone, can, now, be, computer, programmer, as, all, they, need, to, do, is, speak, the, nvidia, corp, ceo, jensen, huang, said, on, hailing, end, of, the | NVDA | US67066G1040",Nvidia has surged to become the world's most valuable listed semiconductor company as a major supplier of chips and computing systems for artificial intelligenc...,https://www.marketscreener.com/quote/stock/NVIDIA-CORPORATION-57355629/news/AI-means-everyone-can-now-be-a-programmer-Nvidia-chief-says-43974923/,https://img.zonebourse.com/reuters/2023-05/2023-05-29T075825Z_1_LYNXMPEJ4S05L_RTROPTP_3_NVIDIA-TAIWAN.JPG,en,2023-05-29T07:58:25.000000Z,marketscreener.com,,equity,Consumer Cyclical,16.937105,-0.4939
d87e6798-af89-489c-ae68-1d46396090e8,AI means everyone can now be a programmer: Nvidia chief Jensen Huang,"The company last week forecast second-quarter revenue more than 50% above Wall Street estimates and said it was boosting supply to meet surging demand for its artificial-intelligence chips, which are used to power ChatGPT and many similar services.","Jensen Huang, huang, nvidia, wpp, nvidia corp, microsoft corp add","Artificial intelligence means everyone can now be a computer programmer as all they need to do is speak to the computer, Nvidia Corp CEO Jensen Huang said on Mo...",https://economictimes.indiatimes.com/tech/technology/ai-means-everyone-can-now-be-a-programmer-nvidia-chief-jensen-huang/articleshow/100587919.cms,"https://img.etimg.com/thumb/msid-100588034,width-1070,height-580,imgsize-91986,overlay-ettech/photo.jpg",en,2023-05-29T08:13:49.000000Z,economictimes.indiatimes.com,,equity,Consumer Cyclical,16.42447233333333,0.0386
67d2952b-5ef1-49e9-812e-d56c66273635,"Musk expected to visit China this week, meet officials","Musk expected to visit China this week, meet officials - sources",,"Published May 29, 2023 08:27AM ET

© Reuters. FILE PHOTO: Tesla CEO Elon Musk and his security detail depart the company’s local office in Washington, U.S. J...",https://www.investing.com/news/stock-market-news/musk-expected-to-visit-china-this-week-meet-officials--sources-3092999,https://i-invdn-com.investing.com/news/LYNXNPEA9907D_L.jpg,en,2023-05-29T12:30:41.000000Z,investing.com,,equity,Consumer Cyclical,15.078357,0.0785
bf8ce1d0-c690-4a2b-af0a-429b07a4207b,"Cobalt Sulfate Market Projected to Witness Strong Growth, Surpassing US$9.09 Billion by 2033, Persistence Market Research",Global Market Study on Cobalt Sulfate: High Use as Additive to Enhance Soil Nutrition...,"Persistence Market Research, Cobalt Sulfate Market, Battery Grade, Industrial Grade, Agriculture & Feed Grade, lithium-ion batteries, Sulfate, pigments, ceramics","New York, May 29, 2023 (GLOBE NEWSWIRE) -- In 2023, the cobalt sulphate market will be worth US$4.09 billion. Sales of cobalt sulphate are projected to grow con...",https://www.globenewswire.com/news-release/2023/05/29/2677729/0/en/Cobalt-Sulfate-Market-Projected-to-Witness-Strong-Growth-Surpassing-US-9-09-Billion-by-2033-Persistence-Market-Research.html,https://www.globenewswire.com/Content/logo/favicon.ico,en,2023-05-29T12:45:00.000000Z,globenewswire.com,,equity,Consumer Cyclical,14.95379683333333,0.0
4339e064-e64c-4cec-926b-0b4e782237dd,"AI boom, data centres and ChatGPT take chipmaker Nvidia's market cap close to $1 trillion",Nvidia projected quarterly revenue more than 50% above the average Wall Street estimates and said it could have more supply of AI chips in the second half to meet the demand. This prompted a 24% rally in stock price and one of the largest mcap jumps ever.,"Nvidia Revenue, nvidia stock, ai boom nvidia, chatgpt nvidia, data centres nvidia, nvidia gpus, generative ai, nvidia ai supercomputer platform, nvidia mcap jump, nvidia","ETtech

ETtech

Last week, US chipmaker Nvidia became $184 billion more valuable - bringing it to the verge of a $1-trillion market capitalisation (mcap) - afte...",https://economictimes.indiatimes.com/tech/technology/ai-boom-data-centres-and-chatgpt-take-chipmaker-nvidias-market-cap-close-to-1-trillion/articleshow/100586037.cms,"https://img.etimg.com/thumb/msid-100586607,width-1070,height-580,imgsize-353214,overlay-ettech/photo.jpg",en,2023-05-29T07:37:54.000000Z,economictimes.indiatimes.com,,equity,Consumer Cyclical,14.287451166666669,-0.4939
8ae98be8-a2ba-41e6-aaef-88bca3729fc1,"AI means everyone can now be a programmer, Nvidia chief says By Reuters","AI means everyone can now be a programmer, Nvidia chief says",,"Published May 29, 2023 03:58AM ET

© Reuters. Nvidia Corp CEO Jensen Huang speaks at the COMPUTEX forum in Taipei, Taiwan May 29, 2023. REUTERS/Ann Wang

NVDA ...",https://www.investing.com/news/stock-market-news/ai-means-everyone-can-now-be-a-programmer-nvidia-chief-says-3092771,https://i-invdn-com.investing.com/news/LYNXMPEE141FU_L.jpg,en,2023-05-29T08:00:38.000000Z,investing.com,,equity,Consumer Cyclical,13.591196,-0.4939
ad50d58d-49db-415a-be5b-080bf0c7a341,"Here is What to Know Beyond Why Tesla, Inc. (TSLA) is a Trending Stock","Recently, Zacks.com users have been paying close attention to Tesla (TSLA). This makes it worthwhile to examine what the stock has in store.","stock, stocks, investment, investment advice, investing, online trading, online investment, online stock trading, stock market, financial, financial planning, quote, quotes, stock quotes","This page has not been authorized, sponsored, or otherwise approved or endorsed by the companies represented herein. Each of the company logos represented herei...",https://www.zacks.com/stock/news/2101283/here-is-what-to-know-beyond-why-tesla-inc-tsla-is-a-trending-stock?cid=CS-ZC-FT-tale_of_the_tape|most_searched_stocks-2101283,https://staticx-tuner.zacks.com/images/default_article_images/default209.jpg,en,2023-05-30T13:00:12.000000Z,zacks.com,,equity,Consumer Cyclical,54.42981716666667,0.0
011c4a5b-884c-4f47-ba18-8dcb769edcb2,Looking At Tesla's Recent Unusual Options Activity - Tesla (NASDAQ:TSLA),,,"A whale with a lot of money to spend has taken a noticeably bearish stance on Tesla.

Looking at options history for Tesla TSLA we detected 160 strange trades.
...",https://www.benzinga.com/markets/options/23/05/32627504/looking-at-teslas-recent-unusual-options-activity,https://www.benzinga.com/next-assets/images/schema-image-default.png,en,2023-05-30T15:15:58.000000Z,benzinga.com,,equity,Consumer Cyclical,58.896835,0.322113
d1a27dc1-470f-4045-9efd-f1063cfa01c0,"Here is What to Know Beyond Why Tesla, Inc. (TSLA) is a Trending Stock","Recently, Zacks.com users have been paying close attention to Tesla (TSLA). This makes it worthwhile to examine what the stock has in store.",,"Tesla (TSLA) has recently been on Zacks.com's list of the most searched stocks. Therefore, you might want to consider some of the key factors that could influen...",https://finance.yahoo.com/news/know-beyond-why-tesla-inc-130012749.html?.tsrc=rss,https://media.zenfs.com/en/zacks.com/d7dcbe11345e3f8e5e71e6827fe3c4c9,en,2023-05-30T13:00:12.000000Z,finance.yahoo.com,,equity,Consumer Cyclical,53.304787833333336,0.28194499999999995
1bd56f4f-ae23-459e-8dc0-e4008cb6ab39,Why Tesla Stock Moved Higher Again Today,"Elon Musk is making his first visit to China in three years, and investors like the implications of that.  Shares of Tesla (NASDAQ: TSLA) jumped higher by as much as 6% on that and other news to start the trading week.  Tesla stock has had a good month, up almost 25% in May.",,"Elon Musk is making his first visit to China in three years, and investors like the implications of that. Shares of Tesla (NASDAQ: TSLA) jumped higher by as muc...",https://finance.yahoo.com/m/876e4f56-a708-3f75-9a79-cf70f6e8e5ff/why-tesla-stock-moved-higher.html?.tsrc=rss,https://s.yimg.com/ny/api/res/1.2/3xqbdw3c38aSLpY4iRSIIQ--/YXBwaWQ9aGlnaGxhbmRlcjt3PTEyMDA7aD02MjE-/https://media.zenfs.com/en/motleyfool.com/06efab62d89ad2ce80d73baefd1a3f96,en,2023-05-30T15:29:46.000000Z,finance.yahoo.com,,equity,Consumer Cyclical,50.281082,0.31245
d051ad22-44c5-4aef-98fb-ca6f9c6bcc7f,Why Nvidia and Tesla Keep Sending the Nasdaq Higher,"Wall Street was generally in an upbeat mood on Tuesday morning.  Coming out of the long holiday weekend, investors were ready to celebrate the announcement of an agreement in principle on raising the U.S. debt ceiling, which had been a key overhang over the stock market.  Futures on the Nasdaq Composite (NASDAQINDEX: ^IXIC) were up another 1.5% in premarket trading Tuesday morning after solid gains last week.",,"Wall Street was generally in an upbeat mood on Tuesday morning. Coming out of the long holiday weekend, investors were ready to celebrate the announcement of an...",https://finance.yahoo.com/m/5684bc71-4d1e-3300-8e4a-d5389b021298/why-nvidia-and-tesla-keep.html?.tsrc=rss,https://s.yimg.com/ny/api/res/1.2/hR6M0o9gPxH5_Wkh6ozplw--/YXBwaWQ9aGlnaGxhbmRlcjt3PTEyMDA7aD03ODg-/https://media.zenfs.com/en/motleyfool.com/3db8004cf7578f9ae548d0a865044b0a,en,2023-05-30T13:15:27.000000Z,finance.yahoo.com,,equity,Consumer Cyclical,49.161575,0.0
c1052218-01af-4d73-8f4b-6230a5969e28,Elon Musk's Decision to Try Out Advertising for Tesla Could Be Game-Changing,"Great products generally don't need much -- or even any -- advertising to sell well.  While Tesla (NASDAQ: TSLA) has generally avoided the use of advertising in the past, it has now shifted course to embrace ads as it goes beyond early adopters to seek out mass market consumers.  Tesla is an unconventional company.",,Great products generally don't need much -- or even any -- advertising to sell well. While Tesla (NASDAQ: TSLA) has generally avoided the use of advertising in ...,https://finance.yahoo.com/m/cf00e3df-fdb8-3df0-a458-69bb90cfa452/elon-musk%27s-decision-to-try.html?.tsrc=rss,https://s.yimg.com/ny/api/res/1.2/kwCrpSA.2aQCtH8jhvyT8w--/YXBwaWQ9aGlnaGxhbmRlcjt3PTEyMDA7aD02Njg-/https://media.zenfs.com/en/motleyfool.com/13a518114de368c76c8fa9e59178f37c,en,2023-05-30T11:30:00.000000Z,finance.yahoo.com,,equity,Consumer Cyclical,45.61207,-0.0129
6dce79f2-b07f-44b8-983f-90936670c73d,"GOP Candidates Trump, DeSantis & Haley: What They'll Do, Or Not, About Cannabis Legalization If Elected - Tesla (NASDAQ:TSLA)","Let’s start with the frontrunner and candidate we know best after his four long years in the White House. Though the former president went back and forth on numerous issues on numerous occasions and still isn't always crystal clear on his views, let's look at his statements and glean as best we can.",,Let’s start with the frontrunner and candidate we know best after his four long years in the White House. Though the former president went back and forth on n...,https://www.benzinga.com/markets/cannabis/23/05/32617038/gop-candidates-trump-desantis-haley-what-theyll-do-or-not-about-cannabis-legalization-if-elected,https://cdn.benzinga.com/files/images/story/2023/05/29/donald_trump_ron_desantis_and_nikki_haley_cannabis_sam_holland_and_gage_skidmore_on_wikimedia_commons_and_openrangestock_on_shutterstock.jpg?width=1200&height=800&fit=crop,en,2023-05-30T02:15:11.000000Z,benzinga.com,,equity,Consumer Cyclical,45.55609,0.31845
