uuid,title,description,keywords,snippet,url,image_url,language,published_at,source,relevance_score,type,industry,match_score,sentiment_score
9091c320-18f5-4a0f-a324-a5376f7531bf,5 Things You Might Not Know About Elon Musk - Tesla Motors (TSLA),Investors and fans of Elon Musk can get an inside look at his life with an,,"Investors and fans of Elon Musk can get an inside look at his life with an upcoming mini-series from HBO looking at the early days of SpaceX.

Here are five thi...",https://www.benzinga.com/markets/cannabis/22/01/18280418/5-things-you-might-not-know-about-elon-musk,https://cdn2.benzinga.com/files/imagecache/og_image_social_share_1200x630/images/story/2012/1340px-elon_musk_presenting_teslas_fully_autonomous_future_40705940233_9.jpg?width=720,en,2022-01-17T16:11:28.000000Z,benzinga.com,,equity,Consumer Cyclical,31.95725733333334,0.34016
51b13497-279d-4c06-9cc8-f961841c7b8d,Tesla wooed by Indian states after Elon Musk flags challenges,"The pitches, tweeted over the weekend, touted everything from infrastructure, sustainability and a streamlined approval process.They were made from different parts of India -- Telangana in the south, Maharashtra in the west, Punjab in the north, West Bengal in the east, and Tamil Nadu in the far south","tesla, Elon Musk, indian states Elon Musk tesla","Politicians from at least five Indian states took to Twitter to invite Tesla Inc. to set up shop in their provinces, just days after billionaire founder Elon Mu...",https://www.livemint.com/companies/news/tesla-wooed-by-indian-states-after-elon-musk-flags-challenges-11642410397090.html,https://images.livemint.com/img/2022/01/17/600x338/Elon_Musk_tesla_1642410623664_1642410623840.jpg,en,2022-01-17T09:11:11.000000Z,livemint.com,,equity,Consumer Cyclical,31.8371525,0.034179999999999995
ea5621f1-7db8-40fb-98c4-13da747cd8d9,Tesla wooed by Indian states after Elon Musk flags government problems,"The pitches, tweeted over the weekend, touted everything from infrastructure, sustainability and a streamlined approval process. They were made from different parts of India -- Telangana in the south, Maharashtra in the west, Punjab in the north, and West Bengal in the east.","electric vehicles, elon musk, tesla, Telangana, Modi, Navjot Singh Sidhu","Hey Elon, I am the Industry & Commerce Minister of Telangana state in IndiaWill be happy to partner Tesla in wor… https://t.co/DBJ7GMyMlQ — KTR (@KTRTRS) 16...",https://economictimes.indiatimes.com/industry/renewables/tesla-wooed-by-indian-states-after-elon-musk-flags-government-problems/articleshow/88945204.cms,"https://img.etimg.com/thumb/msid-88945289,width-1070,height-580,imgsize-27602,overlay-economictimes/photo.jpg",en,2022-01-17T06:01:06.000000Z,economictimes.indiatimes.com,,equity,Consumer Cyclical,29.848650000000003,0.336514
182a976c-11ec-485a-9aa9-a4ad6809acdd,Tesla (TSLA) Outpaces Stock Market Gains: What You Should Know,"Tesla (TSLA) closed the most recent trading day at $1,049.61, moving +1.75% from the previous trading session.","stock, stocks, investment, investment advice, investing, online trading, online investment, online stock trading, stock market, financial, financial planning, quote, quotes, stock quotes","This page has not been authorized, sponsored, or otherwise approved or endorsed by the companies represented herein. Each of the company logos represented herei...",https://www.zacks.com/stock/news/1853046/tesla-tsla-outpaces-stock-market-gains-what-you-should-know?cid=CS-ZC-FT-tale_of_the_tape|yseop_template_6-1853046,https://staticx-tuner.zacks.com/images/default_article_images/default159.jpg,en,2022-01-17T22:55:21.000000Z,zacks.com,,equity,Consumer Cyclical,29.686756,0.34
b104b1ba-6d64-4d2d-8bd7-040c8239cc35,10 Best Clean Energy Penny Stocks To Buy Now,Renewables have been increasing their overall share in new power capacity expansion across the globe over the past few years.,,"In this article, we discuss the 10 best clean energy penny stocks to buy now. If you want to skip our detailed analysis of these stocks, go directly to the 5 Be...",https://www.insidermonkey.com/blog/10-best-clean-energy-penny-stocks-to-buy-now-1019375/,https://d2gr5kl7dt2z3t.cloudfront.net/blog/wp-content/uploads/2017/01/25062143/48509079_ml.jpg,en,2022-01-17T15:01:52.000000Z,insidermonkey.com,,equity,Consumer Cyclical,20.27551066666667,0.7342750000000001
64be6daf-2edb-48c3-960f-1705784ba105,Tesla inks deal to get key battery component outside China,Tesla has a deal with an Australian company to mine graphite from Mozambique to reduce dependence on China.,,Tesla is turning to Mozambique for a key component in its electric car batteries in what analysts believe is a first-of-its-kind deal designed to reduce its dep...,https://www.foxbusiness.com/technology/tesla-inks-deal-battery-component-outside-china,https://a57.foxnews.com/static.foxbusiness.com/foxbusiness.com/content/uploads/2022/01/0/0/AP22014647318487.jpg?ve=1&tl=1,en,2022-01-17T03:32:00.000000Z,foxbusiness.com,,equity,Consumer Cyclical,29.49706466666667,0.173122
cd8e2c8f-968e-49d0-9d23-dd1ef6f78e49,Dogecoin leaps 25% after Musk announces DOGE payments for Tesla merch By Cointelegraph,Dogecoin leaps 25% after Musk announces DOGE payments for Tesla merch,,"Dogecoin leaps 25% after Musk announces DOGE payments for Tesla merch

Cryptocurrency 23 minutes ago (Jan 16, 2022 08:20PM ET)

Dogecoin (DOGE) prices rose subs...",https://www.investing.com/news/cryptocurrency-news/dogecoin-leaps-25-after-musk-announces-doge-payments-for-tesla-merch-2740135,https://i-invdn-com.investing.com/news/Cryptocurrencies_800x533_L_1556444856.jpg,en,2022-01-17T01:20:13.000000Z,investing.com,,equity,Consumer Cyclical,27.278442,0.127267
5e69bb86-ee99-453d-8ffe-7ac433e7c824,India’s Inward Turn Could Stymie Its Rise,"(Bloomberg Opinion) -- Shortly before the 2014 election that made him prime minister, Narendra Modi came up with the idea that India’s young population, constitutional checks on arbitrary political power and large domestic market would bring prosperity over a decade.","ALLTOP, BUSINESS, COS, EUROPE, MARKETS, NORTHAM, US, WORLD, GLOBALMACR, INDUSTRIES, OPINION, CONS, CONSD, GOV, FRX, ASIA, BON, CHINA, MIDEAST, TEC, COLUMNS, ASIATOP, INDUSTRIAL, UK, HAR, AU, INDIA, ELQ, MANU, Bloomberg, bqmetered","Will self-reliant India work? Subramanian and Felman are skeptical. “India has seen this movie before,” they say. Indeed, the current leitmotif is reminisce...",https://www.bloombergquint.com/opinion/can-india-s-consumers-power-the-economy-experts-say-it-s-not-enough,https://gumlet.assettype.com/bloombergquint%2F2022-01%2Ffad429d0-110c-409c-b0d6-6e778e8be58b%2F379008973.jpg?rect=0%2C308%2C6000%2C3150&w=1200&auto=format%2Ccompress&ogImage=true,en,2022-01-17T01:58:59.000000Z,bloombergquint.com,,equity,Consumer Cyclical,22.621382166666667,0.7096
0125344d-2ff6-46f3-8358-d8b1662350fb,"'Never tweet anything controversial', Elon Musk quips as he posts this","Elon Musk's latest tweet saying,","Elon Musk, tweet, Twitter, meme, grapecoin, dogecoin, Tesla, SpaceX, ","Sarcasm is billionaire Elon Musk's forte and he has proved it yet again with his latest tweet. On Monday, Musk shared an image saying, ""Get fired from your job ...",https://www.cnbctv18.com/cryptocurrency/never-tweet-anything-controversial-elon-musk-quips-as-he-posts-this-12146972.htm,https://images.cnbctv18.com/wp-content/uploads/2021/05/elonmusk2-1019x573.jpg,en,2022-01-17T05:46:00.000000Z,news.google.com,,equity,Consumer Cyclical,21.86449483333334,0.46295000000000003
43a9e940-7195-43c3-83b9-cb32e6941b21,"Strong Tower Advisory Services Buys NVIDIA Corp, Exxon Mobil Corp, Unity Software Inc, Sells Tesla Inc, Alibaba Group Holding, iShares Russell Mid-Cap Growth ETF",GuruFocus Article or News written by insider and the topic is about:,"GuruFocus, Article, News, insider, DE, LMT, MMM, TDG, EQIX, ORLY, NVDA, XOM, U, SMMD, CALF, PAGP, BABA, IWP, IWS, GPN, AMRS, ","New Purchases: NVDA, XOM, U, SMMD, CALF, PAGP, COIN, VTI, WINA,

NVDA, XOM, U, SMMD, CALF, PAGP, COIN, VTI, WINA, Added Positions: DE, NKTR, LMT, VZ, MMM, BMY, ...",https://www.gurufocus.com/news/1619155/strong-tower-advisory-services-buys-nvidia-corp-exxon-mobil-corp-unity-software-inc-sells-tesla-inc-alibaba-group-holding-ishares-russell-midcap-growth-etf,https://www.gurufocus.com/favicon.ico,en,2022-01-18T14:38:12.000000Z,gurufocus.com,,equity,Consumer Cyclical,41.542542833333336,0.4813
9fd33e6b-0757-498e-94f0-238300b1f104,Why Analysts Are Hiking Targets on These Trillion-Dollar Tech Names – 24/7 Wall St.,"Although markets turned lower Tuesday, this did not stop analysts from hiking their targets on a couple of trillion-dollar tech stocks.",,"Why Analysts Are Hiking Targets on These Trillion-Dollar Tech Names

Although markets turned lower to start out this truncated trading week, a couple of analyst...",https://247wallst.com/investing/2022/01/18/apple-tesla-why-analysts-are-hiking-targets-on-trillion-dollar-tech-names/,https://247wallst.com/wp-content/uploads/2019/12/imageforentry14-7e4.jpg,en,2022-01-18T15:23:53.000000Z,247wallst.com,,equity,Consumer Cyclical,22.351709166666666,0.13156
ba998f4a-fedd-4f66-a2a9-343d2f9ec98b,Tesla (TSLA) Accepts Dogecoin for Some Merchandise Sales,Electric carmaker Tesla (TSLA) has begun accepting the Dogecoin cryptocurrency for purchases of some merchandise on its website.,,"Electric carmaker Tesla, Inc. (TSLA) has begun accepting the Dogecoin (DOGE) cryptocurrency for certain merchandise on its website. The company's CEO Elon Musk ...",https://www.investopedia.com/tesla-accepts-dogecoin-for-merchandise-5216067,"https://www.investopedia.com/thmb/a121CPu9BCe81a9gOlvDYR5pCZE=/680x453/filters:fill(auto,1)/tesla_hood_shutterstock_242058769-91552f1fff514ff29244016bb63518c6.jpg",en,2022-01-18T14:50:10.000000Z,investopedia.com,,equity,Consumer Cyclical,34.13707333333333,0.517125
eab63c19-c6ff-4517-9611-5755037a9dfb,ASX Today: Nasdaq enters correction as yields surge,The share market was set to open sharply lower after weak corporate…,,"Be the first with the news that moves the market

Subscribe Be the first with the news that moves the market

The share market was set to open sharply lower aft...",https://themarketherald.com.au/asx-today-nasdaq-enters-correction-as-yields-surge-2022-01-19/,https://themarketherald.com.au/wp-content/uploads/2020/08/57868-EOD-Trading-1-6-800x430-1280x720.jpg,en,2022-01-18T21:12:01.000000Z,themarketherald.com.au,,equity,Consumer Cyclical,32.98031,0.1779
427f9866-3719-46b9-af8f-b4a1973aa0b5,Uptrend Stocks to Buy,"As an investor, it’s best to make sure you have a few steady gainers in your portfolio. Check out these uptrend stocks listed below.",,"Investment Opportunities Uptrend Stocks to Buy

It’s always handy to have a list of uptrend stocks right by your side. As an investor, it’s best to make sur...",https://investmentu.com/uptrend-stocks/,https://investmentu.com/wp-content/uploads/2022/01/uptrend-stocks.jpg,en,2022-01-18T14:31:58.000000Z,investmentu.com,,equity,Consumer Cyclical,19.4841995,0.6357
e8332a10-1e7b-4165-806a-4602d9a55b06,EV: Tesla Goes to Africa to Limit Its dependence to China,"Elon Musk's company made a deal to obtain, graphite, an important component in the production of lithium ion batteries, from Mozambique.","Technology, Electric Vehicles, CARS, Investing Stocks, LIFESTYLE, Technology, Stocks, INVESTING, Metals & Mining, Electric Vehicles, STOCKS, Luxury Cars, Investing, Electric Cars, Mining","Elon Musk's company made a deal to obtain, graphite, an important component in the production of lithium ion batteries, from Mozambique.

Tesla (TSLA) - Get Tes...",https://www.thestreet.com/investing/ev-tesla-goes-to-africa-to-limit-its-dependence-to-china,https://www.thestreet.com/.image/t_share/MTc0ODU1OTgwMDIwOTk5NTQ2/tesla-ceo-elon-musk-has-proved-start-ups-with-the-right-technology-and-determination-can-take-on-entrenched-industry-giants-photo-reuters.jpg,en,2022-01-18T18:51:04.000000Z,thestreet.com,,equity,Consumer Cyclical,32.358861499999996,0.47225999999999996
e73bc377-c6cc-44dc-8393-295c2edc2b70,"Dogecoin To $1, Cardano Surge, Starbucks China Deal, Tesla Loses Out To Crypto Stock In ARKW, More Vegan Food Options: 5 Headlines You May Have Missed From This Weekend - Dogecoin - United States Doll","Heading into a new trading week, here is a quick roundup of the top five stories from the technology, corporate and cryptocurrency sectors that inv...",,"Heading into a new trading week, here is a quick roundup of the top five stories from the technology, corporate and cryptocurrency sectors that investors would ...",https://www.benzinga.com/markets/cryptocurrency/22/01/25079357/dogecoin-to-1-cardano-surge-starbucks-china-deal-tesla-loses-out-to-crypto-stock-in-arkw-m,https://cdn2.benzinga.com/files/imagecache/og_image_social_share_1200x630/images/story/2012/roman-kraft-_zua2hyvtbk-unsplash_4_0.jpg?width=720,en,2022-01-18T12:26:30.000000Z,benzinga.com,,equity,Consumer Cyclical,23.958667333333334,0.22629999999999997
041b7e90-194d-4234-ac32-7dce7cd566f0,Nasdaq falls nearly 3% as US stocks plummet on interest rate worries,"The Nasdaq plunged Tuesday, dragged by mega-cap tech giants as the 10-year Treasury yield rose to 1.87% — its highest level since January 2020.",,"US stocks plunged Tuesday as Treasury yields surged to two-year highs.

The 10-year Treasury yield rose to 1.87% — its highest level since January 2020 — up...",https://markets.businessinsider.com/news/stocks/stock-market-news-nasdaq-tech-stocks-interest-rates-fed-us-2022-1,https://i.insider.com/6182819023745d001824cc35?width=1200&format=jpeg,en,2022-01-18T21:20:32.000000Z,businessinsider.com,,equity,Consumer Cyclical,30.45341,-0.4215
b693d19a-39c8-4a2c-97a7-d7ccad5ce234,"Tesla (TSLA) Deploys FSD Beta V10.9, Plans Expansion in Canada",Tesla (TSLA) begins rolling out a new version of its FSD Beta software featuring a number of improvements and announces plans of expanding the FSD program to Canada.,"stock, stocks, investment, investment advice, investing, online trading, online investment, online stock trading, stock market, financial, financial planning, quote, quotes, stock quotes","This page has not been authorized, sponsored, or otherwise approved or endorsed by the companies represented herein. Each of the company logos represented herei...",https://www.zacks.com/stock/news/1853227/tesla-tsla-deploys-fsd-beta-v109-plans-expansion-in-canada?cid=CS-ZC-FT-analyst_blog|company_news_-_corporate_actions-1853227,https://staticx-tuner.zacks.com/images/articles/main/75/107.jpg,en,2022-01-18T12:37:00.000000Z,zacks.com,,equity,Consumer Cyclical,29.685507,0.0
d6ba1157-e2ab-4a2b-bcc6-5f326d55868f,Tesla China: As Good As It Gets? (NASDAQ:TSLA),"For Tesla's CY2021 sales in China, the headlines are good. But the story is not as rosy when I dive into the numbers. Read more about TSLA's Chinese sales here.",,"Xiaolu Chu/Getty Images News

Context

I'm an economist and so my training is to ignore headlines and look at data. While battery electric vehicle sales are gro...",https://seekingalpha.com/article/4480387-tesla-china-as-good-as-it-gets,https://static.seekingalpha.com/cdn/s3/uploads/getty_images/1311107789/medium_image_1311107789.jpg,en,2022-01-19T20:09:09.000000Z,seekingalpha.com,,equity,Consumer Cyclical,66.90286,0.188
0a832dac-6ce9-4b9a-8924-307e2d3c6d32,"Elon Musk Reiterates Warning About 'Population Collapse:' There Aren't Enough People For Earth, Let Alone Mars","Tesla Inc. (NASDAQ: TSLA) CEO Elon Musk has again warned that the world should be worried about a “population collapse.”
What Happened: In a ...",,"Tesla Inc. (NASDAQ: TSLA) CEO Elon Musk has again warned that the world should be worried about a “population collapse.”

What Happened: In a series of twee...",https://www.benzinga.com/news/22/01/25101704/elon-musk-reiterates-warning-about-population-collapse-there-arent-enough-people-for-earth-let-alone,https://cdn.benzinga.com/files/imagecache/og_image_social_share_1200x630/images/story/2012/46339127625_51e6a39f04_o_2.jpg,en,2022-01-19T06:05:00.000000Z,news.google.com,,equity,Consumer Cyclical,23.804096666666666,-0.36005
4ebea7ed-4835-46c5-99fe-d4948a9abc21,"Elon Musk's SpaceX Sends Another 49 Starlink Satellites To Space, Reusable Falcon 9 Lands Back On Earth",Tesla Inc (NASDAQ: TSLA) CEO Elon Musk-owned SpaceX on Tuesday successfully launched 49 more Starlink satellites to earth’s low orbit from NASA's ...,,Tesla Inc (NASDAQ: TSLA) CEO Elon Musk-owned SpaceX on Tuesday successfully launched 49 more Starlink satellites to earth’s low orbit from NASA's Kennedy Spac...,https://www.benzinga.com/news/22/01/25101733/elon-musks-spacex-sends-another-49-starlink-satellites-to-space-reusable-falcon-9-lands-back-on-eart,https://cdn.benzinga.com/files/imagecache/og_image_social_share_1200x630/images/story/2012/anirudh-zukaznxc0ai-unsplash.jpg,en,2022-01-19T07:43:00.000000Z,news.google.com,,equity,Consumer Cyclical,21.879824,0.6368999999999999
24ef87d3-db19-4ec5-b82a-f5dd0149bead,"Ridgecrest Wealth Partners, Llc Buys Salesforce.com Inc, Applied Materials Inc, Vanguard Short-Term Inflation-Protected Securities, Sells SPDR Bloomberg 1-3 Month T-Bill ETF, Tesla Inc, Goldman Sachs ",GuruFocus Article or News written by insider and the topic is about:,"GuruFocus, Article, News, insider, VTEB, VTIP, SUB, AMGN, SWKS, VYM, CRM, AMAT, SHM, VIG, IWD, DSI, COUP, MUB, ARKG, SENS, ","New Purchases: CRM, AMAT, SHM, VIG, IWD, DSI, AME, LMT, O, RSP, JPS, SIRI,

CRM, AMAT, SHM, VIG, IWD, DSI, AME, LMT, O, RSP, JPS, SIRI, Added Positions: VCSH, V...",https://www.gurufocus.com/news/1621046/ridgecrest-wealth-partners-llc-buys-salesforcecom-inc-applied-materials-inc-vanguard-shortterm-inflationprotected-securities-sells-spdr-bloomberg-13-month-tbill-etf-tesla-inc-goldman-sachs-access-treasury-01-year-etf,https://www.gurufocus.com/favicon.ico,en,2022-01-19T22:38:11.000000Z,gurufocus.com,,equity,Consumer Cyclical,38.0110915,0.5308669999999999
cda7b466-8916-4967-a769-9311ab178ba4,Nasdaq confirms fourth correction since pandemic hit,"The Nasdaq’s loss on Wednesday left it down nearly 11% from its November record high close, marking the fourth time in the nearly two years since the…",,"We apologize, but this video has failed to load.

The index of over 3,600 stocks traded on the Nasdaq exchange has had a rough two months since its most recent ...",https://financialpost.com/pmn/business-pmn/nasdaq-confirms-fourth-correction-since-pandemic-hit,https://storage.googleapis.com/pmd-stage-northamerica-northeast1-dcs-static-files/9.2.3/websites/images/fp/favicon-fp.ico,en,2022-01-19T21:29:38.000000Z,financialpost.com,,equity,Consumer Cyclical,36.676483,0.6908
92db7c6a-0f6a-42fa-aa49-c6a96380005b,"Wall Street sell-off deepens, Nasdaq confirms correction","The Nasdaq ends down 10.7 per cent from its Nov 19 closing record high.
. Read more at straitstimes.com.",,"NEW YORK (REUTERS) - Wall Street's main indexes ended sharply lower on Wednesday (Jan 19), with the tech-heavy Nasdaq confirming it was in a correction, after a...",https://www.straitstimes.com/business/companies-markets/wall-street-sell-off-deepens-nasdaq-confirms-correction,https://static1.straitstimes.com.sg/s3fs-public/styles/large30x20/public/articles/2022/01/20/2022-01-19T160821Z_1861600114_RC2D2S9I3DGQ_RTRMADP_3_USA-STOCKS.JPG?VersionId=fqcc8bnsuGOmmx532jO_Ga552Dv41nC4,en,2022-01-19T22:53:25.000000Z,straitstimes.com,,equity,Consumer Cyclical,34.921104,0.7717
f09ccc56-20b0-46a3-837c-aa3159e3cd7d,Nasdaq confirms fourth correction since pandemic hit By Reuters,Nasdaq confirms fourth correction since pandemic hit,,"© Reuters. FILE PHOTO: The Nasdaq logo is displayed at the Nasdaq Market site in Times Square in New York City, U.S., December 3, 2021. REUTERS/Jeenah Moon/Fil...",https://www.investing.com/news/stock-market-news/nasdaq-confirms-fourth-correction-since-pandemic-hit-2742994,https://i-invdn-com.investing.com/news/LYNXMPECBE0OL_L.jpg,en,2022-01-19T21:36:48.000000Z,investing.com,,equity,Consumer Cyclical,34.2154,0.6908
eb9f90f2-c39a-4c0f-901f-172df9b5e626,"Wall Street sell-off deepens, Nasdaq confirms correction","Wall Street’s main indexes ended sharply lower on Wednesday, with the tech-heavy Nasdaq confirming it was in a correction, after a diverse set of corporate…",,"This advertisement has not loaded yet, but your article continues below.







Share this Story: Wall Street sell-off deepens, Nasdaq confirms correction

Wall...",https://financialpost.com/pmn/business-pmn/wall-street-sell-off-deepens-nasdaq-confirms-correction-2,https://storage.googleapis.com/pmd-stage-northamerica-northeast1-dcs-static-files/9.2.3/websites/images/fp/favicon-fp.ico,en,2022-01-19T21:33:34.000000Z,financialpost.com,,equity,Consumer Cyclical,33.437885,0.7717
a560f41a-ebdc-4bdd-ae0e-190b8a6c0d44,This Play-To-Earn Coin Named After Elon Musk's Pet 'Floki' Is Up Over 800% Today Even As Dogecoin And Shiba Inu Slump - Dogecoin - United States Dollar ($DOGE),Some of the Dogecoin (CRYPTO: DOGE) and Shiba Inu,,"Some of the Dogecoin (CRYPTO: DOGE) and Shiba Inu (CRYPTO: SHIB) knockoffs are seeing strong gains as of Tuesday night even as Dogecoin and Shiba Inu tumbled, w...",https://www.benzinga.com/markets/cryptocurrency/22/01/25101006/this-play-to-earn-coin-named-after-elon-musks-pet-floki-is-up-over-800-today-even-as-dogec,https://cdn2.benzinga.com/files/imagecache/og_image_social_share_1200x630/images/story/2012/alison-pang-tulol5rpw3u-unsplash_1_1.jpg?width=720,en,2022-01-19T02:15:00.000000Z,news.google.com,,equity,Consumer Cyclical,21.762211499999996,-0.3182
1bed767f-7682-42b2-aa3b-098f677b5a34,Futures rise on earnings after Nasdaq enters correction territory,"U.S. stock futures rose on Thursday on a string of strong earnings led by American Airlines and insurer Travelers, a day after the tech-heavy Nasdaq plunged into correction territory.... | January 20,  2022","NORTHERN TRUST CORPORATION stock exchange, news, information, press release, stock, futures, rose, on, thursday, string, of, strong, earnings, led, by, american, airlines, and, insurer, day, after, the, nasdaq, plunged, into, correction | NTRS | US6658591044",Investors will also be watching jobless claims data at 0830 ET for cues on the Federal Reserve's policy meeting next week after data earlier this month showed U...,https://www.marketscreener.com/quote/stock/NORTHERN-TRUST-CORPORATIO-40311094/news/Futures-rise-on-earnings-after-Nasdaq-enters-correction-territory-37596490/,https://img.zonebourse.com/reuters/2022-01/2022-01-20T125044Z_1_LYNXMPEI0J0P8_RTROPTP_3_USA-STOCKS-NASDAQ.JPG,en,2022-01-20T12:50:44.000000Z,marketscreener.com,,equity,Consumer Cyclical,23.31828516666667,0.8402
54ad8b7e-e0f1-42eb-9d61-3850c48695a5,"Chapman Investment Management, LLC Buys Charles Schwab Corp, Tesla Inc, KLA Corp, Sells Fidelity National Information Services Inc, Gilead Sciences Inc, Coca-Cola Co",GuruFocus Article or News written by insider and the topic is about:,"GuruFocus, Article, News, insider, TSLA, BRK.B, MTB, CVX, SCHW, KLAC, WAL, TGT, SPGI, JNJ, GILD, MCD, ","New Purchases: SCHW, KLAC, WAL, TGT, SPGI, JNJ, CI, FB, SCHB,

SCHW, KLAC, WAL, TGT, SPGI, JNJ, CI, FB, SCHB, Added Positions: TSLA, AAPL, MA, MSFT, V, AMZN, GO...",https://www.gurufocus.com/news/1622317/chapman-investment-management-llc-buys-charles-schwab-corp-tesla-inc-kla-corp-sells-fidelity-national-information-services-inc-gilead-sciences-inc-cocacola-co,https://www.gurufocus.com/favicon.ico,en,2022-01-20T22:38:04.000000Z,gurufocus.com,,equity,Consumer Cyclical,42.520167666666666,0.074
4a23885d-dca1-4688-b57d-a870f477e3dc,"Encompass Wealth Advisors, Llc Buys AbbVie Inc, Coca-Cola Co, Freeport-McMoRan Inc, Sells Tesla Inc, iShares Core 1-5 Year USD Bond ETF, Avaya Holdings Corp",GuruFocus Article or News written by insider and the topic is about:,"GuruFocus, Article, News, insider, DIS, MA, ILMN, IBM, PYPL, PRVA, ABBV, KO, FCX, SHW, AXP, ISTB, KD, ","New Purchases: ABBV, KO, FCX, AXP, SHW,

ABBV, KO, FCX, AXP, SHW, Added Positions: IVE, IEFA, IVW, IJR, IJH, SCZ, VNQ, IEMG, JMST, JPST, VEA, VO, MA, DIS, VWO, ...",https://www.gurufocus.com/news/1622335/encompass-wealth-advisors-llc-buys-abbvie-inc-cocacola-co-freeportmcmoran-inc-sells-tesla-inc-ishares-core-15-year-usd-bond-etf-avaya-holdings-corp,https://www.gurufocus.com/favicon.ico,en,2022-01-20T22:38:14.000000Z,gurufocus.com,,equity,Consumer Cyclical,39.69980916666666,0.329267
a2c6e53e-3795-489a-a16b-f1a29df3c0d2,A Peek Into The Markets: US Stock Futures Gain Ahead Of Jobless Claims Data,"Pre-open movers
U.S. stock futures traded higher in early pre-market trade after the Dow Jones fell around 1% in the previous session. Investors are ...",,"Pre-open movers

U.S. stock futures traded higher in early pre-market trade after the Dow Jones fell around 1% in the previous session. Investors are awaiting e...",https://www.benzinga.com/news/earnings/22/01/25128141/a-peek-into-the-markets-us-stock-futures-gain-ahead-of-jobless-claims-data,https://cdn.benzinga.com/files/imagecache/og_image_social_share_1200x630/images/story/2012/peek_1.jpg,en,2022-01-20T10:21:13.000000Z,benzinga.com,,equity,Consumer Cyclical,18.0024415,0.010666666666666666
