uuid,title,description,keywords,snippet,url,image_url,language,published_at,source,relevance_score,type,industry,match_score,sentiment_score
0a3876dd-5247-4a27-b046-7cfb2bdacd7c,Elon Musk's Neuralink to start clinical trials of implanting brain chips in humans,"Billionaire Elon Musk's company Neuralink is conceiving implants to be able to communicate with machines by thought. 

Neuralink’s first clinical trials with a small number of human patients would be aimed at treating paralysis or paraplegia, the company’s head surgeon Dr. Matthew MacDougall said.

The neurotechnology firm aims to develop implants that can treat neural disorders and that may one day be powerful enough to put humanity on a more even footing with possible future superintelligent computers.","Elon Musk, Neuralink, brain chips, Alzheimer, Bryan Johnson, Technology News, wionews.com","Billionaire Elon Musk's company Neuralink is conceiving implants to be able to communicate with machines by thought.

Neuralink’s first clinical trials with a...",https://www.wionews.com/technology/elon-musks-neuralink-to-start-clinical-trials-of-implanting-brain-chips-in-humans-446942,https://cdn.wionews.com/sites/default/files/styles/story_page/public/2022/01/23/235545-untitled-design-6.jpg,en,2022-01-23T13:41:41.000000Z,news.google.com,,equity,Consumer Cyclical,19.2762065,0.10785
7a0cdfb9-eb32-45d1-bdf4-fc0e8e1d91f6,McDonald's Under Pressure to Accept Musk's Favorite Crypto Dogecoin,Meme coins fans are begging Big Mac owner to take as a means of payment Elon Musk's favorite digital currency.,"Cryptocurrency, Technology, Stocks, Social Media, Technology, Retail, CRYPTOCURRENCY, Fast Food, Investing Stocks, STOCKS, FOOD AND DRINK, Cryptocurrency, LIFESTYLE, Food & Drink, Crypto, Investing, INVESTING, Bitcoin","Meme coins fans are begging the Big Mac owner to take as a means of payment Elon Musk's favorite digital currency.

Buy your fries or your Chicken McNuggets wit...",https://www.thestreet.com/investing/cryptocurrency/mcdonalds-under-pressure-to-accept-musks-favorite-crypto-dogecoin,https://www.thestreet.com/.image/t_share/MTY4NjUwODI3MzYzODUzOTU5/how-healthy-is-that-happy-meal-inside-the-kids-menus-at-mcdonalds-and-more.jpg,en,2022-01-23T17:23:38.000000Z,thestreet.com,,equity,Consumer Cyclical,17.759595,0.875
45ab8afe-ce7f-4125-9eef-66646b88db2b,Top 5 Things to Watch in Markets in The Week Ahead By Investing.com,Top 5 Things to Watch in Markets in The Week Ahead,,"© Reuters

By Noreen Burke

Investing.com -- It’s set to be a major week for markets, between the Federal Reserve meeting and an avalanche of big-name earnin...",https://www.investing.com/news/economy/top-5-things-to-watch-in-markets-in-the-week-ahead-2745688,https://i-invdn-com.investing.com/news/moved_LYNXMPEHA90KI_L.jpg,en,2022-01-23T12:15:09.000000Z,investing.com,,equity,Consumer Cyclical,16.571135,0.5431
dfcd4a90-148b-4efd-b446-c59def3b76a7,Wall Street Breakfast: The Week Ahead,"Listen on the go! A daily podcast of Wall Street Breakfast will be available by 8:00 a.m. on Seeking Alpha, iTunes, Stitcher and Spotify.",,"Economic reports in the week ahead

Investors dig in next week with the Nasdaq and S&P 500 Index coming off their worst weekly loss since March of 2020. The Nas...",https://seekingalpha.com/article/4481048-wall-street-breakfast-week-ahead,https://static.seekingalpha.com/assets/og_image_1200-29b2bfe1a595477db6826bd2126c63ac2091efb7ec76347a8e7f81ba17e3de6c.png,en,2022-01-23T12:19:53.000000Z,seekingalpha.com,,equity,Consumer Cyclical,16.519346,0.106067
6845323f-be9f-43dc-a51e-a8586de2a0e4,Tesla Stock: Clear Bullish Story (NASDAQ:TSLA),Its expected revenue and profit growth rates make Tesla stand out among growth companies. Read this article to learn more about TSLA stock.,,"Spencer Platt/Getty Images News

Intro

In the financial market, a stock's price tells the story of what investors see as the most likely future. And with Tesla...",https://seekingalpha.com/article/4481251-tesla-clear-bullish-story,https://static.seekingalpha.com/cdn/s3/uploads/getty_images/545144494/image_545144494.jpg?io=getty-c-w750,en,2022-01-24T18:50:58.000000Z,seekingalpha.com,,equity,Consumer Cyclical,72.58681,0.4207
edf4753e-38ba-4198-9956-272bc5b15771,Tesla Stock: 3 Major Earnings Questions (NASDAQ:TSLA),Tesla's margins are in focus due to price raises and inflation pressure. 2022 forecast expected to beat analyst estimates. Read more on TSLA stock here.,,"Justin Sullivan/Getty Images News

All eyes will be on electric vehicle maker Tesla (TSLA) when the company reports its Q4 and full-year 2021 results Wednesday ...",https://seekingalpha.com/article/4481280-tesla-stock-q4-earnings-major-questions,https://static.seekingalpha.com/cdn/s3/uploads/getty_images/187005526/image_187005526.jpg?io=getty-c-w750,en,2022-01-24T19:36:12.000000Z,seekingalpha.com,,equity,Consumer Cyclical,69.62459,0.327936
747bc335-c111-4300-a31c-d505a85fe854,"The Zacks Analyst Blog Highlights: Tesla Inc., Steel Dynamics Inc., United Rentals Inc., Freeport-McMoRan Inc. and Vertex Pharmaceuticals Inc.","Tesla Inc., Steel Dynamics Inc., United Rentals Inc., Freeport-McMoRan Inc. and Vertex Pharmaceuticals Inc. are included in this blog.","stock, stocks, investment, investment advice, investing, online trading, online investment, online stock trading, stock market, financial, financial planning, quote, quotes, stock quotes","This page has not been authorized, sponsored, or otherwise approved or endorsed by the companies represented herein. Each of the company logos represented herei...",https://www.zacks.com/stock/news/1856261/the-zacks-analyst-blog-highlights-tesla-inc-steel-dynamics-inc-united-rentals-inc-freeport-mcmoran-inc-and-vertex-pharmaceuticals-inc?cid=CS-ZC-FT-press_releases-1856261,https://staticx-tuner.zacks.com/images/articles/main/29/1920.jpg,en,2022-01-24T16:44:00.000000Z,zacks.com,,equity,Consumer Cyclical,48.21888583333333,0.5994
9995f646-8748-4013-85ba-3e219570ccfd,"Vision Capital Management, Inc. Buys Pinterest Inc, Schlumberger, Amgen Inc, Sells Verizon Communications Inc, Tesla Inc, Comcast Corp",GuruFocus Article or News written by insider and the topic is about:,"GuruFocus, Article, News, insider, AMGN, ESGU, PINS, SLB, SCHJ, KRG, MAS, PFE, HVT, CMCSA, RPAI, BA, EEM, ","New Purchases: PINS, SLB, SCHJ, KRG, SCHW, MAS, NVDA, PFE, TMO, IVW, MDY,

PINS, SLB, SCHJ, KRG, SCHW, MAS, NVDA, PFE, TMO, IVW, MDY, Added Positions: VEA, AMGN...",https://www.gurufocus.com/news/1624569/vision-capital-management-inc-buys-pinterest-inc-schlumberger-amgen-inc-sells-verizon-communications-inc-tesla-inc-comcast-corp,https://www.gurufocus.com/favicon.ico,en,2022-01-24T22:38:22.000000Z,gurufocus.com,,equity,Consumer Cyclical,49.61481716666666,0.236267
d0b71d6a-648d-48f6-a861-7b6813ad2b03,"The Zacks Analyst Blog Highlights: Tesla Inc., Steel Dynamics Inc., United Rentals Inc., Freeport-McMoRan Inc. and Vertex Pharmaceuticals Inc.","Tesla Inc., Steel Dynamics Inc., United Rentals Inc., Freeport-McMoRan Inc. and Vertex Pharmaceuticals Inc. are included in this blog.","Stocks, Finance","For Immediate Release

Chicago, IL – January 24, 2022 – Zacks.com announces the list of stocks featured in the Analyst Blog. Every day the Zacks Equity Rese...",https://www.entrepreneur.com/article/414794,https://assets.entrepreneur.com/providers/zacks/hero-image-zacks-414794.jpeg,en,2022-01-24T16:44:00.000000Z,entrepreneur.com,,equity,Consumer Cyclical,47.00376333333333,0.744886
dd566ebc-8209-4ea7-b36d-2c669fc50731,"LCM Capital Management Inc Buys Southern Co, Advanced Micro Devices Inc, Diageo PLC, Sells Tesla Inc, Biogen Inc, Yum China Holdings Inc",GuruFocus Article or News written by insider and the topic is about:,"GuruFocus, Article, News, insider, SO, DEO, DUK, XEL, AMD, ACN, YUMC, BIIB, PATH, CBAY, ","New Purchases: SO, AMD, DEO, DUK, XEL, ACN, HON, AES, XLNX, DD, GSAT, GRNQ,

SO, AMD, DEO, DUK, XEL, ACN, HON, AES, XLNX, DD, GSAT, GRNQ, Added Positions: AAPL,...",https://www.gurufocus.com/news/1624559/lcm-capital-management-inc-buys-southern-co-advanced-micro-devices-inc-diageo-plc-sells-tesla-inc-biogen-inc-yum-china-holdings-inc,https://www.gurufocus.com/favicon.ico,en,2022-01-24T22:38:17.000000Z,gurufocus.com,,equity,Consumer Cyclical,44.650036666666665,0.295633
2ab2ebe1-b19b-4bad-b4f8-9f6ae003158a,"Nasdaq plunges over 4%, S&P 500 set to confirm correction","U.S. stock indexes plunged on Monday,
with the S&P 500 on course to confirm a correction as the
prospect of a Russian attack on Ukraine posed as a double whammy
for investors already worried about... | January 24,  2022","TESLA, INC. stock exchange, news, information, press release, stock, indexes, plunged, on, the, 500, course, to, confirm, correction, as, of, russian, attack, ukraine, posed, double, investors, already, worried | TSLA | US88160R1014","(For a Reuters live blog on U.S., UK and European stock markets, click LIVE/ or type LIVE/ in a news window.)

* S&P 500 falls over 10% from its record closing ...",https://www.marketscreener.com/quote/stock/TESLA-INC-6344549/news/Nasdaq-plunges-over-4-S-P-500-set-to-confirm-correction-37624236/,https://img.zonebourse.com/reuters/2022-01/2022-01-24T154907Z_2_LYNXMPEI0N0IV_RTROPTP_3_USA-STOCKS.JPG,en,2022-01-24T17:44:17.000000Z,marketscreener.com,,equity,Consumer Cyclical,18.117626833333333,0.0
b3d77bd4-8767-4eff-afe0-c8cd2a81c0be,"Nasdaq dives over 3%, S&P 500 on course to confirm a correction","Read more about Nasdaq dives over 3%, S&P 500 on course to confirm a correction on Business Standard. All the 11 major S&P sectors declined in early trading, with nine of them falling more than 2% each","Wall Street, Dow Jones, Markets, Coronavirus, United States","US stock indexes dropped on Monday, with the S&P 500 on course to confirm a correction as the prospect of a Russian attack on Ukraine posed as a double whammy f...",https://www.business-standard.com/article/markets/nasdaq-dives-over-3-s-p-500-on-course-to-confirm-a-correction-122012401352_1.html,https://bsmedia.business-standard.com/_media/bs/img/article/2021-08/27/full/1630086700-069.jpg,en,2022-01-24T15:51:00.000000Z,business-standard.com,,equity,Consumer Cyclical,18.548620666666665,0.34
ba1c0fc9-343c-4cd6-93e5-ea68b7c0e969,Tesla Whale Trades Spotted,"A whale with a lot of money to spend has taken a noticeably bearish stance on Tesla.
Looking at options history for Tesla (NASDAQ:TSLA) we detected 513 ...",,"A whale with a lot of money to spend has taken a noticeably bearish stance on Tesla.

Looking at options history for Tesla (NASDAQ:TSLA) we detected 513 strange...",https://www.benzinga.com/markets/options/22/01/25186720/tesla-whale-trades-spotted,https://cdn.benzinga.com/files/imagecache/og_image_social_share_1200x630/images/story/2022/movers_image_1315.jpeg,en,2022-01-24T15:38:11.000000Z,benzinga.com,,equity,Consumer Cyclical,37.730618,0.3313
41c097bc-2774-4fca-8348-861b2fba4d06,Tesla Stock’s Taper Tantrum (NASDAQ:TSLA),Tesla is a car maker. Many investors have been in denial of that fact. Read more to find out what will happen when TSLA's stock price reenters this world.,,"Bill Pugliano/Getty Images News

That photo is Ford’s (NYSE:F) coming F-15O Lightning electric truck. It will compete with similar from other car makers for t...",https://seekingalpha.com/article/4481468-teslas-taper-tantrum,https://static.seekingalpha.com/cdn/s3/uploads/getty_images/1232993515/image_1232993515.jpg?io=getty-c-w750,en,2022-01-25T17:08:10.000000Z,seekingalpha.com,,equity,Consumer Cyclical,78.32497,-0.127045
6d673f69-a320-488a-9fab-7a21824400d7,Is A Tesla Stock Split Likely In 2022? (NASDAQ:TSLA),Tesla has had an enormous increase in share price over the last several years. Read more to find out if a TSLA stock split is likely in 2022.,,"traveler1116/iStock Unreleased via Getty Images

Is Tesla In The Position For A Stock Split?

Tesla, Inc. (TSLA) has had an enormous increase in share price ove...",https://seekingalpha.com/article/4481393-tesla-stock-split-2022,https://static.seekingalpha.com/cdn/s3/uploads/getty_images/458246119/image_458246119.jpg?io=getty-c-w750,en,2022-01-25T15:15:00.000000Z,seekingalpha.com,,equity,Consumer Cyclical,37.7780625,0.210867
527f8362-e0fa-4f49-9af6-10a9cedcecb3,"Sterling Investment Advisors Llc Buys NVIDIA Corp, Microsoft Corp, Tesla Inc, Sells U.S. Bancorp",GuruFocus Article or News written by insider and the topic is about:,"GuruFocus, Article, News, insider, NVDA, MSFT, DVY, TSLA, USB, ","New Purchases: NVDA, MSFT, TSLA, DVY,

NVDA, MSFT, TSLA, DVY, Added Positions: IEFA, IEMG, LEMB, QLTA, TIP, HYG, AGG, GNR, IJR, IYR, EEM, FILL,

IEFA, IEMG, LEM...",https://www.gurufocus.com/news/1625647/sterling-investment-advisors-llc--buys-nvidia-corp-microsoft-corp-tesla-inc-sells-us-bancorp,https://www.gurufocus.com/favicon.ico,en,2022-01-25T22:38:17.000000Z,gurufocus.com,,equity,Consumer Cyclical,55.833206999999994,0.074
6f05a69f-542b-4c3f-97fa-8c56c0518fcc,"Supplemental Annuity Collective Trust of NJ Buys Canadian Pacific Railway, Tesla Inc, IQVIA Holdings Inc, Sells , The Hain Celestial Group Inc, Synaptics Inc",GuruFocus Article or News written by insider and the topic is about:,"GuruFocus, Article, News, insider, CP, TSLA, IQV, KSU, ALK, ","New Purchases: CP, TSLA, IQV,

CP, TSLA, IQV, Added Positions: SSSS,

SSSS, Reduced Positions: AAPL, HAIN, SYNA, AMZN, CLF, NEE, FB, MSFT, HL, WDC, LITE, CPK, K...",https://www.gurufocus.com/news/1625652/supplemental-annuity-collective-trust-of-nj-buys-canadian-pacific-railway-tesla-inc-iqvia-holdings-inc-sells--the-hain-celestial-group-inc-synaptics-inc,https://www.gurufocus.com/favicon.ico,en,2022-01-25T22:38:20.000000Z,gurufocus.com,,equity,Consumer Cyclical,43.547470499999996,0.3937
3ea88e1b-11da-48f7-a460-a2ccc1506596,"FUKOKU MUTUAL LIFE INSURANCE Co Buys Tesla Inc, Ecolab Inc, The Hershey Co, Sells Intel Corp, Apollo Global Management Inc, PayPal Holdings Inc",GuruFocus Article or News written by insider and the topic is about:,"GuruFocus, Article, News, insider, TSLA, ECL, SPGI, KMI, BKNG, MRNA, HSY, HE, WDAY, DDOG, FTNT, FANG, APO, SNPS, INFO, AME, XBI, ASML, ","New Purchases: HSY, HE, WDAY, DDOG, FTNT, FANG,

HSY, HE, WDAY, DDOG, FTNT, FANG, Added Positions: VZ, TSLA, JPM, ECL, SPGI, PPL, KMI, CSCO, BKNG, MRNA, TMO, AD...",https://www.gurufocus.com/news/1625403/read,https://www.gurufocus.com/favicon.ico,en,2022-01-25T18:38:14.000000Z,gurufocus.com,,equity,Consumer Cyclical,43.54684233333333,0.22815
5f861f5d-80d8-48fa-8394-154828129df1,"Tesla, Abbott Labs, Intel Earnings: 3 Things to Watch By Investing.com","Tesla, Abbott Labs, Intel Earnings: 3 Things to Watch",,"© Reuters.

By Dhirendra Tripathi

Investing.com -- Stocks continued their tumultuous trading on Tuesday, falling and then recovering as they did in the previo...",https://www.investing.com/news/stock-market-news/tesla-abbott-labs-intel-earnings-3-things-to-watch-2748261,https://i-invdn-com.investing.com/news/LYNXNPEE310MM_L.jpg,en,2022-01-25T21:30:39.000000Z,investing.com,,equity,Consumer Cyclical,33.20090416666667,0.177133
b3deea37-4d03-40bb-b122-2acf1e3b623b,Nio Follows Tesla Into Crypto Fray By Issuing NFTs To Employees: What You Need To Know - NIO (NIO),Chinese electric vehicle maker Nio Inc. (NYSE:NIO) has follow...,,Chinese electric vehicle maker Nio Inc. (NYSE:NIO) has followed rival Tesla Inc. (NASDAQ:TSLA) into the world of cryptocurrencies by issuing non fungible tokens...,https://www.benzinga.com/markets/cryptocurrency/22/01/25200705/nio-follows-tesla-into-crypto-fray-by-issuing-nfts-to-employees-what-you-need-to-know,https://cdn2.benzinga.com/files/imagecache/og_image_social_share_1200x630/images/story/2012/screen_shot_2022-01-25_at_11.44.35_am.png?width=720,en,2022-01-25T06:15:07.000000Z,benzinga.com,,equity,Consumer Cyclical,30.749890666666662,-0.072333
a8406508-a973-4394-9892-629d2fccbddc,"A Peek Into The Markets: US Stock Futures Mostly Lower Ahead Of Earnings, Fed Meeting","Pre-open movers
U.S. stock futures traded mostly lower in early pre-market trade. The Dow Jones settled higher by around 100 points on Monday after tumbling ...",,"Pre-open movers

U.S. stock futures traded mostly lower in early pre-market trade. The Dow Jones settled higher by around 100 points on Monday after tumbling mo...",https://www.benzinga.com/news/earnings/22/01/25202292/a-peek-into-the-markets-us-stock-futures-mostly-lower-ahead-of-earnings-fed-meeting,https://cdn.benzinga.com/files/imagecache/og_image_social_share_1200x630/images/story/2012/peek_into_the_marketnew_351.png,en,2022-01-25T10:34:00.000000Z,benzinga.com,,equity,Consumer Cyclical,18.755076,0.0
d105a303-d7d6-4ad3-be0c-dffe7088b389,"Fulcrum Capital LLC Buys Electronic Arts Inc, Tesla Inc, iShares MSCI Emerging Markets ETF, Sells Meta Platforms Inc, BTC iShares MSCI USA Momentum Factor ETF, Ulta Beauty Inc",GuruFocus Article or News written by insider and the topic is about:,"GuruFocus, Article, News, insider, EFG, EA, TSLA, EEM, MPW, VUG, NKE, MTUM, SMMV, SPLG, BRMK, FVD, VIG, ","New Purchases: EA, TSLA, EEM, MPW, NKE, VV, VUG, VTV, IWF,

EA, TSLA, EEM, MPW, NKE, VV, VUG, VTV, IWF, Added Positions: EFAX, MA, VOT, AMZN, EFG, DIS, XBI, SBU...",https://www.gurufocus.com/news/1625133/fulcrum-capital-llc-buys-electronic-arts-inc-tesla-inc-ishares-msci-emerging-markets-etf-sells-meta-platforms-inc-btc-ishares-msci-usa-momentum-factor-etf-ulta-beauty-inc,https://www.gurufocus.com/favicon.ico,en,2022-01-25T14:38:15.000000Z,gurufocus.com,,equity,Consumer Cyclical,38.85128383333333,0.436925
ddfccae9-7298-4b11-ae00-87c58eea93b0,Tesla: No Surprises In Q4 Results (NASDAQ:TSLA),Tesla's results featured few surprises. Revenues and earnings were mostly where I expected.,,"jetcityimage/iStock Editorial via Getty Images

After the bell on Wednesday, we received fourth quarter results from electric vehicle maker Tesla (TSLA), seen i...",https://seekingalpha.com/article/4481891-tesla-no-surprises-in-q4-results,https://static.seekingalpha.com/cdn/s3/uploads/getty_images/1140204814/image_1140204814.jpg?io=getty-c-w750,en,2022-01-26T23:58:39.000000Z,seekingalpha.com,,equity,Consumer Cyclical,69.554756,0.291863
cd5c7a85-66ab-414e-8e5b-79cb3ccbd6e3,Tesla Stock: New Lathrop Facility Is A Game-Changer (NASDAQ:TSLA),Lathrop opens up the reality of Energy Storage becoming up to 50% of Tesla's revenue. See why I believe Lathrop is a game changer for TSLA stock here.,,"jetcityimage/iStock Editorial via Getty Images

The recent news that Tesla (NASDAQ:TSLA) is ramping up huge production at its Lathrop facility in California has...",https://seekingalpha.com/article/4481733-tesla-lathrop-game-changing-energy-storage-facility,https://static.seekingalpha.com/cdn/s3/uploads/getty_images/1140204814/image_1140204814.jpg?io=getty-c-w750,en,2022-01-26T15:16:52.000000Z,seekingalpha.com,,equity,Consumer Cyclical,35.11898683333333,0.29544583333333335
67799dd9-a394-415f-a3ba-a568871bd718,"APEIRON CAPITAL Ltd Buys DocuSign Inc, Sells Tesla Inc, Alibaba Group Holding",GuruFocus Article or News written by insider and the topic is about:,"GuruFocus, Article, News, insider, DOCU, TSLA, ","Added Positions: DOCU, AMZN, STAA, MSFT, NTES, ALGN, MRNA, KWEB, BNTX,

DOCU, AMZN, STAA, MSFT, NTES, ALGN, MRNA, KWEB, BNTX, Reduced Positions: BABA,

BABA, So...",https://www.gurufocus.com/news/1626213/apeiron-capital-ltd-buys-docusign-inc-sells-tesla-inc-alibaba-group-holding,https://www.gurufocus.com/favicon.ico,en,2022-01-26T14:38:09.000000Z,gurufocus.com,,equity,Consumer Cyclical,59.60280566666666,0.0
94fae38f-63ad-40ca-be57-d2a013acaa30,Tesla's Stock Poised To Rise After Q4 Earnings Report— By How Much? - Tesla Motors (TSLA),Shares of Tesla Inc (NASDAQ:TSLA) have plummeted close to ...,,"Shares of Tesla Inc (NASDAQ:TSLA) have plummeted close to 12% over the last five trading days ahead of the company's fourth-quarter results, scheduled to be rep...",https://www.benzinga.com/trading-ideas/long-ideas/22/01/25226487/teslas-stock-poised-to-rise-after-q4-earnings-report-by-how-much,https://cdn2.benzinga.com/files/imagecache/og_image_social_share_1200x630/images/story/2012/tesla2_0.jpg?width=720,en,2022-01-26T13:26:25.000000Z,benzinga.com,,equity,Consumer Cyclical,34.49113916666666,0.056
19686b0f-1db6-4b4b-ad2a-48e3d98f91ba,"Nasdaq 100 Pares Gains During Volatile Fed Day, Tesla Falls on Earnings",The Nasdaq 100 whipsawed in a volatile session as market participants digested the outcome of the January FOMC policy meeting.,,"Nasdaq 100, Federal Reserve, Treasury Yields, Tesla Earnings – Talking Points

Nasdaq 100 erases gains of roughly 3.5% during volatile Fed session

Tesla beat...",https://www.dailyfx.com/forex/market_alert/2022/01/26/Nasdaq-100-Pares-Gains-During-Volatile-Fed-Day-Tesla-Falls-on-Earnings.html,https://a.c-dn.net/b/3j33V1/headline_NASDAQ_5.JPG,en,2022-01-26T21:30:00.000000Z,dailyfx.com,,equity,Consumer Cyclical,45.400475,0.55376
dd9dfc17-2ce3-4ff7-be6f-f85483c992d4,Has Tesla Arrived To The Final Version Of the Cybertruck?,"Leaked images circulating on the internet revealed a new Cybertruck prototype by Tesla Inc (NASDAQ:TSLA), which due to the characteristics on display, is believed to be the final production model...","Technology, Finance","Leaked images circulating on the internet revealed a new Cybertruck prototype by Tesla Inc (NASDAQ:TSLA), which due to the characteristics on display, is believ...",https://www.entrepreneur.com/article/415345,https://assets.entrepreneur.com/providers/valuewalk/hero-image-valuewalk-415345.jpeg,en,2022-01-26T21:37:28.000000Z,entrepreneur.com,,equity,Consumer Cyclical,34.5096555,-0.10606700000000001
952db469-4c9a-45a1-ada3-7a1f87dc97ba,"WT Asset Management Ltd Buys Li Auto Inc, NIO Inc, Microsoft Corp, Sells Tesla Inc, Taiwan Semiconductor Manufacturing Co, PowerShares QQQ Trust Ser 1",GuruFocus Article or News written by insider and the topic is about:,"GuruFocus, Article, News, insider, LI, KWEB, NIO, MSFT, RLX, BEKE, TSLA, TSM, QQQ, NTES, PDD, BZ, ","New Purchases: NIO, MSFT, RLX, BEKE,

NIO, MSFT, RLX, BEKE, Added Positions: LI, KWEB,

LI, KWEB, Reduced Positions: JD, NVDA,

JD, NVDA, Sold Out: TSLA, TSM, Q...",https://www.gurufocus.com/news/1626236/read,https://www.gurufocus.com/favicon.ico,en,2022-01-26T14:38:24.000000Z,gurufocus.com,,equity,Consumer Cyclical,42.52144633333333,0.5734500000000001
ca1aa2a2-e2ce-4bdc-b1ab-f6fe8dd7a63e,McDonald's Responds To Elon Musk: We Will Accept Dogecoin If Tesla Accepts This Cryptocurrency - Dogecoin - United States Dollar ($DOGE),Fast-food chain McDonald’s Corp. (NYSE:MCD) said it wil...,,Fast-food chain McDonald’s Corp. (NYSE:MCD) said it will accept Tesla Inc. (NASDAQ:TSLA) CEO Elon Musk’s request to accept Dogecoin (CRYPTO: DOGE) as a form...,https://www.benzinga.com/markets/cryptocurrency/22/01/25226045/mcdonalds-responds-to-elon-musk-we-will-accept-dogecoin-if-tesla-accepts-this-cryptocurren,https://cdn2.benzinga.com/files/imagecache/og_image_social_share_1200x630/images/story/2012/screen_shot_2022-01-26_at_8.56.58_am.png?width=720,en,2022-01-26T03:27:47.000000Z,benzinga.com,,equity,Consumer Cyclical,30.776772500000003,0.47936699999999993
fc7b608e-abf3-416c-a755-7c71b89f37a0,Tesla sees supply chain issues throughout 2022 after record earnings By Reuters,Tesla sees supply chain issues throughout 2022 after record earnings,,"2/2 © Reuters. FILE PHOTO: The Tesla logo is seen on a car in Los Angeles, California, U.S., July 9, 2020. REUTERS/Lucy Nicholson/File Photo 2/2

SAN FRANCISCO...",https://www.investing.com/news/economy/tesla-beats-revenue-estimates-on-record-deliveries-2749530,https://i-invdn-com.investing.com/news/STOCK-EXCHANGE-RUSSIAN-TRADING-SYSTEMS_800x533_L_1414427815.jpg,en,2022-01-26T21:26:16.000000Z,investing.com,,equity,Consumer Cyclical,33.19638166666667,0.12972000000000003
5c4b8245-7b3f-409c-b0b7-296e9651abc6,"Tesla, Inc. (NASDAQ:TSLA) Shares Sold by Vident Investment Advisory LLC","Vident Investment Advisory LLC cut its stake in shares of Tesla, Inc. (NASDAQ:TSLA) by 15.5% in the 3rd quarter, according to the company in its most recent disclosure with the Securities and Exchange Commission (SEC). The firm owned 3,239 shares of the electric vehicle producer’s stock after selling 595 shares during the quarter. Vident Investment […]",,"Vident Investment Advisory LLC cut its stake in shares of Tesla, Inc. (NASDAQ:TSLA) by 15.5% in the 3rd quarter, according to the company in its most recent dis...",https://etfdailynews.com/news/tesla-inc-nasdaqtsla-shares-sold-by-vident-investment-advisory-llc/,https://www.marketbeat.com/logos/tesla-motors-inc-logo.jpg,en,2022-01-27T17:52:41.000000Z,etfdailynews.com,,equity,Consumer Cyclical,72.65579816666666,0.4326366666666666
69b65824-647a-4cfc-8d9a-0d5a3f0ca026,Here’s a Reason to Stay Optimistic in Elon Musk’s Tesla Inc. (TSLA),"Alger, an investment management firm, published its “Alger Spectra Fund” fourth quarter 2021 investor letter – a copy of which can be downloaded here.",,"Alger, an investment management firm, published its “Alger Spectra Fund” fourth quarter 2021 investor letter – a copy of which can be downloaded here. Dur...",https://www.insidermonkey.com/blog/heres-a-reason-to-stay-optimistic-in-elon-musks-tesla-inc-tsla-1022539/,https://d2gr5kl7dt2z3t.cloudfront.net/blog/wp-content/uploads/2021/10/27092928/Tesla_1630674574-768x432-1.jpg,en,2022-01-27T13:46:45.000000Z,insidermonkey.com,,equity,Consumer Cyclical,64.33252,0.395133
