uuid,title,description,keywords,snippet,url,image_url,language,published_at,source,relevance_score,type,industry,match_score,sentiment_score
fe9bd9b2-0eb7-43fb-af57-0de5349c5d8e,"A Tesla co-founder returns, TuSimple restructures again and Uber's stickiness strategy","It was another busy week in the transportation world and no surprise, Tesla was one of the headliners.  The company held its annual shareholder meeting and as per ushe, CEO Elon Musk shared tidbits and musings about the company.  Speaking of Musk, he lost another bid to end a 2018 settlement with the U.S. Securities and Exchange Commission that requires oversight of some of his Tesla-related tweets.",,"Welcome back to The Station, your central hub for all past, present and future means of moving people and packages from Point A to Point B.

It was another busy...",https://finance.yahoo.com/news/tesla-co-founder-returns-tusimple-191501675.html,https://s.yimg.com/ny/api/res/1.2/mO1US5AO4mO0p2XnPUPiZA--/YXBwaWQ9aGlnaGxhbmRlcjt3PTEyMDA7aD03NDA-/https://media.zenfs.com/en/techcrunch_350/0058d2c29c2c3e66f0876ab1d4a22c1f,en,2023-05-21T19:15:01.000000Z,finance.yahoo.com,,equity,Consumer Cyclical,22.770336,0.0961
0013a351-db3f-4a3c-9337-a78953abc15e,"Elon Musk open to advertising, Stellantis stalemate: This week in EVs",Investing.com -- Here is your weekly Pro Recap of the past week's biggest headlines in the electric vehicle space: a Stellantis stalemate; Musk signals openness to advertising; NIO goes nuclear; a new EV tax in Texas.,,Investing.com -- Here is your weekly Pro Recap of the past week's biggest headlines in the electric vehicle space: a Stellantis stalemate; Musk signals openness...,https://finance.yahoo.com/news/elon-musk-open-advertising-stellantis-051243727.html?.tsrc=rss,https://s.yimg.com/cv/apiv2/social/images/yahoo_default_logo-1200x1200.png,en,2023-05-21T05:12:43.000000Z,finance.yahoo.com,,equity,Consumer Cyclical,15.892015,0.27825
7564c50b-17de-4517-8b20-b188c4f700bf,This week in tech: Netflix wows with big subscriber numbers; OpenAI CEO 'nervous',By Louis Juricic and Sarina Isaacs,,"By Louis Juricic and Sarina Isaacs

Investing.com -- Here is your weekly Pro Recap on the tech headlines everyone is buzzing about from this past week: firm sub...",https://finance.yahoo.com/news/week-tech-netflix-wows-big-094402378.html?.tsrc=rss,https://s.yimg.com/cv/apiv2/social/images/yahoo_default_logo-1200x1200.png,en,2023-05-21T09:44:02.000000Z,finance.yahoo.com,,equity,Consumer Cyclical,15.424418,0.278975
cb01478f-89b8-4ed3-9d41-8a24ae8b5fca,This week in tech: Netflix wows with big subscriber numbers; OpenAI CEO 'nervous' By Investing.com,This week in tech: Netflix wows with big subscriber numbers; OpenAI CEO 'nervous',,"Published May 21, 2023 09:44AM ET

© Reuters.

MSFT -0.06% Add to/Remove from Watchlist WDC -1.08% Add to/Remove from Watchlist NFLX -1.60% Add to/Remove from ...",https://www.investing.com/news/stock-market-news/this-week-in-tech-netflix-wows-with-big-subscriber-numbers-openai-ceo-nervous-3087224,https://i-invdn-com.investing.com/news/LYNXNPEE8519V_L.jpg,en,2023-05-21T13:44:02.000000Z,investing.com,,equity,Consumer Cyclical,15.20762,0.371967
5cbb07e0-7496-4528-8f99-6246c2b711d9,What Is Growth Investing And 8 Best Strategies,Growth investing is the buying of shares in companies experiencing greater revenue and earnings than those experienced by other companies within the same sector or the...,"EPS, Amazon, growth investing, value vs growth investing, growth stocks, growth mutual funds, growth exchange traded funds","Close-up of sign with logo on facade of the regional headquarters of ecommerce company Amazon in the ... [+] Silicon Valley town of Sunnyvale, California, Octob...",https://www.forbes.com/sites/investor-hub/2023/05/21/what-is-growth-investing-and-8-best-strategies/,https://imageio.forbes.com/specials-images/imageserve/646a83977ddb7fe48676b6ea/0x0.jpg?format=jpg&width=1200,en,2023-05-21T20:49:39.000000Z,forbes.com,,equity,Consumer Cyclical,12.787436,0.86635
85c3d1a3-01f5-4f0a-8add-e4e863b8afdb,RCD ETF: The Wheels Are Coming Off,RCD has underperformed its cap-weighted counterpart over the long term and short term. Click here to read more about the fund.,,"SolStock/E+ via Getty Images

“Don’t tell me where your priorities are. Show me where you spend your money and I’ll tell you what they are.” - James W. ...",https://seekingalpha.com/article/4606327-rcd-etf-wheels-coming-off,https://static.seekingalpha.com/cdn/s3/uploads/getty_images/1402852398/image_1402852398.jpg?io=getty-c-w1536,en,2023-05-21T12:41:28.000000Z,seekingalpha.com,,equity,Consumer Cyclical,9.993783,0.4368
fb839022-9d87-4163-adce-23006667ecdb,Will ChatGPT prevent a recession or is AI a baby bubble?,Is the AI boom good for the economy or another internet bubble? Read more.,,"A return to Big Tech stocks while has helped the broader market through the year.

The S&P 500 (SP500) (NYSEARCA:SPY) (IVV) (VOO) is up nearly 10%, while the eq...",https://seekingalpha.com/news/3973626-ai-chatgpt-recession-bubble,https://static.seekingalpha.com/cdn/s3/uploads/getty_images/1220627489/image_1220627489.jpg?io=getty-c-w750,en,2023-05-21T19:17:24.000000Z,seekingalpha.com,,equity,Consumer Cyclical,9.123627,0.1779
ceb9c484-3fcd-415a-8e8f-c2a67dfc7544,The Theme For The Stock Market Rally Is Now AI And It Is Pure Hype,"This stock market rally began back in November.  In reality, the rally started with a shift of money into Europe, commodities, and mining stocks as the US stock market lagged.  But, in January, momentum began to shift into big cap tech stocks.  Then March came and bank stocks in the United States cr",,"The Theme For The Stock Market Rally Is Now AI And It...

This stock market rally began back in November. In reality, the rally started with a shift of money in...",https://wallstreetwindow.com/2023/05/the-theme-for-the-stock-market-rally-is-now-ai-and-it-is-pure-hype/,https://wallstreetwindow.com/wp-content/uploads/2018/01/a66_0-1.jpg,en,2023-05-21T12:02:06.000000Z,wallstreetwindow.com,,equity,Consumer Cyclical,7.798292,-0.1027
466abbaf-4e5c-4ed0-9c0d-23968fc897e5,Momentum Can Be A Good (Or Bad) Thing - Tesla (NASDAQ:TSLA),"As we meander throughout the markets looking for directional clues, it is challenging when stocks hit levels then reverse suddenly in the other direction.  We as traders often wait patiently for a trend to establish and then slowly, gently climb on board.  But since the start of the bear market in 2022 those trends move quickly.  The big moves up or down are just not sustainable,",,"As we meander throughout the markets looking for directional clues, it is challenging when stocks hit levels then reverse suddenly in the other direction. We as...",https://www.benzinga.com/23/05/32509637/momentum-can-be-a-good-or-bad-thing,https://cdn.benzinga.com/files/maxim-hopman-fixlqxahcfk-unsplash_11_0.jpg?width=1200&height=800&fit=crop,en,2023-05-22T14:30:01.000000Z,benzinga.com,,equity,Consumer Cyclical,56.96885,0.5606
c39dd3bd-24b4-459a-a2fa-3fcf5df96576,"Tesla, Amazon, Meta: What Options Market Shows About Key Trading Levels Ahead Of Potentially Volatile Week - Invesco QQQ Trust, Series 1 (NASDAQ:QQQ), Meta Platforms (NASDAQ:META), Tesla (NASDAQ:TSLA)",,,Equity markets have so far displayed tremendous resilience to the debt ceiling stand-off as President Joe Biden's administration and Republican lawmakers appear...,https://www.benzinga.com/news/23/05/32506609/tesla-amazon-meta-what-options-market-shows-about-key-trading-levels-ahead-of-potentially-volatile-w,https://cdn.benzinga.com/files/images/story/2023/Futures_&_options_traders_suffer_heavy_losses_in_India._9.jpeg?width=1200&height=800&fit=crop,en,2023-05-22T12:35:05.000000Z,benzinga.com,,equity,Consumer Cyclical,34.00366733333333,0.6887
99bc6f59-c32c-408a-9683-d17cdbdb73c2,Best Stock to Buy Now: Tesla vs. Rivian,Tesla (NASDAQ: TSLA) and Rivian (NASDAQ: RIVN) have made big strides in their goals to capture a greater market share of electric vehicle sales. Tesla is admittedly further along that path. Fool.com contributor and finance professor Parkev Tatevosian answers which EV stock he would buy right now.,,Tesla (NASDAQ: TSLA) and Rivian (NASDAQ: RIVN) have made big strides in their goals to capture a greater market share of electric vehicle sales. Tesla is admitt...,https://finance.yahoo.com/m/e9b3374b-953b-3d85-8fad-c77d42a97b22/best-stock-to-buy-now%3A-tesla.html?.tsrc=rss,https://s.yimg.com/ny/api/res/1.2/_NGquljPVehmg4XFIwq0vg--/YXBwaWQ9aGlnaGxhbmRlcjt3PTEyMDA7aD02NzU-/https://media.zenfs.com/en/motleyfool.com/8a7515d967a1aa1de060fa78d667e72c,en,2023-05-22T10:30:00.000000Z,finance.yahoo.com,,equity,Consumer Cyclical,50.886856,0.6044
341f33c9-aa7b-4ab8-bdda-0afd413e14ff,The Tesla Train Continues to Move Forward,"In this week's video, I cover everything you need to know about news related to Tesla (NASDAQ: TSLA) during the week of May 15. Today's video will focus on Tesla's continued domination in Europe and China, Tesla's willingness to try out advertising, reports of Tesla entering the India market, and more.",,"In this week's video, I cover everything you need to know about news related to Tesla (NASDAQ: TSLA) during the week of May 15. Today's video will focus on Tesl...",https://finance.yahoo.com/m/92e7bb6f-ebf1-35bc-856c-2011ac2a9707/the-tesla-train-continues-to.html?.tsrc=rss,https://s.yimg.com/ny/api/res/1.2/PijyueemZ7c5t475XxM48A--/YXBwaWQ9aGlnaGxhbmRlcjt3PTEyMDA7aD02NzU-/https://media.zenfs.com/en/motleyfool.com/8308489e69f9aaaed7df03080c5178e0,en,2023-05-22T14:00:00.000000Z,finance.yahoo.com,,equity,Consumer Cyclical,50.5057,0.11315
52db152d-2d88-415d-9d0f-84d0ac7525e2,Here's Why Tesla Shares Rallied Again Today,"Tesla (NASDAQ: TSLA) shares continued a weeklong rally today that has moved the stock of the electric vehicle (EV) leader up nearly 14% since the middle of last week.  Tesla shareholders might have competing automaker Ford (NYSE: F) to thank for today's gains.  Ford is hoping to match Tesla's success in satisfying the demand for electric vehicles, but it will focus on markets with less competition, and with more unique offerings like its commercial transit vans.",,Tesla (NASDAQ: TSLA) shares continued a weeklong rally today that has moved the stock of the electric vehicle (EV) leader up nearly 14% since the middle of last...,https://finance.yahoo.com/m/b7a06e0c-be0d-3a7f-b0a9-58868ed0b16a/here%27s-why-tesla-shares.html?.tsrc=rss,https://s.yimg.com/ny/api/res/1.2/T6YQasyWWQcqCVKIQ2PhDQ--/YXBwaWQ9aGlnaGxhbmRlcjt3PTEyMDA7aD05ODI-/https://media.zenfs.com/en/motleyfool.com/3e53a653fda7509c562b51f646403e2f,en,2023-05-22T21:03:07.000000Z,finance.yahoo.com,,equity,Consumer Cyclical,49.593018,0.51145
4dc49dba-c1d5-47d7-b699-ca1c767c3885,Tesla CEO Elon Musk Just Put a Huge Rumor to Bed,There aren't too many company-specific events that draw the attention of everyday and professional investors quite like electric-vehicle (EV) manufacturer Tesla's (NASDAQ: TSLA) annual shareholder meeting.  Getting to hear CEO Elon Musk discuss Tesla's progress and what innovations can shape the future is the type of stuff that excites Wall Street and growth-seeking investors.  The reason Musk and his company are given so much credence on Wall Street is because Tesla has been able to do something that no other automaker has done in more than a half-century: successfully build itself from the ground up to mass production.,,There aren't too many company-specific events that draw the attention of everyday and professional investors quite like electric-vehicle (EV) manufacturer Tesla...,https://finance.yahoo.com/m/39d281b6-fe83-3c35-8ec2-1fb3f82558af/tesla-ceo-elon-musk-just-put.html?.tsrc=rss,https://s.yimg.com/ny/api/res/1.2/4KF9QSH.GBj3kvzsWmpLfg--/YXBwaWQ9aGlnaGxhbmRlcjt3PTEyMDA7aD02Njg-/https://media.zenfs.com/en/motleyfool.com/0fe37148fcbbb139e397c611ff27495a,en,2023-05-22T09:21:00.000000Z,finance.yahoo.com,,equity,Consumer Cyclical,45.58754,0.349767
10584e98-94a0-4a00-b5dc-a56c05736856,"Tesla Sell Signals Confirmed (Technical Analysis, Downgrade)","This is a technical analysis article. In our previous article, we identified Tesla, Inc. stock as having Sell Signals. Click for our updated TSLA analysis.",,"AndreyPopov/iStock via Getty Images

As the electric vehicle (""EV"") battle heats up and the pawns take on the king, in this case the auto industry taking on Tes...",https://seekingalpha.com/article/4606449-tesla-sell-signals-confirmed-technical-analysis-downgrade,https://static.seekingalpha.com/cdn/s3/uploads/getty_images/917034162/image_917034162.jpg?io=getty-c-w1536,en,2023-05-22T13:27:40.000000Z,seekingalpha.com,,equity,Consumer Cyclical,32.5211555,-0.134667
b594953e-cab9-48c5-aee9-88daedcae826,"US STOCKS-Nasdaq, S&P 500 rise amid fresh round of debt talks; Micron slides","The Nasdaq and the S&P 500 rose on Monday as markets turned to megacap stocks while awaiting updates on a fresh round of talks about raising the U.S. debt ceiling, and shares of Micron fell after China's ban on its memory chips.  President Joe Biden and House Republican Speaker Kevin McCarthy will meet for talks on Monday after their discussions almost fell apart on Friday.",,"(Updates prices throughout; adds analyst comment and shares of growth stocks)

*

U.S. debt limit talks to kick off at 5:30 p.m. ET

*

China's Micron ban reviv...",https://finance.yahoo.com/news/us-stocks-nasdaq-p-500-165841994.html?.tsrc=rss,https://s.yimg.com/cv/apiv2/social/images/yahoo_default_logo-1200x1200.png,en,2023-05-22T16:58:41.000000Z,finance.yahoo.com,,equity,Consumer Cyclical,17.5012835,0.7003
5c508ce6-d606-46bf-8878-1f785ba01425,"Jio in discussion with Elon Musk's Tesla to build captive private network: Report, ET BrandEquity","Reliance Jio: The sources, however, said that the discussions are currently preliminary and may progress further only if Tesla “firms up” its plans for setting up a manufacturing unit in India, as per the report.","Reliance Jio, Tesla, Elon Musk, ev company, connected car, auto tech, technology, auto manufacturing unit","Advt

Advt

Elon Musk's embrace of advertising at Tesla grabs marketers' attention With Elon Musk outlining plans for Tesla Inc to use traditional advertising f...",https://brandequity.economictimes.indiatimes.com/news/digital/jio-in-discussion-with-elon-musks-tesla-to-build-captive-private-network-report/100421264,"https://etimg.etb2bimg.com/thumb/msid-100421264,imgsize-93036,width-1200,height=765,overlay-etbrandequity/digital/jio-in-discussion-with-elon-musks-tesla-to-build-captive-private-network-report.jpg",en,2023-05-22T11:51:04.000000Z,brandequity.economictimes.indiatimes.com,,equity,Consumer Cyclical,27.962398999999994,0.277025
5f639e4e-d3e5-4990-8f68-d89e386c5d93,How India's Richest Man Could Play A Key Role In Tesla's Expansion Plans - Tesla (NASDAQ:TSLA),This article was first published on the Benzinga India Portal.,,"This article was first published on the Benzinga India Portal.

Reliance Jio, India’s telecom giant, is reportedly in early talks with Tesla Inc TSLA, Elon Mu...",https://www.benzinga.com/markets/asia/23/05/32523258/how-indias-richest-man-could-play-a-key-role-in-teslas-expansion-plans,https://cdn.benzinga.com/files/images/story/2023/05/23/shutterstock_1540447097.jpg?width=1200&height=800&fit=crop,en,2023-05-23T12:50:41.000000Z,benzinga.com,,equity,Consumer Cyclical,34.371464833333334,0.398067
3e7d56fd-0ef1-4372-b00f-3eb5b45344a9,"TSLA, ZM, HEPA, PFE, ZIM: Top 5 Trending Stocks - Tesla (NASDAQ:TSLA), Zoom Video Comms (NASDAQ:ZM), Novo Nordisk (NYSE:NVO), Pfizer (NYSE:PFE), Hepion Pharmaceuticals (NASDAQ:HEPA), ZIM Integrated Sh",,,U.S. markets ended mixed on Monday as Wall Street's wait for a debt ceiling resolution continues with both sides unwilling to yield on spending cuts – the big...,https://www.benzinga.com/markets/equities/23/05/32522239/tesla-zoom-hepion-pfizer-zim-why-these-5-stocks-are-drawing-investor-attention-today,https://cdn.benzinga.com/files/images/story/2023/Stocks_Photo_by_Pixels_Hunter_on_Shutterstock_2.jpeg?width=1200&height=800&fit=crop,en,2023-05-23T01:22:12.000000Z,benzinga.com,,equity,Consumer Cyclical,29.09271583333333,0.429633
4ff06528-544c-4f4d-ad3f-06a83b98b490,"Tesla, Worksport And Ford Are Putting EV Words Into Action","On Monday, Ford Motor (NYSE: F) unveiled its ambitious strategy to ramp up its EV progress and catch up to the EV leader itself, Tesla Inc (NASDAQ: TSLA). Today, Worksport Ltd. (NASDAQ: WKSP)(NASDAQ: WKSPW), who will be equipping several upcoming electric pickups with its revolutionary solar-powered technology, revealed it is another step closer to beginning production as first materials have arrived at its NY manufacturing facility. Ford Aims To Restore Its Credibility On Wall Street Back in Fe",,"On Monday, Ford Motor (NYSE: F) unveiled its ambitious strategy to ramp up its EV progress and catch up to the EV leader itself, Tesla Inc (NASDAQ: TSLA). Today...",https://finance.yahoo.com/news/tesla-worksport-ford-putting-ev-171836829.html?.tsrc=rss,https://media.zenfs.com/en/Benzinga/cf46308e86bfcdf38b4d1400515b8896,en,2023-05-23T17:18:36.000000Z,finance.yahoo.com,,equity,Consumer Cyclical,33.759435333333336,0.28166700000000006
abfd9295-4f87-442d-a2e5-eb504e2e9d2b,Tuesday Premarket Newsmakers: Ford Puts a Charge Into Tesla Stock – 24,Ford's investor day proved to be a good day for investors--in Tesla stock.,,"Tuesday Premarket Newsmakers: Ford Puts a Charge Into Tesla Stock

Premarket action on Tuesday had the three major U.S. indexes trading lower. The Dow Jones ind...",https://247wallst.com/investing/2023/05/23/tuesday-premarket-newsmakers-ford-puts-a-charge-into-tesla-stock/,https://247wallst.com/wp-content/uploads/2022/10/imageForEntry4-Xnv.jpg,en,2023-05-23T11:40:24.000000Z,247wallst.com,,equity,Consumer Cyclical,32.181739666666665,-0.0565
97f6af16-4f07-4ae1-9476-385f985302f4,Tesla to pick location for new factory this year -Musk By Reuters,Tesla to pick location for new factory this year -Musk,,"Published May 23, 2023 03:31PM ET Updated May 23, 2023 03:46PM ET

© Reuters. FILE PHOTO: Twitter, X Corp., and Tesla CEO Elon Musk poses prior to his talks wi...",https://www.investing.com/news/stock-market-news/tesla-to-pick-another-location-for-new-factory-this-year-musk-3089035,https://i-invdn-com.investing.com/news/LYNXNPEC340AO_L.jpg,en,2023-05-23T19:46:13.000000Z,investing.com,,equity,Consumer Cyclical,34.00368616666667,0.272275
a2c71b52-dfe9-4ab1-9c2a-25c06b27f1da,How India's Richest Man Could Play A Key Role In Tesla's Expansion Plans,"This article was first published on the Benzinga India Portal. Reliance Jio, India’s telecom giant, is reportedly in early talks with Tesla Inc (NASDAQ: TSLA), Elon Musk‘s electric vehicle company, about building a private network for Tesla’s operations. However, these discussions hinge on Tesla confirming its plans to establish a manufacturing unit in India. What Happened? According to a Financial Express report, Jio and Tesla expect the private network under consideration to manage critical op",,"This article was first published on the Benzinga India Portal.

Reliance Jio, India’s telecom giant, is reportedly in early talks with Tesla Inc (NASDAQ: TSLA...",https://finance.yahoo.com/news/indias-richest-man-could-play-145041897.html?.tsrc=rss,https://media.zenfs.com/en/Benzinga/a1ba7350d13eb5663a0feea246c0883b,en,2023-05-23T14:50:41.000000Z,finance.yahoo.com,,equity,Consumer Cyclical,22.307544833333335,0.24695
db6b89ab-1961-48ff-8a32-b2301c80ba9d,"Tesla price cuts are working as demand increased, analyst says","Tesla electric-vehicle price vs. volume ""will be the key stock debate"" for the next 18 months, analyst says.","article_normal, Motor Vehicles, Alternative Fuel Vehicles, Automotive, Analysts' Comments/Recommendations, Corporate/Industrial News, Content Types, Factiva Filters, C&E Exclusion Filter, Tesla Inc., TSLA, analysts' comments, recommendations, corporate, industrial news, content types, factiva filters, c&e exclusion filter, motor vehicles, alternative fuel vehicles, automotive","Tesla Inc. has tweaked prices of its electric vehicles several times in recent months, most often reducing them. This has piqued the curiosity of many investors...",https://www.marketwatch.com/story/tesla-price-cuts-are-working-as-demand-increased-analyst-says-618447df,https://images.mktw.net/im-767296/social,en,2023-05-23T17:48:00.000000Z,marketwatch.com,,equity,Consumer Cyclical,32.414222499999994,-0.19199999999999998
b0a6ef67-2ad4-442b-8822-135704f8049a,U.S. says 'real concern' about Tesla Autopilot driver interaction By Reuters,U.S. says 'real concern' about Tesla Autopilot driver interaction,,"Published May 23, 2023 12:24PM ET

© Reuters. FILE PHOTO: The Tesla logo is seen on a car in Los Angeles, California, U.S., July 9, 2020. REUTERS/Lucy Nicholso...",https://www.investing.com/news/stock-market-news/us-says-real-concern-about-tesla-autopilot-driver-interaction-3088960,https://i-invdn-com.investing.com/news/LYNXNPED920A7_L.jpg,en,2023-05-23T16:26:08.000000Z,investing.com,,equity,Consumer Cyclical,27.953331,0.1411
8c16ad80-39c9-47ea-bedd-9bf821065af5,"Oppenheimer remains sidelined on Tesla, acknowledges innovation and production milestones By Investing.com","Oppenheimer remains sidelined on Tesla, acknowledges innovation and production milestones",,"Published May 23, 2023 10:02AM ET

© Reuters. Oppenheimer remains sidelined on Tesla (TSLA), acknowledges innovation and production milestones

TSLA +1.29% Add...",https://www.investing.com/news/stock-market-news/oppenheimer-remains-sidelined-on-tesla-acknowledges-innovation-and-production-milestones-432SI-3088801,https://i-invdn-com.investing.com/news/LYNXNPEB6G10B_L.jpg,en,2023-05-23T13:54:07.000000Z,investing.com,,equity,Consumer Cyclical,25.939602,0.480675
811300a8-5af7-4ef3-91be-9461e7e5941d,"TSLA, PANW, OCEA, INTU, VFC: Top 5 Trending Stocks - VF (NYSE:VFC), Tesla (NASDAQ:TSLA), Intuit (NASDAQ:INTU), Ocean Biomedical (NASDAQ:OCEA), Palo Alto Networks (NASDAQ:PANW)",,,Wall Street finally seemed to realize the gravity of the never-ending debt ceiling talks as representatives of President Joe Biden and Republican lawmakers conc...,https://www.benzinga.com/markets/equities/23/05/32544205/tesla-palo-alto-networks-ocea-biomedical-intuit-vf-corp-why-these-5-stocks-are-drawing-investor-,https://cdn.benzinga.com/files/images/story/2023/Stocks_Photo_by_Jirapong_Manustrong_on_Shutterstock_3.jpeg?width=1200&height=800&fit=crop,en,2023-05-24T01:20:47.000000Z,benzinga.com,,equity,Consumer Cyclical,30.830299166666663,0.4287
231d2571-6175-4580-be12-af30e07527dd,Tesla Has a Growing Inventory Problem,"Tesla's (NASDAQ: TSLA) inventory has exploded over the last year, despite the company slashing prices to increase the volume sold. In this video, Travis Hoium covers why inventory is such a big challenge for auto companies, and how Tesla's inventory is now looking worse than the inventories of legacy automakers.",,"Tesla's (NASDAQ: TSLA) inventory has exploded over the last year, despite the company slashing prices to increase the volume sold. In this video, Travis Hoium c...",https://finance.yahoo.com/m/72646c74-2c02-3f2e-a7f1-5d738f6fadcf/tesla-has-a-growing-inventory.html?.tsrc=rss,https://s.yimg.com/ny/api/res/1.2/Vb0qf4_7eMYiweNEiUZXcw--/YXBwaWQ9aGlnaGxhbmRlcjt3PTEyMDA7aD04MDE-/https://media.zenfs.com/en/motleyfool.com/5dba2bfe4a4ec562afeee111347be02e,en,2023-05-24T09:30:00.000000Z,finance.yahoo.com,,equity,Consumer Cyclical,51.529346,-0.1479
4796be22-2c09-4ef8-8ead-cad9da2f62af,Best Stock to Buy: Tesla vs. Plug Power,"Fool.com contributor and finance professor Parkev Tatevosian compares Tesla (NASDAQ: TSLA) and Plug Power (NASDAQ: PLUG) and picks his favorite stock to buy. *Stock prices used were the afternoon prices of May 21, 2023.",,Fool.com contributor and finance professor Parkev Tatevosian compares Tesla (NASDAQ: TSLA) and Plug Power (NASDAQ: PLUG) and picks his favorite stock to buy. *S...,https://finance.yahoo.com/m/dca80875-2c5d-31d9-b22c-b40a9de8ce59/best-stock-to-buy%3A-tesla-vs..html?.tsrc=rss,https://s.yimg.com/ny/api/res/1.2/CLaJ4rEAnCn2JDJgXMEVVw--/YXBwaWQ9aGlnaGxhbmRlcjt3PTEyMDA7aD02NzU-/https://media.zenfs.com/en/motleyfool.com/ca2c004dc2e6091f4d019c50de2bc113,en,2023-05-24T09:30:00.000000Z,finance.yahoo.com,,equity,Consumer Cyclical,51.308067,0.54785
2149d111-f153-4da6-b3e8-56f9526adec6,"Just When You Thought It Was Safe To Go Back Onto Twitter: Cannabis Advertisers, Elon Musk's Blue Check & More - Tesla (NASDAQ:TSLA)","Cannabis companies lapsed into collective Twitter ecstasy in March when the Bluebird opened its wings and embraced cannabis advertising on its site,",,"Cannabis companies lapsed into collective Twitter ecstasy in March when the Bluebird opened its wings and embraced cannabis advertising on its site, making hist...",https://www.benzinga.com/markets/cannabis/23/05/32544790/just-when-you-thought-it-was-safe-to-go-back-onto-twitter-cannabis-advertisers-elon-musks-blue-c,https://cdn.benzinga.com/files/images/story/2023/05/23/twitter_weed_el_planteo.jpg?width=1200&height=800&fit=crop,en,2023-05-24T04:32:06.000000Z,benzinga.com,,equity,Consumer Cyclical,41.066696,0.4404
