uuid,title,description,keywords,snippet,url,image_url,language,published_at,source,relevance_score,type,industry,match_score,sentiment_score
71430020-202e-48c1-ad91-bec5470f4f02,"Tesla Model 3s now qualify for $7,500 in federal tax credits","All Tesla Model 3 sedans qualify for the federal tax credit, a change that has recently appeared on a government site tracking which EVs qualify for the...","article_normal, Motor Vehicles, Alternative Fuel Vehicles, Automotive, Economic Performance/Indicators, Car Registration/Sales Figures, Economic News, Tesla Inc., TSLA, economic performance, indicators, car registration, sales figures, economic news, motor vehicles, alternative fuel vehicles, automotive","All Tesla Inc.’s Model 3 sedans qualify for $7,500 in federal tax credits, a change that has recently appeared on a government site that keeps track of which ...",https://www.marketwatch.com/story/tesla-model-3s-now-qualify-for-7-500-in-federal-tax-credits-653267d8,https://images.mktw.net/im-795215/social,en,2023-06-06T17:59:00.000000Z,marketwatch.com,,equity,Consumer Cyclical,34.85417233333333,0.4361
9e7172b9-8066-40b1-a953-7af6696c0583,Tesla (TSLA) Outpaces Stock Market Gains: What You Should Know,"Tesla (TSLA) closed the most recent trading day at $221.31, moving +1.7% from the previous trading session.",,"Tesla (TSLA) closed at $221.31 in the latest trading session, marking a +1.7% move from the prior day. The stock outpaced the S&P 500's daily gain of 0.24%. Els...",https://finance.yahoo.com/news/tesla-tsla-outpaces-stock-market-214521373.html?.tsrc=rss,https://media.zenfs.com/en/zacks.com/670d1917693293f70179651625deb88f,en,2023-06-06T21:45:21.000000Z,finance.yahoo.com,,equity,Consumer Cyclical,31.162577666666667,0.5978500000000001
5e78de3c-d5d6-4930-8dc4-d8b29b59fa09,Tesla stock in danger of first loss in eight sessions,"Shares of Tesla Inc. slipped 0.2% in premarket trading Tuesday, putting them in danger of suffering their first loss in eight trading session. The electric...","article_normal, Automobiles, Corporate/Industrial News, Equity Markets, Derivative Securities, Tesla Inc., TSLA, Rivian Automotive Inc. Cl A, RIVN, Lucid Group Inc., LCID, Nikola Corp., NKLA, E-Mini S&P 500 Future Continuous Contract, ES00, Li Auto Inc. ADR, LI, XPeng Inc. ADR, XPEV, NIO Inc. ADR, NIO, SPX, S&P 500 Index, corporate, industrial news, equity markets, derivative securities, automobiles","Shares of Tesla Inc. TSLA, -1.77% slipped 0.2% in premarket trading Tuesday, putting them in danger of suffering their first loss in eight trading session. The ...",https://www.marketwatch.com/story/tesla-stock-in-danger-of-first-loss-in-eight-sessions-79e41e94,https://s.wsj.net/public/resources/MWimages/MW-GP644_MicroS_ZG_20180906154215.jpg,en,2023-06-06T12:57:00.000000Z,marketwatch.com,,equity,Consumer Cyclical,34.46597983333333,-0.7517
e793bbaf-84ee-4fad-bb33-f802bb763902,"AI-Powered Surge: Nasdaq 100 Index Nears Record First-Half Performance - Invesco QQQ Trust, Series 1 (NASDAQ:QQQ)","The Nasdaq 100 index is showing an impressive rally, surging 33% higher year-to-date as of June 6.",,"The Nasdaq 100 index is showing an impressive rally, surging 33% higher year-to-date as of June 6. But with 19 trading sessions still remaining in June 2023, th...",https://www.benzinga.com/markets/equities/23/06/32742395/ai-powered-surge-nasdaq-100-index-nears-record-first-half-performance,https://cdn.benzinga.com/files/images/story/2023/06/06/nasdaq_shutter.jpg?width=1200&height=800&fit=crop,en,2023-06-06T17:35:08.000000Z,benzinga.com,,equity,Consumer Cyclical,17.629387166666667,0.2023
7fc7c2c0-0702-4e8b-8fa1-79f57b1ba329,Is Tesla (TSLA) a Buy for June?,"In order to stave off the rising competition, Tesla (TSLA) undertook price cuts which affected its margins and profitability. With the company seeking higher volumes and a larger fleet, is...","Business News, Stocks, Finance","In order to stave off the rising competition, Tesla (TSLA) undertook price cuts which affected its margins and profitability. With the company seeking higher vo...",https://www.entrepreneur.com/finance/is-tesla-tsla-a-buy-for-june/453608,https://assets.entrepreneur.com/providers/stocknews/hero-image-stocknews-453608.jpeg?format=pjeg&auto=webp,en,2023-06-06T12:08:05.000000Z,entrepreneur.com,,equity,Consumer Cyclical,33.70124033333333,0.06195
69a24fe8-4ee1-49cf-b7c5-23e633a0214e,Lawsuit Claiming Racism at Tesla Draws Almost 240 Black Workers Saying ‘Me Too’,A Black former assembly line staffer at Tesla Inc. is moving to add hundreds of other workers to his 2017 lawsuit in which he called the electric-car,,"New You can now listen to Insurance Journal articles!

A Black former assembly line staffer at Tesla Inc. is moving to add hundreds of other workers to his 2017...",https://www.insurancejournal.com/news/national/2023/06/06/724172.htm,https://www.insurancejournal.com/app/uploads/2023/06/Tesla-plant2-Bloomberg-scaled.jpg,en,2023-06-06T06:00:56.000000Z,insurancejournal.com,,equity,Consumer Cyclical,32.128172000000006,-0.191429
6d450d8a-c8b5-46e5-9cd9-53645a89d11d,UPDATE 1-Court upholds Musk's win in $13 bln lawsuit over Tesla-SolarCity deal,"A trial court properly found that Tesla Inc chief Elon Musk did not push the electric carmaker to overpay for SolarCity in 2016, the Delaware Supreme Court said on Tuesday, ending years of litigation over the $2.6 billion deal.  Musk was the biggest shareholder in both companies at the time of the deal and Tesla shareholders alleged he pushed the carmaker's board into the deal to bail out the billionaire's investment in the struggling rooftop solar company.  The state's highest court said that while a judge on the Delaware Court of Chancery erred in some portions of his analysis, his overall premise still supported his determination that Tesla paid a fair price for SolarCity.",,"(Updates with background on lawsuit, quote from opinion after paragraph 3)

By Tom Hals

June 6 (Reuters) - A trial court properly found that Tesla Inc chief El...",https://finance.yahoo.com/news/1-court-upholds-musks-win-160600826.html?.tsrc=rss,https://s.yimg.com/cv/apiv2/social/images/yahoo_default_logo-1200x1200.png,en,2023-06-06T16:06:00.000000Z,finance.yahoo.com,,equity,Consumer Cyclical,29.660490499999998,-0.018532999999999997
748654fa-5af9-4e2d-8541-61260d801c6c,Tesla Unusual Options Activity - Tesla (NASDAQ:TSLA),,,"A whale with a lot of money to spend has taken a noticeably bearish stance on Tesla.

Looking at options history for Tesla TSLA we detected 83 strange trades.

...",https://www.benzinga.com/markets/options/23/06/32758530/tesla-unusual-options-activity,https://www.benzinga.com/next-assets/images/schema-image-default.png,en,2023-06-07T13:46:55.000000Z,benzinga.com,,equity,Consumer Cyclical,72.9264,0.181643
95f36c8c-f1e0-44a0-85ea-764872863cf0,Tesla Surges – 24,"Not long ago, there was worry that Tesla was in trouble and that the problems would hit the stock price. Not so.",,"Tesla Surges

Not long ago, there was worry that Tesla Inc. (NASDAQ: TSLA) was in trouble and that the problems would hit the stock price. Not so. The shares tr...",https://247wallst.com/autos/2023/06/07/tesla-up-110-ytd/,https://247wallst.com/wp-content/uploads/2022/02/imageForEntry13-4Wj.jpg,en,2023-06-07T13:30:46.000000Z,247wallst.com,,equity,Consumer Cyclical,42.235651833333336,-0.25265
8fb1f95f-3c41-4650-be16-b3ad0e771525,"TSLA, COIN, RNAZ, BA, YEXT: Top 5 Trending Stocks - Yext (NYSE:YEXT), TransCode Therapeutics (NASDAQ:RNAZ), Tesla (NASDAQ:TSLA), Coinbase Glb (NASDAQ:COIN), Boeing (NYSE:BA)",,,U.S. markets ended in the green on Tuesday as investors and traders shifted to a cautious mode ahead of the crucial inflation data release next week along with ...,https://www.benzinga.com/markets/cryptocurrency/23/06/32750986/tesla-coinbase-transcode-therapeutics-boeing-yext-why-these-5-stocks-are-drawing-investor-,https://cdn.benzinga.com/files/images/story/2023/Stocks_Photo_by_Pixels_Hunter_on_Shutterstock_7.jpeg?width=1200&height=800&fit=crop,en,2023-06-07T01:22:31.000000Z,benzinga.com,,equity,Consumer Cyclical,30.898243666666662,0.43696700000000005
8c2598a8-f776-4535-ab6a-c9092c41c4de,Tesla/Ford Partnership Changes EV Charging Forever,"When Ford (NYSE: F) announced it's adopting Tesla's (NASDAQ: TSLA) charging standard in future vehicles, it shook the EV world. But the real impact may be commoditizing plugs and the electricity that goes through them.",,"When Ford (NYSE: F) announced it's adopting Tesla's (NASDAQ: TSLA) charging standard in future vehicles, it shook the EV world. But the real impact may be commo...",https://finance.yahoo.com/m/7af6b0e0-dbde-3612-bddf-26e15b57a496/tesla%2Fford-partnership.html?.tsrc=rss,https://s.yimg.com/ny/api/res/1.2/mN6x.QI0C.v4VlsdNY387w--/YXBwaWQ9aGlnaGxhbmRlcjt3PTEyMDA7aD04MDE-/https://media.zenfs.com/en/motleyfool.com/af2bd0075dd4142c67da377d3aa59807,en,2023-06-07T11:30:00.000000Z,finance.yahoo.com,,equity,Consumer Cyclical,50.909927,-0.05135
7b754a25-b3a0-48eb-b831-ce9b7679360c,Tesla Stock Could Perform Particularly Well in June,TSLA averaged an over 10% gain for the month over the last 10 years,,"Tesla Inc (NASDAQ:TSLA) stock is enjoying some tailwinds today, last seen up 1.5% at $224.68. The electric vehicle (EV) maker updated its website to reflect tha...",https://finance.yahoo.com/news/tesla-stock-could-perform-particularly-163457973.html?.tsrc=rss,https://media.zenfs.com/en/schaeffers_investment_research_24/a2fe35890fb056aefddac93be3805499,en,2023-06-07T16:34:57.000000Z,finance.yahoo.com,,equity,Consumer Cyclical,37.09861216666667,0.559533
aa2c9e78-ac2d-44ef-9502-02d964e16ee5,"Tesla Gears Up For India Entry, Plans To Assemble, Set Up Vendor Base In China's South Asian Rival","This story was originally published on the Benzinga India portal. Tesla Inc (NASDAQ: TSLA), under the leadership of its CEO Elon Musk, has reportedly agreed in principle to the Indian government’s proposal to not just assemble its electric vehicles in India, but also to establish a local vendor base. What Happened? Tesla is not likely to postpone the creation of a domestic vendor base, as it values the integration of manufacturing and supply chains, according to a report from India's Financial E",,"This story was originally published on the Benzinga India portal.

Tesla Inc (NASDAQ: TSLA), under the leadership of its CEO Elon Musk, has reportedly agreed in...",https://finance.yahoo.com/news/tesla-gears-india-entry-plans-081846117.html?.tsrc=rss,https://media.zenfs.com/en/Benzinga/1d58385bb07ed9a24f20393816862519,en,2023-06-07T08:18:46.000000Z,finance.yahoo.com,,equity,Consumer Cyclical,30.23601366666667,0.2504
25e6e23c-79b4-4e8c-91b1-2cbc8aed8130,"Morning Blast: Tesla Not as Corny as Kansas in August, Rivian R1T Catches Fire (Literally) – 24","Tesla and other U.S. EV makers are reportedly losing some $3 billion in renewable energy credits, otherwise known as free money.",,"Morning Blast: Tesla Not as Corny as Kansas in August, Rivian R1T Catches Fire (Literally)

Premarket action on Wednesday had the three major U.S. indexes tradi...",https://247wallst.com/investing/2023/06/07/morning-blast-tesla-not-as-corny-as-kansas-in-august-rivian-r1t-catches-fire-literally/,https://247wallst.com/wp-content/uploads/2022/10/imageForEntry12-zBB.jpg,en,2023-06-07T11:34:46.000000Z,247wallst.com,,equity,Consumer Cyclical,29.166655000000002,0.238383
ca6cdb3b-10f9-478e-a388-3805b5a25a7a,The EV Legend Is In the Works,"Another week, another lineup of news on the EV front. Reuters reported that Panasonic and Tesla Inc (NASDAQ: TSLA) jointly-operated battery factory will be increasing production. While Tesla CEO Elon Musk revealed that the company will deliver its new Cybertruck before the end of the third quarter of the year which translates to the July-September period, many exciting news are on the EV front, promising to give Tesla a run for its EV money. Renowned pickup tonneau cover manufacturer Worksport L",,"Another week, another lineup of news on the EV front. Reuters reported that Panasonic and Tesla Inc (NASDAQ: TSLA) jointly-operated battery factory will be incr...",https://finance.yahoo.com/news/ev-legend-works-215553782.html?.tsrc=rss,https://media.zenfs.com/en/Benzinga/1356afd5cc7b3b5c3085e71757aaf449,en,2023-06-07T21:55:53.000000Z,finance.yahoo.com,,equity,Consumer Cyclical,20.773398,0.10146
0d9a327a-f06b-48bc-b077-afc3c39ba9aa,The Cheapest Way to Buy Tesla (TSLA) Stock,Discover the most affordable way to buy Tesla (TSLA) stock and start trading today. Our comprehensive guide provides step-by-step instructions to help you navigate the process with ease. Don't let the perceived cost deter you—now is the perfect time to invest in Tesla's future. Learn how to seize this opportunity and make informed decisions.,,"By Tim Bohen From StocksToTrade

The cheapest way to buy Tesla (TSLA) stock is with a good broker and plan. In this guide, I’ll show you exactly how to put it...",https://stockstotrade.com/how-to-buy-tsla-stock/,https://stockstotrade.com/wp-content/uploads/2023/05/cheapest_way_tesla_SEO.jpg,en,2023-06-07T20:35:19.000000Z,stockstotrade.com,,equity,Consumer Cyclical,33.129387,0.464509
2095b02a-2439-41fa-8fef-89aa7c6c86e1,"Tesla Opens Charging To Ford, Highlighting Weak National Infrastructure (NASDAQ:TSLA)","Ford Motor Company (F) has decided to collaborate with Tesla, embracing its proprietary charging standard. Click here for our view of the impact on TSLA stock.",,"Tesla electric car charger Ajax9

The decision by Tesla, Inc. (NASDAQ:TSLA) to open its charging network to Ford Motor Company (F) battery-electric (""BEV"") mode...",https://seekingalpha.com/article/4610356-tesla-opens-charging-to-ford-highlighting-weak-national-infrastructure,https://static.seekingalpha.com/cdn/s3/uploads/getty_images/1312470657/image_1312470657.jpg?io=getty-c-w1536,en,2023-06-08T19:04:53.000000Z,seekingalpha.com,,equity,Consumer Cyclical,36.36649966666666,0.331545
dba4902b-7a0f-4c01-9d42-48a96dbcfdef,"Tesla Rival Lucid Eyes Highly Competitive China Market Despite Production Woes On Home Turf - Lucid Gr (NASDAQ:LCID), Tesla (NASDAQ:TSLA), BYD (OTC:BYDDF), NIO (NYSE:NIO), Ford Motor (NYSE:F), Baidu (",,,"Electric vehicle upstart Lucid Group, Inc. LCID could be setting its sights on the highly-competitive Chinese market even as it struggles to navigate through th...",https://www.benzinga.com/markets/asia/23/06/32772479/tesla-rival-lucid-eyes-highly-competitive-china-market-despite-production-woes-on-home-turf,https://cdn.benzinga.com/files/images/story/2023/Lucid_EVs_1.jpeg?width=1200&height=800&fit=crop,en,2023-06-08T05:30:18.000000Z,benzinga.com,,equity,Consumer Cyclical,34.85453866666666,0.11870000000000001
98900091-e1d7-41c4-8406-377707552a5d,"Tesla to open charging network to GM next year; GM, Tesla shares rally","Tesla Inc. has opened its fast-charging network to General Motors Co. electric vehicles, the companies said late Thursday, following a similar announcement...","article_normal, Motor Vehicles, Passenger Cars, Alternative Fuel Vehicles, Automobiles, Financial Performance, Share Price Movement/Disruptions, Capacity/Facilities, Corporate/Industrial News, Facility Openings, Content Types, Factiva Filters, C&E Exclusion Filter, C&E Industry News Filter, General Motors Co., GM, Tesla Inc., TSLA, financial performance, share price movement, disruptions, capacity, facilities, corporate, industrial news, facility openings, content types, factiva filters, c&e exclusion filter, c&e industry news filter, motor vehicles, passenger cars, alternative fuel vehicles, automobiles","Tesla Inc. has opened its fast-charging network to General Motors Co. electric vehicles, the companies said late Thursday, following a similar announcement late...",https://www.marketwatch.com/story/tesla-to-open-charging-network-to-gm-next-year-gm-tesla-shares-rally-4041ac1a,https://images.mktw.net/im-769685/social,en,2023-06-08T21:16:00.000000Z,marketwatch.com,,equity,Consumer Cyclical,37.695226000000005,0.47792000000000007
6f7339bf-5db9-492d-8dc5-c307603321ac,NASDAQ index leads US stocks higher,NASDAQ rises by 1.02%,,"The major US stock indices are closing higher with the NASDAQ index leading the way.

A snapshot of the closing levels shows:

Dow industrial average rose 168.5...",https://www.forexlive.com/news/nasdaq-index-leads-us-stocks-higher-20230608/,https://images.forexlive.com/fl-static/fl-thumbnail.jpg,en,2023-06-08T20:23:25.000000Z,forexlive.com,,equity,Consumer Cyclical,37.262207,0.765
594fa83c-d9dd-493e-a99a-6b5f9e1dc115,"After-hours movers: GM, Tesla gain on EV charging pact; DocuSign jumps on EPS By Investing.com","After-hours movers: GM, Tesla gain on EV charging pact; DocuSign jumps on EPS",,"Published Jun 08, 2023 05:32PM ET

© Reuters After-hours movers: GM, Tesla gain on EV charging pact; DocuSign jump on EPS

GM -1.02% Add to/Remove from Watchli...",https://www.investing.com/news/stock-market-news/afterhours-movers-gm-tesla-gain-on-ev-charging-pact-docusign-jumps-on-eps-432SI-3101525,https://i-invdn-com.investing.com/news/moved_LYNXMPEH9J0WS_L.jpg,en,2023-06-08T21:29:51.000000Z,investing.com,,equity,Consumer Cyclical,29.812696333333335,0.351133
8934f2eb-6106-4edc-a764-2304f1659b5a,"Elon Musk Wants to License Tesla's Self-Driving Tech to Other Brands, and It Could Be Worth Billions","Tesla (NASDAQ: TSLA) has been selling electric vehicles (EVs) at scale for more than a decade, and it has since been the industry leader by a wide margin.  In 2014, the company revealed plans to introduce driver assistance software that would eventually be capable of piloting each Tesla vehicle without human input.  Today, that technology is known as full self-driving (or autonomous driving), and it's currently available in beta mode for some Tesla customers.",,"Tesla (NASDAQ: TSLA) has been selling electric vehicles (EVs) at scale for more than a decade, and it has since been the industry leader by a wide margin. In 20...",https://finance.yahoo.com/m/2bd169b2-7dde-36ed-bb7d-d57652f27069/elon-musk-wants-to-license.html?.tsrc=rss,https://s.yimg.com/ny/api/res/1.2/Ic7rMmLNEDwERZ4O0iIzQg--/YXBwaWQ9aGlnaGxhbmRlcjt3PTEyMDA7aD04MDA-/https://media.zenfs.com/en/motleyfool.com/7371569d968dd443f600b54658187dad,en,2023-06-08T13:20:35.000000Z,finance.yahoo.com,,equity,Consumer Cyclical,35.597443,0.1909
0e5c5bd9-82c6-4a92-8b7d-2a92325b95a4,Tesla stock surges toward a 10th-straight gain,"Tesla's stock rose Thursday toward a 10th-straight gain, as the EV maker sold more cars in China in May than it did in April","article_normal, china, ev, Motor Vehicles, Alternative Fuel Vehicles, Automobiles, Financial Performance, Earnings, Sales Figures, Share Price Movement/Disruptions, Ownership Changes, Corporate Actions, Corporate/Industrial News, Equity Markets, Commodity/Financial Market News, Content Types, Factiva Filters, C&E Exclusion Filter, C&E Industry News Filter, China, EV, Li Auto Inc. ADR, LI, XPeng Inc. ADR, XPEV, NIO Inc. ADR, NIO, Tesla Inc., TSLA, DRIV, SPX, Global X Autonomous & Electric Vehicles ETF, S&P 500 Index, financial performance, earnings, sales figures, share price movement, disruptions, ownership changes, corporate actions, corporate, industrial news, equity markets, commodity, financial market news, content types, factiva filters, c&e exclusion filter, c&e industry news filter, motor vehicles, alternative fuel vehicles, automobiles","Shares of Tesla Inc. rose Thursday toward a 10th-straight gain, as data out of China showed that the electric vehicle giant sold more cars in May than the previ...",https://www.marketwatch.com/story/tesla-stock-ticks-up-toward-a-10th-straight-gain-546cd4ae,https://images.mktw.net/im-796604/social,en,2023-06-08T16:45:00.000000Z,marketwatch.com,,equity,Consumer Cyclical,34.367118,0.17006
49ec060d-a9c3-4f7c-9c49-76cee62427c3,'This Really Needs To Stop': Elon Musk Just Slammed Ireland's Plans To Slaughter 200K Cows For Climate Change — 3 Top Green Stocks That Actually Make A Difference,"Cows, like all living mammals, produce greenhouse gases, which could threaten their existence. According to the Telegraph, Ireland is reportedly considering killing 200,000 cows in the country to meet the European Union’s climate targets. Not everyone is a fan of this method. “Reports like this only serve to further fuel the view that the government is working behind the scenes to undermine our dairy and livestock sectors,” said Tim Cullinan, president of the Irish Farmers’ Association. It also",,"Cows, like all living mammals, produce greenhouse gases, which could threaten their existence.

According to the Telegraph, Ireland is reportedly considering ki...",https://finance.yahoo.com/news/really-needs-stop-elon-musk-200437195.html?.tsrc=rss,https://media.zenfs.com/en/Benzinga/0c62bea42c8f59b78f4dc5dc7a648f9b,en,2023-06-08T20:04:37.000000Z,finance.yahoo.com,,equity,Consumer Cyclical,21.632500833333335,0.0395
17cfc346-de4e-4605-b75a-db577b70384a,'This Really Needs To Stop': Elon Musk Just Slammed Ireland's Plans To Slaughter 200K Cows For Climate Change — 3 Top Green Stocks That Actually Make A Difference,"Cows, like all living mammals, produce greenhouse gases, which could threaten their existence. According to the Telegraph, Ireland is reportedly considering killing 200,000 cows in the country to meet the European Union’s climate targets. Not everyone is a fan of this method. “Reports like this only serve to further fuel the view that the government is working behind the scenes to undermine our dairy and livestock sectors,” said Tim Cullinan, president of the Irish Farmers’ Association. It also",,"Cows, like all living mammals, produce greenhouse gases, which could threaten their existence.

According to the Telegraph, Ireland is reportedly considering ki...",https://finance.yahoo.com/news/really-needs-stop-elon-musk-200437195.html,https://media.zenfs.com/en/Benzinga/0c62bea42c8f59b78f4dc5dc7a648f9b,en,2023-06-08T20:04:37.000000Z,finance.yahoo.com,,equity,Consumer Cyclical,21.632500833333335,0.0395
75f5a83e-0256-4069-83a2-bba7cf087862,Tesla Stock: This Is The Time To Get Out (Rating Downgrade) (NASDAQ:TSLA),"After a 43% gain since April, I am closing out my position in Tesla stock. Recent TSLA deals with Ford and GM have led to upside momentum. Click here for more.",,"jetcityimage/iStock Editorial via Getty Images

Tesla, Inc. (NASDAQ:TSLA)'s shares have crossed into overbought territory recently, and investor sentiment has p...",https://seekingalpha.com/article/4610546-tesla-this-is-the-time-to-get-out-rating-downgrade,https://static.seekingalpha.com/cdn/s3/uploads/getty_images/1140204814/image_1140204814.jpg?io=getty-c-w1536,en,2023-06-09T14:23:51.000000Z,seekingalpha.com,,equity,Consumer Cyclical,37.49158383333333,0.361782
337775fe-7762-4032-aca7-b41733e4ef93,GM Joins the Tesla Bandwagon,"Helping to bolster the mood on Wall Street, two stocks betting big on electric vehicles (EVs) made sizable gains.  It's not every day that you see Tesla (NASDAQ: TSLA) and General Motors (NYSE: GM) working together, but the two automakers announced a landmark deal that has implications for the entire industry.  Shares of General Motors rose 4% in premarket trading.",,"Helping to bolster the mood on Wall Street, two stocks betting big on electric vehicles (EVs) made sizable gains. It's not every day that you see Tesla (NASDAQ:...",https://finance.yahoo.com/m/43546baf-f1a7-32b5-979e-cc0eb97d5202/gm-joins-the-tesla-bandwagon.html?.tsrc=rss,https://s.yimg.com/ny/api/res/1.2/aLcvlmu7BuFevwGXo65K1g--/YXBwaWQ9aGlnaGxhbmRlcjt3PTEyMDA7aD04MDE-/https://media.zenfs.com/en/motleyfool.com/9b0e86d81ea5ce7ab2960756ad553aa5,en,2023-06-09T13:28:20.000000Z,finance.yahoo.com,,equity,Consumer Cyclical,52.08794,0.25115
5deb4235-ed14-474f-9460-033a17bf01e6,What Will Tesla Gain From the GM Partnership?,"In this video, I will talk about the recent partnership between General Motors and Tesla (NASDAQ: TSLA), what both companies will gain from it, and which other automakers will follow suit. At the end of May, Tesla and Ford announced the same partnership.",,"In this video, I will talk about the recent partnership between General Motors and Tesla (NASDAQ: TSLA), what both companies will gain from it, and which other ...",https://finance.yahoo.com/m/5683a6c1-3b36-3d62-b174-1b6e66ff4794/what-will-tesla-gain-from-the.html?.tsrc=rss,https://s.yimg.com/ny/api/res/1.2/ffoW4PdYw21thL5Wqs9ILA--/YXBwaWQ9aGlnaGxhbmRlcjt3PTEyMDA7aD02NzU-/https://media.zenfs.com/en/motleyfool.com/a3db9a484545bd63decf6fcd6e660148,en,2023-06-09T14:00:00.000000Z,finance.yahoo.com,,equity,Consumer Cyclical,49.700016,0.5267
63ba8166-a6c3-4aaf-b8f7-5e7989773bbc,"Ross Gerber Thinks GM's Decision To Adopt Tesla's EV Charging System 'Is Checkmate' — 'This Is Setting A Standard' - Tesla (NASDAQ:TSLA), General Motors (NYSE:GM)",,,"Ross Gerber, President and CEO of wealth and investment management firm Gerber Kawasaki Inc., has reportedly lauded General Motors Co's GM decision to adopt Tes...",https://www.benzinga.com/news/23/06/32790330/ross-gerber-thinks-gms-decision-to-adopt-teslas-ev-charging-system-is-checkmate-this-is-setting-a-st,https://cdn.benzinga.com/files/images/story/2023/Tesla_Superchargers._(image_credits:_brichuas_and_Felix_Mizioznikov_on_Shutterstock)_1.jpeg?width=1200&height=800&fit=crop,en,2023-06-09T01:45:41.000000Z,benzinga.com,,equity,Consumer Cyclical,29.78956283333333,0.2934999999999999
