uuid,title,description,keywords,snippet,url,image_url,language,published_at,source,relevance_score,type,industry,match_score,sentiment_score
cd5525b5-fe3d-4614-af46-d7cf563fb044,Spiros Segalas Comments on Tesla,"Spiros Segalas Comments on Tesla, Stocks: TSLA, Spiros Segalas, release date:Jan 22, 2021",,Tesla ( NASDAQ:TSLA ) was a top contributor to the Fund's performance during the quarter. Tesla posted a host of impressive financial results made possible by s...,https://www.gurufocus.com/news/1338683/spiros-segalas-comments-on-tesla,https://static.gurufocus.com/photos/gurus/guru_logo_square.jpg,en,2021-01-22T22:01:17.000000Z,gurufocus.com,,equity,Consumer Cyclical,37.559517,0.292633
41f0084d-a83c-44e7-ad38-8c0e7098a79f,Tesla Accuses Employee Who Worked For Company For Less Than 2 Weeks Of Stealing Trade Secrets,"Tesla Inc (NASDAQ: TSLA) on Friday sued a former employee over claims of stealing trade secrets.
What Happened: The electric-vehicle maker accuses Alex ...",,"Tesla Inc (NASDAQ: TSLA) on Friday sued a former employee over claims of stealing trade secrets.

What Happened: The electric-vehicle maker accuses Alex Khatilo...",https://www.benzinga.com/news/21/01/19285720/tesla-accuses-employee-who-worked-for-company-for-less-than-2-weeks-of-stealing-trade-secrets,https://cdn.benzinga.com/files/imagecache/og_image_social_share_1200x630/images/story/2012/tesla-made-in-china-model-3_1_2.jpg,en,2021-01-23T13:46:28.000000Z,benzinga.com,,equity,Consumer Cyclical,29.66521775,-0.57892
cfcbc229-9487-4608-9b7e-8d15ad001d47,Germany's Auto Safety Watchdog Investigating Tesla Touchscreen Failures,"German motor vehicle authority Kraftfahrt-Bundesamt is looking into safety risks related to touchscreen displays in Tesla Inc (NASDAQ: TSLA) cars, ...",,"German motor vehicle authority Kraftfahrt-Bundesamt is looking into safety risks related to touchscreen displays in Tesla Inc (NASDAQ: TSLA) cars, Reuters has r...",https://www.benzinga.com/news/21/01/19289184/germanys-auto-safety-watchdog-investigating-tesla-touchscreen-failures,https://cdn.benzinga.com/files/imagecache/og_image_social_share_1200x630/images/story/2012/david-von-diemar-zbwn5dvo0hg-unsplash_5_0.jpg,en,2021-01-24T21:47:21.000000Z,benzinga.com,,equity,Consumer Cyclical,30.736244125,0.264275
2f140a33-0996-4e74-ac93-33995f0f27a9,"Penn National Gaming (PENN), Tesla Motors (TSLA) - Michigan Cannabis Business Donates $420,420 To Barstool Fund Through Sports Betting Match Promotion","Dave Portnoy's The Barstool Fund is getting a boost from a Michigan cannabis product company.

What Happened: George ...",,"Dave Portnoy's The Barstool Fund is getting a boost from a Michigan cannabis product company.

What Happened: George Sinishtaj, owner of Ooze, a Michigan-based ...",https://www.benzinga.com/markets/cannabis/21/01/19288472/michigan-cannabis-business-donates-420-420-to-barstool-fund-through-sports-betting-match-promoti,https://cdn2.benzinga.com/files/imagecache/og_image_social_share_1200x630/images/story/2012/barstool-fund-logo_0.png,en,2021-01-24T17:09:12.000000Z,benzinga.com,,equity,Consumer Cyclical,39.85868,0.0
7e5c26c2-b4cd-4ce7-bb94-cca404c8c832,"AMD, Facebook, GE, Starbucks, Tesla and More Major Earnings to Watch For This Week – 24","Here, 24/7 Wall St. has put together a preview of a few of the most anticipated quarterly reports expected this week.",,"AMD, Facebook, GE, Starbucks, Tesla and More Major Earnings to Watch For This Week

The fourth-quarter earnings reporting season is kicking into gear, and we wi...",https://247wallst.com/investing/2021/01/24/amd-facebook-ge-starbucks-tesla-and-more-major-earnings-to-watch-for-this-week/,https://247wallst.com/wp-content/uploads/2020/04/imageForEntry2-xEf.jpg,en,2021-01-24T12:15:29.000000Z,247wallst.com,,equity,Consumer Cyclical,34.301647,0.239167
