uuid,title,description,keywords,snippet,url,image_url,language,published_at,source,relevance_score,type,industry,match_score,sentiment_score
0c57a7dd-f0cf-4438-8a1b-e525a95cc47b,California accuses Tesla Inc of racial discrimination in lawsuit,"Tesla is appealing that verdict and has denied any knowledge of racist conduct that Diaz said took place at the plant, which has about 10,000 workers. Tesla's blog post said it","tesla, racial discrimination, u.s. securities and exchange commission, wall street journal, tesla inc., san francisco, sexual harassment","California sued Tesla Inc. on Wednesday over allegations of discrimination and harassment of Black employees at its San Francisco Bay area factory. The suit, fi...",https://economictimes.indiatimes.com/news/international/business/california-accuses-tesla-inc-of-racial-discrimination-in-lawsuit/articleshow/89473337.cms,"https://img.etimg.com/thumb/msid-89473468,width-1070,height-580,imgsize-31520,overlay-economictimes/photo.jpg",en,2022-02-10T07:27:27.000000Z,economictimes.indiatimes.com,,equity,Consumer Cyclical,66.214014,-0.434683
9159e6ce-e1d0-47a7-8a1d-08946db4715b,"Catalyst Capital Advisors LLC Buys Synopsys Inc, Tesla Inc, Devon Energy Corp, Sells Adobe Inc, Comcast Corp, DaVita Inc",GuruFocus Article or News written by GuruFocusNews and the topic is about:,"GuruFocus, Article, News, GuruFocusNews, TSLA, SNPS, IRM, DVN, MRNA, PYPL, CPT, DTM, TWLO, IQV, HUN, ALTR, DVA, CCI, SONO, MKC, TAK, LMT, ","New Purchases: CPT, DTM, TWLO, ALTR, VCRA, ICLR, IQV, CCS, LOB, PSTG, GMS, WFG, TW, FBRT, FBRT, MP, FREL, VNM, CLFD, BBL, TREX, TSEM, SIMO, RMBS, PHM, PLUG, MLI...",https://www.gurufocus.com/news/1640319/read,https://www.gurufocus.com/favicon.ico,en,2022-02-10T23:38:04.000000Z,gurufocus.com,,equity,Consumer Cyclical,48.135467166666665,0.307225
dfdbaf17-e167-4a79-bc03-43efac8642fb,Tesla Sued By California Agency Over Racial Discrimination And Harassment,"Issues at Tesla Inc (NASDAQ:TSLA)’s Fremont manufacturing plant are behind a lawsuit filed on Wednesday by the California Department of Fair Employment and Housing against the automaker, on the grounds...","Technology, Finance",Issues at Tesla Inc (NASDAQ:TSLA)’s Fremont manufacturing plant are behind a lawsuit filed on Wednesday by the California Department of Fair Employment and Ho...,https://www.entrepreneur.com/article/417992,https://assets.entrepreneur.com/providers/valuewalk/hero-image-valuewalk-417992.jpeg,en,2022-02-10T14:42:14.000000Z,entrepreneur.com,,equity,Consumer Cyclical,34.09867933333334,-0.415943
e2fe601f-5a1a-4a82-94e4-972422d3aecc,"Antonetti Capital Management LLC Buys Old Dominion Freight Line Inc, iShares U.S. Healthcare ETF, Nucor Corp, Sells Charles River Laboratories International Inc, Tesla Inc,",GuruFocus Article or News written by GuruFocusNews and the topic is about:,"GuruFocus, Article, News, GuruFocusNews, IYH, V, ITA, SUB, IWL, RY, ODFL, NUE, XBI, CP, IHI, AVAV, CRL, KSU, JAZZ, CM, EMNT, XLB, ","New Purchases: ODFL, NUE, XBI, CP, IHI, AVAV, SLF, SHM, PFFD, KD, ONL, TIPX, PGX, VIXY, INDI, DOUG,

ODFL, NUE, XBI, CP, IHI, AVAV, SLF, SHM, PFFD, KD, ONL, TIP...",https://www.gurufocus.com/news/1639991/read,https://www.gurufocus.com/favicon.ico,en,2022-02-10T20:38:13.000000Z,gurufocus.com,,equity,Consumer Cyclical,42.42416066666667,0.175567
7fc82f02-6d70-4763-98fb-3ea20764fc2d,"Antonetti Capital Management LLC Buys Old Dominion Freight Line Inc, iShares U.S. Healthcare ETF, Nucor Corp, Sells Charles River Laboratories International Inc, Tesla Inc,",GuruFocus Article or News written by GuruFocusNews and the topic is about:,"GuruFocus, Article, News, GuruFocusNews, IYH, V, ITA, SUB, IWL, RY, ODFL, NUE, XBI, CP, IHI, AVAV, CRL, KSU, JAZZ, CM, EMNT, XLB, ","New Purchases: ODFL, NUE, XBI, CP, IHI, AVAV, SLF, SHM, PFFD, KD, ONL, TIPX, PGX, VIXY, INDI, DOUG,

ODFL, NUE, XBI, CP, IHI, AVAV, SLF, SHM, PFFD, KD, ONL, TIP...",https://www.gurufocus.com/news/1639991/antonetti-capital-management-llc-buys-old-dominion-freight-line-inc-ishares-us-healthcare-etf-nucor-corp-sells-charles-river-laboratories-international-inc-tesla-inc-,https://www.gurufocus.com/favicon.ico,en,2022-02-10T20:38:13.000000Z,gurufocus.com,,equity,Consumer Cyclical,42.421898000000006,0.175567
6c90dd63-288c-4369-a406-d93d24bc188e,"S&P 500, Nasdaq futures slip ahead of inflation data","Futures tracking the S&P 500 and the Nasdaq slipped on Thursday after the indexes notched strong gains in the past two sessions, with investors awaiting U.S.…",,"This advertisement has not loaded yet, but your article continues below.

S&P 500, Nasdaq futures slip ahead of inflation data

Article content Futures tracking...",https://financialpost.com/pmn/business-pmn/sp-500-nasdaq-futures-slip-ahead-of-inflation-data,https://storage.googleapis.com/pmd-stage-northamerica-northeast1-dcs-static-files/9.4.2/websites/images/fp/favicon-fp.ico,en,2022-02-10T12:19:02.000000Z,financialpost.com,,equity,Consumer Cyclical,17.047369,0.2177
3ffbbe9d-b31b-467d-9fa4-7cb6177503fd,"Peregrine Asset Advisers, Inc. Buys Thermo Fisher Scientific Inc, iShares 20+ Year Treasury Bond ETF, Eaton Corp PLC, Sells Tesla Inc, MongoDB Inc, KraneShares CSI China Internet ETF",GuruFocus Article or News written by GuruFocusNews and the topic is about:,"GuruFocus, Article, News, GuruFocusNews, TMO, ETN, SJM, SHW, AAPL, DG, TLT, CNC, ENB, BMY, RTX, MKSI, MDB, KWEB, NRG, HUBS, ABNB, REGN, ","New Purchases: TLT, CNC, ENB, BMY, RTX, MKSI, GDX, FTNT, ANF, WM, DOCU, MRK, H, V, MU, CMI, NTSX, WMS, COIN, LLY, TRV, CTVA, DXCM, XME, LIT, CCI, GM, EXR, ESS, ...",https://www.gurufocus.com/news/1638995/read,https://www.gurufocus.com/favicon.ico,en,2022-02-10T02:38:05.000000Z,gurufocus.com,,equity,Consumer Cyclical,38.78641466666667,0.320667
3e51621a-b17d-4762-98a6-c3cca82ef588,"Manchester Capital Management LLC Buys Vanguard Health Care ETF, Vanguard Short-Term Corporate Bond ETF, iShares Russell 2000 ETF, Sells Apple Inc, Tesla Inc, Marquee Raine Acquisition Corp",GuruFocus Article or News written by GuruFocusNews and the topic is about:,"GuruFocus, Article, News, GuruFocusNews, VCSH, IWM, VWO, GLD, VEA, VT, VHT, AAXJ, ENJY, RRX, AMG, LFUS, MRAC, AMED, COLL, DRNA, MGK, OSH, ","Manchester, VT, based Investment company Current Portfolio ) buys Vanguard Health Care ETF, Vanguard Short-Term Corporate Bond ETF, iShares Russell 2000 ETF, Va...",https://www.gurufocus.com/news/1639944/manchester-capital-management-llc-buys-vanguard-health-care-etf-vanguard-shortterm-corporate-bond-etf-ishares-russell-2000-etf-sells-apple-inc-tesla-inc-marquee-raine-acquisition-corp,https://www.gurufocus.com/favicon.ico,en,2022-02-10T19:38:06.000000Z,gurufocus.com,,equity,Consumer Cyclical,38.75468983333334,0.5768
20b34b49-6947-4b61-84f7-8df8c5c6a82b,"Jacobi Capital Management LLC Has $1.17 Million Stock Position in Tesla, Inc. (NASDAQ:TSLA)","Jacobi Capital Management LLC lowered its holdings in shares of Tesla, Inc. (NASDAQ:TSLA) by 57.5% in the 3rd quarter, according to its most recent disclosure with the SEC. The fund owned 1,505 shares of the electric vehicle producer’s stock after selling 2,038 shares during the period. Jacobi Capital Management LLC’s holdings in Tesla were worth […]",,"Jacobi Capital Management LLC lowered its holdings in shares of Tesla, Inc. (NASDAQ:TSLA) by 57.5% in the 3rd quarter, according to its most recent disclosure w...",https://etfdailynews.com/news/jacobi-capital-management-llc-has-1-17-million-stock-position-in-tesla-inc-nasdaqtsla/,https://www.marketbeat.com/logos/tesla-motors-inc-logo.jpg,en,2022-02-11T12:56:45.000000Z,etfdailynews.com,,equity,Consumer Cyclical,63.409180333333346,0.35167299999999996
14ba2cea-3c9f-4549-a399-f884f9cf0d0c,Tesla Stock Has Become Impossible To Ignore (NASDAQ:TSLA),Tesla presents an unprecedented combination of size and growth. See why I think TSLA stock is a hold or speculative buy for risk tolerant investors.,,"jetcityimage/iStock Editorial via Getty Images

Thesis

Tesla (NASDAQ:TSLA) is a unique stock because it is the best option for exposure to the fast growing EV ...",https://seekingalpha.com/article/4486129-tesla-tsla-stock-become-impossible-ignore,https://static.seekingalpha.com/cdn/s3/uploads/getty_images/1227575736/image_1227575736.jpg?io=getty-c-w750,en,2022-02-11T02:41:13.000000Z,seekingalpha.com,,equity,Consumer Cyclical,66.46872,0.355545
b0bcf6fb-4417-4ef7-aa78-32122211e9b0,"Charles-Lim Capital Ltd Buys Sea, NIO Inc, CrowdStrike Holdings Inc, Sells Pinterest Inc, Tesla Inc, Amazon.com Inc",GuruFocus Article or News written by GuruFocusNews and the topic is about:,"GuruFocus, Article, News, GuruFocusNews, SE, NIO, CRWD, HDB, SNAP, RKLB, CPNG, PINS, TSLA, ","New Purchases: SNAP, RKLB, CPNG,

SNAP, RKLB, CPNG, Added Positions: SE, NIO, CRWD, HDB,

SE, NIO, CRWD, HDB, Reduced Positions: AMZN,

AMZN, Sold Out: PINS, TS...",https://www.gurufocus.com/news/1640941/read,https://www.gurufocus.com/favicon.ico,en,2022-02-11T17:38:03.000000Z,gurufocus.com,,equity,Consumer Cyclical,49.494510333333345,0.0
3ed6c3dd-cede-400c-96cb-27d3a769f65f,"Baker Avenue Asset Management, LP Buys AppLovin Corp, Tesla Inc, JD.com Inc, Sells Alibaba Group Holding, Sunrun Inc, Globant SA",GuruFocus Article or News written by GuruFocusNews and the topic is about:,"GuruFocus, Article, News, GuruFocusNews, TSLA, QCLN, CPNG, QQQ, ABNB, SPY, APP, JD, ABT, CFLT, EW, POSH, GPS, BJK, ACWX, DAO, VVNT, IXUS, ","New Purchases: APP, JD, ABT, CFLT, EW, POSH, PEN, SHOP, PLD, MA, ZTS, PG, CSCO, AMD, TAN, SPGI, CAT, SQ, SPOT, UBER, CLX, AVGO, XLNX, SCHA, MDB, CL, MCO, SCHM, ...",https://www.gurufocus.com/news/1641099/read,https://www.gurufocus.com/favicon.ico,en,2022-02-11T21:38:19.000000Z,gurufocus.com,,equity,Consumer Cyclical,47.28007833333333,0.40462500000000007
9a5dea07-9bbe-4d49-bf46-32db4af7cd14,"BRYN MAWR TRUST Co Buys Applied Materials Inc, PTC Inc, Essential Utilities Inc, Sells Amcor PLC, Tesla Inc, General Electric Co",GuruFocus Article or News written by GuruFocusNews and the topic is about:,"GuruFocus, Article, News, GuruFocusNews, AMAT, PTC, STZ, BLK, PNC, WTRG, FISV, AWI, PCAR, RSP, ENB, STT, CMG, ROK, COF, MSOS, PHYS, KEYS, ","New Purchases: FISV, MET, XLY, XHB, SHE, RSP, AWI, WHR, WST, STT, PCAR, AOS, HPQ, EQIX, ENB, CCOI, CPK, CPT, CVS,

FISV, MET, XLY, XHB, SHE, RSP, AWI, WHR, WST,...",https://www.gurufocus.com/news/1640391/read,https://www.gurufocus.com/favicon.ico,en,2022-02-11T02:38:04.000000Z,gurufocus.com,,equity,Consumer Cyclical,45.668459000000006,0.411067
cd26753b-5ed9-4dad-a683-18614d14bd5d,"Westfield Capital Management Co Lp Buys Tesla Inc, WillScot Mobile Mini Holdings Corp, Encore Wire Corp, Sells , PayPal Holdings Inc, MercadoLibre Inc",GuruFocus Article or News written by GuruFocusNews and the topic is about:,"GuruFocus, Article, News, GuruFocusNews, WIRE, SPGI, ASND, DXCM, GPN, AVLR, TSLA, WSC, HZNP, MAR, BAM, WCC, XLRN, SYF, CMG, ALGN, ROKU, MU, ","New Purchases: TSLA, WSC, HZNP, MAR, BAM, WCC, SCHW, ELAN, NTAP, ZI, EDR, EDR, BAH, MRTX, TW, WAL, MDB, IRT, MXL, LULU, WK, WING, AZTA, STEP, BILL, IOT, HLT, FI...",https://www.gurufocus.com/news/1640505/westfield-capital-management-co-lp-buys-tesla-inc-willscot-mobile-mini-holdings-corp-encore-wire-corp-sells--paypal-holdings-inc-mercadolibre-inc,https://www.gurufocus.com/favicon.ico,en,2022-02-11T07:38:10.000000Z,gurufocus.com,,equity,Consumer Cyclical,44.523539500000005,0.285825
ebd18641-27cb-4428-8caa-54b9b0c24357,"Factory Mutual Insurance Co Buys Vanguard FTSE Europe ETF, Tesla Inc, Pfizer Inc, Sells Meta Platforms Inc, Goldman Sachs Group Inc, Morgan Stanley",GuruFocus Article or News written by GuruFocusNews and the topic is about:,"GuruFocus, Article, News, GuruFocusNews, VGK, TSLA, GLD, XLP, ACWX, ADBE, PFE, LQD, ALGN, KLAC, BJ, MRNA, FB, GS, MS, JNJ, FDX, SPY, INTC, ","New Purchases: PFE, LQD, ALGN, KLAC, BJ, ISRG, MRNA,

PFE, LQD, ALGN, KLAC, BJ, ISRG, MRNA, Added Positions: VGK, TSLA, GLD, XLP, ACWX, ADBE, NOC, XLF, DXCM, LV...",https://www.gurufocus.com/news/1640528/factory-mutual-insurance-co-buys-vanguard-ftse-europe-etf-tesla-inc-pfizer-inc-sells-meta-platforms-inc-goldman-sachs-group-inc-morgan-stanley,https://www.gurufocus.com/favicon.ico,en,2022-02-11T08:38:03.000000Z,gurufocus.com,,equity,Consumer Cyclical,43.43439483333333,0.148
af0094a8-adc1-47e6-ac03-f2990b1f7bbe,"Kore Private Wealth LLC Buys Tesla Inc, iShares MSCI ACWI Index Fund, Vanguard Real Estate Index Fund ETF, Sells Akero Therapeutics Inc, Compass Inc, Uber Technologies Inc",GuruFocus Article or News written by GuruFocusNews and the topic is about:,"GuruFocus, Article, News, GuruFocusNews, TSLA, ACWI, VNQ, TDG, UPST, PTON, TOST, HOOD, IYZ, RYH, CBL, CTRA, AKRO, VER, VTR, ES, ARKK, ARKF, ","New Purchases: TOST, HOOD, RYH, IYZ, CBL, CTRA, TJX, IEMG, CL, RPM, SBAC, SNAP, FTXN, CSTM, PSA, ODFL, TLK, HPQ, FDIS, IEUR, BUD, BRO, VBR, WIT, XYL, NXPI, VOE,...",https://www.gurufocus.com/news/1640854/read,https://www.gurufocus.com/favicon.ico,en,2022-02-11T15:38:07.000000Z,gurufocus.com,,equity,Consumer Cyclical,39.60889183333334,0.41187500000000005
dde71692-3134-467b-b36b-e0ad60580574,"Magnus Financial Group LLC Buys Vanguard FTSE Emerging Markets ETF, Tesla Inc, BTC iShares International Aggregate Bond Fund, Sells iShares 1-3 Year Treasury Bond ETF, ClearShares Ultra-Short Maturity",GuruFocus Article or News written by GuruFocusNews and the topic is about:,"GuruFocus, Article, News, GuruFocusNews, VWO, TSLA, VTI, VUG, VO, VEA, IAGG, VSS, LIT, NYF, AVGOP.PFD, BACPL.PFD, SHY, PLBY, TAN, FAN, CNBS, PCI, ","New Purchases: IAGG, VSS, LIT, NYF, AVGOP.PFD, VB, HCP, BACPL.PFD, HMOP, PDI, EMLP, VPL, LDP, LXP, DBC, BKCH, QUAL, ICF, IBB, ADBE, GDX, LITE, MYJ, UNP, SRE, RY...",https://www.gurufocus.com/news/1640577/magnus-financial-group-llc-buys-vanguard-ftse-emerging-markets-etf-tesla-inc-btc-ishares-international-aggregate-bond-fund-sells-ishares-13-year-treasury-bond-etf-clearshares-ultrashort-maturity-etf-plby-group-inc,https://www.gurufocus.com/favicon.ico,en,2022-02-11T10:38:05.000000Z,gurufocus.com,,equity,Consumer Cyclical,37.139381500000006,0.19445
21eb79c7-cd39-4332-aa12-7b97776c0a02,"CloudAlpha Capital Management Limited Buys XPeng Inc, NVIDIA Corp, Taiwan Semiconductor Manufacturing Co, Sells Tesla Inc, Advanced Micro Devices Inc, Snap Inc",GuruFocus Article or News written by GuruFocusNews and the topic is about:,"GuruFocus, Article, News, GuruFocusNews, NVDA, WOLF, CRBU, XPEV, TSM, VIXY, TSP, U, NET, AMD, SNAP, SE, TSLA, SVXY, ADAG, RAAS, GRCL, PATH, ","New Purchases: XPEV, TSM, VIXY, TSP, U, NET, RBLX, GM,

XPEV, TSM, VIXY, TSP, U, NET, RBLX, GM, Added Positions: NVDA, WOLF, CRBU,

NVDA, WOLF, CRBU, Reduced Po...",https://www.gurufocus.com/news/1641228/cloudalpha-capital-management-limited-buys-xpeng-inc-nvidia-corp-taiwan-semiconductor-manufacturing-co-sells-tesla-inc-advanced-micro-devices-inc-snap-inc,https://www.gurufocus.com/favicon.ico,en,2022-02-12T02:38:01.000000Z,gurufocus.com,,equity,Consumer Cyclical,44.54354849999999,0.012700000000000001
b4f097bf-16e8-45b2-ae6b-1531a8625dc6,8 Chinese Stocks in Cathie Wood’s Portfolio,"In this article, we discuss the 8 Chinese stocks in Cathie Wood's portfolio.",,"In this article, we discuss the 8 Chinese stocks in Cathie Wood’s portfolio. You can skip our comprehensive analysis of these Chinese stocks and Cathie Wood?...",https://www.insidermonkey.com/blog/8-chinese-stocks-in-cathie-woods-portfolio-1021811/,https://d2gr5kl7dt2z3t.cloudfront.net/blog/wp-content/uploads/2021/03/08164427/Cathie-Wood-ARK-Investment-Management-1267.jpg,en,2022-02-12T21:03:46.000000Z,insidermonkey.com,,equity,Consumer Cyclical,20.02326283333333,0.23405
8a652229-7271-413f-827c-a379d626e653,A Tesla Might be Delivered to the Teenager Who Tracks Musk's Jet,The college student who created the Elon Musk-tracking account could be sitting behind the wheel of a Tesla Model 3 very soon.,"Investing, Tesla, CRYPTOCURRENCY, Cryptocurrency, INVESTING, Elon Musk, Cryptocurrency","The college student who created the Elon Musk-tracking account could be sitting behind the wheel of a Tesla Model 3 very soon.

The saga of the Twitter account ...",https://www.thestreet.com/investing/cryptocurrency/a-tesla-might-be-delivered-to-the-teenager-who-tracks-musks-jet,https://www.thestreet.com/.image/t_share/MTY4NjM2MzI4MDg5NjkxNzgz/introducing-pet-driving-cars-from-elon-musks-tesla-motors.jpg,en,2022-02-12T12:10:10.000000Z,thestreet.com,,equity,Consumer Cyclical,29.573841166666668,0.433467
dd412145-077d-443a-b06b-fde6c4d2196a,Five Ways to Make U.S. Jobs of the Future Better Than Today’s,(Bloomberg) -- Judging by the record number of people who’ve quit their jobs in the pandemic -– the so-called Great Resignation -– millions of Americans don’t really like their work.,"ALLTOP, BUSINESS, COS, NORTHAM, TOP, US, WWTOP, WORLD, INDUSTRIES, GOV, TEC, GEN, INDUSTRIAL, LAW, EXE, MAC, Bloomberg, WWTOPAM","It should encourage technologies that augment human labor, rather than replace it, and try to spread innovation more evenly, both by geography and size of firm....",https://www.bloombergquint.com/business/five-ways-to-make-u-s-jobs-of-the-future-better-than-today-s,https://gumlet.assettype.com/bloombergquint%2F2018-08%2F3a8e2237-2edb-4494-bcf2-231993fb6108%2FBLOOMBERG_LOGO.png?rect=0%2C56%2C1920%2C1008&w=1200&auto=format%2Ccompress&ogImage=true,en,2022-02-12T15:23:12.000000Z,bloombergquint.com,,equity,Consumer Cyclical,23.988165666666664,0.9308
48f0b091-9f40-4be6-a876-be98806d73da,Hyundai Takes a Second Run at China With Luxury Genesis Brand,"(Bloomberg) -- Hyundai Motor Co. is far from the top automobile brand of choice in China but its luxury-car division is seeking to change all that with a direct-to-market strategy targeting young, upwardly mobile consumers.","ALLTOP, BUSINESS, COS, WWTOP, WORLD, INDUSTRIES, AUTOMOTIVE, CONS, CONSD, ASIA, CHINA, GEN, ASIATOP, SKOREA, TRN, INDUSTRIAL, LUX, Bloomberg, WWTOPAS","“It is a tough market to enter but we can’t be a truly global brand without being in China, the most important market in the world,” Genesis China Chief E...",https://www.bloombergquint.com/business/hyundai-takes-a-second-run-at-china-with-luxury-genesis-brand,https://gumlet.assettype.com/bloombergquint%2F2018-08%2F3a8e2237-2edb-4494-bcf2-231993fb6108%2FBLOOMBERG_LOGO.png?rect=0%2C56%2C1920%2C1008&w=1200&auto=format%2Ccompress&ogImage=true,en,2022-02-12T05:05:37.000000Z,bloombergquint.com,,equity,Consumer Cyclical,23.337459,0.0
629406eb-6a9f-456d-9097-879698876332,Billionaire investor buys stake in EV startup Rivian,"The 19,835,761 shares, worth about $2 billion at the time, makes Soros Fund Management among the most prominent investors in a company that has yet to produce a consumer vehicle","rivian, rivian electric vehicle, amazon stake in rivian, amazon, george soros","Billionaire investor George Soros bought nearly 20 million shares of electric truck startup Rivian Automotive Inc in the quarter ended Dec. 31, securities filin...",https://www.livemint.com/companies/news/billionaire-investor-buys-stake-in-ev-startup-rivian-11644624938958.html,https://images.livemint.com/img/2022/02/12/600x338/RIVIAN_1644625134516_1644625134667.JPG,en,2022-02-12T00:20:37.000000Z,livemint.com,,equity,Consumer Cyclical,20.101055499999998,0.3612
237c2464-36af-4386-9d79-b3a457a02e80,Uber Has Good News for Customers,"Uber's top executive says 'we are going to look at cryptocurrency and or bitcoin,' as means of payments but nixes an investment.","Investing, Automotive, Stocks, Bitcoin, Investing Stocks, Technology, Cryptocurrency, CRYPTOCURRENCY, INVESTING, Technology, Consumer Services, Bitcoin, Automotive, Cryptocurrency","Uber's top executive says 'we are going to look at cryptocurrency and or bitcoin,' as means of payments but nixes an investment.

Uber (UBER) - Get Uber Technol...",https://www.thestreet.com/investing/cryptocurrency/uber-has-good-news-for-customers,https://www.thestreet.com/.image/t_share/MTg2NjAzMTUxNzgzMTEwMzE4/uber-lyft_2.jpg,en,2022-02-12T11:56:42.000000Z,thestreet.com,,equity,Consumer Cyclical,18.8033055,0.22019999999999998
036579a1-952f-4828-8364-a85a6c2dad0d,Elon Musk shares leadership advice: ‘The duty of a leader..’,"The CEO of Tesla and SpaceX, Elon Musk has a leadership advice and here is what he said","elon musk, elon musk twitter, tesla ceo elon musk, tesla racism row","Billionaire entrepreneur Elon Musk has shared leadership advice on Twitter which seems to have landed on to a mixed audience. Musk tweeted, “the duty of a lea...",https://www.livemint.com/companies/people/elon-musk-shares-leadership-advice-the-duty-of-a-leader-11644633038355.html,https://images.livemint.com/img/2022/02/12/600x338/TESLA-CHINA-ELECTRIC-2_1644378230122_1644638813730.JPG,en,2022-02-12T04:39:07.000000Z,livemint.com,,equity,Consumer Cyclical,18.202607333333333,-0.2776779999999999
3aa1429c-6108-40af-bcad-b8412a512245,"Top 10 Stock Market Moving Headlines From Last Week: Peloton Transition, Disney Earnings, Crypto Ads, SpaceX Event And More","Every day, Benzinga TV covers the biggest topics of the stock market. Benzinga’s new weekly highlights show features the top 10 events of the...",,"Every day, Benzinga TV covers the biggest topics of the stock market. Benzinga’s new weekly highlights show features the top 10 events of the previous week.

...",https://www.benzinga.com/markets/cryptocurrency/22/02/25587806/top-10-stock-market-moving-headlines-from-last-week-peloton-transition-disney-earnings-cry,https://cdn2.benzinga.com/files/imagecache/og_image_social_share_1200x630/images/story/2012/benzinga_headlines.png?width=720,en,2022-02-12T21:29:22.000000Z,benzinga.com,,equity,Consumer Cyclical,12.320473166666666,0.4939
b278831a-f543-41ac-8f20-90dacce570e6,"Elon Musk Tweets Jibe At NHTSA, Says 'Fun Police' Made Him Carry Out Latest Tesla Recall",The National Highway Traffic Safety Administration (NHTSA) last week said that the “Boombox” function in Tesla Inc (NASDAQ: TSLA) cars ...,,The National Highway Traffic Safety Administration (NHTSA) last week said that the “Boombox” function in Tesla Inc (NASDAQ: TSLA) cars and SUVs breaches fed...,https://www.benzinga.com/news/22/02/25589333/elon-musk-tweets-jibe-at-nhtsa-says-fun-police-made-him-carry-out-latest-tesla-recall,https://cdn.benzinga.com/files/imagecache/og_image_social_share_1200x630/images/story/2012/45790282455_c6f432c8ae_c.jpg,en,2022-02-13T15:27:06.000000Z,benzinga.com,,equity,Consumer Cyclical,33.3178855,0.07543299999999999
1fa08c57-bf89-427b-a112-14ee7faa96e8,2 Dividend-Paying Tech Stocks to Buy in February,,,The allure of investing in tech stocks used to be catching the tail of a rocket and riding it higher while enjoying stock splits along the way. Until Apple (NAS...,https://www.techinvestornews.com/Tech-News/Latest-Headlines/2-dividend-paying-tech-stocks-to-buy-in-february1,https://www.techinvestornews.com/Tech-News/Latest-Headlines/favicon.ico,en,2022-02-13T12:59:30.000000Z,techinvestornews.com,,equity,Consumer Cyclical,38.11347,0.695
b13a30f2-de3e-4902-b722-68ff3a1f9295,Ford Has A Surprise Feature to One-Up GM and Tesla,The Mustang and F-150 maker appears to have developed some new tech that may make its vehicles even more popular.,"INVESTING, Electric Vehicles, Automotive, Electric Vehicles, Automotive, Technology, Investing Stocks, Investing, Technology","The Mustang and F-150 maker appears to have developed some new tech that may make its vehicles even more popular.

It's the chef's surprise.

While automakers a...",https://www.thestreet.com/investing/ford-has-a-surprise-for-gm-and-tesla,https://www.thestreet.com/.image/t_share/MTgxMTQ3Nzk1NDU2NTMzNTky/ford-f-150-lightning_1.jpg,en,2022-02-13T16:01:14.000000Z,thestreet.com,,equity,Consumer Cyclical,29.831935500000004,-0.017199999999999997
336a837e-36f8-4eae-a6a9-19e9da34cc28,McDonald's Teases 'Something's Coming' And Elon Musk Reacts: Is Doge Payment In The Cards?,Fast food giant McDonald's (NYSE:MCD) does at it again. A...,,"Fast food giant McDonald's (NYSE:MCD) does at it again. After creating a stir by a tweet in late January, calling the attention of those running crypto accounts...",https://www.benzinga.com/markets/cryptocurrency/22/02/25588763/mcdonalds-teases-somethings-coming-and-elon-musk-reacts-is-doge-payment-in-the-cards,https://cdn2.benzinga.com/files/imagecache/og_image_social_share_1200x630/images/story/2012/mcdonalds_dog_1.jpg?width=720,en,2022-02-13T12:55:43.000000Z,benzinga.com,,equity,Consumer Cyclical,19.638758499999998,-0.5267
29ff7fb6-b31a-496d-b507-745c39a36e6c,Elon Musk's Tesla Continues to Tap Into Easy and Cheap Money,EV maker demands one of the highest down payments for the Semi even as production of this truck has been pushed back yet again.,"Technology, Automotive, Automotive, Electric Vehicles, STOCKS, Electric Vehicles, INVESTING, Technology","The EV maker continues to demand one of the highest down-payments for its Semi even as production of this truck has been pushed back yet again.

You don't chang...",https://www.thestreet.com/investing/elon-musks-tesla-continues-to-tap-into-easy-and-cheap-money,https://www.thestreet.com/.image/t_share/MTY4NjUwNjMwMDYyNTQ4NjE1/why-walmart-has-placed-orders-for-tesla-semi-trucks.jpg,en,2022-02-13T15:17:43.000000Z,thestreet.com,,equity,Consumer Cyclical,27.63967266666667,0.122973
