uuid,title,description,keywords,snippet,url,image_url,language,published_at,source,relevance_score,type,industry,match_score,sentiment_score
576a8ed8-3944-4a1c-ade0-e7a9a514ef9f,"Bitcoin (BTC/USD) Looking at a Breakout, Ethereum (ETH/USD) Continues its Short-Term Struggle","Bitcoin is setting up a bullish pennant formation on the daily chart, a pattern that would suggest a fresh all-time high may be on the cards",,"Bitcoin (BTC/USD) and Ethereum (ETH/USD) Price, Analysis and Chart:

Bitcoin is looking to test $60,000 and above.

Ethereum is struggling to find direction.

R...",https://www.dailyfx.com/forex/market_alert/2021/03/22/Bitcoin-BTCUSD-Looking-at-a-Breakout-Ethereum-ETHUSD-Continues-its-Short-Term-Struggle.html,https://a.c-dn.net/b/4eiN6y/headline_BITCOIN.jpg,en,2021-03-22T09:49:00.000000Z,dailyfx.com,,cryptocurrency,N/A,71.43586,-0.458867
c282aa04-dfc1-49f4-ba03-ad43e00c8d5c,"Bitcoin (BTC/USD) Backs Down, Ethereum (ETH/USD) Sets Range","Crypto currencies are on their back foot, with Ethereum sticking to what's been a consistent range as Bitcoin bulls take a step back.",,"Bitcoin, Ethereum Price Analysis

A week after the Fed and both Bitcoin and Ethereum remain relatively subdued.

Bitcoin is testing a key spot of trend support,...",https://www.dailyfx.com/forex/fundamental/daily_briefing/session_briefing/daily_fundamentals/2021/03/22/Bitcoin-BTCUSD-BTC-USD-Backs-Down-Ethereum-ETH-USD-ETHUSD-Sets-Range.html,https://a.c-dn.net/b/3k4Cfm/headline_iStock-696301332.jpg,en,2021-03-22T15:42:00.000000Z,dailyfx.com,,cryptocurrency,N/A,65.94696,0.257333
