uuid,title,description,keywords,snippet,url,image_url,language,published_at,source,relevance_score,type,industry,match_score,sentiment_score
bf902a55-e99c-4360-a3a9-025d0a07cae0,Bitcoin Price Forecast: BTC/USD Threatens Bearish Reversal on Wedge Break,"Bitcoin is at risk of a larger downturn after breaking beneath support to start the week. As a result, bulls may seek out secondary support from psychological levels and recent lows alike.",,"Bitcoin (BTC/USD) Price Outlook:

Bitcoin appears vulnerable to further losses after bearish wedge break to start the week

Rising popularity in other cryptocur...",https://www.dailyfx.com/forex/market_alert/2021/05/10/Bitcoin-Price-Forecast-BTCUSD-Threatens-Bearish-Reversal-on-Wedge-Break.html,https://a.c-dn.net/b/0JYk86/headline_BITCOIN.jpg,en,2021-05-10T20:35:00.000000Z,dailyfx.com,,cryptocurrency,N/A,78.81081,-0.07775
13dc80bc-cc12-433f-9e35-6cf2cc498e54,Bitcoin Price Forecast: BTC/USD Threatens Bearish Reversal on Wedge Break,"Bitcoin is at risk of a larger downturn after breaking beneath support to start the week. As a result, bulls may seek out secondary support from psychological levels and recent lows alike.",,"Bitcoin (BTC/USD) Price Outlook:

Bitcoin appears vulnerable to further losses after bearish wedge break to start the week

Rising popularity in other cryptocur...",https://www.dailyfx.com/forex/market_alert/2021/05/11/Bitcoin-Price-Forecast-BTCUSD-Threatens-Bearish-Reversal-on-Wedge-Break.html,https://a.c-dn.net/b/4eiN6y/headline_BITCOIN.jpg,en,2021-05-11T16:00:00.000000Z,dailyfx.com,,cryptocurrency,N/A,78.81716,-0.07775
dd134527-fde9-4d53-ab40-41759bcce071,Ethereum (ETH) Continues to Outshine Bitcoin (BTC) Performance,"Ethereum price action has edged lower with other major cryptocurrencies like Bitcoin, but Ethereum continues to dominate the broader crypto space as highlighted by the ETH/BTC ratio.",,"CRYPTO OUTLOOK: ETHEREUM PRICE ACTION KEEPS OUTPERFORMING BITCOIN

Ethereum, Bitcoin , Ripple, and Dogecoin all declined during Wednesday’s trading session

T...",https://www.dailyfx.com/forex/market_alert/2021/05/12/ethereum-eth-continues-to-outshine-bitcoin-btc-performance.html,https://a.c-dn.net/b/1EAy4Z/headline_shutterstock_330880379.jpg,en,2021-05-12T21:45:00.000000Z,dailyfx.com,,cryptocurrency,N/A,55.06228,0.0258
5b7d5c57-fa3e-4a3d-8cf0-ea4b14aaf82a,Elon Musk Hints at Tesla DOGE Alliance but Lands Short of the Moon,Elon Musk’s latest Dogecoin tweet spurs volatility amid speculation that Tesla may adopt Dogecoin as another method of payment,,"Dogecoin, Ether Talking Points:

Ethereum ETH/USD) Ignites hope for Alt Coins with Fresh All-Time High

Elon Musk hints at Tesla Dogecoin alliance after SNL wip...",https://www.dailyfx.com/forex/market_alert/2021/05/12/Elon-Musk-Hints-at-Tesla-DOGE-Alliance-but-Lands-Short-of-the-Moon-LiveEdu-TDC.html,https://a.c-dn.net/b/2jPuVf/headline_shutterstock_365875643.jpg,en,2021-05-12T13:11:00.000000Z,dailyfx.com,,cryptocurrency,N/A,49.548836,0.7578
b4593624-5afc-4968-87bc-cc9a67af2fa1,Technical Analysis For Beginners: Technical Analysis Indicators You Must Know,Which are the must-know technical analysis indicators that a beginner trader can use to improve on his/her trading journey,,"Share Pin 0 Shares

Common technical analysis indicators

Have you ever experience going through hours of market research and valuation but find your efforts go...",https://newacademyoffinance.com/common-technical-analysis-indicators/,https://newacademyoffinance.com/wp-content/uploads/2021/05/technical-analysis-indicators.jpg.png,en,2021-05-12T00:28:40.000000Z,newacademyoffinance.com,,cryptocurrency,N/A,8.900621,0.6597
