uuid,title,description,keywords,snippet,url,image_url,language,published_at,source,relevance_score,type,industry,match_score,sentiment_score
e1ad98c8-2f9b-427d-8ff8-1b091039a79a,"AMC Entertainment Holdings (AMC), Amazon (AMZN), NetFlix (NFLX) - Should Amazon Or Netflix Try To Acquire AMC In 2021?","Every week, Benzinga conducts a survey to collect sentiment on what traders are most excited about, interested in or thinking about as they manage ...",,"Every week, Benzinga conducts a survey to collect sentiment on what traders are most excited about, interested in or thinking about as they manage and build the...",https://www.benzinga.com/trading-ideas/long-ideas/21/02/19525644/should-amazon-or-netflix-try-to-acquire-amc-in-2021,https://cdn2.benzinga.com/files/imagecache/og_image_social_share_1200x630/images/story/2012/amc_24_downtown_disney_3012254738_1.jpg,en,2021-02-07T12:04:36.000000Z,benzinga.com,,equity,Communication Services,20.411622428571427,0.303822
4b6f2d1a-d5a7-498d-bc0e-6a46873e635b,10 Biggest Companies Competing With Netflix,10 most profitable movies of all timeIn this article we are going to list the 10 biggest companies competing with Netflix. Click to skip ahead and jump...,,10 most profitable movies of all timeIn this article we are going to list the 10 biggest companies competing with Netflix. Click to skip ahead and jump to the 5...,https://www.insidermonkey.com/blog/10-biggest-companies-competing-with-netflix-916273/,https://d2gr5kl7dt2z3t.cloudfront.net/blog/wp-content/uploads/2016/12/10105104/49980983_m-1.jpg,en,2021-02-07T14:31:16.000000Z,insidermonkey.com,,equity,Communication Services,16.114523,0.32315
20db6656-d298-41a3-bbcf-dcd366a981b0,Netflix's Strong Fourth Quarter and What We're Watching Now,,,"After handily beating analysts' expectations, what's next for the streaming content king?

When Netflix (NASDAQ: NFLX) reported its fourth-quarter earnings, the...",https://www.techinvestornews.com/Tech-News/Latest-Headlines/netflixs-strong-fourth-quarter-and-what-were-watching-now,https://www.techinvestornews.com/Tech-News/Latest-Headlines/favicon.ico,en,2021-02-08T12:50:28.000000Z,techinvestornews.com,,equity,Communication Services,42.040806,0.6486
11f9b338-b3df-4bfc-8871-37b5e9370bba,"Weekly Corporate Highlights Feb. 8 – 12, 2021",Corporate event highlights Feb. 8 - 12 2020: Mon 2/8/2021 Novartis (NOVN_CH): Novartis Materiality Assessment 2021: Dialogue matters - support us to spur positive impact...,,"Staying on top of corporate events is critical for any investment firm. Academic research has shown that events, as well as event revisions, can affect volatili...",https://www.tradersinsight.news/traders-insight/securities/macro/weekly-corporate-highlights-feb-8-12-2021/,https://www.tradersinsight.news/wp-content/themes/traders-insight/favicon.png,en,2021-02-08T14:45:00.000000Z,tradersinsight.news,,equity,Communication Services,16.852657,-0.029660714285714287
43a45a55-bc01-4f20-bc32-e9fe2613e5cc,Netflix : ISP Speed Index for January 2021,"A month following our relaunch of the Netflix ISP Speed Index, our monthly update on which Internet Service Providers  provide the best prime time Netflix streaming experience, 18... | February  8,  2021","NETFLIX, INC. stock exchange, news, information, press release, a, month, following, our, relaunch, of, the, netflix, isp, speed, monthly, update, on, which, internet, service, providers, provide, best, prime, time, streaming | NFLX |","A month following our relaunch of the Netflix ISP Speed Index, our monthly update on which Internet Service Providers (ISPs) provide the best prime time Netflix...",https://www.marketscreener.com/quote/stock/NETFLIX-INC-44292425/news/Netflix-ISP-Speed-Index-for-January-2021-32388193/,https://www.marketscreener.com/images/twitter_MS_fdblanc.png,en,2021-02-08T17:04:03.000000Z,marketscreener.com,,equity,Communication Services,18.181255,0.3889532857142857
fbe13a55-54eb-44b2-bce2-bfc05e0e728d,This Week's Earnings Repertoire,"Last week, the earnings season kicked into high gear and the world made another step toward ending the COVID-19 pandemic. Both the Dow Jones Industrial ...",,"Last week, the earnings season kicked into high gear and the world made another step toward ending the COVID-19 pandemic. Both the Dow Jones Industrial Average ...",https://www.benzinga.com/news/earnings/21/02/19541927/this-weeks-earnings-repertoire,https://cdn.benzinga.com/files/imagecache/og_image_social_share_1200x630/images/story/2012/pexels-olenka-sergienko-1904262.jpg,en,2021-02-08T17:05:24.000000Z,benzinga.com,,equity,Communication Services,23.311413,0.1269
2bdd646d-01d6-466d-a554-b01db572a52c,Disney earnings preview: Can Disney+ maintain its torrid pace to sustain the Magic Kingdom?,Walt Disney Co. has managed to adroitly navigate the pandemic despite being hamstrung by shuttered amusement parks and an indefinite pause in live-action...,"article_normal, Computers/Consumer Electronics, Retail/Wholesale, Etailing, Telecommunication Services, Wireless Telecommunications Services, Broadcasting, Cable Broadcasting, Media Content Distribution, E-commerce, Online Service Providers, Media/Entertainment, Streaming Services, Retail, Technology, Financial Performance, Earnings, Earnings Projections, Corporate/Industrial News, Equity Markets, Commodity/Financial Market News, Content Types, Factiva Filters, C&E Exclusion Filter, C&E Industry News Filter, IWE Filter, Routine Market/Financial News, Walt Disney Co., DIS, financial performance, earnings, earnings projections, corporate, industrial news, equity markets, commodity, financial market news, content types, factiva filters, c&e exclusion filter, c&e industry news filter, iwe filter, routine market, financial news, computers, consumer electronics, retail, wholesale, etailing, telecommunication services, wireless telecommunications services, broadcasting, cable broadcasting, media content distribution, e-commerce, online service providers, media, entertainment, streaming services, technology",Walt Disney Co. has managed to adroitly navigate the pandemic despite being hamstrung by shuttered amusement parks and an indefinite pause in live-action produc...,https://www.marketwatch.com/story/disney-earnings-preview-can-disney-maintain-its-torrid-pace-to-sustain-the-magic-kingdom-11612551665,https://images.mktw.net/im-243956/social,en,2021-02-08T12:27:00.000000Z,marketwatch.com,,equity,Communication Services,14.142890857142858,0.6915000000000001
e3269d64-c4a9-432a-a74e-79c654a40d3b,"Facebook, Inc.: Why Social Media Giant Is Also Considered a 5G stock","Facebook, Inc. (NASDAQ:FB) is not usually considered a 5G stock, but at the current price, it could be an opportunity for 5G stock investors. Here's why.",,"Time to Check Out Facebook Stock

If you’ve been following this site, you’d know that I’ve spent quite some time uncovering little-known 5G stocks. And wh...",https://www.profitconfidential.com/stock/facebook-stock/why-also-5g-stock/,https://www.profitconfidential.com/wp-content/uploads/2021/02/ny-usa-december-26-2019-facebook-paper-logo-lies-with-envelope-full-of-dollar-bills-and-smartphone_t20_Xxjw2b-300x200.jpg,en,2021-02-08T12:30:18.000000Z,profitconfidential.com,,equity,Communication Services,12.566389,0.0
