title,url,summary,overall_sentiment_score,overall_sentiment_label,ticker_relevance_score,ticker_sentiment_score,ticker_sentiment_label,time_published
"Flying Cars Market Size Worth USD 1533.471 Billion, Globally, by 2040 at 58.01% CAGR",https://www.benzinga.com/pressreleases/22/10/g29130167/flying-cars-market-size-worth-usd-1533-471-billion-globally-by-2040-at-58-01-cagr,"Pune, India, Oct. 04, 2022 ( GLOBE NEWSWIRE ) -- The global Flying Cars Market was USD 55.00 million in 2021. The global market size is expected to be USD 255.37 million in 2022 and is projected to reach USD 1533.471 billion by 2040, exhibiting a CAGR of 58.1 % during the forecast period from ...",0.243024,Somewhat-Bullish,,0.060533,Neutral,20221004T061433
Boeing does not expect MAX 10 to gain FAA approval before summer 2023,https://www.scmp.com/business/companies/article/3194760/boeing-does-not-expect-max-10-gain-faa-approval-summer-2023,"'With regard to the 737-10, Boeing's current project plan timeline has the 737-10 receiving an amended type certificate no sooner than summer 2023,' two sources said.",0.124565,Neutral,,0.218099,Somewhat-Bullish,20221004T044241
EXCLUSIVE Boeing does not expect FAA approval for MAX 10 before summer 2023 -letter,https://www.reuters.com/business/aerospace-defense/exclusive-boeing-does-not-expect-faa-approval-max-10-before-summer-2023-letter-2022-10-04/,EXCLUSIVE Boeing does not expect FAA approval for MAX 10 before summer ...,0.216535,Somewhat-Bullish,,0.418658,Bullish,20221004T005200
US Rep. Ro Khanna slams Saudi Arabia as 'third-rate power' as OPEC considers slashing oil output | Business,https://www.cnn.com/2022/10/03/energy/ro-khanna-saudi-arabia/index.html,US Rep. Ro Khanna slams Saudi Arabia as 'third-rate power' as OPEC considers slashing oil output ...,-0.106411,Neutral,,0.057486,Neutral,20221004T000900
US Rep. Ro Khanna slams Saudi Arabia as 'third-rate power' as OPEC considers slashing oil output | Business,https://www.cnn.com/2022/10/03/energy/ro-khanna-saudi-arabia,US Rep. Ro Khanna slams Saudi Arabia as 'third-rate power' as OPEC considers slashing oil output ...,-0.106411,Neutral,,0.057486,Neutral,20221004T000900
Why Boeing Stock Is Up Today,https://www.fool.com/investing/2022/10/03/why-boeing-stock-is-up-today/,"After a rough September, bargain hunters are taking another look.",-0.051174,Neutral,,0.036681,Neutral,20221003T185815
SIDM & US Defence companies seek deeper cooperation in joint development & production of military platforms | The Financial Express,https://www.financialexpress.com/defence/sidm-amp-us-defence-companies-seek-deeper-cooperation-in-joint-development-amp-production-of-military-platforms/2699705/,SIDM & US Defence companies seek deeper cooperation in joint development & production of military platforms The Financial Express ...,0.273214,Somewhat-Bullish,,0.07557,Neutral,20221003T171248
Boeing  ( BA )  Wins $192M Deal to Support F/A-18E/F & E/A-18G Jets,https://www.zacks.com/stock/news/1987524/boeing-ba-wins-192m-deal-to-support-fa-18ef-ea-18g-jets,Boeing (BA) is going to be engaged in the repair of multiple flight control surfaces used on the F/A-18E/F and E/A-18G aircraft.,0.279482,Somewhat-Bullish,,0.346237,Somewhat-Bullish,20221003T131000
Credit Suisse Takes a Hit Over Investor Fears,https://www.nytimes.com/2022/10/03/business/dealbook/credit-suisse-share-fall-turnaround.html,Shares in the troubled Swiss banking giant sunk on Monday as investors worry it may not pull off a risky turnaround plan.,-0.173553,Somewhat-Bearish,,-0.107144,Neutral,20221003T121558
"Airlines Face a Shortage of New Boeing, Airbus Jets",https://www.wsj.com/articles/airlines-face-a-shortage-of-new-boeing-airbus-jets-11664743682,"Carriers focus on challenges in planning their networks and increasing flights as plane makers juggle supply-chain, other constraints.",-0.122339,Neutral,,-0.08626,Neutral,20221003T120000
This Aerospace Company Appears To Be A Better Pick Over Textron Stock,https://www.forbes.com/sites/greatspeculations/2022/10/03/this-aerospace-company-appears-to-be-a-better-pick-over-textron-stock/,"While both companies will likely see continued top-line expansion, Howmet Aerospace is expected to outperform.",0.084322,Neutral,,0.031222,Neutral,20221003T110059
Planet Labs Declares War on Global Warming,https://www.fool.com/investing/2022/10/03/planet-labs-declares-war-on-global-warming/,Planet the company's plans sound good for Planet Earth -- but how will they help Planet's profits?,0.174294,Somewhat-Bullish,,0.100878,Neutral,20221003T100700
"Air Canada to Launch New, Non-stop Transborder Routes to the U.S. from Halifax and Vancouver",https://www.newswire.ca/news-releases/air-canada-to-launch-new-non-stop-transborder-routes-to-the-u-s-from-halifax-and-vancouver-818653876.html,"MONTREAL, Oct. 3, 2022 /CNW Telbec/ - Air Canada today announced new, daily transborder flights between Halifax-and-Newark and Vancouver-and-Houston.",0.220542,Somewhat-Bullish,,0.125693,Neutral,20221003T100000
Nigeria would consider China's C919 plane for new airline,https://www.reuters.com/business/aerospace-defense/nigeria-would-consider-chinas-c919-plane-new-airline-2022-10-01/,"MONTREAL, Oct 1 ( Reuters ) - Nigeria would consider buying China's newly-certified C919 passenger jet as it grows the country's fledgling carrier Nigeria Air to 30 planes by around 2025, Aviation Minister Hadi Sirika said on Saturday.",0.221561,Somewhat-Bullish,,0.072012,Neutral,20221001T201700
"Business Highlights: Stocks' miserable month, EU inflation",https://apnews.com/article/business-highlights-5b22bea79e17cd893a4e5a240597a29d,"NEW YORK ( AP ) - Wall Street closed out a miserable September with a loss of 9.3%, the worst monthly decline since March 2020. The S&P 500 fell 1.5% Friday and is at its lowest level in almost two years. The benchmark index has lost ground for six of the last seven weeks and posted its third ...",-0.133239,Neutral,,0.036432,Neutral,20220930T211226
U.S. senator backs extending Boeing 737 MAX approval deadline,https://www.reuters.com/business/aerospace-defense/us-senator-backs-extending-boeing-737-max-approval-deadline-2022-09-30/,"WASHINGTON, Sept 30 ( Reuters ) - The top Republican on the Senate Commerce Committee has proposed extending the deadline for Boeing ( BA.N ) to win approval for two new variants of the 737 MAX until September 2024.",0.1846,Somewhat-Bullish,,0.359767,Bullish,20220930T210000
Argentina Takes Statements From Crew Of Grounded Venezuela Plane,https://www.barrons.com/news/argentina-takes-statements-from-crew-of-grounded-venezuela-plane-01664565307,"An Argentine judge this week took preliminary statements from five crew members from a Venezuelan cargo plane grounded in Buenos Aires since June who are being investigated over possible links to Iran's Al Quds Force, press reports said on Friday.",-0.071189,Neutral,,-0.108659,Neutral,20220930T192014
"Dow Jones Opens Lower, On Track For Steep Monthly Losses; Nike Plummets On Earnings",https://www.investors.com/market-trend/stock-market-today/dow-jones-opens-lower-on-track-for-steep-monthly-losses-nike-plummets-on-earnings/,"Dow Jones Opens Lower, On Track For Steep Monthly Losses. Nike Plummets On Earnings Investor's Business Daily ...",-0.091812,Neutral,,-0.185215,Somewhat-Bearish,20220930T144300
"'Right Now, You've Still Got To Avoid The Stock,' Jim Cramer Says About This Aerospace Company - Alibaba Group Holding  ( NYSE:BABA ) , Boeing  ( NYSE:BA ) ",https://www.benzinga.com/news/22/09/29090220/right-now-youve-still-got-to-avoid-the-stock-cramer-says-about-this-aerospace-major-company,"On CNBC's ""Mad Money Lightning Round,"" Jim Cramer said Sherwin-Williams Co SHW might go lower as the PE ( price-to-earnings ) multiple is still ""way too high"" on the stock. When asked about Charles River Laboratories International, Inc. CRL, Cramer said, ""It finally doesn't have a high ...",0.031385,Neutral,,-0.029837,Neutral,20220930T141043
Stock Market Today: Stocks Edge Higher On Softer Treasury Yields To Close Out Brutal September Slump,https://www.thestreet.com/markets/stock-market-today-stocks-edge-higher-on-softer-treasury-yields,"The S&P 500 will try to close out its worst September decline since 2008 in the green Friday, with stocks closely-tracking U.S. Treasury yields ahead of key inflation data.",-0.041381,Neutral,,0.103641,Neutral,20220930T114400
"China to step up technological development after C919 jet success, state media report",https://www.reuters.com/business/aerospace-defense/china-step-up-technological-development-after-c919-jet-success-state-media-2022-09-30/,"BEIJING/SYDNEY Sept 30 ( Reuters ) - Chinese President Xi Jinping said on Friday that his country would step up efforts to make technological breakthroughs after the homegrown C919 narrowbody jet was certified by its aviation regulator, state media reported.",0.22499,Somewhat-Bullish,,-0.08665,Neutral,20220930T113400
Nike Stock Tumbles After Warning on Profit Margin Hit From Inventory Bloat,https://www.thestreet.com/markets/nike-stock-tanks-after-warning-on-margin-hit-from-inventory-bloat,"Nike said it will take ""decisive action to clear excess inventory"" in the coming months, with markdowns set to pressure near-term profit margins for the sports apparel giant.",0.143318,Neutral,,-0.044716,Neutral,20220930T104100
"Stocks Bounce, Inflation, Nike, Micron And Boeing In Focus - Five Things To Know",https://www.thestreet.com/markets/stocks-bounce-inflation-nike-micron-boeing-5-things-to-know,Stock futures bounce to close out brutal September trading. Inflation back in focus as Fed steps-up rate hike rhetoric. Nike shares crushed as inventory bloat set to hammer margins. Micron shares jump as Japan deal offsets muted outlook and Boeing faces tight timeline for 737 MAX certification.,0.0,Neutral,,0.066147,Neutral,20220930T102000
"China Certifies Homegrown C919 Jet To Compete With Boeing, Airbus",https://www.barrons.com/news/china-certifies-homegrown-c919-jet-to-compete-with-boeing-airbus-01664526908,"Chinese regulators have approved the country's first domestically produced large passenger jet, local media said, with Beijing hoping the plane will challenge foreign models such as the Boeing 737 MAX and Airbus A320.",0.232887,Somewhat-Bullish,,0.521761,Bullish,20220930T083716
"China Certifies Homegrown C919 Jet To Compete With Boeing, Airbus",https://www.barrons.com/news/china-certifies-homegrown-c919-jet-to-compete-with-boeing-airbus-01664526908,"Chinese regulators have approved the country's first domestically produced large passenger jet, local media said, with Beijing hoping the plane will challenge foreign models such as the Boeing 737 MAX and Airbus A320.",0.019118,Neutral,,-0.120961,Neutral,20220930T083716
"China Certifies Homegrown C919 Jet To Compete With Boeing, Airbus",https://www.barrons.com/news/china-certifies-homegrown-c919-jet-to-compete-with-boeing-airbus-01664526908,"Chinese regulators have approved the country's first domestically produced large passenger jet, local media said, with Beijing hoping the plane will challenge foreign models such as the Boeing 737 MAX and Airbus A320.",0.123144,Neutral,,-0.104029,Neutral,20220930T083716
FAA says Boeing has not completed work needed for 737 MAX 7 approval,https://www.reuters.com/business/aerospace-defense/faa-says-boeing-has-not-completed-work-needed-737-max-7-approval-letter-2022-09-30/,"Sept 29 ( Reuters ) - The Federal Aviation Administration ( FAA ) told Boeing ( BA.N ) it has not completed key work needed in order to certify the 737 MAX 7 by December, according to a letter from the FAA seen by Reuters.",0.208011,Somewhat-Bullish,,0.444868,Bullish,20220930T053700
Cramer's lightning round: Charles River is a buy,https://www.cnbc.com/2022/09/29/cramers-lightning-round-charles-river-is-a-buy.html,"""Mad Money"" host Jim Cramer rings the lightning round bell, which means he's giving his answers to callers' stock questions at rapid speed.",0.067718,Neutral,,-0.298598,Somewhat-Bearish,20220929T225241
Why Boeing Shares Are Getting Hammered - Boeing  ( NYSE:BA ) ,https://www.benzinga.com/trading-ideas/movers/22/09/29084155/why-boeing-shares-are-getting-hammered,Boeing Co BA shares are trading lower by 6.86% to $124.29 during Thursday's trading session. Shares of several companies in the broader industrials sector are trading lower as stocks pull back after gaining on Wednesday.,-0.200069,Somewhat-Bearish,,-0.102972,Neutral,20220929T190027
Canada's WestJet places order for 42 Boeing MAX 10 planes,https://www.reuters.com/business/aerospace-defense/canadas-westjet-places-order-42-boeing-max-10-planes-2022-09-29/,"Sept 29 ( Reuters ) - Canada's WestJet Group said on Thursday it has placed an order with Boeing Co ( BA.N ) for 42 MAX 10 jets, adding to the orders for narrowbody aircraft secured by the U.S. planemaker this year.",0.181243,Somewhat-Bullish,,0.183043,Somewhat-Bullish,20220929T163400
Boeing  ( BA )  Wins $169M Deal to Assist F/A-18E/F & E/A-18G Jets,https://www.zacks.com/stock/news/1986654/boeing-ba-wins-169m-deal-to-assist-fa-18ef-ea-18g-jets,Boeing (BA) is set to repair two flight control surfaces used on the F/A-18E/F and E/A-18G aircraft.,0.295,Somewhat-Bullish,,0.371443,Bullish,20220929T162200
Fortem Technologies Announces Executive Leadership Growth,https://www.prnewswire.com/news-releases/fortem-technologies-announces-executive-leadership-growth-301637024.html,Jon Gruen to take on CEO position with Timothy Bean moving to new President and COO role,0.323703,Somewhat-Bullish,,0.029795,Neutral,20220929T160500
Why Boeing Stock Is Falling Today,https://www.fool.com/investing/2022/09/29/why-boeing-stock-is-falling-today/,"As uncertainty grows, would-be buyers head for the exits.",-0.21234,Somewhat-Bearish,,-0.3015,Somewhat-Bearish,20220929T155041
"WestJet Expands Fleet with Largest Boeing 737 MAX Jet, Ordering Up to 64 Fuel-efficient Airplanes - Boeing  ( NYSE:BA ) ",https://www.benzinga.com/pressreleases/22/09/n29078469/westjet-expands-fleet-with-largest-boeing-737-max-jet-ordering-up-to-64-fuel-efficient-airplanes,"SEATTLE, Sept. 29, 2022 /PRNewswire/ -- Boeing BA and WestJet today announced the airline is strengthening its commitment to the 737 MAX family with an order for 42 737-10s and options for an additional 22 jets.",0.370986,Bullish,,0.5961,Bullish,20220929T153000
"WestJet Group furthers growth strategy, inking deal with Boeing for an additional 42 fuel-efficient 737-10 aircraft plus 22 options",https://www.newswire.ca/news-releases/westjet-group-furthers-growth-strategy-inking-deal-with-boeing-for-an-additional-42-fuel-efficient-737-10-aircraft-plus-22-options-854003710.html,Multi-billion-dollar investment to strengthen airline's presence in Western Canada and underpin growth in transcontinental and leisure offerings from eastern Canadian communities Aircraft to foster low-cost positioning and greater affordability for Canadians,0.460861,Bullish,,0.350853,Bullish,20220929T152400
China certifies C919 jet to compete with Airbus and Boeing -photos,https://www.reuters.com/business/aerospace-defense/china-certifies-c919-jet-compete-with-airbus-boeing-photos-2022-09-29/,China certifies C919 jet to compete with Airbus and Boeing ...,0.021219,Neutral,,-0.028279,Neutral,20220929T143300
"Chevron sells global headquarters, pares back in California amid Texas expansion",https://www.foxbusiness.com/energy/chevron-sells-global-headquarters-california-amid-texas-expansion,"Chevron Corp. has sold its current headquarters in California and plans to move into a nearby leased space about one-third of the size, as it continues to relocate employees to Texas.",0.032778,Neutral,,0.085149,Neutral,20220929T141334
Here's A Better Pick Over Lockheed Martin Stock,https://www.forbes.com/sites/greatspeculations/2022/09/29/heres-a-better-pick-over-lockheed-martin-stock/,"There is more to the comparison, and in the sections below, we discuss why we believe BA stock will offer better returns than LMT stock in the next three years.",0.177841,Somewhat-Bullish,,0.32272,Somewhat-Bullish,20220929T140026
The Boeing Company  ( BA )  is Attracting Investor Attention: Here is What You Should Know,https://www.zacks.com/stock/news/1986429/the-boeing-company-ba-is-attracting-investor-attention-here-is-what-you-should-know,"Boeing (BA) has received quite a bit of attention from Zacks.com users lately. Therefore, it is wise to be aware of the facts that can impact the stock's prospects.",0.253167,Somewhat-Bullish,,0.166789,Somewhat-Bullish,20220929T130013
Small Satellite Market Size to Hit USD 12.02 Billion by 2029 | Small Satellite Industry CAGR 11.53%,https://www.benzinga.com/pressreleases/22/09/g29068842/small-satellite-market-size-to-hit-usd-12-02-billion-by-2029-small-satellite-industry-cagr-11-53,"Pune, India, Sept. 29, 2022 ( GLOBE NEWSWIRE ) -- The global small satellite market size was valued at USD 4.90 billion in 2021 and reached USD 5.60 billion in 2022. The market is expected to be valued at USD 12.02 billion by 2029, exhibiting a CAGR of 11.53% during the forecast period.",0.237561,Somewhat-Bullish,,0.17199,Somewhat-Bullish,20220929T090850
Russia Announces Dubious Plans For Aviation Industry Without Boeing and Airbus,https://www.fool.com/investing/2022/09/28/russia-announces-dubious-plans-for-aviation-indust/,"By most accounts, it's just another flight of fancy for Russian President Vladimir Putin. On Wednesday, the state-owned engineering firm Rostec...",0.085284,Neutral,,0.0,Neutral,20220929T010033
Dow rises nearly 550 points as markets break six-day losing streak,https://www.upi.com/Top_News/US/2022/09/28/stock-markets-break-six-day-losing-streak/2531664397349/,"The Dow Jones Industrial Average climbed 548.75 points, or 1.88%, to close at 29,683.74, the S&P 500 increased 71.75 points, or 1.97%, to 3,719.04, and the Nasdaq Composite rose 222.13 points, or 2.05%, to close at 11,051.64. Advertisement",-0.024268,Neutral,,0.051057,Neutral,20220928T213426
Flight Path Museum LAX relaunches popular simulator classes,https://www.benzinga.com/pressreleases/22/09/n29065023/flight-path-museum-lax-relaunches-popular-simulator-classes,Flight Path Museum LAX announces the relaunch of the popular Flight Path Flyers program for high school and college students that offers an introduction to flight training taught by commercial airline pilots.,0.159613,Somewhat-Bullish,,0.105308,Neutral,20220928T203000
Meta Tops Morningstar List of Undervalued Stocks,https://www.thestreet.com/investing/meta-morningstar-list-undervalued-stocks,Morningstar created a roster of the most undervalued stocks among the ones to which it assigns a wide moat.,0.450169,Bullish,,0.489882,Bullish,20220928T202000
Morgan Stanley Bets On Boeing's Prospects Despite Market Pull-Back - Boeing  ( NYSE:BA ) ,https://www.benzinga.com/news/22/09/29059563/morgan-stanley-bets-on-boeings-prospects-despite-market-pull-back,Morgan Stanley analyst Kristine T Liwag has reiterated an Overweight rating on the shares of Boeing Co BA with a price target of $233. The analyst said Boeing's stock had declined about 12% over the last week compared to the S&P 500's decline of about 6.5%.,-0.062502,Neutral,,-0.287757,Somewhat-Bearish,20220928T183052
"A Dry Dock, Tender And Training Can Advance Australia's New AUKUS Sub",https://www.forbes.com/sites/craighooper/2022/09/28/a-dry-dock-tender-and-training-can-advance-australias-new-aukus-sub/,"If the Australia, United Kingdom, United States (AUKUS) security pact is going to go forward, let's start focusing on the basics.",0.175955,Somewhat-Bullish,,0.118986,Neutral,20220928T174454
"Boeing, Taiwan's China Airlines finalize 787 order",https://www.reuters.com/business/aerospace-defense/boeing-taiwans-china-airlines-finalize-787-order-2022-09-28/,"Sept 28 ( Reuters ) - Taiwan's China Airlines ( 2610.TW ) has finalized an order for 16 Boeing Co ( BA.N ) 787 Dreamliner jets, with an option for 8 more, the companies said on Wednesday, nearly a month after disclosing a provisional agreement.",0.045068,Neutral,,0.195267,Somewhat-Bullish,20220928T173000
LYNX AIR ANNOUNCES MAJOR EXPANSION TO UNITED STATES,https://www.newswire.ca/news-releases/lynx-air-announces-major-expansion-to-united-states-874931237.html,"To celebrate, Lynx is launching a contest to win free flight and accommodation packages to its new sun destinations CALGARY, AB, Sept. 28, 2022 /CNW/ - Lynx Air ( Lynx ) , Canada's new ultra-affordable airline, today announced its expansion into the United States, with the addition of Orlando, ...",0.422101,Bullish,,0.236744,Somewhat-Bullish,20220928T170700
China Airlines Finalizes Landmark Order for Up to 24 Boeing 787 Dreamliners - Boeing  ( NYSE:BA ) ,https://www.benzinga.com/pressreleases/22/09/n29058317/china-airlines-finalizes-landmark-order-for-up-to-24-boeing-787-dreamliners,"SEATTLE, Sept. 28, 2022 /PRNewswire/ -- Boeing BA and China Airlines announced they have finalized an order for up to 24 787 Dreamliners, as the carrier invests in the fuel-efficient widebody to expand passenger and cargo operations.",0.392046,Bullish,,0.480596,Bullish,20220928T163000
Why Boeing Stock Popped Today,https://www.fool.com/investing/2022/09/28/why-boeing-stock-popped-today/,Is it finally time to buy Boeing again?,0.221083,Somewhat-Bullish,,0.379566,Bullish,20220928T161408
Looking At Boeing's Recent Whale Trades - Boeing  ( NYSE:BA ) ,https://www.benzinga.com/markets/options/22/09/29056539/looking-at-boeings-recent-whale-trades,"A whale with a lot of money to spend has taken a noticeably bearish stance on Boeing. Looking at options history for Boeing BA we detected 27 strange trades. If we consider the specifics of each trade, it is accurate to state that 40% of the investors opened trades with bullish expectations and ...",0.109637,Neutral,,-0.040511,Neutral,20220928T154256
"In the 2022 Proxy Season, Proposals on Climate Disclosures and Racial Equity Audits Gained Significant Momentum",https://www.prnewswire.com/news-releases/in-the-2022-proxy-season-proposals-on-climate-disclosures-and-racial-equity-audits-gained-significant-momentum-301635652.html,"NEW YORK, Sept. 28, 2022 /PRNewswire/ -- The 2022 proxy season was a banner year for shareholder proposals relating to climate disclosures and racial equity audits, reveals a new analysis conducted by The Conference Board in partnership with ESG data analytics firm ESGAUGE.",0.089856,Neutral,,0.02996,Neutral,20220928T150000
"Lilium aims to build 400 air taxis a year, seek grants",https://www.reuters.com/business/aerospace-defense/lilium-aims-build-400-air-taxis-year-seek-grants-2022-09-28/,"PARIS, Sept 28 ( Reuters ) - German air taxi developer Lilium Air Mobility plans to set up industrial capacity to make some 400 of its electrically powered Lilium Jet flying shuttles a year, while tapping schemes that provide public research support, its new chief executive said.",0.054844,Neutral,,0.11131,Neutral,20220928T132700
"Aerospace Avionics Market Estimated to Gather $110,605.5 Million and Grow at 4.6% CAGR in the 2022 to 2030 Forecast Period [300-Pages] | Research Dive",https://www.benzinga.com/pressreleases/22/09/g29051206/aerospace-avionics-market-estimated-to-gather-110-605-5-million-and-grow-at-4-6-cagr-in-the-2022-t,"New York, USA, Sept. 28, 2022 ( GLOBE NEWSWIRE ) -- According to the report published by Research Dive, the global aerospace avionics market is estimated to gather a revenue of $110,605.5 million and grow at 4.6% CAGR over the forecast period from 2022-2030.",0.32034,Somewhat-Bullish,,0.217466,Somewhat-Bullish,20220928T131000
Exclusive: Russia aiming to fly solo without Airbus and Boeing,https://www.reuters.com/business/aerospace-defense/exclusive-russia-aiming-fly-solo-without-airbus-boeing-2022-09-28/,EXCLUSIVE Russia aiming to fly solo without Airbus and Boeing ...,-0.030848,Neutral,,-0.174366,Somewhat-Bearish,20220928T090700
Bullish sentiment on India on clear display: EAM Jaishankar after meeting US business community | The Financial Express,https://www.financialexpress.com/defence/bullish-sentiment-on-india-on-clear-display-eam-jaishankar-after-meeting-us-business-community/2693647/,Bullish sentiment on India on clear display: EAM Jaishankar after meeting US business community The Financial Express ...,0.393054,Bullish,,0.095762,Neutral,20220928T060446
3 Defensive Stocks To Watch Before October 2022,https://stockmarket.com/featured/3-defensive-stocks-to-watch-before-october-2022-2022-09-27,"Defensive stocks are stocks that investors believe will outperform the stock market during periods of economic decline or market turbulence. For the uninitiated, defensive stocks tend to be companies that provide essential goods or services, such as food, healthcare, or utilities.",0.349839,Somewhat-Bullish,,0.21597,Somewhat-Bullish,20220928T015640
2 Stocks Moving Up On a Mixed Market Day,https://www.fool.com/investing/2022/09/27/2-stocks-moving-up-on-a-mixed-market-day/,Find out why these stocks gained even as some major indexes fell further.,0.125671,Neutral,,0.165078,Somewhat-Bullish,20220927T220200
6 Travel ETFs to Consider in 2022 |,https://www.fool.com/investing/stock-market/market-sectors/consumer-discretionary/travel-stocks/travel-etfs/,"With the world figuring out how to live with COVID-19, the travel industry is in growth mode again. U.S. travel for leisure has reached new all-time highs, but business travel is still down from pre-pandemic levels. The same goes for international travel activity.",0.167799,Somewhat-Bullish,,0.064426,Neutral,20220927T200827
