uuid,title,description,keywords,snippet,url,image_url,language,published_at,source,relevance_score,type,industry,match_score,sentiment_score
8ce8e8c0-f562-4b30-bd65-fcb2793e17ff,Netflix Unusual Options Activity - Netflix (NASDAQ:NFLX),,,"A whale with a lot of money to spend has taken a noticeably bearish stance on Netflix.

Looking at options history for Netflix NFLX we detected 62 strange trade...",https://www.benzinga.com/markets/options/23/03/31367405/netflix-unusual-options-activity,https://www.benzinga.com/next-assets/images/schema-image-default.png,en,2023-03-15T18:15:39.000000Z,benzinga.com,,equity,Communication Services,73.149506,0.343486
abc1b318-d46e-4c50-b793-d08a80b87415,"Netflix pullback means opportunity, Oppenheimer says (NASDAQ:NFLX)","Another analyst sees opportunity in a pullback at Netflix (NFLX), as Oppenheimer reiterated its Outperform rating against some recent worries about execution on the streamer's...",,"Another analyst sees opportunity in a pullback at Netflix (NASDAQ:NFLX), as Oppenheimer reiterated its Outperform rating against some recent worries about execu...",https://seekingalpha.com/news/3947715-netflix-pullback-means-opportunity-oppenheimer-says,https://static.seekingalpha.com/cdn/s3/uploads/getty_images/654056106/image_654056106.jpg?io=getty-c-w750,en,2023-03-15T15:21:42.000000Z,seekingalpha.com,,equity,Communication Services,69.939316,0.25185
90c346bf-8819-440c-b39c-41e81121a210,Netflix to Announce First Quarter 2023 Financial Results,"LOS GATOS, Calif., March 15, 2023 /PRNewswire/ -- Netflix, Inc.  today announced it will post its first quarter 2023 financial results and business outlook on its investor relations website at... | March 15,  2023","NETFLIX, INC. stock exchange, news, information, press release, los, march, 2023, today, announced, it, will, post, quarter, financial, results, and, business, outlook, on, its, investor, relations, website | NFLX | US64110L1061","LOS GATOS, Calif., March 15, 2023 /PRNewswire/ -- Netflix, Inc. (NASDAQ: NFLX) today announced it will post its first quarter 2023 financial results and busines...",https://www.marketscreener.com/quote/stock/NETFLIX-INC-44292425/news/Netflix-to-Announce-First-Quarter-2023-Financial-Results-43253957/,https://www.marketscreener.com/images/twitter_MS_fdgris.png,en,2023-03-15T16:01:03.000000Z,marketscreener.com,,equity,Communication Services,40.320640499999996,0.263325
1d82acf4-b226-4e8f-86fa-e37115b91356,"Pullback offers a buying opportunity in Netflix, Oppenheimer sees 40% upside By Investing.com","Pullback offers a buying opportunity in Netflix, Oppenheimer sees 40% upside",,"© Reuters. Pullback offers a buying opportunity in Netflix (NFLX), Oppenheimer sees 40% upside

NFLX +0.49% Add to/Remove from Watchlist

By Senad Karaahmetovi...",https://www.investing.com/news/stock-market-news/pullback-offers-a-buying-opportunity-in-netflix-oppenheimer-sees-40-upside-432SI-3031123,https://i-invdn-com.investing.com/news/LYNXMPEE6F20H_L.jpg,en,2023-03-15T11:28:20.000000Z,investing.com,,equity,Communication Services,24.803202,0.4433
f62b96a2-4906-4779-944f-e61867e01737,U.S. stocks mixed at close of trade; Dow Jones Industrial Average down 0.87% By Investing.com,U.S. stocks mixed at close of trade; Dow Jones Industrial Average down 0.87%,,"© Reuters. U.S. stocks mixed at close of trade; Dow Jones Industrial Average down 0.87%

Investing.com – U.S. stocks were mixed after the close on Wednesday,...",https://www.investing.com/news/stock-market-news/us-stocks-mixed-at-close-of-trade-dow-jones-industrial-average-down-087-3031663,https://i-invdn-com.investing.com/news/LYNXMPED1J0AC_L.jpg,en,2023-03-15T21:25:17.000000Z,investing.com,,equity,Communication Services,15.164913,0.5267
5fcb3b18-6c12-4931-a1a4-8ef96da3e726,"Here are Wednesday's biggest analyst calls: Charles Schwab, Meta, Nike, Netflix, Truist, FedEx & more","Charles Schwab got an upgrade from Credit Suisse, while Bernstein was bullish on Meta's cost-cutting efforts.","Western Alliance Bancorp, New York Community Bancorp Inc, Nike Inc, Tesla Inc, Amazon.com Inc, Microsoft Corp, W R Berkley Corp, Traeger Inc, Harley-Davidson Inc, Discover Financial Services, FTC Solar Inc, FedEx Corp, Baker Hughes Co, Meta Platforms Inc, Walmart Inc, Norfolk Southern Corp, Truist Financial Corp, Charles Schwab Corp, Netflix Inc, McDonald's Corp, Investment strategy, Breaking News: Markets, Markets, Investment strategy, business news",Here are Wednesday's biggest calls on Wall Street: Oppenheimer reiterates Netflix as outperform Oppenheimer said investors should buy the dip in Netflix shares....,https://www.cnbc.com/2023/03/15/top-wall-street-analyst-calls-include-charles-schwab-meta-truist.html,https://image.cnbcfm.com/api/v1/image/107055963-16516799652022-05-04t155357z_1939990606_rc203s9y38hx_rtrmadp_0_netflix-shareholders-lawsuit.jpeg?v=1678884105&w=1920&h=1080,en,2023-03-15T12:41:00.000000Z,cnbc.com,,equity,Communication Services,21.190392,0.26335
9247bbf9-2dc1-4593-bb75-1adff5df5307,"The Global Video-on-demand (VOD) Market is forecast to grow by $187.53 bn during 2022-2027, accelerating at a CAGR of 15.98% during the forecast period",/PRNewswire/ -- Global Video-on-demand (VOD) Market 2023-2027 The analyst has been monitoring the video-on-demand (VOD) market and is forecast to grow by...,Reportlinker,"NEW YORK, March 15, 2023 /PRNewswire/ -- Global Video-on-demand (VOD) Market 2023-2027

The analyst has been monitoring the video-on-demand (VOD) market and is ...",https://www.prnewswire.com/news-releases/the-global-video-on-demand-vod-market-is-forecast-to-grow-by-187-53-bn-during-2022-2027--accelerating-at-a-cagr-of-15-98-during-the-forecast-period-301771814.html,https://mma.prnewswire.com/media/2032725/Reportlinker.jpg?p=facebook,en,2023-03-15T15:40:00.000000Z,prnewswire.com,,equity,Communication Services,12.944608666666667,0.8689
e8a64ee9-f266-4c46-bd55-1d3b465280d2,"Markets Pare Big Losses, End Mixed on Banking Fears","U.S. stocks were volatile on March 15, 2023, falling for most of the day before ending mixed as concerns about banks rippled through the markets.",,"Key Takeaways Major U.S. equities markets ended mixed on March 13 as concerns about Credit Suisse added to uncertainties surrounding the banking sector.

After ...",https://www.investopedia.com/markets-pare-big-losses-end-mixed-on-banking-fears-7339334,https://www.investopedia.com/thmb/Mt_bv8eAGKoT2ymDO_lBMteI2bI=/1500x0/filters:no_upscale():max_bytes(150000):strip_icc()/indexesmarch15-aa36eac126fc488a83e5a4f948591835.png,en,2023-03-15T21:36:32.000000Z,investopedia.com,,equity,Communication Services,11.98451,0.8402
dc8e0f72-0f0c-4e83-b1c5-c6ed800e5973,Companies are diversifying their corporate boards. But Latinos are left behind,"Latinos are the nation's largest ethnic or racial group with 18.9% of the population, yet few ascend to the pinnacle of U.S. corporate power: board member.",,"(Ludi Leiva / For The Times)

Cisco Systems, the multinational tech giant based in San Jose, has no Latino on its board of directors.

Ditto for Intel, the worl...",https://news.yahoo.com/companies-diversifying-corporate-boards-latinos-120047085.html?.tsrc=rss,https://media.zenfs.com/en/la_times_articles_853/910e907b9303447ab20c5b4b972fd112,en,2023-03-15T12:00:47.000000Z,finance.yahoo.com,,equity,Communication Services,6.537279,-0.24695
f4570690-81ae-48ee-8052-92fe25e4629f,"Investors Heavily Search Netflix, Inc. (NFLX): Here is What You Need to Know","Netflix (NFLX) has been one of the stocks most watched by Zacks.com users lately. So, it is worth exploring what lies ahead for the stock.","stock, stocks, investment, investment advice, investing, online trading, online investment, online stock trading, stock market, financial, financial planning, quote, quotes, stock quotes","This page has not been authorized, sponsored, or otherwise approved or endorsed by the companies represented herein. Each of the company logos represented herei...",https://www.zacks.com/stock/news/2066631/investors-heavily-search-netflix-inc-nflx-here-is-what-you-need-to-know?cid=CS-ZC-FT-tale_of_the_tape|most_searched_stocks-2066631,https://staticx-tuner.zacks.com/images/default_article_images/default168.jpg,en,2023-03-16T13:00:14.000000Z,zacks.com,,equity,Communication Services,53.331410000000005,0.0
333316c3-aa15-4100-b66f-9baf7570013d,Citi suspects recent price cuts by Netflix are tethered to password sharing enforcement By Investing.com,Citi suspects recent price cuts by Netflix are tethered to password sharing enforcement,,"© Reuters Citi suspects recent price cuts by Netflix (NFLX) are tethered to password sharing enforcement

NFLX +3.00% Add to/Remove from Watchlist

By Michael ...",https://www.investing.com/news/stock-market-news/citi-suspects-recent-price-cuts-by-netflix-are-tethered-to-password-sharing-enforcement-432SI-3032317,https://i-invdn-com.investing.com/news/Netflix_800x533_L_1634734744.jpg,en,2023-03-16T12:06:20.000000Z,investing.com,,equity,Communication Services,23.099031,-0.07012
afdac135-e65a-498f-867d-8dc001f3068f,"Thursday’s Top Analyst Upgrades and Downgrades: Charles Schwab, Comerica, KeyCorp, Meta Platforms, Microsoft, Netflix and More – 24","Thursday's top analyst upgrades and downgrades included Azul, Charles Schwab, Comerica, Darden Restaurants, Harley-Davidson, KeyCorp, Meta Platforms, Microsoft, Netflix and Truist Financial.",,"Thursday's Top Analyst Upgrades and Downgrades: Charles Schwab, Comerica, KeyCorp, Meta Platforms, Microsoft, Netflix and More

The futures were lower after ano...",https://247wallst.com/investing/2023/03/16/thursdays-top-analyst-upgrades-and-downgrades-azul-charles-schwab-comerica-keycorp-meta-platforms-microsoft-netflix-truist-financial/,https://247wallst.com/wp-content/uploads/2022/10/imageForEntry4-oOU.jpg,en,2023-03-16T12:47:54.000000Z,247wallst.com,,equity,Communication Services,21.215374,-0.22315
cefba4b8-8617-459c-bcd5-dd1983c5d12f,Lockdown Logic Rears Its Head in Stock Rally Running on Nerves,"(Bloomberg) -- When banks started going belly up, positioning in bonds turned on a dime. Forget inflation. The country is spiraling toward a recession. Yields plunged, higher interest rates were priced out. And over in the stock market a celebration ensued.Most Read from BloombergFirst Republic Set to Get $30 Billion of Deposits in RescueFirst Republic Bank Is Exploring Options Including a SaleIn New York City, a $100,000 Salary Feels Like $36,000The 10 Top US Cities Where a $100,000 Salary Goes",,"(Bloomberg) -- When banks started going belly up, positioning in bonds turned on a dime. Forget inflation. The country is spiraling toward a recession. Yields p...",https://finance.yahoo.com/news/lockdown-logic-rears-head-stock-202158412.html?.tsrc=rss,https://media.zenfs.com/en/bloomberg_markets_842/67aedde97fc8804aabf97d176cbf660a,en,2023-03-16T20:21:58.000000Z,finance.yahoo.com,,equity,Communication Services,12.435862166666668,-0.6908
f50dda82-6fef-4b14-a935-e21e8d6419ef,YouTube to Raise Prices on TV Subscription Offering,"By Denny Jacob 


  YouTube on Thursday said it's raising the price of its TV subscription offering, citing rising content costs. 

  The Alphabet Inc.-owned video platform said the monthly cost... | March 16,  2023","ALPHABET INC. stock exchange, news, information, press release, by, denny, jacob, youtube, on, thursday, said, raising, the, price, of, its, tv, subscription, citing, rising, content, alphabet, video, platform, monthly | GOOGL | US02079K3059","By Denny Jacob

YouTube on Thursday said it's raising the price of its TV subscription offering, citing rising content costs.

The Alphabet Inc.-owned video pla...",https://www.marketscreener.com/quote/stock/ALPHABET-INC-24203373/news/YouTube-to-Raise-Prices-on-TV-Subscription-Offering-43266469/,https://www.marketscreener.com/images/twitter_MS_fdgris.png,en,2023-03-16T18:47:03.000000Z,marketscreener.com,,equity,Communication Services,17.371885000000002,0.0
840dff1f-245c-4a67-bd7b-9c22e82c943d,European Stocks Gain as Credit Suisse Shares Soar: Markets Wrap,"(Bloomberg) -- European stocks staged a partial rebound on Thursday as bank shares rallied after Credit Suisse Group AG said it would borrow money from Switzerland’s central bank and seek to repurchase debt.Most Read from BloombergFirst Republic Bank Is Said to Weigh Options Including a SaleCredit Suisse Reels After Top Shareholder Rules Out Raising StakeRyan Reynolds-Backed Mint Is Bought by T-Mobile for $1.35 BillionIn New York City, a $100,000 Salary Feels Like $36,000Traders Dash for Cover a",,(Bloomberg) -- European stocks staged a partial rebound on Thursday as bank shares rallied after Credit Suisse Group AG said it would borrow money from Switzerl...,https://finance.yahoo.com/news/bank-fears-rock-markets-traders-223116732.html,https://s.yimg.com/ny/api/res/1.2/6M..vrSrHvXzslm9k9UiXw--/YXBwaWQ9aGlnaGxhbmRlcjt3PTEyMDA7aD04MDA-/https://media.zenfs.com/en/bloomberg_markets_842/cd34368789146fbe380845e3979fa756,en,2023-03-16T08:29:04.000000Z,finance.yahoo.com,,equity,Communication Services,12.698282166666665,0.4939
16c7e8e3-8724-40ff-bbf4-90cc204cfbbc,6 big analyst picks: Stifel says FedEx stock is a buy,6 big analyst picks: Stifel says FedEx stock is a buy | Pro Recap,,"© Reuters.

FDX -1.31% Add to/Remove from Watchlist NFLX +3.00% Add to/Remove from Watchlist JKHY +2.59% Add to/Remove from Watchlist WRB -1.44% Add to/Remove ...",https://www.investing.com/news/stock-market-news/6-big-analyst-picks-stifel-says-fedex-stock-is-a-buy--pro-recap-3031973,https://i-invdn-com.investing.com/news/LYNXMPEE5I260_L.jpg,en,2023-03-16T11:10:08.000000Z,investing.com,,equity,Communication Services,14.523634,0.8316
42ed19b7-12bc-4d70-a9fb-8d1b43dc938c,Lockdown Logic Rears Its Head in Stock Rally Running on Nerves,"When banks started going belly up, positioning in bonds turned on a dime. Forget inflation. The country is spiraling toward a recession. Yields plunged, higher…",,"This advertisement has not loaded yet, but your article continues below.

Banks traded at low multiples with a howling wind at their backs, so what happens now?...",https://financialpost.com/pmn/business-pmn/lockdown-logic-rears-its-head-in-stock-rally-running-on-nerves,https://smartcdn.gprod.postmedia.digital/financialpost/wp-content/uploads/2023/03/nasdaq-100-rallies-during-bank-crisis.jpg,en,2023-03-16T21:16:19.000000Z,financialpost.com,,equity,Communication Services,9.209101666666667,0.0
8e643865-3954-4916-b565-6b16728377d1,"Jim Cramer's top 10 things to watch in the stock market Thursday: Banks, Fed, TikTok and Amazon",Concerns about a banking crisis in the U.S. and Europe hit American regional banks. Wall Street remains skittish.,"Breaking News: Markets, Markets, Investment strategy, Jim Cramer, Nikola Corp, NVIDIA Corp, Apple Inc, DocuSign Inc, Intel Corp, Baidu Inc, United States, Dow Jones Industrial Average, S&P 500 Index, Credit Suisse Group AG, Credit Suisse Group AG, Meta Platforms Inc, Amazon.com Inc, Adobe Inc., Skyworks Solutions Inc, T-Mobile US Inc, Qualcomm Inc, Netflix Inc, Block Inc, FedEx Corp, business news","My top 10 things to watch Thursday, March 16 1. Concerns about a banking crisis in the U.S. and Europe hit American regional banks. Wall Street remains skittish...",https://www.cnbc.com/2023/03/16/cramers-top-10-things-in-stock-market-banks-fed-tiktok-and-amazon.html,https://image.cnbcfm.com/api/v1/image/107204738-1678230525595-gettyimages-1471928752-wm_10087_ny9jwu2m.jpeg?v=1678972051&w=1920&h=1080,en,2023-03-16T13:19:27.000000Z,cnbc.com,,equity,Communication Services,8.698011,-0.3094
8e1c42b0-4ecb-448e-aa97-9700271d9b7c,Netflix Unusual Options Activity - Netflix (NASDAQ:NFLX),,,"Someone with a lot of money to spend has taken a bullish stance on Netflix NFLX.

And retail traders should know.

We noticed this today when the big position s...",https://www.benzinga.com/markets/options/23/03/31398843/netflix-unusual-options-activity,https://www.benzinga.com/next-assets/images/schema-image-default.png,en,2023-03-17T14:46:20.000000Z,benzinga.com,,equity,Communication Services,73.17052,0.387488
0a855beb-2fc0-4ffa-bad3-515817c9c518,Best FAANG Stock to Buy: Facebook vs. Amazon vs. Apple vs. Netflix vs. Google,"Meta Platforms (NASDAQ: META), Amazon (NASDAQ: AMZN), Apple (NASDAQ: AAPL), Netflix (NASDAQ: NFLX), and Alphabet (NASDAQ: GOOG) (NASDAQ: GOGL) have all done an excellent job growing their businesses and boosting profits.",,"Best FAANG Stock to Buy: Facebook vs. Amazon vs. Apple vs. Netflix vs. Google

Meta Platforms (NASDAQ: META), Amazon (NASDAQ: AMZN), Apple (NASDAQ: AAPL), Netfl...",https://finance.yahoo.com/m/50dd0475-6c79-372f-9beb-82e4b94c7052/best-faang-stock-to-buy%3A.html?.tsrc=rss,https://s.yimg.com/ny/api/res/1.2/xiTCMxMpVmgg_4Qf7uPa0g--/YXBwaWQ9aGlnaGxhbmRlcjt3PTEyMDA7aD02NzU-/https://media.zenfs.com/en/motleyfool.com/b64f09aa2f3f97aebe5470d4123a682d,en,2023-03-17T20:54:47.000000Z,finance.yahoo.com,,equity,Communication Services,48.11857,0.443
47a6124c-548b-4e86-aeaa-aa3f8e95fd8b,"SpaceX, Netflix, Boeing to join ""biggest-ever"" US business mission to Vietnam By Reuters","SpaceX, Netflix, Boeing to join ""biggest-ever"" US business mission to Vietnam",,"2/2 © Reuters. FILE PHOTO: Men transport people on three-wheel cyclo past the Government Guesthouse in Hanoi, Vietnam February 20, 2019. REUTERS/Kham 2/2

PEP ...",https://www.investing.com/news/stock-market-news/spacex-netflix-boeing-to-join-biggestever-us-business-mission-to-vietnam-3032995,https://i-invdn-com.investing.com/news/LYNXMPEB3F0K7_L.jpg,en,2023-03-17T04:46:00.000000Z,investing.com,,equity,Communication Services,25.522137,0.098667
796db3c0-7dd7-470f-90ea-37add915677f,"Before the Bell: White Knights Save First Republic, Tech Giants Rule the Day – 24","Eleven U.S. banks combined to rescue First Republic on Thursday, and tech stocks lifted markets thanks to enthusiasm over ChatGPT and AI in general.",,"Before the Bell: White Knights Save First Republic, Tech Giants Rule the Day

Premarket action on Friday had the three major U.S. indexes trading mixed. The Dow...",https://247wallst.com/investing/2023/03/17/before-the-bell-white-knights-save-first-republic-tech-giants-rule-the-day/,https://247wallst.com/wp-content/uploads/2022/06/imageForEntry6-5eW.jpg,en,2023-03-17T11:33:27.000000Z,247wallst.com,,equity,Communication Services,13.223078,0.0
adfda55c-d779-40e8-867b-7bde44f2a9bc,UK's Prince Harry to seek Mail on Sunday libel win without trial By Reuters,UK's Prince Harry to seek Mail on Sunday libel win without trial,,"3/3 © Reuters. Britain's Prince Harry attends a rugby event at Buckingham Palace gardens in London, Britain January 16, 2020. REUTERS/Toby Melville 2/3

NFLX +...",https://www.investing.com/news/stock-market-news/uks-prince-harry-to-seek-mail-on-sunday-libel-win-without-trial-3032935,https://i-invdn-com.investing.com/news/LYNXMPEB3F0K7_L.jpg,en,2023-03-17T00:11:10.000000Z,investing.com,,equity,Communication Services,10.017679,-0.2263
b8946508-c9fc-410b-b5ff-79bdebeb0f0e,"What Is Dry Powder, And How Will It Affect Technology In 2023?","2023 is predicted to bring resilience among businesses, and tech startups will more likely strategically display themselves to attract investors.",Cisco,"Steve Taplin is the CEO and cofounder of Sonatafy Technology, providing experienced nearshore software developers and engineers.

getty

Dry powder, an informal...",https://www.forbes.com/sites/forbestechcouncil/2023/03/17/what-is-dry-powder-and-how-will-it-affect-technology-in-2023/,https://imageio.forbes.com/specials-images/imageserve/62fbb5fdd37dff2eb70cac59/0x0.jpg?format=jpg&width=1200,en,2023-03-17T11:15:00.000000Z,forbes.com,,equity,Communication Services,7.716185,0.1531
