uuid,title,description,keywords,snippet,url,image_url,language,published_at,source,relevance_score,type,industry,match_score,sentiment_score
ddef9550-d3e7-4064-a259-09bb771a2de8,Netflix: Q3 Shows The Power Of Company’s Licensed Content (NASDAQ:NFLX),"Netflix's Q3 performance exceeded expectations, with strong revenue and subscriber growth. Read more about NFLX stock here.",,"Investment Thesis

The last time I wrote about Netflix, I mentioned how the actors’ and writers’ strikes were unlikely to have an adverse impact on the comp...",https://seekingalpha.com/article/4642473-netflix-q3-shows-the-power-of-companys-licensed-content,https://static.seekingalpha.com/cdn/s3/uploads/getty_images/1393651026/image_1393651026.jpg?io=getty-c-w1536,en,2023-10-22T15:02:35.000000Z,seekingalpha.com,,equity,Communication Services,56.971066,0.185843
29724854-4595-45f3-9c77-a3f93dbfa239,"Economic Safari: Visa And Mastercard's Big Bet On Africa's Digital Wallets As E-commerce Growth Picks Up - Netflix (NASDAQ:NFLX), Mastercard (NYSE:MA), Visa (NYSE:V), Estee Lauder Cos (NYSE:EL)",Mastercard Incorporated (NYSE: MA) and Visa Inc.(NYSE: V) are reportedly investing billions into African companies that have,,"Loading... Loading... Loading...

Mastercard Incorporated MA and Visa Inc.V are reportedly investing billions into African companies that have powered a sharp p...",https://www.benzinga.com/markets/equities/23/10/35362561/economic-safari-visa-and-mastercards-big-bet-on-africas-digital-wallets-as-e-commerce-growth-pic,https://cdn.benzinga.com/files/images/story/2023/10/21/shutterstock_2106485201.jpg?width=1200&height=800&fit=crop,en,2023-10-22T00:40:39.000000Z,benzinga.com,,equity,Communication Services,25.92397666666666,0.1909
99ba36a0-fac6-426b-8406-6453e408327f,"A grim week for Nvidia, Tesla; Netflix takes the cake: Weekly tech roundup",By Louis Juricic and Sarina Isaacs,,"By Louis Juricic and Sarina Isaacs

Investing.com -- Here is your weekly Pro Recap on the biggest headlines out of tech this past week: Netflix triumphs; Nvidia...",https://finance.yahoo.com/news/grim-week-nvidia-tesla-netflix-101438050.html?.tsrc=rss,https://s.yimg.com/cv/apiv2/social/images/yahoo_default_logo-1200x1200.png,en,2023-10-22T10:14:38.000000Z,finance.yahoo.com,,equity,Communication Services,24.905985,0.205763
0387e98d-2424-4a8a-98f6-23342f8f5de6,"A grim week for Nvidia and Tesla, but Netflix triumphs: Weekly tech roundup By Investing.com","A grim week for Nvidia and Tesla, but Netflix triumphs: Weekly tech roundup",,"Published Oct 22, 2023 10:14AM ET

© Reuters.

NVDA -1.70% Add to/Remove from Watchlist NFLX -0.20% Add to/Remove from Watchlist TSLA -3.69% Add to/Remove from...",https://www.investing.com/news/stock-market-news/a-grim-week-for-nvidia-and-tesla-but-netflix-triumphs-weekly-tech-roundup-3205004,https://i-invdn-com.investing.com/news/LYNXMPEB1A16P_L.jpg,en,2023-10-22T14:14:38.000000Z,investing.com,,equity,Communication Services,23.961563,0.385643
b3def38c-5045-4259-bc1b-c49117e57453,"Fed Focus, Loving + Hating Earnings Season, Bond/Stock Competition","Rob Isbitts and Matthew Tuttle discuss focusing on the Fed, Magnificent Seven earnings and why a little bullishness may be warranted.",,"Maria Vonotna

Listen below or on the go on Apple Podcasts and Spotify

Rob Isbitts and Matthew Tuttle discuss focusing on the Fed, Magnificent Seven earnings a...",https://seekingalpha.com/article/4642471-fed-focus-loving-plus-hating-earnings-season-bonds-competing-with-stocks,https://static.seekingalpha.com/cdn/s3/uploads/getty_images/1297220565/image_1297220565.jpg?io=getty-c-w1536,en,2023-10-22T15:30:00.000000Z,seekingalpha.com,,equity,Communication Services,6.000454,-0.30405
f0fc160e-aa1b-47ac-ab12-c1b79cd832a6,Netflix: Long-Term Thesis Cemented After Blowout Q3 (NASDAQ:NFLX),"Netflix's Q3 earnings exceeded expectations, leading to a 16% surge in stock price. Check out why I reiterate NFLX stock as a buy.",,"Tommaso Boddi/Getty Images Entertainment

Netflix (NASDAQ:NFLX) reported third-quarter results that exceeded expectations. Revenues totaled $8.54B, in line with...",https://seekingalpha.com/article/4642505-netflix-long-term-thesis-cemented-after-blowout-third-quarter,https://static.seekingalpha.com/cdn/s3/uploads/getty_images/1637254372/image_1637254372.jpg?io=getty-c-w1536,en,2023-10-23T04:22:28.000000Z,seekingalpha.com,,equity,Communication Services,59.112877,0.400555
b22d4bee-292b-4099-aec8-94a939a643ed,"Netflix's Q3: Maintaining Hold, Not Convinced Upside Can Continue","Read a financial writer's analysis of Netflix: maintaining a hold rating, expecting short-term outperformance, but uncertain about future surprises.",,"Mario Tama/Getty Images News

We maintain our hold rating on Netflix (NASDAQ:NFLX) in spite of the company’s earnings beat this week. Consistent with our upgr...",https://seekingalpha.com/article/4642633-netflixs-q3-maintaining-hold-not-convinced-upside-can-continue,https://media.gettyimages.com/id/1701580103/photo/los-angeles-california-the-netflix-logo-is-displayed-at-its-corporate-offices-on-september-25.jpg?b=1&s=594x594&w=0&k=20&c=QAj0oEPczNLcg-miA4zgDygWzTiCotmTo6LOEjnLDs4=,en,2023-10-23T16:02:20.000000Z,seekingalpha.com,,equity,Communication Services,17.01388,0.554171
237d3325-d1f5-4a7e-b392-40d874ae0b12,Top 3 Stocks on the S&P 500 Last Week,"This is a big week for earnings as major tech companies like Alphabet, Microsoft, Amazon, Visa, and Meta. Here were the top three stocks on the S&P 500 last week.",,"The S&P 500ʻs winning streak ended at two weeks as the benchmark fell 2.4% last week to 4,224 as of the market close on Friday. Geopolitical strife and a rise ...",https://www.valuewalk.com/top-3-stocks-on-the-sp-500-last-week/,https://www.valuewalk.com/wp-content/uploads/2023/02/SP-500.jpeg,en,2023-10-23T15:37:40.000000Z,valuewalk.com,,equity,Communication Services,16.928946,0.7717
9c9d0430-682b-489c-9a7d-f244c35a341c,“Magnificent 7” Tech Giants Initiate Q3 Earnings Season By Investing.com,“Magnificent 7” Tech Giants Initiate Q3 Earnings Season,,"Published Oct 23, 2023 05:32PM ET

© Reuters.

META +1.74% Add to/Remove from Watchlist TSLA +0.04% Add to/Remove from Watchlist NVDA +3.84% Add to/Remove from...",https://www.investing.com/news/stock-market-news/magnificent-7-tech-giants-initiate-q3-earnings-season-93CH-3206292,https://i-invdn-com.investing.com/news/LYNXNPEB6L0A8_L.jpg,en,2023-10-23T21:32:10.000000Z,investing.com,,equity,Communication Services,14.322403,0.9136
a473c04c-e55d-4d2c-9c6d-f5220d7ccefa,Snap (SNAP) Q3 Earnings Report Preview: What To Look For By Stock Story,Snap (SNAP) Q3 Earnings Report Preview: What To Look For,,"Published Oct 23, 2023 03:15AM ET Updated Oct 23, 2023 09:01AM ET

Snap (SNAP) Q3 Earnings Report Preview: What To Look For

SNAP -2.18% Add to/Remove from Watc...",https://www.investing.com/news/stock-market-news/snap-snap-q3-earnings-report-preview-what-to-look-for-3205848,https://i-invdn-com.investing.com/news/LYNXMPED0S0CN_L.jpg,en,2023-10-23T13:01:44.000000Z,investing.com,,equity,Communication Services,10.981378,-0.1027
1f6b8205-6ec7-4a65-80e5-94bf26aa0fbe,Teladoc (TDOC) To Report Earnings Tomorrow: Here Is What To Expect By Stock Story,Teladoc (TDOC) To Report Earnings Tomorrow: Here Is What To Expect,,"Published Oct 23, 2023 07:16AM ET Updated Oct 23, 2023 08:01AM ET

Teladoc (TDOC) To Report Earnings Tomorrow: Here Is What To Expect

TDOC +1.71% Add to/Remove...",https://www.investing.com/news/stock-market-news/teladoc-tdoc-to-report-earnings-tomorrow-here-is-what-to-expect-3205701,https://i-invdn-com.investing.com/news/LYNXNPEC0E0NI_L.jpg,en,2023-10-23T12:01:26.000000Z,investing.com,,equity,Communication Services,10.673195,-0.1027
ad9ed832-ea08-4c1c-8463-ce1b854756a1,Spotify Q3 Earnings Preview: Fasten The Seat Belt (NYSE:SPOT),Spotify is set to report Q3 earnings before the market opens on October 24. Check out why investors need to be careful of investing in SPOT stock.,,"Michael M. Santiago

Spotify Technology S.A. (NYSE:SPOT) is scheduled to report third-quarter earnings before the market opens tomorrow, and I am keeping a clos...",https://seekingalpha.com/article/4642577-spotify-q3-earnings-preview-increased-volatility,https://static.seekingalpha.com/cdn/s3/uploads/getty_images/1461363374/image_1461363374.jpg?io=getty-c-w1536,en,2023-10-23T13:01:32.000000Z,seekingalpha.com,,equity,Communication Services,7.8709681666666675,0.7845
9c132257-280d-498a-bd3f-f8c8abd29fe5,Baidu: A Strong Buy Considering Its Exposure To Promising Tech Trends (NASDAQ:BIDU),Baidu offers a cyclical sentiment opportunity. China's macro recovery could result in margin expansion of the core business. Explore more details here.,,Editor's note: Seeking Alpha is proud to welcome Wiebe De Ruyck as a new contributor. It's easy to become a Seeking Alpha contributor and earn money for your be...,https://seekingalpha.com/article/4642610-baidu-strong-buy-considering-exposure-promising-tech-trends,https://static.seekingalpha.com/cdn/s3/uploads/getty_images/482803973/image_482803973.jpg?io=getty-c-w1536,en,2023-10-23T15:03:07.000000Z,seekingalpha.com,,equity,Communication Services,6.296697,0.4215
793372d1-993e-4aa9-ab7e-249490aec32c,Top Articles: Week of Oct 16,"MOST READ: Enbridge, Canadian MFs for international exposure, and ETF holdings were the most viewed pieces of content last week.",TOP ARTICLES,"3 Undervalued Stocks for Beginners

The shares of these wide-moat companies are trading for less than they’re worth.

Fund Profile: Vanguard Allocation ETFs

...",https://www.morningstar.ca/ca/news/237315/top-articles-week-of-oct-16.aspx,https://www.morningstar.co.uk/static/UploadManager/Image/Top%20of%20peak%20-%20Banff%20-%20550px.jpg,en,2023-10-23T06:38:00.000000Z,morningstar.ca,,equity,Communication Services,3.158552,0.6097
9d73f434-2a04-4959-9151-e0e936611982,Navigating Market Uncertainty: Intrinsic Value of Netflix Inc,"In this article, we will take a look into Netflix Inc's (NFLX) DCF analysis, a reliable and data-driven approach to estimating its intrinsic value. Instead of u","GuruFocus, Article, News, GuruFocus Research, NFLX","In this article, we will take a look into Netflix Inc's (NFLX, Financial) DCF analysis, a reliable and data-driven approach to estimating its intrinsic value. I...",https://www.gurufocus.com/news/2111160/navigating-market-uncertainty-intrinsic-value-of-netflix-inc,https://static.gurufocus.com/logos/0C00000BRT.png?5,en,2023-10-24T12:01:08.000000Z,gurufocus.com,,equity,Communication Services,62.104373166666655,0.5229
0e3725e5-184b-415e-8379-8aee8edf4075,"Investors Heavily Search Netflix, Inc. (NFLX): Here is What You Need to Know","Zacks.com users have recently been watching Netflix (NFLX) quite a bit. Thus, it is worth knowing the facts that could determine the stock's prospects.","stock, stocks, investment, investment advice, investing, online trading, online investment, online stock trading, stock market, financial, financial planning, quote, quotes, stock quotes","This page has not been authorized, sponsored, or otherwise approved or endorsed by the companies represented herein. Each of the company logos represented herei...",https://www.zacks.com/stock/news/2170707/investors-heavily-search-netflix-inc-nflx-here-is-what-you-need-to-know?cid=CS-ZC-FT-tale_of_the_tape|most_searched_stocks-2170707,https://staticx-tuner.zacks.com/images/default_article_images/default127.jpg,en,2023-10-24T13:00:11.000000Z,zacks.com,,equity,Communication Services,53.206817333333326,0.0
ef152fdf-3ee1-4e95-84ae-c95b85d81351,Check Out What Whales Are Doing With NFLX - Netflix (NASDAQ:NFLX),,,"Loading... Loading... Loading...

Someone with a lot of money to spend has taken a bearish stance on Netflix NFLX.

And retail traders should know.

We noticed ...",https://www.benzinga.com/markets/options/23/10/35395004/check-out-what-whales-are-doing-with-nflx,https://cdn.benzinga.com/files/images/story/2023/movers_image_18.jpeg?width=1200&height=800&fit=crop,en,2023-10-24T14:01:19.000000Z,benzinga.com,,equity,Communication Services,57.03444,0.262325
5f21536f-0316-4ed1-839c-76a9c8c4a037,"Netflix Q3: Strategic Updates Bring Profits, Gaming Adoption Will Have Positive Effect",Netflix is showing stable organic user growth base. Churn remain low despite paid sharing initiatives. Click here to read an analysis on NFLX stock now.,,"Giuliano Benzin

Investment Thesis

Netflix (NASDAQ:NFLX) pleased investors again with Q3 earnings - company showed stable organic user base growth and it seems...",https://seekingalpha.com/article/4643072-netflix-q3-strategic-updates-bring-profits-possible-gaming-adoption-will-have-positive-effect,https://static.seekingalpha.com/cdn/s3/uploads/getty_images/1476749137/image_1476749137.jpg?io=getty-c-w1536,en,2023-10-24T22:04:58.000000Z,seekingalpha.com,,equity,Communication Services,25.175684,0.45483
5a305dce-d30e-4046-947e-32b2f0f1ee18,Netflix’s Share Price Jumped Almost 16% in One Day: Good Buy or Value Trap?,The streaming giant reported a strong set of numbers and is enjoying several catalysts that can grow its business further.,,"The world of streaming television is becoming more competitive.

Apart from Netflix (NASDAQ: NFLX), new players such as Disney (NYSE: DIS) and Amazon (NASDAQ: A...",https://thesmartinvestor.com.sg/netflixs-share-price-jumped-almost-16-in-one-day-good-buy-or-value-trap/,https://thesmartinvestor.com.sg/wp-content/uploads/2023/10/netflix-office.png,en,2023-10-24T23:30:00.000000Z,thesmartinvestor.com.sg,,equity,Communication Services,22.859257,0.626544
39bb3c56-2a8e-405e-9aa1-051861053df2,Netflix's 'Beckham' documentary boosts his personal brand,"The retired pro soccer player at the center of ""Beckham"" has apparently seen the popular Netflix documentary series help give his personal brand a lift to the tune of 500,000 followers.",,"The retired pro soccer player at the center of ""Beckham"" has apparently seen the popular Netflix documentary series help give his personal brand a lift.

In the...",https://www.foxbusiness.com/sports/netflixs-david-beckham-documentary-boosts-personal-brand,https://a57.foxnews.com/static.foxbusiness.com/foxbusiness.com/content/uploads/2023/10/0/0/david-beckham-closeup-getty.jpg?ve=1&tl=1,en,2023-10-24T13:00:40.000000Z,foxbusiness.com,,equity,Communication Services,19.147248833333332,0.30295
594b989b-7aff-4943-b512-4df94ebd1f8c,Apple to Revamp TV App in Step Toward Simplifying Video Services,"(Bloomberg) -- Apple Inc. will redesign its TV app in a step toward consolidating the company’s various video offerings later this year, according to people with knowledge of the matter, part of its efforts to become a bigger player in the streaming world. Most Read from BloombergIsrael Latest: UN Chief Urges Halt as Hezbollah Clashes FlareAn Oil Giant Quietly Ditched the World’s Biggest Carbon Capture PlantNobody Wants Mutual Funds NowXi Makes Unprecedented Central Bank Visit in Sign of Focus o",,"(Bloomberg) -- Apple Inc. will redesign its TV app in a step toward consolidating the company’s various video offerings later this year, according to people w...",https://finance.yahoo.com/news/apple-revamp-tv-app-step-174726586.html?.tsrc=rss,https://s.yimg.com/ny/api/res/1.2/isor5_hkzKqgBwpB8dfzfw--/YXBwaWQ9aGlnaGxhbmRlcjt3PTEyMDA7aD04MDA-/https://media.zenfs.com/en/bloomberg_technology_68/6caa88acd0ed370ea6ce3939d0ad719c,en,2023-10-24T17:47:26.000000Z,finance.yahoo.com,,equity,Communication Services,14.075100999999998,0.0
d386b4a6-117b-43d7-b27b-fcf55f38aaa8,"Global Markets Rebound Ahead of Key Reports, But Fundamentals Still Look Iffy","Stocks Analysis by Fawad Razaqzada covering: Microsoft Corporation, Alphabet Inc Class A, Apple Inc, Amazon.com Inc. Read Fawad Razaqzada's latest article on Investing.com",,MSFT +0.06% Add to/Remove from Watchlist GOOGL +1.41% Add to/Remove from Watchlist AAPL -0.54% Add to/Remove from Watchlist AMZN +0.62% Add to/Remove from Watch...,https://www.investing.com/analysis/global-markets-rebound-ahead-of-key-reports-but-fundamentals-still-look-iffy-200643014,https://i-invdn-com.investing.com/redesign/images/seo/investingcom_analysis_og.jpg,en,2023-10-24T17:12:00.000000Z,investing.com,,equity,Communication Services,11.923805,0.4215
e1b98f66-46cb-4e4f-a313-26f8b88e8a56,"Top Stock Reports for Netflix, Honeywell International & RTX","Today's Research Daily features new research reports on 16 major stocks, including Netflix, Inc. (NFLX), Honeywell International Inc. (HON) and RTX Corporation (RTX).","stock, stocks, investment, investment advice, investing, online trading, online investment, online stock trading, stock market, financial, financial planning, quote, quotes, stock quotes","Wednesday, October 25, 2023



The Zacks Research Daily presents the best research output of our analyst team. Today's Research Daily features new research repo...",https://www.zacks.com/research-daily/2171873/top-stock-reports-for-netflix-honeywell-international-rtx?cid=CS-ZC-FT-research_daily-2171873,https://staticx-tuner.zacks.com/images/articles/main/da/91.jpg,en,2023-10-25T22:34:00.000000Z,zacks.com,,equity,Communication Services,30.3204215,0.347867
f84c35ad-bd8e-4431-b31c-50c750f7a767,Netflix: Paid Sharing Strategy Results Weren't A Given Nor Are They Temporary (NFLX),Netflix's strategy to crack down on password sharing has resulted in a meaningful increase in subscribers. Read why I have a Buy rating on NFLX stock.,,"wutwhanfoto

With Netflix's (NASDAQ:NFLX) Q3 earnings report showing a significant bump in subscribers, many opinions have emerged about the relevancy and impor...",https://seekingalpha.com/article/4643152-netflix-stock-q3-2023-earnings-paid-sharing-strategy-yielded-revenue-buy,https://static.seekingalpha.com/cdn/s3/uploads/getty_images/992007460/image_992007460.jpg?io=getty-c-w1536,en,2023-10-25T14:00:00.000000Z,seekingalpha.com,,equity,Communication Services,24.568893,0.2724
97424e94-0b9f-4efd-8b6a-130b2b79c4d3,20 Highest CPM YouTube Niches in 2023,"This article will discuss the 20 Highest CPM YouTube Niches in 2023. If you want to skip our detailed analysis of the streaming industry and its recent trends, head straight to the 6 Highest CPM YouTube Niches in 2023. The shifting landscape of entertainment is evident in the rise of platforms like YouTube and Netflix, which […]",,"This article will discuss the 20 Highest CPM YouTube Niches in 2023. If you want to skip our detailed analysis of the streaming industry and its recent trends, ...",https://finance.yahoo.com/news/20-highest-cpm-youtube-niches-091413416.html?.tsrc=rss,https://media.zenfs.com/en/insidermonkey.com/38241706442f8349b04d4a2058671a77,en,2023-10-25T09:14:13.000000Z,finance.yahoo.com,,equity,Communication Services,16.130385333333333,0.43095
ae8383e2-f76f-4724-8909-1a354f441ab3,Spotify's Unexpected Profit Confirms It Is Truly Becoming An All-Purpose Audio Platform,"Known as the Netflix (NASDAQ: NFLX) of music, Spotify Technology S.A. (NYSE: SPOT) reported a surprise quarterly profit, its first in 18 months. The Swedish-based music streaming king is also going against Amazon.com Inc (NASDAQ: AMZN) as it expanded its business into audio books and podcasts. Upon the strong earnings report, Spotify shares closed 10% up on Tuesday with its stock having more than doubled year to date, giving the company a market value of $33.22 billion. Challenging Amazon After",,"Known as the Netflix (NASDAQ: NFLX) of music, Spotify Technology S.A. (NYSE: SPOT) reported a surprise quarterly profit, its first in 18 months. The Swedish-bas...",https://finance.yahoo.com/news/spotifys-unexpected-profit-confirms-truly-153059974.html?.tsrc=rss,https://media.zenfs.com/en/Benzinga/7085b22d724a793b04d1b9226cea5538,en,2023-10-25T15:30:59.000000Z,finance.yahoo.com,,equity,Communication Services,21.454744,0.6124
3f1cc436-c158-4eb1-a26d-037f25307ce5,"Apple raise prices for Arcade gaming subscription service, AppleTV+ streaming","Apple Inc. is raising the prices for its AppleTV+ streaming and Arcade gaming plans as well as its bundled Apple One service that includes streaming, music and other subscriptions.  Arcade will now cost $6.99, up from $4.99.  AppleTV+ is now $9.99, up from $6.99.",,"FILE - The Apple logo is illuminated at a store in the city center of Munich, Germany, Dec. 16, 2020. Apple Inc. is raising the prices for its AppleTV+ streamin...",https://finance.yahoo.com/news/apple-raise-prices-arcade-gaming-171740616.html?.tsrc=rss,https://s.yimg.com/ny/api/res/1.2/KZSdJFfxlQMIBRUAlO7cKQ--/YXBwaWQ9aGlnaGxhbmRlcjt3PTEyMDA7aD04MDA-/https://media.zenfs.com/en/ap_finance_articles_694/955345d12048e162309f4503866683af,en,2023-10-25T17:17:40.000000Z,finance.yahoo.com,,equity,Communication Services,16.845035833333334,0.3182
62665986-cbf9-4842-b978-abd43820a9ac,Apple Raises Prices of TV+ to $9.99 from $6.99 per Month,"(Bloomberg) -- Apple Inc. raised prices of its TV+, Arcade gaming and News+ subscriptions on Wednesday, following similar moves by other content providers, as the iPhone maker looks to generate more revenue from services. Most Read from BloombergTrump Signals Support for Johnson’s Bid to Become House SpeakerChina Developer Country Garden Deemed in Default on Dollar Bond for First TimeControversial Chip in Huawei Phone Produced on ASML MachineBig Tech Leads Losses as Treasuries Under Pressure: Ma",,"(Bloomberg) -- Apple Inc. raised prices of its TV+, Arcade gaming and News+ subscriptions on Wednesday, following similar moves by other content providers, as t...",https://finance.yahoo.com/news/apple-raises-prices-tv-9-154120303.html?.tsrc=rss,https://s.yimg.com/ny/api/res/1.2/fN5e1CVLEMPDyFYn76YR.Q--/YXBwaWQ9aGlnaGxhbmRlcjt3PTEyMDA7aD04MDA-/https://media.zenfs.com/en/bloomberg_technology_68/752d22fb94438f5f9c8bdaf5f68f6b0f,en,2023-10-25T15:41:20.000000Z,finance.yahoo.com,,equity,Communication Services,15.153126666666667,-0.4019
c6e585d0-f990-4465-bee8-281b717ac48d,"Apple raises prices for Arcade gaming subscription service, AppleTV+ streaming","Apple Inc. is raising the prices for its AppleTV+ streaming and Arcade gaming plans as well as its bundled Apple One service that includes streaming, music and other subscriptions","Media and entertainment industry, Gaming, Business, Technology, Entertainment, Lifestyle, Article, 104286890","FILE - The Apple logo is illuminated at a store in the city center of Munich, Germany, Dec. 16, 2020. Apple Inc. is raising the prices for its AppleTV+ streamin...",https://abcnews.go.com/Business/wireStory/apple-raise-prices-arcade-gaming-subscription-service-appletv-104286890,https://i.abcnewsfe.com/a/0f0f7233-ecd6-423f-9d28-82f29a84406c/wirestory_8bc244e8528ddc3a47cbbddaab4dfe54_12x5.jpg?w=992,en,2023-10-25T18:06:38.000000Z,abcnews.go.com,,equity,Communication Services,13.357573166666667,0.3182
d7651343-3f26-4dc6-83c8-76b797c428b8,What To Expect From Coursera’s (COUR) Q3 Earnings By Stock Story,What To Expect From Coursera’s (COUR) Q3 Earnings,,"Published Oct 25, 2023 03:15AM ET Updated Oct 25, 2023 07:01AM ET

What To Expect From Coursera’s (COUR) Q3 Earnings

Online learning platform Coursera (NYSE:...",https://www.investing.com/news/stock-market-news/what-to-expect-from-courseras-cour-q3-earnings-3208292,https://i-invdn-com.investing.com/news/LYNXMPEBBR0PM_L.jpg,en,2023-10-25T11:01:04.000000Z,investing.com,,equity,Communication Services,12.724112,-0.3818
68f993db-4bf5-424e-94cf-b4bbe85080fe,Market Volatility Strikes: Tech Earnings and Rising Yields Shake U.S. Stocks,"The technology sector took a significant hit on Wednesday, largely due to Alphabet Inc.’s disappointing third-quarter earnings report. The report revealed underwhelming performance in Alphabet’s…",,"Market Volatility Strikes: Tech Earnings and Rising Yields Shake U.S. Stocks

Tech Giants Stumble As Alphabet’s Disappointing Earnings Rock Markets Nate Ostro...",https://medium.com/@nateostrowski/market-volatility-strikes-tech-earnings-and-rising-yields-shake-u-s-stocks-046a984740ce,https://miro.medium.com/v2/resize:fit:1024/0*pPUuox2EHM6CxZeV.png,en,2023-10-25T23:13:28.000000Z,medium.com,,equity,Communication Services,10.148243,0.3612
cec72b76-b770-4d64-9fb9-57d713611c82,Netflix: Long-Term Potential Vs. A Bad Rate Environment (NASDAQ:NFLX),"Netflix reports strong third-quarter earnings, solidifying its position as the leading streaming company. Read more about NFLX stock here.",,"Amy Sussman/Getty Images Entertainment

Netflix (NASDAQ:NFLX) proves yet again that it is the streaming company to beat. Third-quarter earnings reported on Octo...",https://seekingalpha.com/article/4643751-netflix-long-term-potential-vs-a-bad-rate-environment,https://static.seekingalpha.com/cdn/s3/uploads/getty_images/1158919542/image_1158919542.jpg?io=getty-c-w1536,en,2023-10-26T14:24:13.000000Z,seekingalpha.com,,equity,Communication Services,57.06573,0.271618
719ed100-a00a-461a-a7e5-791c06fda9a2,"Ford Deal With UAW: How Do Pay Raises Compare To Hollywood Writers, Other Recent Union Wins? - Netflix (NASDAQ:NFLX), Stellantis (NYSE:STLA), Comcast (NASDAQ:CMCSA), Spirit AeroSystems Hldgs (NYSE:SPR",UAW and WGA have scored wins with their deals. Will GM and Stellantis make deals with the unions soon? How will SAG-AFTRA do?,,"Loading... Loading... Loading...

It's the beginning of the end for a six-week-long strike on Detroit automakers as the United Auto Workers (UAW) celebrates a t...",https://www.benzinga.com/news/large-cap/23/10/35453884/ford-deal-with-uaw-how-do-pay-raises-compare-to-hollywood-writers-other-recent-union-wins,https://cdn.benzinga.com/files/images/story/2023/uaw_strike_shutter3_3.jpeg?width=1200&height=800&fit=crop,en,2023-10-26T22:08:26.000000Z,benzinga.com,,equity,Communication Services,23.556535333333333,0.4391
