uuid,title,description,keywords,snippet,url,image_url,language,published_at,source,relevance_score,type,industry,match_score,sentiment_score
cf10b7d5-1bae-4d3d-b530-8c4a5e39d22a,"Forbes Daily: SBF Found Guilty, Bringing High-Profile Trial To An End",House OKs Israel aid package; Stocks climb on Fed optimism; Trump's sons testify; Automatic college admissions; The challenge of fighting Hamas underground; and more,"ftx, crypto, s&p 500, dow, apple, uber, lyft, youtube, espn, bankman-fried","This is a published version of the Forbes Daily newsletter, you can sign-up to get Forbes Daily in your inbox here.

Good morning,

Netflix stand-up comedian an...",https://www.forbes.com/sites/daniellechemtob/2023/11/03/forbes-daily-sbf-found-guilty-bringing-high-profile-trial-to-an-end/,"https://imageio.forbes.com/specials-images/imageserve/6544dc010280b277b0cf24b3/0x0.jpg?format=jpg&crop=3863,2174,x0,y139,safe&height=900&width=1600&fit=bounds",en,2023-11-03T12:08:03.000000Z,forbes.com,,equity,Communication Services,4.849514,0.6705
20c18a8a-1aec-4904-9106-e9a4c775ddb4,"FAANG stocks record remarkable growth in 2023, Meta leads with 155% surge By Investing.com","FAANG stocks record remarkable growth in 2023, Meta leads with 155% surge",,"Published Nov 04, 2023 06:34AM ET

© Reuters.

AAPL -0.52% Add to/Remove from Watchlist AMZN +0.38% Add to/Remove from Watchlist NFLX +1.80% Add to/Remove from...",https://www.investing.com/news/stock-market-news/faang-stocks-record-remarkable-growth-in-2023-meta-leads-with-155-surge-93CH-3222136,https://i-invdn-com.investing.com/news/LYNXMPEB4E0TV_L.jpg,en,2023-11-04T10:34:54.000000Z,investing.com,,equity,Communication Services,16.959644,0.54005
e93e4737-f025-4142-a196-a9d6c358f73c,"Striking Hollywood actors receive 'last, best, and final offer' from studios By Reuters","Striking Hollywood actors receive 'last, best, and final offer' from studios",,"Published Nov 04, 2023 06:24PM ET

© Reuters. FILE PHOTO: SAG-AFTRA members walk the picket line during their ongoing strike outside Sony Studios in Culver Cit...",https://www.investing.com/news/stock-market-news/striking-hollywood-actors-receive-last-best-and-final-offer-from-studios-3222232,https://i-invdn-com.investing.com/news/LYNXNPEB8506G_L.jpg,en,2023-11-04T22:25:40.000000Z,investing.com,,equity,Communication Services,13.730753,0.6369
4e0f2c7f-d4ce-4e9c-8eb5-6608e82977c4,12 Best Large Cap Stocks To Buy Now,"In this piece, we will take a look at the 12 best large cap stocks to buy now. If you want to skip our introduction to the stock market and the different kinds of stocks that can be traded, then read 5 Best Large Cap Stocks To Buy Now. Stocks can be divided and segregated […]",,"In this piece, we will take a look at the 12 best large cap stocks to buy now. If you want to skip our introduction to the stock market and the different kinds ...",https://finance.yahoo.com/news/12-best-large-cap-stocks-120831198.html?.tsrc=rss,https://s.yimg.com/ny/api/res/1.2/6gihzsOF.CLeAmfYAjoF5Q--/YXBwaWQ9aGlnaGxhbmRlcjt3PTEyMDA7aD02NjU-/https://media.zenfs.com/en/insidermonkey.com/6591caa8b24dbd7587917ec0d7b3a4bf,en,2023-11-05T12:08:31.000000Z,finance.yahoo.com,,equity,Communication Services,16.0856995,0.830733
59056d62-d3d0-4058-8a80-f555201afc12,12 Best Large Cap Stocks To Buy Now,"In this piece, we will take a look at the 12 best large cap stocks to buy now.",,"In this piece, we will take a look at the 12 best large cap stocks to buy now. If you want to skip our introduction to the stock market and the different kinds ...",https://www.insidermonkey.com/blog/12-best-large-cap-stocks-to-buy-now-1216839/,https://d2gr5kl7dt2z3t.cloudfront.net/blog/wp-content/uploads/2017/11/08063228/money-2165758_960_720.jpg,en,2023-11-05T12:08:31.000000Z,insidermonkey.com,,equity,Communication Services,16.080734500000002,0.7994
7183e019-be1d-4346-aed4-b31cf89a0e6e,"Disney and other entertainment giants report after upbeat results from peers, but investors are getting harsher on companies that don’t deliver","Walt Disney Co., Warner Bros. Discovery Inc., Lions Gate Entertainment Corp. and AMC Entertainment Holdings Inc. all report results this week.","article_normal, Computers/Consumer Electronics, Audio/Video Equipment, Motor Vehicles, Passenger Cars, Alternative Fuel Vehicles, Printing/Publishing, Newspaper Publishing, Taxi/Limousine Services, Multimedia Content Services, Audiovisual Production, Cinema Film Production, Film/Video Exhibition, Broadcasting, Cable Broadcasting, Automotive, Business/Consumer Services, Consumer Goods, Media Content Distribution, Durable Household Products, E-commerce, Consumer Electronics, Home Electronics/Appliances, Online Service Providers, Leisure/Arts/Hospitality, Media/Entertainment, Streaming Services, Publishing, Land Transport, Ride-Hailing Platforms/Services, Shell Company, Technology, Sharing/On-demand Economy Services, Transportation/Logistics, Financial Performance, Earnings, Corporate/Industrial News, Content Types, Factiva Filters, C&E Industry News Filter, Walt Disney Co., DIS, financial performance, earnings, corporate, industrial news, content types, factiva filters, c&e industry news filter, computers, consumer electronics, audio, video equipment, motor vehicles, passenger cars, alternative fuel vehicles, printing, publishing, newspaper publishing, taxi, limousine services, multimedia content services, audiovisual production, cinema film production, film, video exhibition, broadcasting, cable broadcasting, automotive, business, consumer services, consumer goods, media content distribution, durable household products, e-commerce, home electronics, appliances, online service providers, leisure, arts, hospitality, media, entertainment, streaming services, land transport, ride-hailing platforms, services, shell company, technology, sharing, on-demand economy services, transportation, logistics","Last month, Netflix Inc. NFLX, +1.80% stock jumped after it reported big subscriber gains and hiked prices. Last week, results from Paramount Global PARA, +15.4...",https://www.marketwatch.com/story/disney-and-other-entertainment-giants-report-after-upbeat-results-from-peers-but-investors-are-getting-harsher-on-companies-that-dont-deliver-c7318fa7,https://images.mktw.net/im-881106/social,en,2023-11-05T15:31:00.000000Z,marketwatch.com,,equity,Communication Services,10.113184,0.9325
2125bd49-bdf9-45cd-9055-5545943f03f4,"HUB Cyber Security : Immediate Report for General Material Information -November 05, 2023 at 10:32 am EST","Hub Security Announces New CFO, a Key Appointment in Its Leadership Team
      
      
        Tel-Aviv Israel, November 2, 2023 - HUB Cyber Security Ltd , a developer of Confidential...",Markets,"Hub Security Announces New CFO, a Key Appointment in Its Leadership Team Tel-Aviv Israel, November 2, 2023 - HUB Cyber Security Ltd (Nasdaq: HUBC), a developer ...",https://www.marketscreener.com/quote/stock/HUB-CYBER-SECURITY-LTD-148702520/news/HUB-Cyber-Security-Immediate-Report-for-General-Material-Information-45244219/,https://www.marketscreener.com/images/twitter_MS_fdblanc.png,en,2023-11-05T15:32:02.000000Z,marketscreener.com,,equity,Communication Services,7.903838,0.5994
e1f6c1d4-7c06-4881-a29c-9e9ec9180583,Here’s Why Netflix (NFLX) Sold Off in the Quarter,"Polen Capital, an investment management company, released its “Polen Focus Growth Strategy” third-quarter 2023 investor letter. A copy of the same can be downloaded here.",,"Polen Capital, an investment management company, released its “Polen Focus Growth Strategy” third-quarter 2023 investor letter. A copy of the same can be do...",https://www.insidermonkey.com/blog/heres-why-netflix-nflx-sold-off-in-the-quarter-1218045/,https://d2gr5kl7dt2z3t.cloudfront.net/blog/wp-content/uploads/2023/09/19143040/NFLX-insidermonkey-1695148237577.jpg,en,2023-11-06T12:13:39.000000Z,insidermonkey.com,,equity,Communication Services,41.050774999999994,0.465525
bdc19eca-5466-4683-9761-9e343ef053d0,"Zacks Value Investor Highlights: Visa, Netflix, Bank of America, Vertiv and Donnelley Financial","Visa, Netflix, Bank of America, Vertiv and Donnelley Financial have been highlighted in this Value Investor article.","stock, stocks, investment, investment advice, investing, online trading, online investment, online stock trading, stock market, financial, financial planning, quote, quotes, stock quotes","This page has not been authorized, sponsored, or otherwise approved or endorsed by the companies represented herein. Each of the company logos represented herei...",https://www.zacks.com/stock/news/2178830/zacks-value-investor-highlights-visa-netflix-bank-of-america-vertiv-and-donnelley-financial?cid=CS-ZC-FT-press_releases-2178830,https://staticx-tuner.zacks.com/images/articles/main/23/20486.jpg,en,2023-11-06T09:20:00.000000Z,zacks.com,,equity,Communication Services,25.576826,0.34
049d8858-93fc-48ff-a2ce-13066485c072,Scottish Mortgage Investment half-year underperforms market,"Scottish Mortgage Investment Trust PLC on Monday said its net asset value fell in its first half, as total return lagged behind a key index.

The Edinburgh-based company invests in growth companies,...",Markets,"(Alliance News) - Scottish Mortgage Investment Trust PLC on Monday said its net asset value fell in its first half, as total return lagged behind a key index.

...",https://www.marketscreener.com/quote/stock/SCOTTISH-MORTGAGE-INVESTM-16840490/news/Scottish-Mortgage-Investment-half-year-underperforms-market-45245853/,https://www.marketscreener.com/images/twitter_MS_fdblanc.png,en,2023-11-06T08:00:06.000000Z,marketscreener.com,,equity,Communication Services,17.4428005,0.7579000000000001
8e8c9087-08fd-4b25-9a00-ee8c22f44001,Dish swings to surprise loss as pay-TV subscribers slump By Reuters,Dish swings to surprise loss as pay-TV subscribers slump,,"Published Nov 06, 2023 07:42AM ET Updated Nov 06, 2023 07:50AM ET

© Reuters.

DISH +5.17% Add to/Remove from Watchlist

(Reuters) - Dish Network (NASDAQ: ) po...",https://www.investing.com/news/stock-market-news/dish-swings-to-surprise-loss-as-paytv-subscribers-slump-3223279,https://i-invdn-com.investing.com/news/LYNXNPEB6R0AQ_L.jpg,en,2023-11-06T12:50:44.000000Z,investing.com,,equity,Communication Services,13.287144,0.5423
5a47692c-96e8-44ba-a1ff-b7d6f1d3bd18,Disney Headlines A Quieter Week Of Earnings,A decision by the Fed to stand pat and some weaker than expected economic data to close out the week gave investors reason to be optimistic as we head into the final w...,"disney, Jerome Powell, Uber, employment, interest rates, Federal Reserve, Corporate earnings, inflation, bonds, yields","Disney will announce earnings this week as the company looks to end its stock's decline this year. ... [+] (Photo by Steve Granitz/WireImage) WireImage

Takeawa...",https://www.forbes.com/sites/jjkinahan/2023/11/06/disney-headlines-a-quieter-week-of-earnings/,https://imageio.forbes.com/specials-images/imageserve/6548edb9ba114297107e6d72/0x0.jpg?format=jpg&height=900&width=1600&fit=bounds,en,2023-11-06T13:46:35.000000Z,forbes.com,,equity,Communication Services,10.153851,0.802
900288de-1775-4f4c-aca6-53ee26d32937,"Disney and other entertainment giants report after upbeat results from peers, but investors are getting harsher on companies that don’t deliver","This week, Walt Disney Co., Warner Bros. Discovery Inc., Lions Gate Entertainment Corp. and AMC Entertainment Holdings Inc. all report earnings results","article_normal, Computers/Consumer Electronics, Audio/Video Equipment, Motor Vehicles, Passenger Cars, Alternative Fuel Vehicles, Printing/Publishing, Newspaper Publishing, Taxi/Limousine Services, Multimedia Content Services, Audiovisual Production, Cinema Film Production, Film/Video Exhibition, Broadcasting, Cable Broadcasting, Automobiles, Business/Consumer Services, Consumer Goods, Media Content Distribution, Durable Household Products, E-commerce, Consumer Electronics, Home Electronics/Appliances, Online Service Providers, Leisure/Arts/Hospitality, Media, Streaming Services, Publishing, Land Transport, Ride-Hailing Platforms/Services, Shell Company, Technology, Sharing/On-demand Economy Services, Transportation/Logistics, Financial Performance, Earnings, Corporate/Industrial News, Content Types, Factiva Filters, C&E Industry News Filter, Walt Disney Co., DIS, financial performance, earnings, corporate, industrial news, content types, factiva filters, c&e industry news filter, computers, consumer electronics, audio, video equipment, motor vehicles, passenger cars, alternative fuel vehicles, printing, publishing, newspaper publishing, taxi, limousine services, multimedia content services, audiovisual production, cinema film production, film, video exhibition, broadcasting, cable broadcasting, automobiles, business, consumer services, consumer goods, media content distribution, durable household products, e-commerce, home electronics, appliances, online service providers, leisure, arts, hospitality, media, streaming services, land transport, ride-hailing platforms, services, shell company, technology, sharing, on-demand economy services, transportation, logistics","Last month, Netflix Inc. NFLX, +1.80% stock jumped after it reported big subscriber gains and hiked prices. Last week, results from Paramount Global PARA, +15.4...",https://www.marketwatch.com/story/disney-and-other-entertainment-giants-report-after-upbeat-results-from-peers-but-investors-are-getting-harsher-on-companies-that-dont-deliver-c7318fa7?g=%7B0FEF55C7-61A4-4937-9166-33B365CCB995%7D&siteid=bulletrss,https://images.mktw.net/im-881106/social,en,2023-11-06T01:19:53.000000Z,marketwatch.com,,equity,Communication Services,10.113838166666667,0.9325
49eebdc1-7540-426a-9cf9-09a90e02952a,Paramount Global shares drop following Bank of America downgrade By Investing.com,Paramount Global shares drop following Bank of America downgrade,,"Published Nov 06, 2023 12:52PM ET

© Reuters

PARA -8.07% Add to/Remove from Watchlist

Shares of Paramount Global (NASDAQ:PARA) suffered a significant hit tod...",https://www.investing.com/news/stock-market-news/paramount-global-shares-drop-following-bank-of-america-downgrade-93CH-3223845,https://i-invdn-com.investing.com/news/moved_LYNXMPEI160OQ_L.jpg,en,2023-11-06T17:52:25.000000Z,investing.com,,equity,Communication Services,10.114864,0.5574
ffb98270-4ae6-48f4-a50c-de73673e886c,Top Articles: Week of Oct 30,"MOST READ: Stocks, dividends, and telecom were the most viewed pieces of content last week.",TOP ARTICLES,"This Canadian High Dividend Stock is 25% Undervalued

This stock has a forward dividend yield of 7.14%, and boasts a narrow economic moat.

Four Cheap Canadian ...",https://www.morningstar.ca/ca/news/237315/top-articles-week-of-oct-30.aspx,https://www.morningstar.co.uk/static/UploadManager/Image/Top%20of%20peak%20-%20Banff%20-%20550px.jpg,en,2023-11-06T06:38:00.000000Z,morningstar.ca,,equity,Communication Services,3.16007,0.6097
9485887f-dcd8-421d-9f64-dc630b891c83,This Is What Whales Are Betting On Netflix - Netflix (NASDAQ:NFLX),,,"Loading... Loading... Loading...

A deep-pocketed investor has adopted a bullish approach towards Netflix NFLX, and it's something market players shouldn't igno...",https://www.benzinga.com/markets/options/23/11/35649621/this-is-what-whales-are-betting-on-netflix,https://cdn.benzinga.com/files/images/story/2023/movers_image_5.jpeg?width=1200&height=800&fit=crop,en,2023-11-07T16:01:04.000000Z,benzinga.com,,equity,Communication Services,63.97525,0.1943
4d219406-7afa-4328-bfe9-ce6630277938,Netflix Inc: An Exploration into Its Intrinsic Value,"In this article, we will take a look into Netflix Inc's (NFLX) DCF analysis, a reliable and data-driven approach to estimating its intrinsic value. Instead of u","GuruFocus, Article, News, GuruFocus Research, NFLX","In this article, we will take a look into Netflix Inc's (NFLX, Financial) DCF analysis, a reliable and data-driven approach to estimating its intrinsic value. I...",https://www.gurufocus.com/news/2119715/netflix-inc-an-exploration-into-its-intrinsic-value,https://static.gurufocus.com/logos/0C00000BRT.png?5,en,2023-11-07T11:02:07.000000Z,gurufocus.com,,equity,Communication Services,62.16361,0.62502
e6bada16-9e4e-4e82-b974-a8478f35184c,"Netflix, Inc. (NFLX) Is a Trending Stock: Facts to Know Before Betting on It","Netflix (NFLX) has received quite a bit of attention from Zacks.com users lately. Therefore, it is wise to be aware of the facts that can impact the stock's prospects.","stock, stocks, investment, investment advice, investing, online trading, online investment, online stock trading, stock market, financial, financial planning, quote, quotes, stock quotes","This page has not been authorized, sponsored, or otherwise approved or endorsed by the companies represented herein. Each of the company logos represented herei...",https://www.zacks.com/stock/news/2179965/netflix-inc-nflx-is-a-trending-stock-facts-to-know-before-betting-on-it?cid=CS-ZC-FT-tale_of_the_tape|most_searched_stocks-2179965,https://staticx-tuner.zacks.com/images/default_article_images/default318.jpg,en,2023-11-07T14:00:11.000000Z,zacks.com,,equity,Communication Services,51.640651833333344,0.0
6b96fb19-b186-4124-8d23-8ab773f96bf6,Netflix shares continue to rise amid broader market upswing By Investing.com,Netflix shares continue to rise amid broader market upswing,,"Published Nov 07, 2023 09:51AM ET Updated Nov 07, 2023 09:51AM ET

© Reuters

NFLX -0.20% Add to/Remove from Watchlist US500 +0.09% Add to/Remove from Watchlis...",https://www.investing.com/news/stock-market-news/netflix-shares-continue-to-rise-amid-broader-market-upswing-93CH-3225235,https://i-invdn-com.investing.com/news/Netflix_800x533_L_1634734744.jpg,en,2023-11-07T14:51:49.000000Z,investing.com,,equity,Communication Services,31.9057035,0.074
3dcd3099-f946-4868-be34-c9a8739e41b5,Dow Jones Climbs Despite Renewed Fed Rate Fears; Netflix Raises Prices As Disney Looms,The Dow Jones and other indexes searched for direction as fears of a rate hike returned. Netflix is raising prices for the holidays.,,The Dow Jones Industrial Average rose 0.2% in morning trades Tuesday despite renewed talk of interest rate hikes from the Federal Reserve. The closely watched i...,https://www.investors.com/market-trend/stock-market-today/dow-jones-paused-as-fed-rate-fears-return-netflix-raises-prices-for-holidays-as-disney-looms/,https://www.investors.com/wp-content/uploads/2019/05/stock-disney-mickey-07-shutter.jpg,en,2023-11-07T16:21:16.000000Z,investors.com,,equity,Communication Services,23.609364,0.13195
21c2d54d-62fc-47f2-9dea-b67480515d69,Airbnb took in $4bn in rent in Italy. Now the country’s Finance Police is seizing $835m of it because they allegedly didn’t pay taxes,Because Airbnb allegedly didn’t pay taxes.,,"Italy’s Finance Police is seizing about €779 million ($835 million) from the home-sharing company Airbnb Inc. after it allegedly failed to pay some taxes.

...",https://fortune.com/europe/2023/11/07/airbnb-4bn-rent-italy-finance-police-seizing-835m-taxes/,"https://content.fortune.com/wp-content/uploads/2023/11/GettyImages-1694891372-e1699351469396.jpg?resize=1200,600",en,2023-11-07T10:09:32.000000Z,fortune.com,,equity,Communication Services,17.751863166666666,-0.4939
2ea23a96-8795-4fc3-9830-1dd7f37fcc3f,Fox Corp Cl A shares break five-day winning streak despite market gains By Investing.com,Fox Corp Cl A shares break five-day winning streak despite market gains,,"Published Nov 07, 2023 03:06AM ET

© Pavlo Gonchar / SOPA Images/Sipa via Reuters Connect

FOXA -1.63% Add to/Remove from Watchlist US500 +0.18% Add to/Remove ...",https://www.investing.com/news/stock-market-news/fox-corp-cl-a-shares-break-fiveday-winning-streak-despite-market-gains-93CH-3224424,https://i-invdn-com.investing.com/news/SP500StandardandPoors500Index_800x533_L_1657544297.jpg,en,2023-11-07T08:06:24.000000Z,investing.com,,equity,Communication Services,13.576029,0.6249
ef41d974-dbcc-4495-a0e5-315051edaf1f,"Hollywood actors' union notes disagreements with studios' offer, including AI By Reuters","Hollywood actors' union notes disagreements with studios' offer, including AI",,"Published Nov 06, 2023 07:34PM ET

© Reuters. FILE PHOTO: Duncan Crabtree-Ireland, SAG-AFTRA National Executive Director and Chief Negotiator, speaks next to S...",https://www.investing.com/news/stock-market-news/hollywood-actors-union-notes-disagreements-with-studios-offer-including-ai-3224220,https://i-invdn-com.investing.com/news/LYNXNPEC0D0AP_L.jpg,en,2023-11-07T00:40:59.000000Z,investing.com,,equity,Communication Services,11.666019,0.6369
3ce181dc-8f72-4b8b-8423-aaa78b6006a3,"Old American Brand Names Rally: Abercrombie, Hilton, Motorola, Sunoco","While some of the best-known, world renown Nasdaq tech and social media stocks struggle to make higher highs — Apple, Alphabet, Microsoft and Netflix come to mind — th...","American Brand Names, Old American Brand Names Rally: Abercrombie, New York Stock Exchange, Abercrombie & Fitch, Mike Jeffries, Motorola, Hilton, Sunoco, Apple, Microsoft","Abercrombie, Hilton getty

While some of the best-known Nasdaq-100 tech and social media stocks struggle to make higher highs — Apple AAPL , Alphabet, Microso...",https://www.forbes.com/sites/johnnavin/2023/11/06/old-american-brand-names-rally-abercrombie-hilton-motorola-sunoco/,https://imageio.forbes.com/specials-images/imageserve/6549a3c7d757446c4468ae11/0x0.jpg?format=jpg&height=900&width=1600&fit=bounds,en,2023-11-07T02:46:15.000000Z,forbes.com,,equity,Communication Services,11.197704,-0.3182
19f39418-1a48-4fdc-b1ef-a154a49615cd,"Disney shares rise on huge increase in streaming users, improved earnings","Walt Disney Co.'s stock edged up 2% in extended trading Wednesday after the media giant announced earnings that beat estimates, a huge jump in streaming...","article_normal, dis, Broadcasting, Cable Broadcasting, Internet/Online Services, Leisure/Arts, Media, Technology, Financial Performance, Earnings, Share Price Movement/Disruptions, Corporate/Industrial News, Equity Markets, Commodity/Financial Market News, Content Types, Factiva Filters, C&E Exclusion Filter, C&E Industry News Filter, DIS, Walt Disney Co., financial performance, earnings, share price movement, disruptions, corporate, industrial news, equity markets, commodity, financial market news, content types, factiva filters, c&e exclusion filter, c&e industry news filter, broadcasting, cable broadcasting, internet, online services, leisure, arts, media, technology","Walt Disney Co.’s stock edged up 2% in extended trading Wednesday after the media giant announced earnings that beat estimates, a huge jump in streaming users...",https://www.marketwatch.com/story/disney-shares-rise-on-huge-increase-in-streaming-users-improved-earnings-1299f071?g=%7B879DB912-4CFB-4F40-865C-6C4E45612013%7D&siteid=bulletrss,https://images.mktw.net/im-810420/social,en,2023-11-08T21:26:26.000000Z,marketwatch.com,,equity,Communication Services,15.350817166666666,0.25
641ef932-ae48-4318-9801-e3ab35c26259,"Disney shares rise on huge increase in streaming users, improved earnings","Walt Disney Co.'s stock edged up 2% in extended trading Wednesday after the media giant announced earnings that beat estimates, a huge jump in streaming...","article_normal, dis, Broadcasting, Cable Broadcasting, Internet/Online Services, Leisure/Arts, Media, Technology, Financial Performance, Earnings, Share Price Movement/Disruptions, Corporate/Industrial News, Equity Markets, Commodity/Financial Market News, Content Types, Factiva Filters, C&E Exclusion Filter, C&E Industry News Filter, DIS, Walt Disney Co., financial performance, earnings, share price movement, disruptions, corporate, industrial news, equity markets, commodity, financial market news, content types, factiva filters, c&e exclusion filter, c&e industry news filter, broadcasting, cable broadcasting, internet, online services, leisure, arts, media, technology","Walt Disney Co.’s stock edged up 2% in extended trading Wednesday after the media giant announced earnings that beat estimates, a huge jump in streaming users...",https://www.marketwatch.com/story/disney-shares-rise-on-huge-increase-in-streaming-users-improved-earnings-1299f071,https://images.mktw.net/im-810420/social,en,2023-11-08T21:25:00.000000Z,marketwatch.com,,equity,Communication Services,15.350817166666666,0.25
c15a554f-5548-4ae4-85e6-47e4479bdad6,iQIYI: Risk/Reward Very Enticing Even With Beaten-Down Estimates (NASDAQ:IQ),"iQIYI could be a great investment choice with its growing profitability, vast market potential, and expanding subscriber count. Learn more about IQ stock here.",,"demaerre

Investment Thesis

I wanted to take a look at iQIYI, Inc. (NASDAQ:IQ) to see if it would be a good time to start a position before it reports earnings...",https://seekingalpha.com/article/4649249-iqiyi-risk-reward-very-enticing-even-with-beaten-down-estimates,https://static.seekingalpha.com/cdn/s3/uploads/getty_images/1412871535/image_1412871535.jpg?io=getty-c-w1536,en,2023-11-08T19:12:50.000000Z,seekingalpha.com,,equity,Communication Services,11.810375,0.5583999999999999
9b978702-2827-4583-a25d-710c8bf221be,These 8 days explain the stock market's gains this year - and show there are just 4 factors driving the moves,,,"Just eight out of 251 trading days can explain the market's big moves this year, DataTrek said.

Four factors are largely behind the moves: Fed policy, long ter...",https://markets.businessinsider.com/news/stocks/stock-market-rally-year-end-bond-crash-treasury-yields-recession-2023-11,https://i.insider.com/654b8a78b788914e55524a8f?width=1200&format=jpeg,en,2023-11-08T16:36:10.000000Z,businessinsider.com,,equity,Communication Services,8.958677,0.8625
