uuid,title,description,keywords,snippet,url,image_url,language,published_at,source,relevance_score,type,industry,match_score,sentiment_score
88d09997-dd94-4349-a4b6-39182a892d29,Top Articles: Week of Oct 23,MOST READ: Dividends and Blackberry were the most viewed pieces of content last week.,TOP ARTICLES,"A Dividend Aristocrat to Buy That’s 26% Undervalued

This wide-moat company’s stock looks cheaper than it has in several years.

After Earnings, Is BlackBer...",https://www.morningstar.ca/ca/news/237315/top-articles-week-of-oct-23.aspx,https://www.morningstar.co.uk/static/UploadManager/Image/Top%20of%20peak%20-%20Banff%20-%20550px.jpg,en,2023-10-30T06:38:00.000000Z,morningstar.ca,,equity,Communication Services,3.157902,0.6097
013c041e-6be7-4117-921f-2cf3746b3b39,Looking At Netflix's Recent Unusual Options Activity - Netflix (NASDAQ:NFLX),,,"Loading... Loading... Loading...

A whale with a lot of money to spend has taken a noticeably bullish stance on Netflix.

Looking at options history for Netflix...",https://www.benzinga.com/markets/options/23/10/35515594/looking-at-netflixs-recent-unusual-options-activity,https://cdn.benzinga.com/files/images/story/2023/movers_image_1.jpeg?width=1200&height=800&fit=crop,en,2023-10-31T14:31:53.000000Z,benzinga.com,,equity,Communication Services,59.15771,0.25585
0f219f16-d9e2-4e4f-b473-9aa7ffe21aab,"Zacks Investment Ideas feature highlights: QQQ, IWM, Netflix, Microsoft and Nvidia","QQQ, IWM, Netflix, Microsoft and Nvidia are part of the Zacks Investment Ideas article.","stock, stocks, investment, investment advice, investing, online trading, online investment, online stock trading, stock market, financial, financial planning, quote, quotes, stock quotes","This page has not been authorized, sponsored, or otherwise approved or endorsed by the companies represented herein. Each of the company logos represented herei...",https://www.zacks.com/stock/news/2175102/zacks-investment-ideas-feature-highlights-qqq-iwm-netflix-microsoft-and-nvidia?cid=CS-ZC-FT-press_releases-2175102,https://staticx-tuner.zacks.com/images/articles/main/a0/43171.jpg,en,2023-10-31T10:14:00.000000Z,zacks.com,,equity,Communication Services,26.838707,0.0
6c1ee5bb-1f8f-4186-9e5d-b3a4449ff670,"Netflix, Microsoft, and More. Here Are the Top and Bottom Stock Performers for October.",Microsoft leads the Dow as the index’s best performing stock this month while Chevron is its worst performer.,"article_normal, Computers/Consumer Electronics, Software, Applications Software, Semiconductors, Computing, Industrial Electronics, Industrial Goods, Technology, Financial Performance, Share Price Movement/Disruptions, Corporate/Industrial News, Content Types, Factiva Filters, C&E Exclusion Filter, C&E Industry News Filter, SYND, Markets, Media, Consumer, Microsoft, MSFT, Chevron, CVX, Hess, HES, Netflix, NFLX, Align Technology, ALGN, SolarEdge Technologies, SEDG, Dollar General, DG, Invesco Solar ETF, TAN, NASDAQ 100 Index (NASDAQ Calculation), NDX, S&P 500 Index, SPX, Dow Jones Industrial Average, DJIA, financial performance, share price movement, disruptions, corporate, industrial news, content types, factiva filters, c&e exclusion filter, c&e industry news filter, markets, media, technology, consumer, computers, consumer electronics, software, applications software, semiconductors, computing, industrial electronics, industrial goods","October is coming to a close on Tuesday, and while kids are getting ready to put on their costumes to go trick-or-treating, investors are reflecting on what was...",https://www.marketwatch.com/articles/djia-best-worst-stocks-october-7d436add,https://images.barrons.com/im-630545/social,en,2023-10-31T18:26:00.000000Z,marketwatch.com,,equity,Communication Services,24.838486,0.53865
243224eb-a74e-4e4b-a05e-1cad0bb0aaf8,"Hollywood Actors, Studios To Resume Contract Talks",Hollywood studios and actors are scheduled to resume contract talks on Tuesday aimed at ending a strike that has largely shut down film and TV production.,"NFLX:US, DIS:US, ALLTOP, BUSINESS, COS, INDUSTRIES, LIFESTYLE, MED, NORTHAM, TMT, TOP, US, WORLD, WWTOP, WWTOPAM, WWTOPAS","The Screen Actors Guild, in a statement Monday, said that “while talks have been productive, we remain far apart on key issues.” The union urged members to ...",https://www.bqprime.com/business/hollywood-studios-striking-actors-to-resume-talks-on-tuesday,https://gumlet.assettype.com/bloombergquint%2F2023-10%2Fac71a009-731e-4d96-b028-614bfb2dbb5c%2F_1x_1.jpg?w=1200&auto=format%2Ccompress&ogImage=true,en,2023-10-31T17:36:53.000000Z,bloombergquint.com,,equity,Communication Services,21.450401333333332,0.0
40de061c-bc9b-43ee-970b-1ba2fdcfab9f,30 Most Barbaric Countries in the World,"There are many definitions of barbarism, but all of them have one thing in common: cruel and violent behavior.",,"In this article, we will look at the 30 most barbaric countries in the world.

There are many definitions of barbarism, but all of them have one thing in common...",https://www.insidermonkey.com/blog/30-most-barbaric-countries-in-the-world-1207985/,https://d2gr5kl7dt2z3t.cloudfront.net/blog/wp-content/uploads/2017/04/19052314/shutterstock_552424993.jpg,en,2023-10-31T23:31:52.000000Z,insidermonkey.com,,equity,Communication Services,11.450485333333335,-0.9295
5a5baded-1608-4c97-bff1-671a3bc885a2,Apple (AAPL) to Report Q4 Earnings: What's in the Offing?,Apple's (AAPL) fourth-quarter fiscal 2023 results are likely to reflect strong services growth despite macroeconomic headwinds and unfavorable forex.,,"Apple AAPL is set to report its fourth-quarter fiscal 2023 results on Nov 2.



The company expects the to-be-reported quarter’s year-over-year revenue growth...",https://finance.yahoo.com/news/apple-aapl-report-q4-earnings-170900826.html?.tsrc=rss,https://media.zenfs.com/en/zacks.com/4559ba18e310a117276bf6dedbe00edd,en,2023-10-31T17:09:00.000000Z,finance.yahoo.com,,equity,Communication Services,14.676606166666668,0.9087
d803e547-8433-49bb-acd3-a39ee753e07c,Striking US actors union says major issues still unresolved with studios By Reuters,Striking US actors union says major issues still unresolved with studios,,"Published Oct 30, 2023 11:49PM ET Updated Oct 30, 2023 11:55PM ET

© Reuters. FILE PHOTO: SAG-AFTRA members walk the picket line on the 100th day of their ongo...",https://www.investing.com/news/stock-market-news/striking-us-actors-union-says-major-issues-still-unresolved-with-studios-3214568,https://i-invdn-com.investing.com/news/LYNXNPEB6R0AQ_L.jpg,en,2023-10-31T03:50:44.000000Z,investing.com,,equity,Communication Services,12.035517,0.25
a9c0c702-a9e6-4d44-8461-828a031c7630,Spotify: Focus On Profitability Makes Me Positive (NYSE:SPOT),Spotify's growing exposure to podcasting and advertising could improve its profitability in the long term. Read why I assign a Buy rating to SPOT stock.,,"Delmaine Donson

Investment Thesis

Spotify Technology S.A.'s (NYSE:SPOT) growing exposure to podcasting and advertising could counterbalance any potential slow...",https://seekingalpha.com/article/4645627-spotify-stock-q3-2023-earnings-focus-profitability-buy,https://static.seekingalpha.com/cdn/s3/uploads/getty_images/1437814880/image_1437814880.jpg?io=getty-c-w1536,en,2023-10-31T23:51:18.000000Z,seekingalpha.com,,equity,Communication Services,7.8771233333333335,0.5423
9cdf740e-3980-4c87-b3e2-23ac7896bb97,'Massive victory': Workers getting the biggest raises in decades after U.S. labour wins,Workers in the US are getting record-breaking wage hikes this year thanks to strategic strikes and stunning contract wins. Read on.,,"This advertisement has not loaded yet, but your article continues below.

'Massive victory': Workers getting the biggest raises in decades after U.S. labour win...",https://financialpost.com/fp-work/workers-biggest-raises-decades,https://smartcdn.gprod.postmedia.digital/financialpost/wp-content/uploads/2023/10/uaw-labour-vw1031.jpg,en,2023-10-31T15:28:40.000000Z,financialpost.com,,equity,Communication Services,6.524331,0.03339999999999999
b1481e0e-5832-4e71-ad64-5dcacfcfa6d4,Should You Hold Netflix (NFLX)?,"Ensemble Capital Management, an investment management company, released its third quarter 2023 investor letter. A copy of the same can be downloaded here.",,"Ensemble Capital Management, an investment management company, released its third quarter 2023 investor letter. A copy of the same can be downloaded here. Durin...",https://www.insidermonkey.com/blog/should-you-hold-netflix-nflx-1214811/,https://d2gr5kl7dt2z3t.cloudfront.net/blog/wp-content/uploads/2021/09/13020533/thibault-penin-AWOl7qqsffM-unsplash.jpg,en,2023-11-01T10:55:41.000000Z,insidermonkey.com,,equity,Communication Services,45.06136166666667,0.3083416666666667
d2623a68-044f-4c49-a0d5-50a8ff167490,Could Netflix Stage a Comeback?,"Stocks Analysis by The Tokenist (Timothy Fries) covering: Netflix Inc, Netflix Inc, Netflix Inc DRC, COMMERZBANK AG Call 92 USD Netflix Inc 31Dec99. Read The Tokenist (Timothy Fries)'s latest article on Investing.com",,"Netflix (NASDAQ: )'s stock price grew with a resurgence in user growth, and healthy financials and successful ad tier suggest there's more to come.

Netflix, on...",https://www.investing.com/analysis/could-netflix-stage-a-comeback-200643238,https://i-invdn-com.investing.com/redesign/images/seo/investingcom_analysis_og.jpg,en,2023-11-01T18:50:00.000000Z,investing.com,,equity,Communication Services,29.911198,0.551214
fd2388f3-75a5-4792-b758-153f6e42f581,Netflix's ad tier reaches 15 million users a year after launch By Reuters,Netflix's ad tier reaches 15 million users a year after launch,,"Published Nov 01, 2023 11:40AM ET Updated Nov 01, 2023 11:46AM ET

© Reuters. FILE PHOTO: Smartphone with Netflix logo is placed on a keyboard in this illustra...",https://www.investing.com/news/stock-market-news/netflixs-ad-tier-reaches-15-million-users-a-year-after-launch-3217465,https://i-invdn-com.investing.com/news/2af302cbecff10d63ab1791c6d04f3de_L.jpg,en,2023-11-01T15:46:05.000000Z,investing.com,,equity,Communication Services,16.45238,0.41174
8d2d9b35-00b1-4b08-9051-ccd3a00e4dd8,My Top FAANG Stock to Buy for the Second Half of 2023 (and Beyond),"The FAANG stocks are a group of mostly tech stocks that led the way for the market over the past decade. They are: Facebook (now known as Meta Platforms), Apple, Amazon (NASDAQ: AMZN), Netflix, and Google (now known as Alphabet) While this cohort trounced the market leading up to 2022, it hasn't done well since then.",,"The FAANG stocks are a group of mostly tech stocks that led the way for the market over the past decade. They are: Facebook (now known as Meta Platforms), Apple...",https://finance.yahoo.com/m/2b26581d-553f-3f19-a5f7-d6a8c4eb371f/my-top-faang-stock-to-buy-for.html?.tsrc=rss,https://s.yimg.com/ny/api/res/1.2/3mt3Nuqy6prRtkyajU8Tlg--/YXBwaWQ9aGlnaGxhbmRlcjt3PTEyMDA7aD04MDA-/https://media.zenfs.com/en/motleyfool.com/f0bd4587aa93145d9b90a99ea6998972,en,2023-11-01T11:00:00.000000Z,finance.yahoo.com,,equity,Communication Services,15.003106,0.0971
6fc6900b-c837-41b6-bdf0-414ab72898a6,15 Stocks to Buy as ‘Hawkish’ Fed Keeps Door Open for Future Hikes,Stocks Analysis by Investing.com (Jesse Cohen) covering: . Read Investing.com (Jesse Cohen)'s latest article on Investing.com,,"In a widely expected decision, the Fed held off on raising interest rates for the second consecutive meeting but kept the door open for further tightening this ...",https://www.investing.com/analysis/15-stocks-to-buy-as-hawkish-fed-keeps-door-open-for-future-hikes-200643237,https://i-invdn-com.investing.com/redesign/images/seo/investingcom_analysis_og.jpg,en,2023-11-01T18:37:00.000000Z,investing.com,,equity,Communication Services,12.349165,-0.8807
b49c3662-52ba-4834-a09f-4e128d520b1f,Cumulus Media Introduces Hello Rossipes Podcast,Ross Mathews and Bethie Hungerford to Host All-New Cooking Podcast Each Wednesday Beginning November 8...,"Nasdaq:CMLS, Cumulus Media Inc., #RossMathews, #CumulusPodcastNetwork, #Audio, #Cooking","NEW YORK, Nov. 01, 2023 (GLOBE NEWSWIRE) -- Cumulus Media (NASDAQ: CMLS) today introduces Hello Rossipes, a new weekly cooking podcast featuring TV host and pro...",https://www.globenewswire.com/news-release/2023/11/01/2771614/9032/en/Cumulus-Media-Introduces-Hello-Rossipes-Podcast.html,https://ml.globenewswire.com/Resource/Download/60169da3-936a-4c59-a78f-317945e702e6,en,2023-11-01T17:40:00.000000Z,globenewswire.com,,equity,Communication Services,10.965419,0.2023
3a3a9e75-60fe-46e6-8d5b-7b6edec6fc7a,Paramount Stock Is Down 70% Since 2021. Will A Q3 Earnings Surprise Drive A Recovery For The Stock?,"Paramount Global stock (NASDAQ: PARA) is expected to publish its Q3 2023 results on November 2, reporting on a quarter that is likely to see the company’s revenues sho...","Trefis, HQ Portfolio, Paramount, paramount, para stock, para revenue","16 September 2023, USA, New York: The Paramount logo in Times Square, taken in Manhattan. Photo: ... [+] Michael Kappeler/dpa (Photo by Michael Kappeler/picture...",https://www.forbes.com/sites/greatspeculations/2023/11/01/paramount-stock-is-down-70-since-2021-will-a-q3-earnings-surprise-drive-a-recovery-for-the-stock/,https://imageio.forbes.com/specials-images/imageserve/6541e8a4a3ef24d7670fe483/0x0.jpg?format=jpg&height=900&width=1600&fit=bounds,en,2023-11-01T10:30:25.000000Z,forbes.com,,equity,Communication Services,10.002302,0.73095
defa0564-702d-4380-aa0e-f865155b30db,Disney Stock: Don't Expect A Huge Upside (NYSE:DIS),"Disney's near-term stock performance doesn't look promising, with the risk outweighing potential rewards. Click here to read why I rate DIS stock a Sell now.",,"JHVEPhoto

Thesis

In light of the comprehensive analysis conducted, it is evident that The Walt Disney Company's (NYSE:DIS) short-term stock performance presen...",https://seekingalpha.com/article/4645791-disney-stock-dont-expect-a-huge-upside,https://static.seekingalpha.com/cdn/s3/uploads/getty_images/1445766832/image_1445766832.jpg?io=getty-c-w1536,en,2023-11-01T12:57:05.000000Z,seekingalpha.com,,equity,Communication Services,8.589533166666667,0.46205
7608c9f9-d3db-4b3a-bfc0-aa4590fa75a9,Netflix Doesn't Deserve Its Recent Appreciation (NASDAQ:NFLX),"Netflix's growth has been supported by its total streaming memberships, which have reached 247.15 million with 10.8% YoY growth. Learn more on NFLX stock here.",,"Nanci Santos

Netflix, Inc. (NASDAQ:NFLX) is the largest publicly traded streaming company in the world, with a market cap of almost $200 billion. The company's...",https://seekingalpha.com/article/4646764-netflix-doesnt-deserve-its-recent-appreciation,https://static.seekingalpha.com/cdn/s3/uploads/getty_images/1603700869/image_1603700869.jpg?io=getty-c-w1536,en,2023-11-02T21:23:10.000000Z,seekingalpha.com,,equity,Communication Services,37.203224,0.7269170000000001
630aa758-daa4-4f93-bbaf-54fa8556d17e,Netflix Just Issued a Warning That All Media Stock Investors Must Hear,"In its recent letter to shareholders, Netflix (NASDAQ: NFLX) shared a prediction for the future that could impact every major television and movie studio.  Netflix built itself on the back of licensing other media companies' content.  Netflix's competitors are finding out it's not as easy to extract additional value out of their own content as Netflix makes it look.",,"In its recent letter to shareholders, Netflix (NASDAQ: NFLX) shared a prediction for the future that could impact every major television and movie studio. Netfl...",https://finance.yahoo.com/m/22a82c9d-cef6-353b-aac9-f9059009678e/netflix-just-issued-a-warning.html?.tsrc=rss,https://s.yimg.com/ny/api/res/1.2/5eC3wwtr5sc_w55K8InEzg--/YXBwaWQ9aGlnaGxhbmRlcjt3PTEyMDA7aD04MDA-/https://media.zenfs.com/en/motleyfool.com/22294caa4b0b1bcd64bb91f93f0edf6d,en,2023-11-02T09:20:00.000000Z,finance.yahoo.com,,equity,Communication Services,45.621643,0.070933
bf51cbd3-4eab-4522-ac33-4abc69e322db,"Zacks Investment Ideas feature highlights: Tesla, Alphabet, Pinterest, Netflix and Meta Platforms","Tesla, Alphabet, Pinterest, Netflix and Meta Platforms are part of the Zacks Investment Ideas article.","stock, stocks, investment, investment advice, investing, online trading, online investment, online stock trading, stock market, financial, financial planning, quote, quotes, stock quotes","This page has not been authorized, sponsored, or otherwise approved or endorsed by the companies represented herein. Each of the company logos represented herei...",https://www.zacks.com/stock/news/2177380/zacks-investment-ideas-feature-highlights-tesla-alphabet-pinterest-netflix-and-meta-platforms?cid=CS-ZC-FT-press_releases-2177380,https://staticx-tuner.zacks.com/images/articles/main/81/12600.jpg,en,2023-11-02T13:19:00.000000Z,zacks.com,,equity,Communication Services,26.181044,0.0
92f40b4e-a595-4ac1-99b5-5d44502581e2,"AT&T shares rise for third consecutive day, outpacing Disney but trailing Netflix and Comcast By Investing.com","AT&T shares rise for third consecutive day, outpacing Disney but trailing Netflix and Comcast",,"Published Nov 02, 2023 05:36AM ET

© Reuters

T +1.17% Add to/Remove from Watchlist DIS -0.64% Add to/Remove from Watchlist CMCSA +1.28% Add to/Remove from Wat...",https://www.investing.com/news/stock-market-news/att-shares-rise-for-third-consecutive-day-outpacing-disney-but-trailing-netflix-and-comcast-93CH-3218447,https://i-invdn-com.investing.com/news/moved_LYNXMPEJ6G09Q_L.jpg,en,2023-11-02T09:36:20.000000Z,investing.com,,equity,Communication Services,23.990232,0.5025
f8ceab7d-8c0d-4234-a672-8d6d6c50b69b,US streaming stocks jump as Roku signals ad market recovery By Reuters,US streaming stocks jump as Roku signals ad market recovery,,"Published Nov 02, 2023 07:22AM ET Updated Nov 02, 2023 01:31PM ET

© Reuters. FILE PHOTO A video sign displays the logo for Roku Inc, a Fox-backed video stream...",https://www.investing.com/news/stock-market-news/roku-soars-as-improving-ad-revenue-fuels-upbeat-forecast-3218987,https://i-invdn-com.investing.com/news/LYNXMPEDAF0IH_L.jpg,en,2023-11-02T17:31:15.000000Z,investing.com,,equity,Communication Services,14.024961,0.6124
c49ed269-51d6-47e6-ad57-54f5a270b75a,"Q3 Earnings Season Scorecard and Analyst Reports for Merck, Bank of America & AMD","Today's Research Daily features the Q3 earnings season scorecard and new research reports on Merck (MRK), Bank of America (BAC), AMD (AMD) and others.",,"Thursday, November 2, 2023



The Zacks Research Daily presents the best research output of our analyst team. Today's Research Daily features a real-time update...",https://finance.yahoo.com/news/q3-earnings-season-scorecard-analyst-203700828.html?.tsrc=rss,https://media.zenfs.com/en/zacks.com/cdcfe82daada6304206839820f5aa2ea,en,2023-11-02T20:37:00.000000Z,finance.yahoo.com,,equity,Communication Services,13.120376666666665,0.5781
bbf2354d-2224-4db8-bb79-2bbfefe526ee,"Roku Q3 revenue exceeds expectations, plans for positive adjusted EBITDA by 2024 By Investing.com","Roku Q3 revenue exceeds expectations, plans for positive adjusted EBITDA by 2024",,"Published Nov 02, 2023 04:41AM ET

© Reuters.

ROKU +0.22% Add to/Remove from Watchlist

Roku (NASDAQ: NASDAQ: ), the online TV streaming service provider, has...",https://www.investing.com/news/stock-market-news/roku-q3-revenue-exceeds-expectations-plans-for-positive-adjusted-ebitda-by-2024-93CH-3218386,https://i-invdn-com.investing.com/news/LYNXNPEB9M0BY_L.jpg,en,2023-11-02T08:41:07.000000Z,investing.com,,equity,Communication Services,12.75242,0.743
0a1582e4-1a45-4a61-a485-e5839b2195c5,"Actors, Hollywood studios still at odds on AI and other issues, union says By Reuters","Actors, Hollywood studios still at odds on AI and other issues, union says",,"Published Nov 02, 2023 12:37AM ET Updated Nov 02, 2023 12:42AM ET

© Reuters. FILE PHOTO: SAG-AFTRA members walk the picket line on the 100th day of their ongo...",https://www.investing.com/news/stock-market-news/actors-hollywood-studios-still-at-odds-on-ai-and-other-issues-union-says-3218104,https://i-invdn-com.investing.com/news/LYNXNPEC3B0CQ_L.jpg,en,2023-11-02T04:42:22.000000Z,investing.com,,equity,Communication Services,10.675148,0.4767
d7750ea1-1c83-49f3-9683-9d5056973a58,Netflix said to discuss live-streaming boxing match (NASDAQ:NFLX),Netflix's (NFLX) live-sports ambitions might take a step forward with an initial move into broadcasting boxing. The streamer's approach to sports has traditiona,,"Netflix's (NASDAQ:NFLX) live-sports ambitions might take a step forward with an initial move into broadcasting boxing.

The streamer's approach to sports has tr...",https://seekingalpha.com/news/4030303-netflix-said-to-discuss-live-streaming-boxing-match,https://static.seekingalpha.com/cdn/s3/uploads/getty_images/1465343709/image_1465343709.jpg?io=getty-c-w750,en,2023-11-03T15:09:47.000000Z,seekingalpha.com,,equity,Communication Services,59.186237,0.16508
920101e5-a2e6-4b5f-a4fc-d541dfbabd33,Broadcom seeks penalties from Netflix for infringing on patents,"Shares of Broadcom Inc. gained 0.4% in premarket trading Friday, after the semiconductor company said a German patent court said its patent related to video...","article_normal, Computers/Electronics, Internet/Online Services, Media, Regulation/Government Policy, Corporate/Industrial News, Equity Markets, Derivative Securities, Broadcom Inc., AVGO, Netflix Inc., NFLX, E-Mini S&P 500 Future Continuous Contract, ES00, SPX, S&P 500 Index, regulation, government policy, corporate, industrial news, equity markets, derivative securities, computers, electronics, internet, online services, media","Shares of Broadcom Inc. AVGO, +1.31% gained 0.4% in premarket trading Friday, after the semiconductor company said a German patent court said its patent related...",https://www.marketwatch.com/story/broadcom-seeks-penalties-from-netflix-for-infringing-on-patents-53d68d25,https://s.wsj.net/public/resources/MWimages/MW-GP644_MicroS_ZG_20180906154215.jpg,en,2023-11-03T12:18:00.000000Z,marketwatch.com,,equity,Communication Services,33.59531916666666,-0.23835000000000003
202247ae-b44c-4995-a25c-fa838138ffb7,"The Zacks Analyst Blog Highlights Merck, Bank of America, AMD, Netflix and Union Pacific","Merck, Bank of America, AMD, Netflix and Union Pacific are part of the Zacks top Analyst Blog.",,"For Immediate Release

Chicago, IL – November 3, 2023 – Zacks.com announces the list of stocks featured in the Analyst Blog. Every day the Zacks Equity Rese...",https://finance.yahoo.com/news/zacks-analyst-blog-highlights-merck-134600405.html?.tsrc=rss,https://media.zenfs.com/en/zacks.com/8caea1d10b17de34fac5dfab9fa21224,en,2023-11-03T13:46:00.000000Z,finance.yahoo.com,,equity,Communication Services,28.194194333333332,0.556825
f3e4d1f8-e41f-48d7-bd12-f2927ae2436c,German Court’s Preliminary Opinion Finds Broadcom Patent Valid; Netflix Found to Infringe,"SAN JOSE, Calif., Nov.  03, 2023  (GLOBE NEWSWIRE) -- Broadcom Inc. (NASDAQ: AVGO) announced today that the German Federal Patent Court issued a...","Nasdaq:AVGO, Broadcom Inc.","SAN JOSE, Calif., Nov. 03, 2023 (GLOBE NEWSWIRE) -- Broadcom Inc. (NASDAQ: AVGO) announced today that the German Federal Patent Court issued a preliminary opini...",https://www.globenewswire.com/news-release/2023/11/03/2773217/19933/en/German-Court-s-Preliminary-Opinion-Finds-Broadcom-Patent-Valid-Netflix-Found-to-Infringe.html,https://ml.globenewswire.com/Resource/Download/2fecbd2d-d0e5-4503-969d-90632b69ed65,en,2023-11-03T13:00:00.000000Z,globenewswire.com,,equity,Communication Services,25.80172,-0.15765
9af0b1fd-4e85-4f30-a367-05e065cf8e13,"The Zacks Analyst Blog Highlights Merck, Bank of America, AMD, Netflix and Union Pacific","Merck, Bank of America, AMD, Netflix and Union Pacific are part of the Zacks top Analyst Blog.","stock, stocks, investment, investment advice, investing, online trading, online investment, online stock trading, stock market, financial, financial planning, quote, quotes, stock quotes","This page has not been authorized, sponsored, or otherwise approved or endorsed by the companies represented herein. Each of the company logos represented herei...",https://www.zacks.com/stock/news/2178212/the-zacks-analyst-blog-highlights-merck-bank-of-america-amd-netflix-and-union-pacific?cid=CS-ZC-FT-press_releases-2178212,https://staticx-tuner.zacks.com/images/articles/main/7e/42272.jpg,en,2023-11-03T13:46:00.000000Z,zacks.com,,equity,Communication Services,24.998798,0.0
8a3236a0-d5f7-405f-84cc-c301dbc4e618,"AT&T shares rise amidst strong market, still lag behind competitors By Investing.com","AT&T shares rise amidst strong market, still lag behind competitors",,"Published Nov 03, 2023 03:17AM ET

© Pavlo Gonchar / SOPA Images/Sipa via Reuters Connect

T +0.96% Add to/Remove from Watchlist US500 +1.89% Add to/Remove fro...",https://www.investing.com/news/assorted/att-shares-rise-amidst-strong-market-still-lag-behind-competitors-93CH-3220542,https://i-invdn-com.investing.com/news/SP500StandardandPoors500Index_800x533_L_1657544297.jpg,en,2023-11-03T07:17:59.000000Z,investing.com,,equity,Communication Services,15.494228,0.34
e65619cc-3b77-4a40-b9a7-6676d0bd05a2,The future of AI in Singapore: Where does the biggest 2023 tech trend go from here?,"As one of the world's largest semiconductor exporters, Singapore is set to reap the benefits of the AI boom in coming years.",,"In contrast to the start of the year, ChatGPT’s views on philosophy and geopolitics no longer dominate the news cycle. The hype around generative artificial i...",https://vulcanpost.com/843953/the-future-of-ai-in-singapore-where-does-it-go-from-here/,https://vulcanpost.com/wp-content/uploads/2023/10/Untitled-design-2023-10-30T193212.716.png,en,2023-11-03T21:29:35.000000Z,vulcanpost.com,,equity,Communication Services,7.097758,0.3612
