uuid,title,description,keywords,snippet,url,image_url,language,published_at,source,relevance_score,type,industry,match_score,sentiment_score
0649b9a1-6ce7-4cfc-a74a-ad3f50f27f02,"Earnings Previews: Netflix, United Airlines, Western Alliance Bancorp – 24","After U.S. markets close on Tuesday, these three companies are expected to report quarterly results.",,"Earnings Previews: Netflix, United Airlines, Western Alliance Bancorp

Shortly after Monday’s opening bell, the Dow Jones industrials traded up 0.07%, the S&P...",https://247wallst.com/investing/2023/04/17/earnings-previews-netflix-united-airlines-western-alliance-bancorp/,https://247wallst.com/wp-content/uploads/2018/09/netflix-reed-hastings.jpg,en,2023-04-17T14:19:23.000000Z,247wallst.com,,equity,Communication Services,32.24960816666666,0.42645
0fb9b7b2-300a-42fb-af33-cc5f49d8738c,"Netflix down for more than 11,000 US users -Downdetector By Reuters","Netflix down for more than 11,000 US users -Downdetector",,"© Reuters. FILE PHOTO: Smartphone with Netflix logo is placed on a keyboard in this illustration taken April 19, 2022. REUTERS/Dado Ruvic

NFLX -2.18% Add to/R...",https://www.investing.com/news/stock-market-news/netflix-down-for-more-than-11000-us-users-downdetector-3056404,https://i-invdn-com.investing.com/news/LYNXMPEC9G1B8_L.jpg,en,2023-04-17T00:56:07.000000Z,investing.com,,equity,Communication Services,33.90142733333333,0.21075
ac8ea922-63ad-4f5e-8315-ac7f04d14415,"Netflix reports, Johnson & Johnson, bank earnings: 3 things to watch By Investing.com","Netflix reports, Johnson & Johnson, bank earnings: 3 things to watch",,"© Reuters.

BAC +2.95% Add to/Remove from Watchlist GS +0.80% Add to/Remove from Watchlist SCHW +3.94% Add to/Remove from Watchlist JNJ -0.14% Add to/Remove fr...",https://www.investing.com/news/stock-market-news/netflix-reports-johnson--johnson-bank-earnings-3-things-to-watch-3057368,https://i-invdn-com.investing.com/news/LYNXNPEE8519V_L.jpg,en,2023-04-17T20:14:36.000000Z,investing.com,,equity,Communication Services,29.363730333333336,0.3062
2dfd0892-bc6b-49ba-8243-037b81095817,"Will Netflix price cuts, ad-supported plan help add more users? By Reuters","Will Netflix price cuts, ad-supported plan help add more users?",,"© Reuters. FILE PHOTO: Smartphone with Netflix logo is seen in front of a descending stock graph in this illustration taken April 19, 2022. REUTERS/Dado Ruvic/...",https://www.investing.com/news/stock-market-news/will-netflix-price-cuts-adsupported-plan-help-add-more-users-3056715,https://i-invdn-com.investing.com/news/LYNXMPED1R0IB_L.jpg,en,2023-04-17T10:10:58.000000Z,investing.com,,equity,Communication Services,27.602251,0.221764
74d10ce7-fe45-49ec-9029-a210b11549f6,Netflix apologizes for live streaming delay for ‘Love is Blind’,Netflix Inc. apologized Sunday night after the live stream for a reunion of its “Love is Blind” dating show was delayed more than an hour for subscribers....,"article_normal, netflix, love is blind, live streaming, disney, apple, amazon, Internet/Online Services, Corporate Actions, Consumer Affairs, Netflix, Love is Blind, Disney, Apple, Amazon, Netflix Inc., NFLX, Walt Disney Co., DIS, Apple Inc., AAPL, Amazon.com Inc., AMZN, corporate actions, consumer affairs, internet, online services","Netflix Inc. NFLX, -1.73% apologized Sunday night after the live stream for a reunion of its “Love is Blind” dating show was delayed more than an hour for s...",https://www.marketwatch.com/story/netflix-apologizes-for-live-streaming-delay-for-love-is-blind-786f87e,https://s.wsj.net/public/resources/MWimages/MW-GP644_MicroS_ZG_20180906154215.jpg,en,2023-04-17T19:23:00.000000Z,marketwatch.com,,equity,Communication Services,32.63177616666667,-0.07384999999999999
cd117bc3-3018-4aa4-9578-085c7430f3cc,"Netflix down for more than 11,000 US users",Downdetector tracks outages by collating status reports from several sources including users.,"Netflix, Netflix outage, netflix US outage, Netflix US","Netflix Inc. is down for more than 11,000 users in the United States on late Sunday, according outage tracking website Downdetector.com.

Downdetector tracks ou...",https://www.livemint.com/news/world/netflix-down-for-more-than-11-000-us-users-11681697702292.html,https://www.livemint.com/lm-img/img/2023/04/17/600x338/Netflix_1681698114574_1681698114788_1681698114788.JPG,en,2023-04-17T02:39:43.000000Z,livemint.com,,equity,Communication Services,31.7084595,0.31328
81446d64-7a93-4c11-bb71-8f6f03137f41,"Q1 Earnings: Tesla, Netflix On Deck","Earnings season kicked off last week, with several big banks such as JPMorgan, Wells Fargo, and Citigroup getting the party started. And this week, the party continues with several market favorites, including Netflix and Tesla.",,"Earnings season kicked off last week, with several big banks such as JPMorgan JPM, Wells Fargo WFC, and Citigroup C getting the party started. All three posted ...",https://finance.yahoo.com/news/q1-earnings-tesla-netflix-deck-183906214.html?.tsrc=rss,https://media.zenfs.com/en/zacks.com/9162d16222b61d3ed71db62a06ea99c0,en,2023-04-17T18:39:06.000000Z,finance.yahoo.com,,equity,Communication Services,30.983127666666665,0.337011
5122939a-c351-479a-b2f1-8434106110c1,"Q1 Earnings: Tesla, Netflix On Deck","Earnings season kicked off last week, with several big banks such as JPMorgan, Wells Fargo, and Citigroup getting the party started. And this week, the party continues with several market favorites, including Netflix and Tesla.","stock, stocks, investment, investment advice, investing, online trading, online investment, online stock trading, stock market, financial, financial planning, quote, quotes, stock quotes","This page has not been authorized, sponsored, or otherwise approved or endorsed by the companies represented herein. Each of the company logos represented herei...",https://www.zacks.com/commentary/2079899/q1-earnings-tesla-netflix-on-deck?cid=CS-ZC-FT-investment_ideas-2079899,https://staticx-tuner.zacks.com/images/articles/main/8a/25768.jpg,en,2023-04-17T18:39:00.000000Z,zacks.com,,equity,Communication Services,30.883223,0.0
0f1656d7-f19b-49df-8f07-8747dd4d1b74,Netflix Options Tell An Interesting Story Ahead Of Earnings - Netflix (NASDAQ:NFLX),,,Netflix Inc NFLX is scheduled to report its first quarter earnings on Tuesday. The streaming giant is expected to post revenue of $8.17 billion in the first qua...,https://www.benzinga.com/markets/equities/23/04/31847785/as-netflix-gets-ready-for-earnings-heres-what-options-market-indicates-about-the-stock,https://cdn.benzinga.com/files/images/story/2023/Netflix_Photo_by_Mouse_family_on_Shutterstock_3.jpeg?width=1200&height=800&fit=crop,en,2023-04-18T08:47:18.000000Z,benzinga.com,,equity,Communication Services,42.14360983333333,0.300625
637f521a-d79d-4bbb-a218-430ce7326034,Bullish Bets On Netflix: Options Traders Anticipate A Significant Stock Surge By Week's End - Netflix (NASDAQ:NFLX),"Netflix, Inc. (NASDAQ: NFLX) is all set to release earnings for the latest quarter after the closing bell on Tuesday.",,"Netflix, Inc. NFLX is all set to release earnings for the latest quarter after the closing bell on Tuesday. Analysts expect the company to post quarterly earnin...",https://www.benzinga.com/news/earnings/23/04/31846490/bullish-bets-on-netflix-options-traders-anticipate-a-significant-stock-surge-by-weeks-end,https://cdn.benzinga.com/files/images/story/2023/04/18/netflix_shutter.jpg?width=1200&height=800&fit=crop,en,2023-04-18T12:15:30.000000Z,benzinga.com,,equity,Communication Services,40.4145705,0.1575
7d94bb15-3216-4e42-8f46-c119a1a8e1d8,Netflix Likely To Report Lower Q1 Earnings; Here's A Look At Recent Price Target Changes By The Most Accurate Analysts - Netflix (NASDAQ:NFLX),"Netflix, Inc. (NASDAQ: NFLX) is expected to report its first quarter earnings results after the closing bell on April 18, 2023.",,"Netflix, Inc. NFLX is expected to report its first quarter earnings results after the closing bell on April 18, 2023.

Analysts expect the company to post quart...",https://www.benzinga.com/news/earnings/23/04/31852051/netflix-likely-to-report-lower-q1-earnings-heres-a-look-at-recent-price-target-changes-by-the-most-,https://cdn.benzinga.com/files/images/story/2023/04/18/netflix_-_logo.jpg?width=1200&height=800&fit=crop,en,2023-04-18T11:39:45.000000Z,benzinga.com,,equity,Communication Services,34.081431333333335,0.175567
4e2302b6-63b3-4c21-b866-120bae6f1603,Trade Gold With 3 Times Leverage Using REX Shares’s SHNY And DULL ETNs - Netflix (NASDAQ:NFLX),"Volatility appears to be a constant for markets in 2023 so far and perhaps beyond. The Federal Reserve's monetary tightening stance has helped cool down inflation, but it has also placed immense financial strain on businesses.",,Volatility appears to be a constant for markets in 2023 so far and perhaps beyond. The Federal Reserve's monetary tightening stance has helped cool down inflati...,https://www.benzinga.com/markets/commodities/23/04/31852480/trade-gold-with-3-times-leverage-using-rex-sharess-shny-and-dull-etns,https://cdn.benzinga.com/files/images/story/2023/04/18/screenshot_2023-04-18_at_5.26.22_pm.png?width=1200&height=800&fit=crop,en,2023-04-18T11:57:38.000000Z,benzinga.com,,equity,Communication Services,48.628883,0.04025
d6a32cfc-e356-44c2-83a0-287451bfc5cf,"TSLA, WINT, ENVX, MRNA, BLBX: Top 5 Trending Stocks - Netflix (NASDAQ:NFLX), Windtree Therapeutics (NASDAQ:WINT), Tesla (NASDAQ:TSLA), Morgan Stanley (NYSE:MS), Merck & Co (NYSE:MRK), Enovix (NASDAQ:E",,,"U.S. markets ended in the green on Monday, supported by financial and industrial stocks. Investors and traders are watching out for a slew of corporate earnings...",https://www.benzinga.com/markets/equities/23/04/31845100/tesla-windtree-therapeutics-enovix-corp-moderna-blackboxstocks-why-these-5-stocks-are-drawing-in,https://cdn.benzinga.com/files/images/story/2023/Stocks_Photo_by_WHYFRAME_on_Shutterstock_4.jpeg?width=1200&height=800&fit=crop,en,2023-04-18T01:13:13.000000Z,benzinga.com,,equity,Communication Services,27.56957033333333,0.28175
1c34f081-8193-46d7-b34c-23e8c6c8f874,"S&P 500, Nasdaq open higher as investors digest more bank earnings","U.S. stocks opened higher on Tuesday as investors digested a fresh batch of earnings, including reports from megabanks Goldman Sachs Group and Bank of...","article_normal, Investing/Securities, Equity Markets, Netflix Inc., NFLX, Goldman Sachs Group Inc., GS, Bank of America Corp., BAC, SPX, COMP, DJIA, S&P 500 Index, Dow Jones Industrial Average, NASDAQ Composite Index, equity markets, investing, securities","U.S. stocks opened higher on Tuesday as investors digested a fresh batch of earnings, including reports from megabanks Goldman Sachs Group GS, -2.51% and Bank o...",https://www.marketwatch.com/story/s-p-500-nasdaq-open-higher-as-investors-digest-more-bank-earnings-a648bbf3,https://s.wsj.net/public/resources/MWimages/MW-GP644_MicroS_ZG_20180906154215.jpg,en,2023-04-18T13:35:00.000000Z,marketwatch.com,,equity,Communication Services,23.9128175,0.0
6ae6b11a-58b2-4e9e-9370-0b03b2af5ca6,"Nasdaq 100 Update: US Stocks Gear up for Tech Earnings: Netflix, Tesla",Netflix and Tesla get the megacap tech stocks underway in the first earnings season of 2023. The Nasdaq has led other US indices as rate expectations and inflation ease,,"Nasdaq (US Tech 100) News and Analysis

Netflix and Tesla kickstart Q1 megacap tech earnings

Nasdaq 100 reveals clear hurdle to bullish continuation while the ...",https://www.dailyfx.com/news/nasdaq-100-update-us-stocks-gear-up-for-tech-earnings-netflix-tesla-20230418.html,https://a.c-dn.net/b/3vBpNA/Nasdaq1.jpg,en,2023-04-18T11:30:33.000000Z,dailyfx.com,,equity,Communication Services,42.96852,0.099275
383abc08-a634-4d21-8823-04ec2262c528,Netflix Winds Down DVD-Rental Business,Streamer said mailed DVDs paved the way for shift to streaming,"wsjcorp, corpearnings, Multimedia Content Services, Media Content Distribution, Online Service Providers, Media/Entertainment, Streaming Services, Technology, Corporate/Industrial News, SYND, WSJ-PRO-WSJ.com, Netflix, NFLX, Ted Sarandos, corporate, industrial news, media, entertainment","Netflix is ending 25 years of mailing shows and movies to subscribers.

Netflix Inc. will ship its last red DVD envelopes in September, the company said, ending...",https://www.wsj.com/articles/netflix-nflx-q1-earnings-report-2023-8460b7e4?mod=pls_whats_news_us_business_f,https://images.wsj.net/im-765843/social,en,2023-04-18T19:30:00.000000Z,online.wsj.com,,equity,Communication Services,36.40040166666667,0.0
dfc0d8f6-65d6-4c87-aecb-8279cd9396fc,Netflix Winds Down DVD-Rental Business,Streamer said mailed DVDs paved the way for shift to streaming,"wsjcorp, corpearnings, Multimedia Content Services, Media Content Distribution, Online Service Providers, Media/Entertainment, Streaming Services, Technology, Corporate/Industrial News, SYND, WSJ-PRO-WSJ.com, Netflix, NFLX, Ted Sarandos, corporate, industrial news, media, entertainment","Netflix is ending 25 years of mailing shows and movies to subscribers.

Netflix Inc. will ship its last red DVD envelopes in September, the company said, ending...",https://www.wsj.com/articles/netflix-nflx-q1-earnings-report-2023-8460b7e4,https://images.wsj.net/im-765843/social,en,2023-04-18T19:30:00.000000Z,online.wsj.com,,equity,Communication Services,36.40040166666667,0.0
ac6d7436-e2a7-4d26-b4b6-e0c69c353844,"Netflix, Inc. : Netflix, Inc: Message received","The world's leading streaming company, which released highly anticipated quarterly results yesterday, has clearly understood the message sent with force by its various shareholders. | April 19,  2023","NETFLIX, INC. stock exchange, news, information, press release, the, leading, streaming, which, released, highly, anticipated, quarterly, results, has, clearly, understood, message, sent, with, force, by, its, various | NFLX | US64110L1061","Three things stand out. Firstly, the nominal growth in turnover of 3.7% compared to the first quarter of last year, positive on paper but below inflation in rea...",https://www.marketscreener.com/quote/stock/NETFLIX-INC-44292425/news/Netflix-Inc-Netflix-Inc-Message-received-43543869/,https://img.zonebourse.com/reuters/2022-09/2022-09-06T230331Z_3_LYNXMPEI850VS_RTROPTP_3_NETFLIX-GULF.JPG,en,2023-04-19T14:11:58.000000Z,marketscreener.com,,equity,Communication Services,85.06735916666666,0.074517
963448b7-95a8-4f11-b5fa-b2a80da75915,These Analysts Revise Price Targets On Netflix After Q1 Results - Netflix (NASDAQ:NFLX),"Netflix, Inc. (NASDAQ: NFLX) posted upbeat earnings for its first quarter, but sales missed estimates.",,"Netflix, Inc. NFLX posted upbeat earnings for its first quarter, but sales missed estimates.

Netflix reported first-quarter revenue of $8.16 billion, which was...",https://www.benzinga.com/news/earnings/23/04/31893750/these-analysts-revise-price-targets-on-netflix-after-q1-results,https://cdn.benzinga.com/files/images/story/2023/04/19/netflix_-_logo.jpg?width=1200&height=800&fit=crop,en,2023-04-19T15:09:06.000000Z,benzinga.com,,equity,Communication Services,41.2936745,0.184257
9de2c7eb-d8c3-42ef-aa27-e6a11257c76b,LinkedIn Reveals Top Workplace: Where Amazon and Netflix Rank For Happy Employees,"Microsoft Corp’s (NASDAQ: MSFT) social media platform LinkedIn published its annual list of the best workplace, where Amazon.Com Inc (NASDAQ: AMZN) held on to the top spot, and Google owner Alphabet Inc (NASDAQ: GOOG) (NASDAQ: GOOGL) dropped from number two last year to number five this year. Wells Fargo & Co (NYSE: WFC), JP Morgan Chase & Co (NYSE: JPM), and Bank Of America Corp (NYSE: BAC) bagged the second, third, and fourth positions, TechCrunch reports. Meta Platforms Inc (NASDAQ: META), Ne",,"Microsoft Corp’s (NASDAQ: MSFT) social media platform LinkedIn published its annual list of the best workplace, where Amazon.Com Inc (NASDAQ: AMZN) held on to...",https://finance.yahoo.com/news/linkedin-reveals-top-workplace-where-155427039.html?.tsrc=rss,https://media.zenfs.com/en/Benzinga/a3b0f164705a63e4eaea48322abf3ea1,en,2023-04-19T15:54:27.000000Z,finance.yahoo.com,,equity,Communication Services,32.73294433333333,0.288033
39376980-19f3-4509-a992-f641fd305039,"Wednesday's Market Minute: Bulls Are Hoping This Five-Year Trendline Breaks - Netflix (NASDAQ:NFLX), Apple (NASDAQ:AAPL)","Netflix (NASDAQ: NFLX) plunged and recovered almost immediately after earnings Tuesday, the latest sign of determination by bulls to erase last year’s bear market. It’s looking like dreams of a full recovery could come true.",,"Netflix NFLX plunged and recovered almost immediately after earnings Tuesday, the latest sign of determination by bulls to erase last year’s bear market. It?...",https://www.benzinga.com/markets/23/04/31897198/wednesdays-market-minute-bulls-are-hoping-this-five-year-trendline-breaks,https://cdn.benzinga.com/files/images/story/2023/04/19/shutterstock_1717289245.jpg?width=1200&height=800&fit=crop,en,2023-04-19T17:05:09.000000Z,benzinga.com,,equity,Communication Services,48.583427,0.64365
dcb1363f-c9a1-4c49-8c9c-30ee537a5d00,"TSLA, NFLX, WAL, DKNG, UAL: Top Trending Stocks - DraftKings (NASDAQ:DKNG), Netflix (NASDAQ:NFLX), United Airlines Holdings (NASDAQ:UAL), Tesla (NASDAQ:TSLA), Western Alliance (NYSE:WAL), Bank of Amer",,,Major U.S. equity indices closed flat on Tuesday following a mixed set of earnings announcements. While market participants were disappointed with Goldman Sachs...,https://www.benzinga.com/markets/equities/23/04/31876886/tesla-netflix-western-alliance-draftkings-united-airlines-why-these-5-stocks-are-drawing-investo,https://cdn.benzinga.com/files/images/story/2023/Stocks_Photo_by_Jirapong_Manustrong_on_Shutterstock_0.jpeg?width=1200&height=800&fit=crop,en,2023-04-19T01:08:51.000000Z,benzinga.com,,equity,Communication Services,27.252404000000002,0.2787
e9ca8a11-d870-44b0-8e57-855353b6855b,"Before the Bell: No More Red Envelopes From Netflix, Regional Bank Gets Cash Transfusion, Tesla Cuts Prices Again – 24",Premarket trading had all three major U.S. stock indexes lower on Wednesday. Regional banks reporting results have not offered a lot of good news.,,"Before the Bell: No More Red Envelopes From Netflix, Regional Bank Gets Cash Transfusion, Tesla Cuts Prices Again

Premarket action on Wednesday had the three m...",https://247wallst.com/investing/2023/04/19/before-the-bell-no-more-red-envelopes-from-netflix-regional-bank-gets-cash-transfusion-tesla-cuts-prices-again/,https://247wallst.com/wp-content/uploads/2022/03/imageForEntry13-EYQ.jpg,en,2023-04-19T11:38:37.000000Z,247wallst.com,,equity,Communication Services,24.995711,0.150767
b2502478-6144-4b28-a299-41e30b0c306b,"S&P 500 pares losses, but Netflix slump curbs upside momentum",By Yasin Ebrahim,,"By Yasin Ebrahim

Investing.com -- The S&P 500 pared losses Wednesday, but gains were kept in check by mixed quarterly results including from streaming giant Ne...",https://finance.yahoo.com/news/p-500-pares-losses-netflix-151730047.html?.tsrc=rss,https://s.yimg.com/cv/apiv2/social/images/yahoo_default_logo-1200x1200.png,en,2023-04-19T15:17:30.000000Z,finance.yahoo.com,,equity,Communication Services,35.332493,0.206425
53e27bbc-c757-4046-8890-3a9dc44478aa,"Netflix Gains 1.75 Million Subscribers, Axes DVD-Rental Business",Streaming service says U.S. password-sharing crackdown is coming soon,Netflix,"Netflix Inc. said it would roll out new password-sharing limitations more broadly—including in the U.S.—by the end of June, and announced it would soon wind...",https://www.livemint.com/companies/news/netflix-gains-1-75-million-subscribers-axes-dvd-rental-business-11681904109551.html,https://www.livemint.com/lm-img/img/2023/04/19/600x338/Netflix-DVD-Service-s-Demise-0_1681904162994_1681904184882.jpg,en,2023-04-19T11:37:46.000000Z,livemint.com,,equity,Communication Services,34.57714766666667,0.17
77ac68fa-e6ba-4a71-b068-de8c98aac96c,"Dow dips, S&P 500 stable after medtech gains, Netflix drag","(April 20): The S&P 500 ended virtually unchanged on Wednesday while the Dow dipped as investors digested a mixed bag of corporate earnings, including upbeat reports from medical technology companies, countered by weakness in Netflix shares. The Dow was weighed down by declines in Walt Disney Co and UnitedHealth Group Inc shares following results from rivals in their respective industries. Major equity indexes have been largely stable during the early stages of a first-quarter earnings season that investors expect to show tepid results.",,"(April 20): The S&P 500 ended virtually unchanged on Wednesday while the Dow dipped as investors digested a mixed bag of corporate earnings, including upbeat re...",https://www.theedgemarkets.com/node/664115,https://www.theedgemarkets.com/sites/default/files/default.jpg,en,2023-04-19T22:47:41.000000Z,theedgemarkets.com,,equity,Communication Services,28.798151833333336,0.2637
ba4fbb71-1b9b-4f90-8f0d-034f6af42982,"CBOE Volatility Index Drops To Lowest Level Since November 2021; S&P 500 Ends Almost Flat - Netflix (NASDAQ:NFLX), Abbott Laboratories (NYSE:ABT)",The S&P 500 closed almost flat on Wednesday following the release of corporate earnings.,,"The S&P 500 closed almost flat on Wednesday following the release of corporate earnings.

Abbott Laboratories ABT shares gained 7.8% on Wednesday after the comp...",https://www.benzinga.com/news/earnings/23/04/31908290/cboe-volatility-index-drops-to-lowest-level-since-november-2021-s-p-500-ends-almost-flat,https://cdn.benzinga.com/files/images/story/2023/04/20/image_3.jpg?width=1200&height=800&fit=crop,en,2023-04-20T09:50:42.000000Z,benzinga.com,,equity,Communication Services,31.092895,0.15925
6e8f0810-297b-45ed-8e52-23d5a62e8385,"Tesla, Rivian, IBM, Zions, Lam Research: Why These Five Stocks Are Drawing Investors' Attention Today - Netflix (NASDAQ:NFLX), Abbott Laboratories (NYSE:ABT), Tesla (NASDAQ:TSLA), Western Alliance (NY",,,U.S. markets ended in the flat zone on Wednesday after investors and traders weighed-in a mixed set of corporate earnings. While shares of Western Alliance Banc...,https://www.benzinga.com/markets/equities/23/04/31906137/tesla-rivian-ibm-zions-lam-research-why-these-five-stocks-are-drawing-investors-attention-today,https://cdn.benzinga.com/files/images/story/2023/Stocks_Photo_by_Pixels_Hunter_on_Shutterstock_0.jpeg?width=1200&height=800&fit=crop,en,2023-04-20T01:28:08.000000Z,benzinga.com,,equity,Communication Services,27.138594833333332,-0.0129
4a894f93-ff80-4540-9ff7-2cdd5d8de8ac,"Dow dips, S&P 500 stable after medtech gains, Netflix drag",The Dow was weighed down by declines in Walt Disney Co and UnitedHealth Group Inc shares following results from rivals in their respective industries.,"Wall Street, Dow Jones, Dow Jones Industrials, Dow Jones Industrial Average, S&P 500, Nasdaq, Nasdaq Composite, Nasdaq Composite index, Netflix, Netflix shares, Netflix share price, Walt Disney, Walt Disney shares, Walt Disney share price, Tesla, Tesla shares, Tesla share price, Western Alliance Bancorp, Western Alliance Bancorp shares, Western Alliance Bancorp share price, Wall Street latest, Wall Street updates, Wall Street update, Wall Street news","The S&P 500 ended virtually unchanged on Wednesday while the Dow dipped as investors digested a mixed bag of corporate earnings, including upbeat reports from m...",https://www.businesstoday.in/markets/global-markets/story/dow-dips-sp-500-stable-after-medtech-gains-netflix-drag-378092-2023-04-20,https://akm-img-a-in.tosshub.com/businesstoday/images/story/202304/wall-street_4-sixteen_nine.jpg,en,2023-04-20T01:24:56.000000Z,businesstoday.in,,equity,Communication Services,28.79975566666667,0.2637
1fcf078f-401a-4e7c-a19e-6f2cbdea5c8d,Netflix Is Mailing Its Last DVD. The Die-Hards Are in Mourning.,Subscribers say the DVD business has a bigger catalog of older films; ‘streaming looks like garbage’,"wsjcorp, wsjspeeddesk, Retail/Wholesale, Etailing, Multimedia Content Services, Media Content Distribution, E-commerce, Online Service Providers, Media/Entertainment, Streaming Services, Retail, Technology, Corporate/Industrial News, Political/General News, Arts/Entertainment, Television/Radio, SYND, WSJ-PRO-WSJ.com, Etsy, Netflix, NFLX, corporate, industrial news, political, general news, arts, entertainment, television, radio, wholesale, media","Thomas Johnson ’s daughter texted him Tuesday afternoon with difficult news: Netflix Inc. planned to get rid of its DVD-by-mail business later this year.

“...",https://www.wsj.com/articles/netflix-is-mailing-its-last-dvd-the-die-hards-are-in-mourning-e7fe8c4c?mod=pls_whats_news_us_business_f,https://images.wsj.net/im-767275/social,en,2023-04-20T19:50:00.000000Z,online.wsj.com,,equity,Communication Services,32.230812,-0.4008
512ddf83-2558-45ac-9076-0b561cd71710,Netflix Is Mailing Its Last DVD. The Die-Hards Are in Mourning.,Subscribers say the DVD business has a bigger catalog of older films; ‘streaming looks like garbage’,"wsjcorp, wsjspeeddesk, Retail/Wholesale, Etailing, Multimedia Content Services, Media Content Distribution, E-commerce, Online Service Providers, Media/Entertainment, Streaming Services, Retail, Technology, Corporate/Industrial News, Political/General News, Arts/Entertainment, Television/Radio, SYND, WSJ-PRO-WSJ.com, Etsy, Netflix, NFLX, corporate, industrial news, political, general news, arts, entertainment, television, radio, wholesale, media","Thomas Johnson ’s daughter texted him Tuesday afternoon with difficult news: Netflix Inc. planned to get rid of its DVD-by-mail business later this year.

“...",https://www.wsj.com/articles/netflix-is-mailing-its-last-dvd-the-die-hards-are-in-mourning-e7fe8c4c,https://images.wsj.net/im-767275/social,en,2023-04-20T19:50:00.000000Z,online.wsj.com,,equity,Communication Services,32.228894833333335,-0.4008
