uuid,title,description,keywords,snippet,url,image_url,language,published_at,source,relevance_score,type,industry,match_score,sentiment_score
3d87d712-98f6-4974-9f8f-f51f8e7ff1f3,Elon Musk Floats New Conspiracy Theory About The Identity Of Elusive Bitcoin Creator Satoshi Nakamoto - Tesla (NASDAQ:TSLA),"Satoshi Nakamoto is the name used by the presumed pseudonymous person(s) who developed apex cryptocurrency Bitcoin (CRYPTO: BTC), but Tesla Inc.",,"Satoshi Nakamoto is the name used by the presumed pseudonymous person(s) who developed apex cryptocurrency Bitcoin BTC/USD, but Tesla Inc. TSLA CEO Elon Musk ha...",https://www.benzinga.com/markets/cryptocurrency/22/03/26055190/elon-musk-floats-new-conspiracy-theory-about-the-identity-of-elusive-bitcoin-creator-sat-1,https://cdn.benzinga.com/files/images/story/2012/screen_shot_2022-03-09_at_2.10.29_pm.png?width=1200&height=800&fit=crop,en,2022-11-27T19:23:16.000000Z,benzinga.com,,equity,Consumer Cyclical,34.70766966666667,-0.26335
94a17b39-5c1f-4dbf-b507-c5198256a3f0,Tesla preps for first Semi deliveries as it breaks into Class 8 market,Tesla (TSLA) will hold an event on December 1 at the Gigafactory in Nevada to commemorate the first deliveries of the all-electric Semi Class 8 truck. Read more.,,"Tesla (NASDAQ:TSLA) will hold an event on December 1 at the Gigafactory in Nevada to commemorate the first deliveries of the all-electric Semi Class 8 truck.

A...",https://seekingalpha.com/news/3911440-electric-stuff-tesla-preps-for-first-semi-deliveries-as-it-breaks-into-class-8-market,https://static.seekingalpha.com/cdn/s3/uploads/getty_images/1210484438/image_1210484438.jpg?io=getty-c-w750,en,2022-11-27T16:58:15.000000Z,seekingalpha.com,,equity,Consumer Cyclical,31.797173,0.2775
b99e44f4-2662-4458-b55c-34bd52553a8a,Where to Get the World’s Cheapest — and Most Expensive — Tesla,"(Bloomberg) -- Tesla Inc.’s Model Y has been a smash-hit worldwide -- on track to rank among the top five best-selling models this year and the only electric car to make the cut. More than 500,000 were snapped up in the first nine months, but depending on which country you live in, you may be forking out vastly different sums. Most Read from BloombergNext Covid-19 Strain May be More Dangerous, Lab Study ShowsThe Treasury Market’s Big Recession Trade Is Gathering MomentumUkraine’s Victories May B",,(Bloomberg) -- Tesla Inc.’s Model Y has been a smash-hit worldwide -- on track to rank among the top five best-selling models this year and the only electric ...,https://finance.yahoo.com/news/where-world-cheapest-most-expensive-223000537.html?.tsrc=rss,https://s.yimg.com/ny/api/res/1.2/maZMoj7RmZcic37GqzoJtQ--/YXBwaWQ9aGlnaGxhbmRlcjt3PTEyMDA7aD03NDM-/https://media.zenfs.com/en/bloomberg_technology_68/a35ec974791ad79dca6e9dd17a671cc3,en,2022-11-27T22:30:00.000000Z,finance.yahoo.com,,equity,Consumer Cyclical,29.828197333333335,0.19512700000000002
e9f56393-9bc9-4d4c-ab78-3c884fede5f3,Elon Musk and the confessions of a reader of Ayn Rand novels,"Elon Musk: For the sake of nostalgia, I'll keep Rand in my bookshelf and Musk in my peripheral vision","elon musk, ayn rand, twitter, twitter news, Ayn Rand novels","I’m fed up reading about and . If you think about it, neither the spoiled-brat serial entrepreneur nor the spoiled-brat social network he bought matters a whi...",https://www.business-standard.com/article/current-affairs/elon-musk-and-the-confessions-of-a-reader-of-ayn-rand-novels-122112700488_1.html,https://bsmedia.business-standard.com/_media/bs/img/article/2022-11/27/full/1669549530-0726.jpg,en,2022-11-27T15:28:11.000000Z,business-standard.com,,equity,Consumer Cyclical,13.498963166666664,-0.041967
65acc11a-325e-421d-b03e-2df1464140b6,Elon Musk and the Confessions of an Ayn Rand Reader,"As boys, we dream of being John Galt or Howard Roark. As men, most of us move on. If we don’t, that’s a problem.",,"Comment Gift Article Share

I’m fed up reading about Elon Musk and Twitter. If you think about it, neither the spoiled-brat serial entrepreneur nor the spoile...",https://www.washingtonpost.com/business/elon-musk-and-the-confessions-of-an-ayn-rand-reader/2022/11/27/0587ba4c-6e32-11ed-8619-0b92f0565592_story.html,https://www.washingtonpost.com/wp-apps/imrs.php?src=https://arc-anglerfish-washpost-prod-washpost.s3.amazonaws.com/public/AJVP6GDOGII63BQZBOJPAVSVSI.jpg&w=1440,en,2022-11-27T09:00:13.000000Z,washingtonpost.com,,equity,Consumer Cyclical,13.127090166666667,-0.041967
b5beed2f-185d-4ce0-821e-72a98b38ed32,"Marketers Must Be Flexible, Without Losing Identity, in Uncertain Times","Budget cuts will be requested, but ‘this is not the time to do that.’ Be flexible, maintain your identity, and convey to customers your value proposition.","Advertising Services, Advertising/Marketing/Public Relations, Marketing, Advertising, Advertising Spending, Social Media Marketing/Advertising, synd, WSJ-PRO-WSJ.com, marketing, advertising, advertising spending, social media marketing, advertising services, public relations","Ad executives are bracing for history to repeat itself: When the economy sputters, companies frequently reduce their advertising and marketing budgets.

“In t...",https://www.wsj.com/articles/marketers-must-be-flexible-without-losing-identity-in-uncertain-times-11669415041,https://images.wsj.net/im-672957/social,en,2022-11-27T14:00:00.000000Z,finance.yahoo.com,,equity,Consumer Cyclical,8.916823,0.2997
