uuid,title,description,keywords,snippet,url,image_url,language,published_at,source,relevance_score,type,industry,match_score,sentiment_score
e178a8fb-77c0-464b-9b01-b65c61aa1328,"Spirit AeroSystems Calls On Boeing & Airbus To Share Inflation Burden: Report - Airbus (OTC:EADSY), Spirit AeroSystems Hldgs (NYSE:SPR), Boeing (NYSE:BA)","Spirit AeroSystems Holdings, Inc. (NYSE: SPR) has reportedly asked Boeing Company (NYSE: BA) and Airbus SE (OTC: EADSY",,"Spirit AeroSystems Holdings, Inc. SPR has reportedly asked Boeing Company BA and Airbus SE EADSY to share a more significant portion of the financial strain bro...",https://www.benzinga.com/markets/equities/23/09/34355130/spirit-aerosystems-calls-on-boeing-airbus-to-share-inflation-burden-report,https://cdn.benzinga.com/files/images/story/2023/09/08/spr.png?width=1200&height=800&fit=crop,en,2023-09-08T11:30:58.000000Z,benzinga.com,,equity,Industrials,39.14141,0.10185
f01e8309-6c2b-4479-86b8-1fcc6725c566,Special Mission Aircraft Industry Report 2023: Increasing Global Security Threats Demand Specialized Capabilities,/PRNewswire/ -- The,Research and Markets,"DUBLIN, Sept. 8, 2023 /PRNewswire/ -- The ""Special Mission Aircraft Market Report 2023-2033"" has been added to ResearchAndMarkets.com's offering.

The report ex...",https://www.prnewswire.com/news-releases/special-mission-aircraft-industry-report-2023-increasing-global-security-threats-demand-specialized-capabilities-301921773.html,https://mma.prnewswire.com/media/539438/Research_and_Markets_Logo.jpg?p=facebook,en,2023-09-08T10:15:00.000000Z,prnewswire.com,,equity,Industrials,18.445321,0.7351
210f0ce3-e8cd-4771-8699-3084d5fb0409,Asia Pacific Dominates Global Logistics with Thriving E-commerce and Advanced Technology Adoption,"/PRNewswire/ -- The ""Logistics Market - Global Industry Analysis, Size, Share, Growth, Trends, and Forecast 2023-2030 - By Product, Technology, Grade,...",Research and Markets,"DUBLIN, Sept. 8, 2023 /PRNewswire/ -- The ""Logistics Market - Global Industry Analysis, Size, Share, Growth, Trends, and Forecast 2023-2030 - By Product, Techno...",https://www.prnewswire.com/news-releases/asia-pacific-dominates-global-logistics-with-thriving-e-commerce-and-advanced-technology-adoption-301921866.html,https://mma.prnewswire.com/media/539438/Research_and_Markets_Logo.jpg?p=facebook,en,2023-09-08T17:30:00.000000Z,prnewswire.com,,equity,Industrials,17.96540685714286,0.5423
dd196c43-8090-4836-8466-433df5d41f21,"Latest Market Study | Business Jets Market Size & Analysis - Growth Trends, Forecasts, and Share Analysis, 2023-2030","Global Demand for Business Jets is expected to reach US$ 37.6 billion by 2030, registering a CAGR of approximately 3.8%, says RationalStat...","Rationalstat LLC, Business Jets Market Size, Business Jets Market Share, Business Jets Market Report, Business Jets Market growth, Business Jets","Wilmington, Delaware, Sept. 08, 2023 (GLOBE NEWSWIRE) -- Global Business Jets Market was valued at US$ 28 billion in 2022 and is expected to grow at a significa...",https://www.globenewswire.com/news-release/2023/09/08/2740202/0/en/Latest-Market-Study-Business-Jets-Market-Size-Analysis-Growth-Trends-Forecasts-and-Share-Analysis-2023-2030.html,https://ml.globenewswire.com/Resource/Download/ced67b94-5d6b-4532-b365-e1f1f26f8f16,en,2023-09-08T15:00:00.000000Z,globenewswire.com,,equity,Industrials,16.977173571428573,0.7545000000000001
48bedf2b-ec6f-4354-8df5-1100074d73ae,US NTSB cites inadequate inspections in 2021 United Airlines engine failure By Reuters,US NTSB cites inadequate inspections in 2021 United Airlines engine failure,,"Published Sep 08, 2023 05:35PM ET Updated Sep 08, 2023 05:40PM ET

© Reuters. FILE PHOTO: A United Airlines Boeing 777-200ER plane is towed as American Airline...",https://www.investing.com/news/stock-market-news/us-ntsb-cites-inadequate-inspections-in-2021-united-airlines-engine-failure-3170975,https://i-invdn-com.investing.com/news/LYNXNPEB6M0JV_L.jpg,en,2023-09-08T21:40:43.000000Z,investing.com,,equity,Industrials,15.77807,-0.2617
