uuid,title,description,keywords,snippet,url,image_url,language,published_at,source,relevance_score,type,industry,match_score,sentiment_score
4248517d-3ece-4e7b-9e77-894b86dd1a66,Boeing 737 MAX Activity Explodes In China (NYSE:BA),Boeing 737 MAX return to service in China is picking up pace. Click here to read our analysis and why we think BA stock is a buy.,,"Wirestock

Boeing (NYSE:BA) is currently working on a turnaround which includes a much needed reduction of inventories consisting of the Boeing 737 MAX, Boeing ...",https://seekingalpha.com/article/4590626-boeing-737-max-activity-explodes-in-china,https://static.seekingalpha.com/cdn/s3/uploads/getty_images/1438906752/image_1438906752.jpg?io=getty-c-w1536,en,2023-03-28T15:59:18.000000Z,seekingalpha.com,,equity,Industrials,54.85481,0.14064
d62297e5-1db0-412f-89d3-393f94f2e056,Investors Heavily Search The Boeing Company (BA): Here is What You Need to Know,"Zacks.com users have recently been watching Boeing (BA) quite a bit. Thus, it is worth knowing the facts that could determine the stock's prospects.","stock, stocks, investment, investment advice, investing, online trading, online investment, online stock trading, stock market, financial, financial planning, quote, quotes, stock quotes","This page has not been authorized, sponsored, or otherwise approved or endorsed by the companies represented herein. Each of the company logos represented herei...",https://www.zacks.com/stock/news/2071785/investors-heavily-search-the-boeing-company-ba-here-is-what-you-need-to-know?cid=CS-ZC-FT-tale_of_the_tape|most_searched_stocks-2071785,https://staticx-tuner.zacks.com/images/default_article_images/default241.jpg,en,2023-03-29T13:00:13.000000Z,zacks.com,,equity,Industrials,84.63198857142858,0.0
891b0861-4262-42e0-b3e8-d2de93df95b7,iShares ESG USA ETF: $5 Billion Outflow This Month Prompts ESG Skepticism (NASDAQ:ESGU),ESGU follows a sector-neutral strategy designed to mimic the risk and return profile of the broader market. Read more about ESGU ETF here.,,"gesrey

Investment Thesis

According to the 2022 Annual ESG Survey by Russell Investments, 236 surveyed respondents cited climate risk, general environmental co...",https://seekingalpha.com/article/4591057-esgu-5-billion-outflow-this-month-prompts-esg-skepticism,https://static.seekingalpha.com/cdn/s3/uploads/getty_images/1359584148/image_1359584148.jpg?io=getty-c-w1536,en,2023-03-29T21:28:52.000000Z,seekingalpha.com,,equity,Industrials,12.63185257142857,0.27320000000000005
42e80986-2624-41e9-a6d6-6f451d6f68ca,Vistara first to operate wide-body aircraft using sustainable aviation fuel on long-haul route,Vistara becomes the first Indian airline to operate a wide-body aircraft on a long-haul route using sustainable aviation fuel,"Vistara, Tata group, Singapore Airlines, sustainable aviation fuel, Carbon emmission, Net zero","Vistara, India’s finest full-service carrier and a joint venture of Tata group and Singapore Airlines, today became India’s first carrier to operate a wide-...",https://www.thehindubusinessline.com/news/vistara-first-to-operate-wide-body-aircraft-using-sustainable-aviation-fuel-on-long-haul-route/article66679907.ece,https://bl-i.thgim.com/public/news/myd19s/article66680228.ece/alternates/LANDSCAPE_1200/image%20%283%29.jpg,en,2023-03-30T14:17:19.000000Z,thehindubusinessline.com,,equity,Industrials,19.685317142857144,0.0
737e8754-7357-4785-a356-3ca2d5308c63,Lufthansa: A New Product For A New Era (OTCMKTS:DLAKY),Deutsche Lufthansa AG is set to offer a more premium and flexible experience meeting flexibility demands from travelers. Click here for our DLAKY stock review.,,"Lukas Wunderlich/iStock Editorial via Getty Images

Deutsche Lufthansa AG (OTCQX:DLAKF) (OTCQX:DLAKY) recently ordered more airplanes from Airbus SE (OTCPK:EADS...",https://seekingalpha.com/article/4591367-lufthansa-a-new-product-for-a-new-era,https://static.seekingalpha.com/cdn/s3/uploads/getty_images/1199058287/image_1199058287.jpg?io=getty-c-w1536,en,2023-03-30T22:58:26.000000Z,seekingalpha.com,,equity,Industrials,19.011395857142855,0.13396
c7346d68-de6f-4e3f-b35e-ce95ce7257cf,Vistara operates Boeing Dreamliner plane powered by SAF-blended fuel,"Vistara on Thursday said it has operated a Dreamliner plane using fuel blended with Sustainable Aviation Fuel (SAF) from the US to the national capital, becoming the first Indian carrier to fly on a long route using SAF.",Vistara operates Boeing Dreamliner powered by SAF-blended fuel,"Vistara on Thursday said it has operated a Dreamliner plane using fuel blended with Sustainable Aviation Fuel (SAF) from the US to the national capital, becomin...",https://www.business-standard.com/companies/news/vistara-operates-boeing-dreamliner-plane-powered-by-saf-blended-fuel-123033000784_1.html,https://bsmedia.business-standard.com/_media/bs/img/article/2020-12/07/full/1607307260-2555.jpg,en,2023-03-30T14:21:00.000000Z,business-standard.com,,equity,Industrials,16.809289714285715,0.0
9fdbb176-773b-4cfc-8911-0828fddbd037,Global Military Aviation Market Report 2023: North America is the Largest Market,/PRNewswire/ -- The,Research and Markets,"DUBLIN, March 30, 2023 /PRNewswire/ -- The ""Global Military Aviation Market - Size, Share, COVID-19 Impact & Forecasts up to 2028"" report has been added to Rese...",https://www.prnewswire.com/news-releases/global-military-aviation-market-report-2023-north-america-is-the-largest-market-301786012.html,https://mma.prnewswire.com/media/539438/Research_and_Markets_Logo.jpg?p=facebook,en,2023-03-30T18:30:00.000000Z,prnewswire.com,,equity,Industrials,13.58081057142857,0.4215
d3761e86-8cb4-4189-8ba7-efdfaa0999a9,Boeing: The Uber Of The 2030s (NYSE:BA),Boeing has differentiated its eVTOL product to such a degree that it may dominate this new industry. Click here for more on BA stock prospects.,,"MARHARYTA MARKO/iStock via Getty Images

In this article, I will suggest that The Boeing Company (NYSE:BA) has a product in development that will be the market-...",https://seekingalpha.com/article/4591579-boeing-the-uber-of-the-2030s,https://static.seekingalpha.com/cdn/s3/uploads/getty_images/1222566427/image_1222566427.jpg?io=getty-c-w1536,en,2023-03-31T19:28:24.000000Z,seekingalpha.com,,equity,Industrials,38.02548757142858,0.2859642857142857
3ce4c4a7-1338-4602-9936-af09872983be,15 Countries That Produce the Best Engineers in the World,"The field of engineering is the bedrock of modern civilization, right from the industrial revolution to the information revolution.",,"In this article, we take a look at the 15 countries that produce the best engineers in the world. For more such countries, go to 5 Countries That Produce The Be...",https://www.insidermonkey.com/blog/15-countries-that-produce-the-best-engineers-in-the-world-1136454/,https://d2gr5kl7dt2z3t.cloudfront.net/blog/wp-content/uploads/2022/12/25115722/thisisengineering-raeng-xYCBw1uIP_M-unsplash.jpg,en,2023-03-31T02:50:53.000000Z,insidermonkey.com,,equity,Industrials,15.470933428571428,0.0326
