uuid,title,description,keywords,snippet,url,image_url,language,published_at,source,relevance_score,type,industry,match_score,sentiment_score
130ad199-b5a1-41b7-a45f-4d0115c20b92,Boeing And Airbus Win Big Wide Body Airplane Orders (NYSE:BA),Lufthansa ordered Airbus A350 and Boeing 787 airplanes. The airline group will significantly reduce specific fuel consumption. Read what investors need to know.,,"Jetlinerimages/iStock Unreleased via Getty Images

During the pandemic, we saw airlines making significant cuts to their fleets, and looking at it now, I believ...",https://seekingalpha.com/article/4584847-boeing-airbus-win-big-wide-body-airplane-orders,https://static.seekingalpha.com/cdn/s3/uploads/getty_images/502393508/image_502393508.jpg?io=getty-c-w1536,en,2023-03-06T14:30:49.000000Z,seekingalpha.com,,equity,Industrials,53.893753,0.267873
d98cfcbf-eb42-451b-93e4-f376998ff3a0,United States Top 5 Aerospace & Defense Primes Report 2022-2026: Comparative Analysis of Industry Players and OEMs from a Business & Relative Strategy Perspective,"/PRNewswire/ -- The ""Comparative SWOT & Strategy Focus - 2022-2026 - Top 5 U.S. Aerospace & Defense Primes - Lockheed Martin, Northrop Grumman, Boeing, General...",Research and Markets,"DUBLIN, March 6, 2023 /PRNewswire/ -- The ""Comparative SWOT & Strategy Focus - 2022-2026 - Top 5 U.S. Aerospace & Defense Primes - Lockheed Martin, Northrop Gru...",https://www.prnewswire.com/news-releases/united-states-top-5-aerospace--defense-primes-report-2022-2026-comparative-analysis-of-industry-players-and-oems-from-a-business--relative-strategy-perspective-301763189.html,http://mma.prnewswire.com/media/539438/Research_and_Markets_Logo.jpg?p=facebook,en,2023-03-06T15:30:00.000000Z,prnewswire.com,,equity,Industrials,22.947055714285714,0.453767
b7e6838c-1800-4f29-9c60-3ba51a0689c2,DJD: Yield-Weighted Dow ETF Solid Despite Headwinds (NYSEARCA:DJD),Invesco Dow Jones Industrial Average Dividend ETF is an ETF that simply takes the 30 stocks in the DJIA and equal-weights them. Click to see our take on DJD.,,"Zerbor

By Rob Isbitts.

My usual approach to evaluating exchange-traded funds (""ETFs"") is to start with a profile report that outlines the basics of the fund: ...",https://seekingalpha.com/article/4584935-djd-yield-weighted-dow-etf-solid-despite-headwinds-technical-analysis,https://static.seekingalpha.com/cdn/s3/uploads/getty_images/513232938/image_513232938.jpg?io=getty-c-w1536,en,2023-03-06T19:05:32.000000Z,seekingalpha.com,,equity,Industrials,11.797483285714284,-0.27320000000000005
