uuid,title,description,keywords,snippet,url,image_url,language,published_at,source,relevance_score,type,industry,match_score,sentiment_score
afd23f0b-16ef-4f9c-891c-c9f8a001caac,"SHAREHOLDER ALERT: Pomerantz Law Firm Investigates Claims On Behalf of Investors of Spirit AeroSystems Holdings, Inc. - SPR","NEW YORK, May  27, 2023  (GLOBE NEWSWIRE) -- Pomerantz LLP is investigating claims on behalf of investors of Spirit AeroSystems Holdings, Inc. (“Spirit” or...","Pomerantz LLP, Class Action","NEW YORK, May 27, 2023 (GLOBE NEWSWIRE) -- Pomerantz LLP is investigating claims on behalf of investors of Spirit AeroSystems Holdings, Inc. (“Spirit” or th...",https://www.globenewswire.com/news-release/2023/05/28/2677471/1087/en/SHAREHOLDER-ALERT-Pomerantz-Law-Firm-Investigates-Claims-On-Behalf-of-Investors-of-Spirit-AeroSystems-Holdings-Inc-SPR.html,https://www.globenewswire.com/Content/logo/favicon.ico,en,2023-05-28T00:56:00.000000Z,globenewswire.com,,equity,Industrials,23.88082528571428,-0.25
04d98946-cd65-48db-9e95-177184a14ee2,Boeing looks to sell at least 150 737 Max jets to Riyadh Air,Boeing looks to sell at least 150 737 Max jets to Riyadh Air - Bloomberg News,,"Published May 28, 2023 03:03PM ET

© Reuters. FILE PHOTO: The Boeing 737 MAX aircraft is displayed at the Farnborough International Airshow, in Farnborough, Br...",https://www.investing.com/news/stock-market-news/boeing-looks-to-sell-at-least-150-737-max-jets-to-riyadh-air--bloomberg-news-3092612,https://i-invdn-com.investing.com/news/LYNXMPEA6F0JM_L.jpg,en,2023-05-28T19:05:36.000000Z,investing.com,,equity,Industrials,19.00725,0.0
3b7be819-8752-472a-8e7b-91073c9beccb,Global Military Laser Systems Market Research Report 2023,"/PRNewswire/ -- The ""Military Laser Systems Market Size, Share & Industry Growth Analysis Report by Application (Weapons and Non-weapons), Technology,...",Research and Markets,"DUBLIN, May 29, 2023 /PRNewswire/ -- The ""Military Laser Systems Market Size, Share & Industry Growth Analysis Report by Application (Weapons and Non-weapons), ...",https://www.prnewswire.com/news-releases/global-military-laser-systems-market-research-report-2023-301836425.html,https://mma.prnewswire.com/media/539438/Research_and_Markets_Logo.jpg?p=facebook,en,2023-05-29T10:15:00.000000Z,prnewswire.com,,equity,Industrials,19.50449842857143,0.08894999999999999
e0e69e73-95f9-441a-ae1d-fece24d5c8c8,Business Jet Market to Rise with USD 38.34 Billion by 2029 | Fortune Business Insights™,"The global business jet market covered major segments By Type (Light Business Jet, Mid-Size Business Jet, Large Business Jet), By Platform (On-Demand...","Fortune Business Insights, Business Jet Market, Business Jet Market Share, Business Jet Market Size, Business Jet Market Trends, Business Jet Industry","Pune, India, May 29, 2023 (GLOBE NEWSWIRE) -- The global business jet market size was USD 25.87 billion in 2021 and is expected to grow from USD 29.03 billion i...",https://www.globenewswire.com/news-release/2023/05/29/2677770/0/en/Business-Jet-Market-to-Rise-with-USD-38-34-Billion-by-2029-Fortune-Business-Insights.html,https://ml.globenewswire.com/Resource/Download/05408ba1-26b1-4fdd-8f48-1af4df373348,en,2023-05-29T13:45:00.000000Z,globenewswire.com,,equity,Industrials,12.630221285714287,0.5106
a528e424-8afd-471c-bcb6-bf9d5866800b,"SHAREHOLDER ALERT: Pomerantz Law Firm Investigates Claims On Behalf of Investors of Spirit AeroSystems Holdings, Inc. - SPR","/PRNewswire/ -- Pomerantz LLP is investigating claims on behalf of investors of Spirit AeroSystems Holdings, Inc. (""Spirit"" or the ""Company"") (NYSE: SPR). Such...",Pomerantz LLP,"NEW YORK, May 30, 2023 /PRNewswire/ -- Pomerantz LLP is investigating claims on behalf of investors of Spirit AeroSystems Holdings, Inc. (""Spirit"" or the ""Compa...",https://www.prnewswire.com/news-releases/shareholder-alert-pomerantz-law-firm-investigates-claims-on-behalf-of-investors-of-spirit-aerosystems-holdings-inc---spr-301837668.html,https://mma.prnewswire.com/media/1486339/Pomerantz_Logo.jpg?p=facebook,en,2023-05-30T21:05:00.000000Z,prnewswire.com,,equity,Industrials,23.457867000000004,-0.25
305848be-a594-4b6c-9c04-ceb616c97cb1,"Pomerantz Law Firm Investigates Claims On Behalf of Investors of Spirit AeroSystems Holdings, Inc. - SPR","NEW YORK, May 30, 2023 /PRNewswire/ -- Pomerantz LLP is investigating claims on behalf of investors of Spirit AeroSystems Holdings, Inc.  . Such investors are advised to contact Robert S.... | May 30,  2023","SPIRIT AEROSYSTEMS HOLDINGS, INC. stock exchange, news, information, press release, new, may, 2023, pomerantz, llp, is, investigating, claims, on, behalf, of, investors, spirit, aerosystems, such, are, advised, to, contact, robert | SPR | US8485741099","NEW YORK, May 30, 2023 /PRNewswire/ -- Pomerantz LLP is investigating claims on behalf of investors of Spirit AeroSystems Holdings, Inc. (""Spirit"" or the ""Compa...",https://www.marketscreener.com/quote/stock/SPIRIT-AEROSYSTEMS-HOLDIN-37142/news/Pomerantz-Law-Firm-Investigates-Claims-On-Behalf-of-Investors-of-Spirit-AeroSystems-Holdings-Inc--43993182/,https://www.marketscreener.com/images/twitter_MS_fdgris.png,en,2023-05-30T21:06:03.000000Z,marketscreener.com,,equity,Industrials,23.071822428571434,-0.25
90267d5f-ba4d-47d5-8cf7-0f5fb80ef85f,Top Three Technologies shaping The Aerospace And Defense Market In 2023-2032 - By The Business Research Company,/PRNewswire/ -- The Business Research Company's global market reports are now updated with the latest market sizing information for the year 2023 and...,The Business Research Company,"LONDON , May 30, 2023 /PRNewswire/ -- The Business Research Company's global market reports are now updated with the latest market sizing information for the ye...",https://www.prnewswire.com/news-releases/top-three-technologies-shaping-the-aerospace-and-defense-market-in-2023-2032--by-the-business-research-company-301836349.html,https://mma.prnewswire.com/media/1751581/3970581/tbrc_logo.jpg?p=facebook,en,2023-05-30T10:40:00.000000Z,prnewswire.com,,equity,Industrials,14.696144285714285,0.5859
