uuid,title,description,keywords,snippet,url,image_url,language,published_at,source,relevance_score,type,industry,match_score,sentiment_score
9e8ae978-97fa-4bf1-9084-5b18b6deec6e,Boeing delivers first 787 Dreamliner since weeks-long delivery pause in February By Reuters,Boeing delivers first 787 Dreamliner since weeks-long delivery pause in February,,"© Reuters. FILE PHOTO: The Boeing 787 Dreamliner airplane is seen in Long Beach, California March 14, 2012. REUTERS/Lucy Nicholson/File Photo

BA +1.58% Add to...",https://www.investing.com/news/stock-market-news/boeing-delivers-first-787-dreamliner-since-weekslong-delivery-pause-in-february-3032571,https://i-invdn-com.investing.com/news/LYNXMPEF290M3_L.jpg,en,2023-03-16T14:41:15.000000Z,investing.com,,equity,Industrials,19.70523,0.0
5c5218b4-1f00-4352-aa0a-05f3d0345bc6,Boeing signs deal with U.S. army to build 184 AH-64E Apache helicopters By Reuters,Boeing signs deal with U.S. army to build 184 AH-64E Apache helicopters,,"© Reuters. FILE PHOTO: The Boeing logo is displayed on a screen, at the New York Stock Exchange (NYSE) in New York, U.S., August 7, 2019. REUTERS/Brendan McDer...",https://www.investing.com/news/stock-market-news/boeing-signs-deal-with-us-army-to-build-184-ah64e-apache-helicopters-3033777,https://i-invdn-com.investing.com/news/LYNXNPEC0O18W_L.jpg,en,2023-03-17T23:21:21.000000Z,investing.com,,equity,Industrials,21.237724,0.0
566b2807-944f-4002-bb23-532d912791c1,Spirit AeroSystems Stock: A Lot Of Upside For Buyers (NYSE:SPR),Spirit AeroSystems could improve margins in 2023 despite a tough supply chain environment. The supply chain environment is improving for SPR. Click here for more.,,"Larry W. Smith

I previously have put a buy rating on Spirit AeroSystems Holdings, Inc. (NYSE:SPR) stock, but the reality has been that for Spirit AeroSystems s...",https://seekingalpha.com/article/4588405-spirit-aerosystems-stock-a-lot-of-upside-for-buyers,https://static.seekingalpha.com/cdn/s3/uploads/getty_images/51187612/image_51187612.jpg?io=getty-c-w1536,en,2023-03-17T23:02:03.000000Z,seekingalpha.com,,equity,Industrials,19.058401714285715,0.36828
